Session_ID,user_input,retrieved_contexts,response,faithfulness,answer_relevancy
AUTO_ANALYSIS_ACB_0,Phân tích tổng hợp cổ phiếu ACB,"['[MARKET REPORT]: \nTheo dấu dòng tiền cá mập 24/11: Dòng tiền tự doanh nỗ lực bám trụ khi khối ngoại xả ròng\nPhiên 24/11 chứng kiến khối ngoại tiếp tục bán ròng hơn 1.2 ngàn tỷ đồng, trong khi dòng tiền tự doanh công ty chứng khoán (CTCK) vẫn duy trì xu hướng mua ròng, tạo bức tranh thị trường trái chiều.\nCác ""cá mập"" nước ngoài lại vừa có phiên bán ròng mạnh, hơn 1.2 ngàn tỷ đồng. Tâm điểm là các cổ phiếu họ Vingroup, với VRE bị xả mạnh nhất, hơn 288 tỷ đồng, gần gấp đôi giá trị bán ra của VHM (151 tỷ đồng). STB và VIC cũng nằm trong nhóm bị bán ròng mạnh, mỗi cổ phiếu khoảng 120 tỷ đồng.\nTrong khi đó, dòng tiền ngoại vẫn săn tìm cơ hội ở nhóm công nghệ. FPT dẫn đầu lực mua với 158 tỷ đồng, nối dài chuỗi phiên gom ròng liên tục trong hàng chục phiên gần đây. VNM đứng ngay sau với 147 tỷ đồng, còn VPB được mua ròng 58 tỷ đồng.\nTính từ đầu tháng 11, khối ngoại đã gom ròng FPT hơn 1.78 ngàn tỷ đồng - dẫn đầu toàn sàn, trong khi HPG theo sát với gần 1.73 ngàn tỷ đồng. Ở chiều ngược lại, STB bị xả mạnh nhất với hơn 2 ngàn tỷ đồng. Tổng cộng, giá trị bán ròng của khối ngoại trong tháng 11 vượt 9 ngàn tỷ đồng.\nNhìn rộng hơn, từ đầu quý 4 đến nay, FPT đã được gom ròng gần 4 ngàn tỷ đồng. Mặt khác, MBB bị xả mạnh nhất với hơn 4.3 ngàn tỷ đồng, đẩy tổng giá trị bán ròng toàn quý lên hơn 32 ngàn tỷ đồng.\nKhối ngoại bán ròng hơn ngàn tỷ\nTop 10 cổ phiếu khối ngoại giao dịch ròng nhiều nhất phiên 24/11\nỞ chiều ngược lại, khối tự doanh tiếp tục duy trì đà mua ròng, đạt 380 tỷ đồng trên HOSE, ghi nhận phiên mua ròng thứ hai liên tiếp. HPG và VNM dẫn đầu lực gom với lần lượt 63 tỷ đồng và 62 tỷ đồng, MWG theo sau 43 tỷ đồng.\nTrong khi đó, CTCK bán ròng mạnh nhất là STB gần 32 tỷ đồng, tiếp theo là KBC và VRE với 11 tỷ và 10 tỷ đồng.\nTự doanh lại mua ròng mạnh\nTop 10 cổ phiếu tự doanh giao dịch ròng mạnh nhất trong phiên 24/11\nTử Kính\nFILI\n- 17:55 24/11/2025\ncá mập\ntheo dấu dòng tiền cá mập\ntự doanh\nkhối ngoại mua ròng\nbán ròng\ngiao dịch cổ phiếu\nMÃ CHỨNG KHOÁN LIÊN QUAN (11)\nFPT\n100,200\n-600\n-0.60%\nHPG\n27,100\n-300\n-1.09%\nKBC\n34,950\n50\n+0.14%\nMBB\n23,150\n-50\n-0.22%\nMWG\n79,300\n-700\n-0.88%\nSTB\n50,000\n-1,300\n-2.53%\nVHM\n102,700\n3,400\n+3.42%\nVIC\n239,500\n9,800\n+4.27%\nVNM\n63,000\n3,100\n+5.18%\nVPB\n29,000\n450\n+1.58%\nVRE\n34,450\n2,250\n+6.99%\nTIN TỨC MÃ CHỨNG KHOÁN\n1\nThị trường chứng quyền ngày 25/11/2025: Nhóm chứng quyền VRE bứt phá\n45 phút trước\n2\nAFIEX có gì trong tay trước khi lên sàn HOSE?\n1 giờ trước\n3\nPhân tích kỹ thuật phiên chiều 24/11: Test lại đường SMA 50 ngày\n24/11 13:02\n4\nCông ty bao bì Việt do người Thái nắm giữ xin hủy đại chúng và rời HOSE\n24/11 12:40\n5\n48 tấn sữa và nước uống của Vinamilk đến rốn lũ miền Trung và Tây Nguyên\n24/11 11:41\nTIN CÙNG CHUYÊN MỤC\nCỔ PHIẾU\n13 phút trước\nCổ phiếu thủy sản, thực phẩm có tuần hút tiền\nThanh khoản diễn biến trái chiều ở hai sàn HOSE và HNX trong tuần giao dịch 17 - 21/11. Dòng tiền vẫn đang duy trì xu hướng thận trọng. Tuần vừa qua, nhóm cổ phiếu...\nCỔ PHIẾU\n24/11 11:01\nAfiex rời UPCoM cuối tháng 11 để chuyển sang HOSE\nSở Giao dịch Chứng khoán Hà Nội (HNX) thông báo hủy giao dịch toàn bộ 35 triệu cp của CTCP Xuất nhập khẩu Nông sản Thực phẩm An Giang (Afiex, UPCoM: AFX) từ ngày...\nCỔ PHIẾU\n24/11 08:00\nTop cổ phiếu đáng chú ý đầu tuần 24/11\nDanh sách các mã cổ phiếu tăng và giảm mạnh nhất những phiên gần đây theo số liệu thống kê của Vietstock.\nCỔ PHIẾU\n24/11 06:02\n24/11: Đọc gì trước giờ giao dịch chứng khoán?\nCập nhật nhanh những diễn biến kinh tế, tài chính trong nước và thế giới những ngày cuối tuần trước khi thị trường mở cửa.\nCỔ PHIẾU\n22/11 20:30\nVIC dẫn dắt đà tăng, VN-Index có thêm gần 20 điểm trong tuần phân hóa\nVIC tiếp tục dẫn dắt với mức đóng góp vượt trội, cùng nhóm Vingroup là VHM và VPL củng cố đà tăng, giúp chỉ số VN-Index duy trì nhịp phục hồi trong tuần 17-21/11...\nCỔ PHIẾU\n22/11 08:00\nDNSE Future Tech Summit: Bước đệm cho kỷ nguyên giao dịch T+0 và thị trường “không độ trễ”\nChiều 21/11/2025, sự kiện công nghệ DNSE Future Tech Summit đã diễn ra tại TP. Hồ Chí Minh, quy tụ nhiều chuyên gia tài chính - công nghệ uy tín và trên 200 nhà đầu...\nCỔ PHIẾU\n21/11 22:32\nTheo dấu dòng tiền cá mập 21/11: Khối ngoại rút ròng VIX hơn 700 tỷ\nKhối ngoại quay lại bán ròng trong phiên 21/11 với tâm điểm là VIX, trái chiều với lực mua từ tự doanh các công ty chứng khoán (CTCK).\nCỔ PHIẾU\n21/11 13:02\nNhững dấu ấn của cổ phiếu thủy sản trong một năm thuế quan gây chao đảo\nGiữa một năm đầy biến động bởi chính sách thuế quan từ Mỹ, cổ phiếu thủy sản vẫn đang ghi những dấu ấn. 3/5 mã lớn của ngành vẫn giảm sâu trong khi ANV lại tìm thấy...\nCỔ PHIẾU\n21/11 10:32\nBầu Đức và “game” mới\nCổ phiếu HAG vừa đạt đỉnh 10 năm, bầu Đức tính chuyện niêm yết công ty con sau khi “cục máu đông” nợ tan được đôi phần.\nCỔ PHIẾU\n21/11 08:00\nTop cổ phiếu đáng chú ý đầu phiên 21/11\nDanh sách các mã cổ phiếu tăng và giảm mạnh nhất những phiên gần đây theo số liệu thống kê của Vietstock.\nXem thêm\nChỉ số thị trường\nTIN CHÍNH\nĐỌC NHIỀU NHẤT\n×\nBáo lỗi bài viết\nCám ơn bạn đã gửi báo lỗi bài viết.\nĐịa chỉ email\nHọ tên\nSố điện thoại\nNội dung\nGửi\nVietstock – Cổng thông tin tài chính và chứng khoán chính thức hoạt động từ ngày 02/08/2002, với định hướng trở thành người bạn đồng hành đáng tin cậy của nhà đầu tư. Ngay từ những ngày đầu, Vietstock đã không ngừng nỗ lực mang đến hệ thống thông tin và dữ liệu tài chính chính xác – cập nhật – đầy đủ, giúp nhà đầu tư hiểu đúng, nhìn rộng và tự tin đưa ra quyết định trong hành trình đầu tư của mình.\nTruyền Thông Tài Chính\nQuan hệ công chúng (PR)\nQuan hệ nhà đầu tư (IR)\nQuảng cáo banner\nBáo cáo phân tích\nDữ Liệu Tài Chính\nDataFeed\nVietstockXLS\nInvestOnline\nIROnline\nVietstockUpdater\nVietstockFinance\nSách tài chính\nPhân tích kỹ thuật từ A đến Z\nVai trò của Quan hệ Nhà đầu tư (IR) trong việc tối đa hóa giá trị doanh nghiệp\nVietstock\nQuảng cáo & Dịch vụ\n0908 169 898 - (028) 3848 7238\nkinhdoanh@vietstock.vn\nSáng tạo nội dung\n0938 046 488\ninfo@vietstock.vn\nVăn phòng giao dịch\n81/10B Hồ Văn Huê,\nPhường Đức Nhuận, Tp.HCM\nLớp học sắp khai giảng\n11/2025 Khóa học online - Phân tích Kỹ thuật Ứng dụng\nKhai giảng: 17/11/2025 |\nThời gian: Tối 2, 4, 6\n11/2025 Khóa học online - Đọc hiểu Báo cáo Tài chính\nKhai giảng: 25/11/2025 |\nThời gian: Tối 3, 5\n12/2025 Khóa học Online - Bắt đáy và Chốt lời Cổ phiếu\nKhai giảng: 13/12/2025 |\nThời gian: Thứ 7\n12/2025 Khóa học online - Phân tích Ngành và Dòng tiền Thị trường\nKhai giảng: 15/12/2025 |\nThời gian: Tối 2, 4, 6\n11/2025 Khóa học online - Phân tích Kỹ thuật Nâng cao\nKhai giảng: 03/11/2025 |\nThời gian: Tối 2, 4, 6\nSách tài chính\nPhân tích kỹ thuật từ A đến Z\nVai trò của Quan hệ Nhà đầu tư (IR) trong việc tối đa hóa giá trị doanh nghiệp\nVietstock\nVietstock\nVận hành bởi CTCP Tài Việt.\nTrụ sở: 28/47 Lê Thị Hồng, P.Gò Vấp, Tp.HCM\nTel: (84.28) 3848 7238 - Fax: (84.28) 3848 7237\nGiấy phép số 48/GP-STTTT ngày 04/11/2016\nQuyết định số 13/QĐ-STTTT ngày 02/11/2017\nQuyết định số 06/QĐ-STTTT-ICP ngày 20/07/2023\nĐược cấp bởi Sở Thông tin và Truyền thông TPHCM\nNgười chịu trách nhiệm\nBÀ PHẠM THỊ THANH NGA\nQuảng cáo & Dịch vụ\n0908 169 898 - (028) 3848 7238\nkinhdoanh@vietstock.vn\nSáng tạo nội dung\n0938 046 488\ninfo@vietstock.vn\nVăn phòng giao dịch\n81/10B Hồ Văn Huê,\nPhường Đức Nhuận, TPHCM\nSách tài chính\nPhân tích kỹ thuật từ A đến Z\nVai trò của Quan hệ Nhà đầu tư (IR) trong việc tối đa hóa giá trị doanh nghiệp\nVietstock\nVận hành bởi CTCP Tài Việt.\nTrụ sở: 28/47 Lê Thị Hồng, P.Gò Vấp, Tp.HCM\nTel: (84.28) 3848 7238 - Fax: (84.28) 3848 7237\nGiấy phép số 48/GP-STTTT ngày 04/11/2016\nQuyết định số 13/QĐ-STTTT ngày 02/11/2017\nQuyết định số 06/QĐ-STTTT-ICP ngày 20/07/2023\nĐược cấp bởi Sở Thông tin và Truyền thông TPHCM\nNgười chịu trách nhiệm\nBÀ PHẠM THỊ THANH NGA\n© Bản quyền thuộc về Vietstock\nSitemap\nVề chúng tôi\nChính sách quyền riêng tư\nQuảng cáo & Dịch vụ\n© Bản quyền thuộc về Vietstock\nHotline: 0908 16 98 98\nTất cả\nGiờ qua\n24 giờ qua\nTuần qua\nTháng qua\nNăm qua\nTất cả\nTính năng\nNgành\nMã chứng khoán\nLãnh đạo\nTin tức\nBáo cáo phân tích\nThuật ngữ\nDịch vụ\nTính năng (-)\nVietstock\nChứng khoán\nCổ phiếu\nGiao dịch nội bộ\nNiêm yết\nETF và các quỹ\nChứng khoán phái sinh\nChứng quyền\nÝ kiến chuyên gia\nCâu chuyện đầu tư\nChính sách\nTrái phiếu\nDoanh nghiệp\nHoạt động kinh doanh\nCổ tức\nTăng vốn - M&A\nIPO - Cổ phần hóa\nChứng khoán phái sinh\nNhân vật\nTrái phiếu doanh nghiệp\nBất động sản\nThị trường nhà đất\nQuy hoạch - Hạ tầng\nDự án\nBảo hiểm và thuế nhà đất\nTài chính\nNgân hàng\nBảo hiểm\nThuế và Ngân sách\nHàng hóa\nVàng và kim loại quý\nNhiên liệu\nKim loại\nNông sản thực phẩm\nKinh tế\nVĩ mô\nDữ liệu vĩ mô\nGDP\nCPI\nIIP\nBán lẻ\nXuất nhập khẩu\nFDI\nTín dụng\nThị trường mở\nTỷ giá - Lãi suất\nDân số và Lao động\nKinh tế - Đầu tư\nThế giới\nChứng khoán thế giới\nTiền kỹ thuật số\nTài chính quốc tế\nKinh tế - Đầu tư\nĐông dương\nVĩ mô\nTài chính - Ngân hàng\nThị trường chứng khoán\nKinh tế - Đầu tư\nTài chính cá nhân\nLàm chủ đồng tiền\nĐầu tư - Kinh doanh nhỏ\nDoanh nhân và khởi nghiệp\nChơi sang\nXe - Công nghệ\nTiêu dùng và lối sống\nVì cộng đồng\nPhân tích\nNhận định thị thường\nPhân tích cơ bản\nPhân tích kỹ thuật\nVietstockFinance\nVĩ mô\nDữ liệu vĩ mô\nGDP\nCPI\nIIP\nBán lẻ\nXuất nhập khẩu\nFDI\nTín dụng\nThị trường mở\nTỷ giá - Lãi suất\nDân số và Lao động\nNgành\nDữ liệu ngành\nNgành chi tiết\nDoanh nghiệp\nDoanh nghiệp A-Z\nHồ sơ lãnh đạo\nLịch sự kiện\nNiêm yết\nCổ tức và phát hành thêm\nĐại hội đồng cổ đông\nCập nhật lãi lỗ\nGiao dịch nội bộ\nCổ đông nội bộ\nNgười liên quan\nCổ đông lớn\nCổ phiếu quỹ\nTài liệu cổ đông\nBáo cáo tài chính\nGiải trình KQKD\nBáo cáo quản trị\nBáo cáo thường niên\nNghị quyết ĐHĐCĐ\nTài liệu ĐHĐCĐ\nNiên giám\nCổ phiếu\nThị trường cổ phiếu\nBản đồ thị trường\nTổng hợp thị trường\nThanh khoản\nĐịnh giá\nNước ngoài\nTự doanh\nTop cổ phiếu\nBản đồ ngành\nThống kê giao dịch\nGiá\nĐặt lệnh\nNước ngoài\nTự doanh\nẢnh hưởng chỉ số\nBiến động cổ phiếu\nGiao dịch nội bộ\nTrạng thái cổ phiếu\nQuy mô thị trường\nNiêm yết\nNiêm yết mới\nNiêm yết bổ sung\nHủy niêm yết\nTheo dõi đặc biệt\nKhông được ký quỹ\nETF\nCổ phiếu chi tiết\nTổng quan\nGiao dịch\nTài chính\nPhân tích kỹ thuật\nHồ sơ doanh nghiệp\nTin tức sự kiện\nTài liệu\nTâm lý thị trường\nPhái sinh\nHợp đồng tương lai\nTổng quan\nThống kê giao dịch\nKiến thức / Qui định\nChứng quyền\nTổng quan\nThống kê giao dịch\nBlackScholes\nTrái phiếu\nTổng quan\nTổ chức phát hành\nTrái phiếu A-Z\nThống kê giao dịch\nTin tức\nCông cụ đầu tư\nBản đồ thị trường\nSức mạnh giá RRG\nPhân tích kỹ thuật\nBảng giá trực tuyến\nBộ lọc cổ phiếu\nSo sánh cổ phiếu\nBáo cáo phân tích\nNghiên cứu - Phân tích\nVĩ mô - Chiến lược thị trường\nPhân tích ngành\nPhân tích doanh nghiệp\nTài liệu tham khảo\nBiểu đồ tài chính\nTruy xuất dữ liệu\nTổng hợp doanh nghiệp\nBáo cáo tài chính\nBáo cáo tài chính ngành\nVĩ mô\nNgành (-)\nVS-Sector\nNăng lượng\nNăng lượng\n-\xa0 Thiết bị và dịch vụ năng lượng\n-\xa0 Dầu khí\nNguyên vật liệu\nNguyên vật liệu\n-\xa0 Hóa chất\n-\xa0 Vật liệu xây dựng\n-\xa0 Bao bì và vật chứa\n-\xa0 Khai khoáng và luyện kim\n-\xa0 Gỗ và giấy\nCông nghiệp\nHàng hóa công nghiệp\n-\xa0 Thiết bị hàng không vũ trụ và quốc phòng\n-\xa0 Sản phẩm xây dựng\n-\xa0 Kỹ thuật xây dựng\n-\xa0 Thiết bị điện\n-\xa0 Tập đoàn đa ngành\n-\xa0 Máy móc công nghiệp\n-\xa0 Phân phối hàng công nghiệp\nDịch vụ thương mại và chuyên nghiệp\n-\xa0 Dịch vụ và thiết bị thương mại\n-\xa0 Dịch vụ chuyên nghiệp\nVận tải\n-\xa0 Vận tải và logistics hàng không\n-\xa0 Hãng hàng không chở khách\n-\xa0 Vận tải biển\n-\xa0 Vận tải mặt đất\n-\xa0 Hạ tầng giao thông\nTiêu dùng không thiết yếu\nXe và linh kiện\n-\xa0 Linh kiện xe\n-\xa0 Xe\nThời trang và hàng lâu bền\n-\xa0 Hàng tiêu dùng lâu bền\n-\xa0 Sản phẩm giải trí\n-\xa0 Thời trang và dệt may\nDịch vụ tiêu dùng\n-\xa0 Khách sạn, nhà hàng và giải trí\n-\xa0 Dịch vụ tiêu dùng khác\nThương mại hàng không thiết yếu\n-\xa0 Nhà phân phối\n-\xa0 Bán lẻ đa dạng\n-\xa0 Bán lẻ chuyên doanh\nTiêu dùng thiết yếu\nThương mại hàng thiết yếu\n-\xa0 Thương mại hàng thiết yếu\nThực phẩm, đồ uống và thuốc lá\n-\xa0 Đồ uống\n-\xa0 Thực phẩm\n-\xa0 Thuốc lá\nSản phẩm chăm sóc cá nhân và gia đình\n-\xa0 Sản phẩm chăm sóc gia đình\n-\xa0 Sản phẩm chăm sóc cá nhân\nChăm sóc sức khỏe\nThiết bị và dịch vụ chăm sóc sức khỏe\n-\xa0 Thiết bị và vật tư chăm sóc sức khỏe\n-\xa0 Thương mại và dịch vụ chăm sóc sức khỏe\n-\xa0 Công nghệ chăm sóc sức khỏe\nDược phẩm, công nghệ sinh học và khoa học sự sống\n-\xa0 Công nghệ sinh học\n-\xa0 Dược phẩm\n-\xa0 Công cụ và dịch vụ khoa học sự sống\nTài chính\nTổ chức tín dụng\n-\xa0 Ngân hàng\n-\xa0 Tín dụng phi ngân hàng\n-\xa0 Tín dụng khác\nDịch vụ tài chính\n-\xa0 Dịch vụ tài chính\n-\xa0 Thị trường vốn\n-\xa0 REIT thế chấp\nBảo hiểm\n-\xa0 Bảo hiểm\nCông nghệ thông tin\nPhần mềm và dịch vụ\n-\xa0 Dịch vụ CNTT\n-\xa0 Phần mềm\nPhần cứng và thiết bị\n-\xa0 Thiết bị viễn thông\n-\xa0 Phần cứng, bộ lưu trữ và thiết bị ngoại vi\n-\xa0 Điện tử\nBán dẫn\n-\xa0 Bán dẫn\nDịch vụ truyền thông\nDịch vụ viễn thông\n-\xa0 Dịch vụ viễn thông đa dạng\n-\xa0 Dịch vụ viễn thông không dây\nTruyền thông và giải trí\n-\xa0 Truyền thông\n-\xa0 Giải trí\n-\xa0 Truyền thông tương tác\nTiện ích\nTiện ích\n-\xa0 Điện\n-\xa0 Gas sinh hoạt\n-\xa0 Tiện tích tổng hợp\n-\xa0 Nước\n-\xa0 Phát điện độc lập và điện tái tạo\nBất động sản\nQuỹ REITs\n-\xa0 REITs bất động sản đa dạng\n-\xa0 REITs khu công nghiệp\n-\xa0 REITs khách sạn và khu nghỉ dưỡng\n-\xa0 REITs văn phòng\n-\xa0 REITs bất động sản y tế\n-\xa0 REITs nhà ở\n-\xa0 REITs bán lẻ\n-\xa0 REITs chuyên biệt\nBất động sản\n-\xa0 Quản lý và phát triển bất động sản\n-\xa0 Bất động sản đa dạng\n-\xa0 Dịch vụ bất động sản\nMã chứng khoán (-)\nTất cả\nCổ phiếu\nChỉ số\nChứng chỉ quỹ\nChứng quyền\nHợp đồng tương lai\nTrái phiếu\nXem thêm\nLãnh đạo (-)\nTất cả\nNgười nội bộ\nNgười liên quan\nCổ đông lớn\nXem thêm\nTin tức (-)\nXem thêm\nBài viết của tác giả (-)\nXem thêm\nBáo cáo phân tích (-)\nXem thêm\nThuật ngữ (-)\nXem thêm\nDịch vụ (-)\nĐào tạo\nKhóa học online - Phân tích Kỹ thuật Ứng dụng\nKhai giảng: 17/11/2025 |\nThời gian: Tối 2, 4, 6 |\nSố buổi: 7 |\nHọc phí: 3,825,000 đ\nKhóa học online - Đọc hiểu Báo cáo Tài chính\nKhai giảng: 25/11/2025 |\nThời gian: Tối 3, 5 |\nSố buổi: 3 |\nHọc phí: 1,530,000 đ\nKhóa học Online - Bắt đáy và Chốt lời Cổ phiếu\nKhai giảng: 13/12/2025 |\nThời gian: Thứ 7 |\nSố buổi: 3 |\nHọc phí: 1,870,000 đ\nKhóa học online - Phân tích Ngành và Dòng tiền Thị trường\nKhai giảng: 15/12/2025 |\nThời gian: Tối 2, 4, 6 |\nSố buổi: 6 |\nHọc phí: 3,570,000 đ\nKhóa học online - Phân tích Kỹ thuật Nâng cao\nKhai giảng: 03/11/2025 |\nThời gian: Tối 2, 4, 6 |\nSố buổi: 5 |\nHọc phí: 3,825,000 đ\nKhóa học online - Chứng khoán Cơ bản\nKhai giảng: 04/11/2025 |\nThời gian: Tối 3, 5 |\nSố buổi: 4 |\nHọc phí: 1,530,000 đ\nKhóa học online - Phân tích và Định giá Cổ phiếu\nKhai giảng: 21/10/2025 |\nThời gian: Tối 3, 5 |\nSố buổi: 4 |\nHọc phí: 1,870,000 đ\nKhóa học - Phân tích Kỹ thuật Ứng dụng - tại Tp. HCM\nKhai giảng: |\nThời gian: Tối 2, 4, 6 |\nSố buổi: 7 |\nHọc phí: 5,500,000 đ\nKhóa học online - Lướt sóng cổ phiếu nóng\nKhai giảng: 23/08/2025 |\nThời gian: Thứ 7 |\nSố buổi: 2 |\nHọc phí: 849,000 đ\nĐào tạo Phân tích và Đầu tư Chứng khoán IN - HOUSE\nKhai giảng: |\nThời gian: |\nSố buổi: 8 |\nHọc phí: 0 đ\nSách tài chính\nPhân tích kỹ thuật từ A đến Z\nVai trò của Quan hệ Nhà đầu tư (IR) trong việc Tối đa hóa Giá trị Doanh nghiệp\nCông cụ đầu tư\nVietstockUpdater\nVietstockFinance\nTruyền thông tài chính\nBanner Ads\nOnline PR\nQuan hệ nhà đầu tư\nBáo cáo phân tích\nDữ liệu tài chính\nDataFeed - Dữ liệu tài chính tích hợp chuyên nghiệp\nVietstockXLS - Dữ liệu Kinh tế Tài chính Chứng khoán theo yêu cầu\nInvestOnline - Giải pháp website tra cứu chứng khoán toàn diện\nIROnline - Giải pháp thuê ngoài website IR, website quan hệ cổ đông\nThông báo\nVietstock trân trọng thông báo đến Quý Khách hàng về việc áp dụng “Chính sách quyền riêng tư” căn cứ theo Nghị định số 13/2023/NĐ-CP v/v bảo vệ dữ liệu cá nhân được ban hành bởi Chính phủ.\nTrong quá trình thiết lập mối quan hệ giữa Vietstock và Khách hàng, Vietstock có thể thu thập và xử lý dữ liệu cá nhân của Khách hàng cho mục đích được xác định tại Chính sách quyền riêng tư (“CSQRT”) này. Trong trường hợp Khách hàng không đồng ý một phần hoặc toàn bộ quy định tại CSQRT, Vietstock không thể cung cấp sản phẩm và dịch vụ cho Khách hàng.\nVietstock cam kết luôn tôn trọng quyền riêng tư, bảo mật và an toàn thông tin cá nhân; đồng thời luôn nỗ lực bảo vệ dữ liệu cá nhân của Khách hàng, tuân thủ quy định pháp luật Việt Nam thông qua những biện pháp bảo vệ dữ liệu cá nhân đáp ứng và phù hợp với quy định pháp luật Việt Nam.\nChính sách quyền riêng tư là một phần không thể tách rời của các thỏa thuận, điều khoản và điều kiện chi phối mối quan hệ giữa Vietstock và Quý Khách hàng.\nQuý Khách hàng đã đọc kỹ, hiểu rõ và đồng ý với toàn bộ điều khoản của “Chính sách quyền riêng tư”. Chi tiết Chính sách quyền riêng tư xem tại đây.\nNếu không đồng ý với Chính sách quyền riêng tư này, Chúng tôi không thể cung cấp sản phẩm và dịch vụ cho Quý Khách hàng.\nTôi đã đọc kỹ, hiểu rõ và đồng ý với toàn bộ điều khoản của Chính sách quyền riêng tư\nĐồng ý\nTheo dấu dòng tiền cá mập 24/11: Dòng tiền tự doanh nỗ lực bám trụ khi khối ngoại xả ròng\nPhiên 24/11 chứng kiến khối ngoại tiếp tục bán ròng hơn 1.2 ngàn tỷ đồng, trong khi dòng tiền tự doanh công ty chứng khoán (CTCK) vẫn duy trì xu hướng mua ròng, tạo bức tranh thị trường trái chiều.\nCác ""cá mập"" nước ngoài lại vừa có phiên bán ròng mạnh, hơn 1.2 ngàn tỷ đồng. Tâm điểm là các cổ phiếu họ Vingroup, với VRE bị xả mạnh nhất, hơn 288 tỷ đồng, gần gấp đôi giá trị bán ra của VHM (151 tỷ đồng). STB và VIC cũng nằm trong nhóm bị bán ròng mạnh, mỗi cổ phiếu khoảng 120 tỷ đồng.\nTrong khi đó, dòng tiền ngoại vẫn săn tìm cơ hội ở nhóm công nghệ. FPT dẫn đầu lực mua với 158 tỷ đồng, nối dài chuỗi phiên gom ròng liên tục trong hàng chục phiên gần đây. VNM đứng ngay sau với 147 tỷ đồng, còn VPB được mua ròng 58 tỷ đồng.\nTính từ đầu tháng 11, khối ngoại đã gom ròng FPT hơn 1.78 ngàn tỷ đồng - dẫn đầu toàn sàn, trong khi HPG theo sát với gần 1.73 ngàn tỷ đồng. Ở chiều ngược lại, STB bị xả mạnh nhất với hơn 2 ngàn tỷ đồng. Tổng cộng, giá trị bán ròng của khối ngoại trong tháng 11 vượt 9 ngàn tỷ đồng.\nNhìn rộng hơn, từ đầu quý 4 đến nay, FPT đã được gom ròng gần 4 ngàn tỷ đồng. Mặt khác, MBB bị xả mạnh nhất với hơn 4.3 ngàn tỷ đồng, đẩy tổng giá trị bán ròng toàn quý lên hơn 32 ngàn tỷ đồng.\nKhối ngoại bán ròng hơn ngàn tỷ\nTop 10 cổ phiếu khối ngoại giao dịch ròng nhiều nhất phiên 24/11\nỞ chiều ngược lại, khối tự doanh tiếp tục duy trì đà mua ròng, đạt 380 tỷ đồng trên HOSE, ghi nhận phiên mua ròng thứ hai liên tiếp. HPG và VNM dẫn đầu lực gom với lần lượt 63 tỷ đồng và 62 tỷ đồng, MWG theo sau 43 tỷ đồng.\nTrong khi đó, CTCK bán ròng mạnh nhất là STB gần 32 tỷ đồng, tiếp theo là KBC và VRE với 11 tỷ và 10 tỷ đồng.\nTự doanh lại mua ròng mạnh\nTop 10 cổ phiếu tự doanh giao dịch ròng mạnh nhất trong phiên 24/11\nTử Kính\nFILI\n- 17:55 24/11/2025\ncá mập\ntheo dấu dòng tiền cá mập\ntự doanh\nkhối ngoại mua ròng\nbán ròng\ngiao dịch cổ phiếu\nMÃ CHỨNG KHOÁN LIÊN QUAN (11)\nFPT\n100,200\n-600\n-0.60%\nHPG\n27,100\n-300\n-1.09%\nKBC\n34,950\n50\n+0.14%\nMBB\n23,150\n-50\n-0.22%\nMWG\n79,300\n-700\n-0.88%\nSTB\n50,000\n-1,300\n-2.53%\nVHM\n102,700\n3,400\n+3.42%\nVIC\n239,500\n9,800\n+4.27%\nVNM\n63,000\n3,100\n+5.18%\nVPB\n29,000\n450\n+1.58%\nVRE\n34,450\n2,250\n+6.99%\nTIN TỨC MÃ CHỨNG KHOÁN\n1\nThị trường chứng quyền ngày 25/11/2025: Nhóm chứng quyền VRE bứt phá\n45 phút trước\n2\nAFIEX có gì trong tay trước khi lên sàn HOSE?\n1 giờ trước\n3\nPhân tích kỹ thuật phiên chiều 24/11: Test lại đường SMA 50 ngày\n24/11 13:02\n4\nCông ty bao bì Việt do người Thái nắm giữ xin hủy đại chúng và rời HOSE\n24/11 12:40\n5\n48 tấn sữa và nước uống của Vinamilk đến rốn lũ miền Trung và Tây Nguyên\n24/11 11:41\nTIN CÙNG CHUYÊN MỤC\nCỔ PHIẾU\n13 phút trước\nCổ phiếu thủy sản, thực phẩm có tuần hút tiền\nThanh khoản diễn biến trái chiều ở hai sàn HOSE và HNX trong tuần giao dịch 17 - 21/11. Dòng tiền vẫn đang duy trì xu hướng thận trọng. Tuần vừa qua, nhóm cổ phiếu...\nCỔ PHIẾU\n24/11 11:01\nAfiex rời UPCoM cuối tháng 11 để chuyển sang HOSE\nSở Giao dịch Chứng khoán Hà Nội (HNX) thông báo hủy giao dịch toàn bộ 35 triệu cp của CTCP Xuất nhập khẩu Nông sản Thực phẩm An Giang (Afiex, UPCoM: AFX) từ ngày...\nCỔ PHIẾU\n24/11 08:00\nTop cổ phiếu đáng chú ý đầu tuần 24/11\nDanh sách các mã cổ phiếu tăng và giảm mạnh nhất những phiên gần đây theo số liệu thống kê của Vietstock.\nCỔ PHIẾU\n24/11 06:02\n24/11: Đọc gì trước giờ giao dịch chứng khoán?\nCập nhật nhanh những diễn biến kinh tế, tài chính trong nước và thế giới những ngày cuối tuần trước khi thị trường mở cửa.\nCỔ PHIẾU\n22/11 20:30\nVIC dẫn dắt đà tăng, VN-Index có thêm gần 20 điểm trong tuần phân hóa\nVIC tiếp tục dẫn dắt với mức đóng góp vượt trội, cùng nhóm Vingroup là VHM và VPL củng cố đà tăng, giúp chỉ số VN-Index duy trì nhịp phục hồi trong tuần 17-21/11...\nCỔ PHIẾU\n22/11 08:00\nDNSE Future Tech Summit: Bước đệm cho kỷ nguyên giao dịch T+0 và thị trường “không độ trễ”\nChiều 21/11/2025, sự kiện công nghệ DNSE Future Tech Summit đã diễn ra tại TP. Hồ Chí Minh, quy tụ nhiều chuyên gia tài chính - công nghệ uy tín và trên 200 nhà đầu...\nCỔ PHIẾU\n21/11 22:32\nTheo dấu dòng tiền cá mập 21/11: Khối ngoại rút ròng VIX hơn 700 tỷ\nKhối ngoại quay lại bán ròng trong phiên 21/11 với tâm điểm là VIX, trái chiều với lực mua từ tự doanh các công ty chứng khoán (CTCK).\nCỔ PHIỆU\n21/11 13:02\nNhững dấu ấn của cổ phiếu thủy sản trong một năm thuế quan gây chao đảo\nGiữa một năm đầy biến động bởi chính sách thuế quan từ Mỹ, cổ phiếu thủy sản vẫn đang ghi những dấu ấn. 3/5 mã lớn của ngành vẫn giảm sâu trong khi ANV lại tìm thấy...\nCỔ PHIẾU\n21/11 10:32\nBầu Đức và “game” mới\nCổ phiếu HAG vừa đạt đỉnh 10 năm, bầu Đức tính chuyện niêm yết công ty con sau khi “cục máu đông” nợ tan được đôi phần.\nCỔ PHIẾU\n21/11 08:00\nTop cổ phiếu đáng chú ý đầu phiên 21/11\nDanh sách các mã cổ phiếu tăng và giảm mạnh nhất những phiên gần đây theo số liệu thống kê của Vietstock.\nXem thêm\nChỉ số thị trường\nTIN CHÍNH\nĐỌC NHIỀU NHẤT\n×\nBáo lỗi bài viết\nCám ơn bạn đã gửi báo lỗi bài viết.\nĐịa chỉ email\nHọ tên\nSố điện thoại\nNội dung\nGửi\nVietstock – Cổng thông tin tài chính và chứng khoán chính thức hoạt động từ ngày 02/08/2002, với định hướng trở thành người bạn đồng hành đáng tin cậy của nhà đầu tư. Ngay từ những ngày đầu, Vietstock đã không ngừng nỗ lực mang đến hệ thống thông tin và dữ liệu tài chính chính xác – cập nhật – đầy đủ, giúp nhà đầu tư hiểu đúng, nhìn rộng và tự tin đưa ra quyết định trong hành trình đầu tư của mình.\nTruyền Thông Tài Chính\nQuan hệ công chúng (PR)\nQuan hệ nhà đầu tư (IR)\nQuảng cáo banner\nBáo cáo phân tích\nDữ Liệu Tài Chính\nDataFeed\nVietstockXLS\nInvestOnline\nIROnline\nVietstockUpdater\nVietstockFinance\nSách tài chính\nPhân tích kỹ thuật từ A đến Z\nVai trò của Quan hệ Nhà đầu tư (IR) trong việc tối đa hóa giá trị doanh nghiệp\nVietstock\nQuảng cáo & Dịch vụ\n0908 169 898 - (028) 3848 7238\nkinhdoanh@vietstock.vn\nSáng tạo nội dung\n0938 046 488\ninfo@vietstock.vn\nVăn phòng giao dịch\n81/10B Hồ Văn Huê,\nPhường Đức Nhuận, Tp.HCM\nLớp học sắp khai giảng\n11/2025 Khóa học online - Phân tích Kỹ thuật Ứng dụng\nKhai giảng: 17/11/2025 |\nThời gian: Tối 2, 4, 6\n11/2025 Khóa học online - Đọc hiểu Báo cáo Tài chính\nKhai giảng: 25/11/2025 |\nThời gian: Tối 3, 5\n12/2025 Khóa học Online - Bắt đáy và Chốt lời Cổ phiếu\nKhai giảng: 13/12/2025 |\nThời gian: Thứ 7\n12/2025 Khóa học online - Phân tích Ngành và Dòng tiền Thị trường\nKhai giảng: 15/12/2025 |\nThời gian: Tối 2, 4, 6\n11/2025 Khóa học online - Phân tích Kỹ thuật Nâng cao\nKhai giảng: 03/11/2025 |\nThời gian: Tối 2, 4, 6\nSách tài chính\nPhân tích kỹ thuật từ A đến Z\nVai trò của Quan hệ Nhà đầu tư (IR) trong việc tối đa hóa giá trị doanh nghiệp\nVietstock\nVietstock\nVận hành bởi CTCP Tài Việt.\nTrụ sở: 28/47 Lê Thị Hồng, P.Gò Vấp, Tp.HCM\nTel: (84.28) 3848 7238 - Fax: (84.28) 3848 7237\nGiấy phép số 48/GP-STTTT ngày 04/11/2016\nQuyết định số 13/QĐ-STTTT ngày 02/11/2017\nQuyết định số 06/QĐ-STTTT-ICP ngày 20/07/2023\nĐược cấp bởi Sở Thông tin và Truyền thông TPHCM\nNgười chịu trách nhiệm\nBÀ PHẠM THỊ THANH NGA\nQuảng cáo & Dịch vụ\n0908 169 898 - (028) 3848 7238\nkinhdoanh@vietstock.vn\nSáng tạo nội dung\n0938 046 488\ninfo@vietstock.vn\nVăn phòng giao dịch\n81/10B Hồ Văn Huê,\nPhường Đức Nhuận, TPHCM\nSách tài chính\nPhân tích kỹ thuật từ A đến Z\nVai trò của Quan hệ Nhà đầu tư (IR) trong việc tối đa hóa giá trị doanh nghiệp\nVietstock\nVận hành bởi CTCP Tài Việt.\nTrụ sở: 28/47 Lê Thị Hồng, P.Gò Vấp, Tp.HCM\nTel: (84.28) 3848 7238 - Fax: (84.28) 3848 7237\nGiấy phép số 48/GP-STTTT ngày 04/11/2016\nQuyết định số 13/QĐ-STTTT ngày 02/11/2017\nQuyết định số 06/QĐ-STTTT-ICP ngày 20/07/2023\nĐược cấp bởi Sở Thông tin và Truyền thông TPHCM\nNgười chịu trách nhiệm\nBÀ PHẠM THỊ THANH NGA\n© Bản quyền thuộc về Vietstock\nSitemap\nVề chúng tôi\nChính sách quyền riêng tư\nQuảng cáo & Dịch vụ\n© Bản quyền thuộc về Vietstock\nHotline: 0908 16 98 98\nTất cả\nGiờ qua\n24 giờ qua\nTuần qua\nTháng qua\nNăm qua\nTất cả\nTính năng\nNgành\nMã chứng khoán\nLãnh đạo\nTin tức\nBáo cáo phân tích\nThuật ngữ\nDịch vụ\nTính năng (-)\nVietstock\nChứng khoán\nCổ phiếu\nGiao dịch nội bộ\nNiêm yết\nETF và các quỹ\nChứng khoán phái sinh\nChứng quyền\nÝ kiến chuyên gia\nCâu chuyện đầu tư\nChính sách\nTrái phiếu\nDoanh nghiệp\nHoạt động kinh doanh\nCổ tức\nTăng vốn - M&A\nIPO - Cổ phần hóa\nChứng khoán phái sinh\nNhân vật\nTrái phiếu doanh nghiệp\nBất động sản\nThị trường nhà đất\nQuy hoạch - Hạ tầng\nDự án\nBảo hiểm và thuế nhà đất\nTài chính\nNgân hàng\nBảo hiểm\nThuế và Ngân sách\nHàng hóa\nVàng và kim loại quý\nNhiên liệu\nKim loại\nNông sản thực phẩm\nKinh tế\nVĩ mô\nDữ liệu vĩ mô\nGDP\nCPI\nIIP\nBán lẻ\nXuất nhập khẩu\nFDI\nTín dụng\nThị trường mở\nTỷ giá - Lãi suất\nDân số và Lao động\nKinh tế - Đầu tư\nThế giới\nChứng khoán thế giới\nTiền kỹ thuật số\nTài chính quốc tế\nKinh tế - Đầu tư\nĐông dương\nVĩ mô\nTài chính - Ngân hàng\nThị trường chứng khoán\nKinh tế - Đầu tư\nTài chính cá nhân\nLàm chủ đồng tiền\nĐầu tư - Kinh doanh nhỏ\nDoanh nhân và khởi nghiệp\nChơi sang\nXe - Công nghệ\nTiêu dùng và lối sống\nVì cộng đồng\nPhân tích\nNhận định thị thường\nPhân tích cơ bản\nPhân tích kỹ thuật\nVietstockFinance\nVĩ mô\nDữ liệu vĩ mô\nGDP\nCPI\nIIP\nBán lẻ\nXuất nhập khẩu\nFDI\nTín dụng\nThị trường mở\nTỷ giá - Lãi suất\nDân số và Lao động\nNgành\nDữ liệu ngành\nNgành chi tiết\nDoanh nghiệp\nDoanh nghiệp A-Z\nHồ sơ lãnh đạo\nLịch sự kiện\nNiêm yết\nCổ tức và phát hành thêm\nĐại hội đồng cổ đông\nCập nhật lãi lỗ\nGiao dịch nội bộ\nCổ đông nội bộ\nNgười liên quan\nCổ đông lớn\nCổ phiếu quỹ\nTài liệu cổ đông\nBáo cáo tài chính\nGiải trình KQKD\nBáo cáo quản trị\nBáo cáo thường niên\nNghị quyết ĐHĐCĐ\nTài liệu ĐHĐCĐ\nNiên giám\nCổ phiếu\nThị trường cổ phiếu\nBản đồ thị trường\nTổng hợp thị trường\nThanh khoản\nĐịnh giá\nNước ngoài\nTự doanh\nTop cổ phiếu\nBản đồ ngành\nThống kê giao dịch\nGiá\nĐặt lệnh\nNước ngoài\nTự doanh\nẢnh hưởng chỉ số\nBiến động cổ phiếu\nGiao dịch nội bộ\nTrạng thái cổ phiếu\nQuy mô thị trường\nNiêm yết\nNiêm yết mới\nNiêm yết bổ sung\nHủy niêm yết\nTheo dõi đặc biệt\nKhông được ký quỹ\nETF\nCổ phiếu chi tiết\nTổng quan\nGiao dịch\nTài chính\nPhân tích kỹ thuật\nHồ sơ doanh nghiệp\nTin tức sự kiện\nTài liệu\nTâm lý thị trường\nPhái sinh\nHợp đồng tương lai\nTổng quan\nThống kê giao dịch\nKiến thức / Qui định\nChứng quyền\nTổng quan\nThống kê giao dịch\nBlackScholes\nTrái phiếu\nTổng quan\nTổ chức phát hành\nTrái phiếu A-Z\nThống kê giao dịch\nTin tức\nCông cụ đầu tư\nBản đồ thị trường\nSức mạnh giá RRG\nPhân tích kỹ thuật\nBảng giá trực tuyến\nBộ lọc cổ phiếu\nSo sánh cổ phiếu\nBáo cáo phân tích\nNghiên cứu - Phân tích\nVĩ mô - Chiến lược thị trường\nPhân tích ngành\nPhân tích doanh nghiệp\nTài liệu tham khảo\nBiểu đồ tài chính\nTruy xuất dữ liệu\nTổng hợp doanh nghiệp\nBáo cáo tài chính\nBáo cáo tài chính ngành\nVĩ mô\nNgành (-)\nVS-Sector\nNăng lượng\nNăng lượng\n-\xa0 Thiết bị và dịch vụ năng lượng\n-\xa0 Dầu khí\nNguyên vật liệu\nNguyên vật liệu\n-\xa0 Hóa chất\n-\xa0 Vật liệu xây dựng\n-\xa0 Bao bì và vật chứa\n-\xa0 Khai khoáng và luyện kim\n-\xa0 Gỗ và giấy\nCông nghiệp\nHàng hóa công nghiệp\n-\xa0 Thiết bị hàng không vũ trụ và quốc phòng\n-\xa0 Sản phẩm xây dựng\n-\xa0 Kỹ thuật xây dựng\n-\xa0 Thiết bị điện\n-\xa0 Tập đoàn đa ngành\n-\xa0 Máy móc công nghiệp\n-\xa0 Phân phối hàng công nghiệp\nDịch vụ thương mại và chuyên nghiệp\n-\xa0 Dịch vụ và thiết bị thương mại\n-\xa0 Dịch vụ chuyên nghiệp\nVận tải\n-\xa0 Vận tải và logistics hàng không\n-\xa0 Hãng hàng không chở khách\n-\xa0 Vận tải biển\n-\xa0 Vận tải mặt đất\n-\xa0 Hạ tầng giao thông\nTiêu dùng không thiết yếu\nXe và linh kiện\n-\xa0 Linh kiện xe\n-\xa0 Xe\nThời trang và hàng lâu bền\n-\xa0 Hàng tiêu dùng lâu bền\n-\xa0 Sản phẩm giải trí\n-\xa0 Thời trang và dệt may\nDịch vụ tiêu dùng\n-\xa0 Khách sạn, nhà hàng và giải trí\n-\xa0 Dịch vụ tiêu dùng khác\nThương mại hàng không thiết yếu\n-\xa0 Nhà phân phối\n-\xa0 Bán lẻ đa dạng\n-\xa0 Bán lẻ chuyên doanh\nTiêu dùng thiết yếu\nThương mại hàng thiết yếu\n-\xa0 Thương mại hàng thiết yếu\nThực phẩm, đồ uống và thuốc lá\n-\xa0 Đồ uống\n-\xa0 Thực phẩm\n-\xa0 Thuốc lá\nSản phẩm chăm sóc cá nhân và gia đình\n-\xa0 Sản phẩm chăm sóc gia đình\n-\xa0 Sản phẩm chăm sóc cá nhân\nChăm sóc sức khỏe\nThiết bị và dịch vụ chăm sóc sức khỏe\n-\xa0 Thiết bị và vật tư chăm sóc sức khỏe\n-\xa0 Thương mại và dịch vụ chăm sóc sức khỏe\n-\xa0 Công nghệ chăm sóc sức khỏe\nDược phẩm, công nghệ sinh học và khoa học sự sống\n-\xa0 Công nghệ sinh học\n-\xa0 Dược phẩm\n-\xa0 Công cụ và dịch vụ khoa học sự sống\nTài chính\nTổ chức tín dụng\n-\xa0 Ngân hàng\n-\xa0 Tín dụng phi ngân hàng\n-\xa0 Tín dụng khác\nDịch vụ tài chính\n-\xa0 Dịch vụ tài chính\n-\xa0 Thị trường vốn\n-\xa0 REIT thế chấp\nBảo hiểm\n-\xa0 Bảo hiểm\nCông nghệ thông tin\nPhần mềm và dịch vụ\n-\xa0 Dịch vụ CNTT\n-\xa0 Phần mềm\nPhần cứng và thiết bị\n-\xa0 Thiết bị viễn thông\n-\xa0 Phần cứng, bộ lưu trữ và thiết bị ngoại vi\n-\xa0 Điện tử\nBán dẫn\n-\xa0 Bán dẫn\nDịch vụ truyền thông\nDịch vụ viễn thông\n-\xa0 Dịch vụ viễn thông đa dạng\n-\xa0 Dịch vụ viễn thông không dây\nTruyền thông và giải trí\n-\xa0 Truyền thông\n-\xa0 Giải trí\n-\xa0 Truyền thông tương tác\nTiện ích\nTiện ích\n-\xa0 Điện\n-\xa0 Gas sinh hoạt\n-\xa0 Tiện tích tổng hợp\n-\xa0 Nước\n-\xa0 Phát điện độc lập và điện tái tạo\nBất động sản\nQuỹ REITs\n-\xa0 REITs bất động sản đa dạng\n-\xa0 REITs khu công nghiệp\n-\xa0 REITs khách sạn và khu nghỉ dưỡng\n-\xa0 REITs văn phòng\n-\xa0 REITs bất động sản y tế\n-\xa0 REITs nhà ở\n-\xa0 REITs bán lẻ\n-\xa0 REITs chuyên biệt\nBất động sản\n-\xa0 Quản lý và phát triển bất động sản\n-\xa0 Bất động sản đa dạng\n-\xa0 Dịch vụ bất động sản\nMã chứng khoán (-)\nTất cả\nCổ phiếu\nChỉ số\nChứng chỉ quỹ\nChứng quyền\nHợp đồng tương lai\nTrái phiếu\nXem thêm\nLãnh đạo (-)\nTất cả\nNgười nội bộ\nNgười liên quan\nCổ đông lớn\nXem thêm\nTin tức (-)\nXem thêm\nBài viết của tác giả (-)\nXem thêm\nBáo cáo phân tích (-)\nXem thêm\nThuật ngữ (-)\nXem thêm\nDịch vụ (-)\nĐào tạo\nKhóa học online - Phân tích Kỹ thuật Ứng dụng\nKhai giảng: 17/11/2025 |\nThời gian: Tối 2, 4, 6 |\nSố buổi: 7 |\nHọc phí: 3,825,000 đ\nKhóa học online - Đọc hiểu Báo cáo Tài chính\nKhai giảng: 25/11/2025 |\nThời gian: Tối 3, 5 |\nSố buổi: 3 |\nHọc phí: 1,530,000 đ\nKhóa học Online - Bắt đáy và Chốt lời Cổ phiếu\nKhai giảng: 13/12/2025 |\nThời gian: Thứ 7 |\nSố buổi: 3 |\nHọc phí: 1,870,000 đ\nKhóa học online - Phân tích Ngành và Dòng tiền Thị trường\nKhai giảng: 15/12/2025 |\nThời gian: Tối 2, 4, 6 |\nSố buổi: 6 |\nHọc phí: 3,570,000 đ\nKhóa học online - Phân tích Kỹ thuật Nâng cao\nKhai giảng: 03/11/2025 |\nThời gian: Tối 2, 4, 6 |\nSố buổi: 5 |\nHọc phí: 3,825,000 đ\nKhóa học online - Chứng khoán Cơ bản\nKhai giảng: 04/11/2025 |\nThời gian: Tối 3, 5 |\nSố buổi: 4 |\nHọc phí: 1,530,000 đ\nKhóa học online - Phân tích và Định giá Cổ phiếu\nKhai giảng: 21/10/2025 |\nThời gian: Tối 3, 5 |\nSố buổi: 4 |\nHọc phí: 1,870,000 đ\nKhóa học - Phân tích Kỹ thuật Ứng dụng - tại Tp. HCM\nKhai giảng: |\nThời gian: Tối 2, 4, 6 |\nSố buổi: 7 |\nHọc phí: 5,500,000 đ\nKhóa học online - Lướt sóng cổ phiếu nóng\nKhai giảng: 23/08/2025 |\nThời gian: Thứ 7 |\nSố buổi: 2 |\nHọc phí: 849,000 đ\nĐào tạo Phân tích và Đầu tư Chứng khoán IN - HOUSE\nKhai giảng: |\nThời gian: |\nSố buổi: 8 |\nHọc phí: 0 đ\nSách tài chính\nPhân tích kỹ thuật từ A và Z\nVai trò của Quan hệ Nhà đầu tư (IR) trong việc Tối đa hóa Giá trị Doanh nghiệp\nCông cụ đầu tư\nVietstockUpdater\nVietstockFinance\nTruyền thông tài chính\nBanner Ads\nOnline PR\nQuan hệ nhà đầu tư\nBáo cáo phân tích\nDữ liệu tài chính\nDataFeed - Dữ liệu tài chính tích hợp chuyên nghiệp\nVietstockXLS - Dữ liệu Kinh tế Tài chính Chứng khoán theo yêu cầu\nInvestOnline - Giải pháp website tra cứu chứng khoán toàn diện\nIROnline - Giải pháp thuê ngoài website IR, website quan hệ cổ đông\nThông báo\nVietstock trân trọng thông báo đến Quý Khách hàng về việc áp dụng “Chính sách quyền riêng tư” căn cứ theo Nghị định số 13/2023/NĐ-CP v/v bảo vệ dữ liệu cá nhân được ban hành bởi Chính phủ.\nTrong quá trình thiết lập mối quan hệ giữa Vietstock và Khách hàng, Vietstock có thể thu thập và xử lý dữ liệu cá nhân của Khách hàng cho mục đích được xác định tại Chính sách quyền riêng tư (“CSQRT”) này. Trong trường hợp Khách hàng không đồng ý một phần hoặc toàn bộ quy định tại CSQRT, Vietstock không thể cung cấp sản phẩm và dịch vụ cho Khách hàng.\nVietstock cam kết luôn tôn trọng quyền riêng tư, bảo mật và an toàn thông tin cá nhân; đồng thời luôn nỗ lực bảo vệ dữ liệu cá nhân của Khách hàng, tuân thủ quy định pháp luật Việt Nam thông qua những biện pháp bảo vệ dữ liệu cá nhân đáp ứng và phù hợp với quy định pháp luật Việt Nam.\nChính sách quyền riêng tư là một phần không thể tách rời của các thỏa thuận, điều khoản và điều kiện chi phối mối quan hệ giữa Vietstock và Quý Khách hàng.\nQuý Khách hàng đã đọc kỹ, hiểu rõ và đồng ý với toàn bộ điều khoản của “Chính sách quyền riêng tư”. Chi tiết Chính sách quyền riêng tư xem tại đây.\nNếu không đồng ý với Chính sách quyền riêng tư này, Chúng tôi không thể cung cấp sản phẩm và dịch vụ cho Quý Khách hàng.\nTôi đã đọc kỹ, hiểu rõ và đồng ý với toàn bộ điều khoản của Chính sách quyền riêng tư\nĐồng ý\nTheo dấu dòng tiền cá mập 24/11: Dòng tiền tự doanh nỗ lực bám trụ khi khối ngoại xả ròng\nPhiên 24/11 chứng kiến khối ngoại tiếp tục bán ròng hơn 1.2 ngàn tỷ đồng, trong khi dòng tiền tự doanh công ty chứng khoán (CTCK) vẫn duy trì xu hướng mua ròng, tạo bức tranh thị trường trái chiều.\nCác ""cá mập"" nước ngoài lại vừa có phiên bán ròng mạnh, hơn 1.2 ngàn tỷ đồng. Tâm điểm là các cổ phiếu họ Vingroup, với VRE bị xả mạnh nhất, hơn 288 tỷ đồng, gần gấp đôi giá trị bán ra của VHM (151 tỷ đồng). STB và VIC cũng nằm trong nhóm bị bán ròng mạnh, mỗi cổ phiếu khoảng 120 tỷ đồng.\nTrong khi đó, dòng tiền ngoại vẫn săn tìm cơ hội ở nhóm công nghệ. FPT dẫn đầu lực mua với 158 tỷ đồng, nối dài chuỗi phiên gom ròng liên tục trong hàng chục phiên gần đây. VNM đứng ngay sau với 147 tỷ đồng, còn VPB được mua ròng 58 tỷ đồng.\nTính từ đầu tháng 11, khối ngoại đã gom ròng FPT hơn 1.78 ngàn tỷ đồng - dẫn đầu toàn sàn, trong khi HPG theo sát với gần 1.73 ngàn tỷ đồng. Ở chiều ngược lại, STB bị xả mạnh nhất với hơn 2 ngàn tỷ đồng. Tổng cộng, giá trị bán ròng của khối ngoại trong tháng 11 vượt 9 ngàn tỷ đồng.\nNhìn rộng hơn, từ đầu quý 4 đến nay, FPT đã được gom ròng gần 4 ngàn tỷ đồng. Mặt khác, MBB bị xả mạnh nhất với hơn 4.3 ngàn tỷ đồng, đẩy tổng giá trị bán ròng toàn quý lên hơn 32 ngàn tỷ đồng.\nKhối ngoại bán ròng hơn ngàn tỷ\nTop 10 cổ phiếu khối ngoại giao dịch ròng nhiều nhất phiên 24/11\nỞ chiều ngược lại, khối tự doanh tiếp tục duy trì đà mua ròng, đạt 380 tỷ đồng trên HOSE, ghi nhận phiên mua ròng thứ hai liên tiếp. HPG và VNM dẫn đầu lực gom với lần lượt 63 tỷ đồng và 62 tỷ đồng, MWG theo sau 43 tỷ đồng.\nTrong khi đó, CTCK bán ròng mạnh nhất là STB gần 32 tỷ đồng, tiếp theo là KBC và VRE với 11 tỷ và 10 tỷ đồng.\nTự doanh lại mua ròng mạnh\nTop 10 cổ phiếu tự doanh giao dịch ròng mạnh nhất trong phiên 24/11\nTử Kính\nFILI\n- 17:55 24/11/2025\ncá mập\ntheo dấu dòng tiền cá mập\ntự doanh\nkhối ngoại mua ròng\nbán ròng\ngiao dịch cổ phiếu\nMÃ CHỨNG KHOÁN LIÊN QUAN (11)\nFPT\n100,200\n-600\n-0.60%\nHPG\n27,100\n-300\n-1.09%\nKBC\n34,950\n50\n+0.14%\nMBB\n23,150\n-50\n-0.22%\nMWG\n79,300\n-700\n-0.88%\nSTB\n50,000\n-1,300\n-2.53%\nVHM\n102,700\n3,400\n+3.42%\nVIC\n239,500\n9,800\n+4.27%\nVNM\n63,000\n3,100\n+5.18%\nVPB\n29,000\n450\n+1.58%\nVRE\n34,450\n2,250\n+6.99%\nTIN TỨC MÃ CHỨNG KHOÁN\n1\nThị trường chứng quyền ngày 25/11/2025: Nhóm chứng quyền VRE bứt phá\n45 phút trước\n2\nAFIEX có gì trong tay trước khi lên sàn HOSE?\n1 giờ trước\n3\nPhân tích kỹ thuật phiên chiều 24/11: Test lại đường SMA 50 ngày\n24/11 13:02\n4\nCông ty bao bì Việt do người Thái nắm giữ xin hủy đại chúng và rời HOSE\n24/11 12:40\n5\n48 tấn sữa và nước uống của Vinamilk đến rốn lũ miền Trung và Tây Nguyên\n24/11 11:41\nTIN CÙNG CHUYÊN MỤC\nCỔ PHIẾU\n13 phút trước\nCổ phiếu thủy sản, thực phẩm có tuần hút tiền\nThanh khoản diễn biến trái chiều ở hai sàn HOSE và HNX trong tuần giao dịch 17 - 21/11. Dòng tiền vẫn đang duy trì xu hướng thận trọng. Tuần vừa qua, nhóm cổ phiếu...\nCỔ PHIẾU\n24/11 11:01\nAfiex rời UPCoM cuối tháng 11 để chuyển sang HOSE\nSở Giao dịch Chứng khoán Hà Nội (HNX) thông báo hủy giao dịch toàn bộ 35 triệu cp của CTCP Xuất nhập khẩu Nông sản Thực phẩm An Giang (Afiex, UPCoM: AFX) từ ngày...\nCỔ PHIẾU\n24/11 08:00\nTop cổ phiếu đáng chú ý đầu tuần 24/11\nDanh sách các mã cổ phiếu tăng và giảm mạnh nhất những phiên gần đây theo số liệu thống kê của Vietstock.\nCỔ PHIẾU\n24/11 06:02\n24/11: Đọc gì trước giờ giao dịch chứng khoán?\nCập nhật nhanh những diễn biến kinh tế, tài chính trong nước và thế giới những ngày cuối tuần trước khi thị trường mở cửa.\nCỔ PHIẾU\n22/11 20:30\nVIC dẫn dắt đà tăng, VN-Index có thêm gần 20 điểm trong tuần phân hóa\nVIC tiếp tục dẫn dắt với mức đóng góp vượt trội, cùng nhóm Vingroup là VHM và VPL củng cố đà tăng, giúp chỉ số VN-Index duy trì nhịp phục hồi trong tuần 17-21/11...\nCỔ PHIẾU\n22/11 08:00\nDNSE Future Tech Summit: Bước đệm cho kỷ nguyên giao dịch T+0 và thị trường “không độ trễ”\nChiều 21/11/2025, sự kiện công nghệ DNSE Future Tech Summit đã diễn ra tại TP. Hồ Chí Minh, quy tụ nhiều chuyên gia tài chính - công nghệ uy tín và trên 200 nhà đầu...\nCỔ PHIẾU\n21/11 22:32\nTheo dấu dòng tiền cá mập 21/11: Khối ngoại rút ròng VIX hơn 700 tỷ\nKhối ngoại quay lại bán ròng trong phiên 21/11 với tâm điểm là VIX, trái chiều với lực mua từ tự doanh các công ty chứng khoán (CTCK).\nCỔ PHIẾU\n21/11 13:02\nNhững dấu ấn của cổ phiếu thủy sản trong một năm thuế quan gây chao đảo\nGiữa một năm đầy biến động bởi chính sách thuế quan từ Mỹ, cổ phiếu thủy sản vẫn đang ghi những dấu ấn. 3/5 mã lớn của ngành vẫn giảm sâu trong khi ANV lại tìm thấy...\nCỔ PHIẾU\n21/11 10:32\nBầu Đức và “game” mới\nCổ phiếu HAG vừa đạt đỉnh 10 năm, bầu Đức tính chuyện niêm yết công ty con sau khi “cục máu đông” nợ tan được đôi phần.\nCỔ PHIẾU\n21/11 08:00\nTop cổ phiếu đáng chú ý đầu phiên 21/11\nDanh sách các mã cổ phiếu tăng và giảm mạnh nhất những phiên gần đây theo số liệu thống kê của Vietstock.\nXem thêm\nChỉ số thị trường\nTIN CHÍNH\nĐỌC NHIỀU NHẤT\n×\nBáo lỗi bài viết\nCám ơn bạn đã gửi báo lỗi bài viết.\nĐịa chỉ email\nHọ tên\nSố điện thoại\nNội dung\nGửi\nVietstock – Cổng thông tin tài chính và chứng khoán chính thức hoạt động từ ngày 02/08/2002, với định hướng trở thành người bạn đồng hành đáng tin cậy của nhà đầu tư. Ngay từ những ngày đầu, Vietstock đã không ngừng nỗ lực mang đến hệ thống thông tin và dữ liệu tài chính chính xác – cập nhật – đầy đủ, giúp nhà đầu tư hiểu đúng, nhìn rộng và tự tin đưa ra quyết định trong hành trình đầu tư của mình.\nTruyền Thông Tài Chính\nQuan hệ công chúng (PR)\nQuan hệ nhà đầu tư (IR)\nQuảng cáo banner\nBáo cáo phân tích\nDữ Liệu Tài Chính\nDataFeed\nVietstockXLS\nInvestOnline\nIROnline\nVietstockUpdater\nVietstockFinance\nSách tài chính\nPhân tích kỹ thuật từ A đến Z\nVai trò của Quan hệ Nhà đầu tư (IR) trong việc tối đa hóa giá trị doanh nghiệp\nVietstock\nQuảng cáo & Dịch vụ\n0908 169 898 - (028) 3848 7238\nkinhdoanh@vietstock.vn\nSáng tạo nội dung\n0938 046 488\ninfo@vietstock.vn\nVăn phòng giao dịch\n81/10B Hồ Văn Huê,\nPhường Đức Nhuận, Tp.HCM\nLớp học sắp khai giảng\n11/2025 Khóa học online - Phân tích Kỹ thuật Ứng dụng\nKhai giảng: 17/11/2025 |\nThời gian: Tối 2, 4, 6\n11/2025 Khóa học online - Đọc hiểu Báo cáo Tài chính\nKhai giảng: 25/11/2025 |\nThời gian: Tối 3, 5\n12/2025 Khóa học Online - Bắt đáy và Chốt lời Cổ phiếu\nKhai giảng: 13/12/2025 |\nThời gian: Thứ 7\n12/2025 Khóa học online - Phân tích Ngành và Dòng tiền Thị trường\nKhai giảng: 15/12/2025 |\nThời gian: Tối 2, 4, 6\n11/2025 Khóa học online - Phân tích Kỹ thuật Nâng cao\nKhai giảng: 03/11/2025 |\nThời gian: Tối 2, 4, 6\nSách tài chính\nPhân tích kỹ thuật từ A đến Z\nVai trò của Quan hệ Nhà đầu tư (IR) trong việc tối đa hóa giá trị doanh nghiệp\nVietstock\nVietstock\nVận hành bởi CTCP Tài Việt.\nTrụ sở: 28/47 Lê Thị Hồng, P.Gò Vấp, Tp.HCM\nTel: (84.28) 3848 7238 - Fax: (84.28) 3848 7237\nGiấy phép số 48/GP-STTTT ngày 04/11/2016\nQuyết định số 13/QĐ-STTTT ngày 02/11/2017\nQuyết định số 06/QĐ-STTTT-ICP ngày 20/07/2023\nĐược cấp bởi Sở Thông tin và Truyền thông TPHCM\nNgười chịu trách nhiệm\nBÀ PHẠM THỊ THANH NGA\nQuảng cáo & Dịch vụ\n0908 169 898 - (028) 3848 7238\nkinhdoanh@vietstock.vn\nSáng tạo nội dung\n0938 046 488\ninfo@vietstock.vn\nVăn phòng giao dịch\n81/10B Hồ Văn Huê,\nPhường Đức Nhuận, TPHCM\nSách tài chính\nPhân tích kỹ thuật từ A đến Z\nVai trò của Quan hệ Nhà đầu tư (IR) trong việc tối đa hóa giá trị doanh nghiệp\nVietstock\nVận hành bởi CTCP Tài Việt.\nTrụ sở: 28/47 Lê Thị Hồng, P.Gò Vấp, Tp.HCM\nTel: (84.28) 3848 7238 - Fax: (84.28) 3848 7237\nGiấy phép số 48/GP-STTTT ngày 04/11/2016\nQuyết định số 13/QĐ-STTTT ngày 02/11/2017\nQuyết định số 06/QĐ-STTTT-ICP ngày 20/07/2023\nĐược cấp bởi Sở Thông tin và Truyền thông TPHCM\nNgười chịu trách nhiệm\nBÀ PHẠM THỊ THANH NGA\n© Bản quyền thuộc về Vietstock\nSitemap\nVề chúng tôi\nChính sách quyền riêng tư\nQuảng cáo & Dịch vụ\n© Bản quyền thuộc về Vietstock\nHotline: 0908 16 98 98\nTất cả\nGiờ qua\n24 giờ qua\nTuần qua\nTháng qua\nNăm qua\nTất cả\nTính năng\nNgành\nMã chứng khoán\nLãnh đạo\nTin tức\nBáo cáo phân tích\nThuật ngữ\nDịch vụ\nTính năng (-)\nVietstock\nChứng khoán\nCổ phiếu\nGiao dịch nội bộ\nNiêm yết\nETF và các quỹ\nChứng khoán phái sinh\nChứng quyền\nÝ kiến chuyên gia\nCâu chuyện đầu tư\nChính sách\nTrái phiếu\nDoanh nghiệp\nHoạt động kinh doanh\nCổ tức\nTăng vốn - M&A\nIPO - Cổ phần hóa\nChứng khoán phái sinh\nNhân vật\nTrái phiếu doanh nghiệp\nBất động sản\nThị trường nhà đất\nQuy hoạch - Hạ tầng\nDự án\nBảo hiểm và thuế nhà đất\nTài chính\nNgân hàng\nBảo hiểm\nThuế và Ngân sách\nHàng hóa\nVàng và kim loại quý\nNhiên liệu\nKim loại\nNông sản thực phẩm\nKinh tế\nVĩ mô\nDữ liệu vĩ mô\nGDP\nCPI\nIIP\nBán lẻ\nXuất nhập khẩu\nFDI\nTín dụng\nThị trường mở\nTỷ giá - Lãi suất\nDân số và Lao động\nKinh tế - Đầu tư\nThế giới\nChứng khoán thế giới\nTiền kỹ thuật số\nTài chính quốc tế\nKinh tế - Đầu tư\nĐông dương\nVĩ mô\nTài chính - Ngân hàng\nThị trường chứng khoán\nKinh tế - Đầu tư\nTài chính cá nhân\nLàm chủ đồng tiền\nĐầu tư - Kinh doanh nhỏ\nDoanh nhân và khởi nghiệp\nChơi sang\nXe - Công nghệ\nTiêu dùng và lối sống\nVì cộng đồng\nPhân tích\nNhận định thị thường\nPhân tích cơ bản\nPhân tích kỹ thuật\nVietstockFinance\nVĩ mô\nDữ liệu vĩ mô\nGDP\nCPI\nIIP\nBán lẻ\nXuất nhập khẩu\nFDI\nTín dụng\nThị trường mở\nTỷ giá - Lãi suất\nDân số và Lao động\nNgành\nDữ liệu ngành\nNgành chi tiết\nDoanh nghiệp\nDoanh nghiệp A-Z\nHồ sơ lãnh đạo\nLịch sự kiện\nNiêm yết\nCổ tức và phát hành thêm\nĐại hội đồng cổ đông\nCập nhật lãi lỗ\nGiao dịch nội bộ\nCổ đông nội bộ\nNgười liên quan\nCổ đông lớn\nCổ phiếu quỹ\nTài liệu cổ đông\nBáo cáo tài chính\nGiải trình KQKD\nBáo cáo quản trị\nBáo cáo thường niên\nNghị quyết ĐHĐCĐ\nTài liệu ĐHĐCĐ\nNiên giám\nCổ phiếu\nThị trường cổ phiếu\nBản đồ thị trường\nTổng hợp thị trường\nThanh khoản\nĐịnh giá\nNước ngoài\nTự doanh\nTop cổ phiếu\nBản đồ ngành\nThống kê giao dịch\nGiá\nĐặt lệnh\nNước ngoài\nTự doanh\nẢnh hưởng chỉ số\nBiến động cổ phiếu\nGiao dịch nội bộ\nTrạng thái cổ phiếu\nQuy mô thị trường\nNiêm yết\nNiêm yết mới\nNiêm yết bổ sung\nHủy niêm yết\nTheo dõi đặc biệt\nKhông được ký quỹ\nETF\nCổ phiếu chi tiết\nTổng quan\nGiao dịch\nTài chính\nPhân tích kỹ thuật\nHồ sơ doanh nghiệp\nTin tức sự kiện\nTài liệu\nTâm lý thị trường\nPhái sinh\nHợp đồng tương lai\nTổng quan\nThống kê giao dịch\nKiến thức / Qui định\nChứng quyền\nTổng quan\nThống kê giao dịch\nBlackScholes\nTrái phiếu\nTổng quan\nTổ chức phát hành\nTrái phiếu A-Z\nThống kê giao dịch\nTin tức\nCông cụ đầu tư\nBản đồ thị trường\nSức mạnh giá RRG\nPhân tích kỹ thuật\nBảng giá trực tuyến\nBộ lọc cổ phiếu\nSo sánh cổ phiếu\nBáo cáo phân tích\nNghiên cứu - Phân tích\nVĩ mô - Chiến lược thị trường\nPhân tích ngành\nPhân tích doanh nghiệp\nTài liệu tham khảo\nBiểu đồ tài chính\nTruy xuất dữ liệu\nTổng hợp doanh nghiệp\nBáo cáo tài chính\nBáo cáo tài chính ngành\nVĩ mô\nNgành (-)\nVS-Sector\nNăng lượng\nNăng lượng\n-\xa0 Thiết bị và dịch vụ năng lượng\n-\xa0 Dầu khí\nNguyên vật liệu\nNguyên vật liệu\n-\xa0 Hóa chất\n-\xa0 Vật liệu xây dựng\n-\xa0 Bao bì và vật chứa\n-\xa0 Khai khoáng và luyện kim\n-\xa0 Gỗ và giấy\nCông nghiệp\nHàng hóa công nghiệp\n-\xa0 Thiết bị hàng không vũ trụ và quốc phòng\n-\xa0 Sản phẩm xây dựng\n-\xa0 Kỹ thuật xây dựng\n-\xa0 Thiết bị điện\n-\xa0 Tập đoàn đa ngành\n-\xa0 Máy móc công nghiệp\n-\xa0 Phân phối hàng công nghiệp\nDịch vụ thương mại và chuyên nghiệp\n-\xa0 Dịch vụ và thiết bị thương mại\n-\xa0 Dịch vụ chuyên nghiệp\nVận tải\n-\xa0 Vận tải và logistics hàng không\n-\xa0 Hãng hàng không chở khách\n-\xa0 Vận tải biển\n-\xa0 Vận tải mặt đất\n-\xa0 Hạ tầng giao thông\nTiêu dùng không thiết yếu\nXe và linh kiện\n-\xa0 Linh kiện xe\n-\xa0 Xe\nThời trang và hàng lâu bền\n-\xa0 Hàng tiêu dùng lâu bền\n-\xa0 Sản phẩm giải trí\n-\xa0 Thời trang và dệt may\nDịch vụ tiêu dùng\n-\xa0 Khách sạn, nhà hàng và giải trí\n-\xa0 Dịch vụ tiêu dùng khác\nThương mại hàng không thiết yếu\n-\xa0 Nhà phân phối\n-\xa0 Bán lẻ đa dạng\n-\xa0 Bán lẻ chuyên doanh\nTiêu dùng thiết yếu\nThương mại hàng thiết yếu\n-\xa0 Thương mại hàng thiết yếu\nThực phẩm, đồ uống và thuốc lá\n-\xa0 Đồ uống\n-\xa0 Thực phẩm\n-\xa0 Thuốc lá\nSản phẩm chăm sóc cá nhân và gia đình\n-\xa0 Sản phẩm chăm sóc gia đình\n-\xa0 Sản phẩm chăm sóc cá nhân\nChăm sóc sức khỏe\nThiết bị và dịch vụ chăm sóc sức khỏe\n-\xa0 Thiết bị và vật tư chăm sóc sức khỏe\n-\xa0 Thương mại và dịch vụ chăm sóc sức khỏe\n-\xa0 Công nghệ chăm sóc sức khỏe\nDược phẩm, công nghệ sinh học và khoa học sự sống\n-\xa0 Công nghệ sinh học\n-\xa0 Dược phẩm\n-\xa0 Công cụ và dịch vụ khoa học sự sống\nTài chính\nTổ chức tín dụng\n-\xa0 Ngân hàng\n-\xa0 Tín dụng phi ngân hàng\n-\xa0 Tín dụng khác\nDịch vụ tài chính\n-\xa0 Dịch vụ tài chính\n-\xa0 Thị trường vốn\n-\xa0 REIT thế chấp\nBảo hiểm\n-\xa0 Bảo hiểm\nCông nghệ thông tin\nPhần mềm và dịch vụ\n-\xa0 Dịch vụ CNTT\n-\xa0 Phần mềm\nPhần cứng và thiết bị\n-\xa0 Thiết bị viễn thông\n-\xa0 Phần cứng, bộ lưu trữ và thiết bị ngoại vi\n-\xa0 Điện tử\nBán dẫn\n-\xa0 Bán dẫn\nDịch vụ truyền thông\nDịch vụ viễn thông\n-\xa0 Dịch vụ viễn thông đa dạng\n-\xa0 Dịch vụ viễn thông không dây\nTruyền thông và giải trí\n-\xa0 Truyền thông\n-\xa0 Giải trí\n-\xa0 Truyền thông tương tác\nTiện ích\nTiện ích\n-\xa0 Điện\n-\xa0 Gas sinh hoạt\n-\xa0 Tiện tích tổng hợp\n-\xa0 Nước\n-\xa0 Phát điện độc lập và điện tái tạo\nBất động sản\nQuỹ REITs\n-\xa0 REITs bất động sản đa dạng\n-\xa0 REITs khu công nghiệp\n-\xa0 REITs khách sạn và khu nghỉ dưỡng\n-\xa0 REITs văn phòng\n-\xa0 REITs bất động sản y tế\n-\xa0 REITs nhà ở\n-\xa0 REITs bán lẻ\n-\xa0 REITs chuyên biệt\nBất động sản\n-\xa0 Quản lý và phát triển bất động sản\n-\xa0 Bất động sản đa dạng\n-\xa0 Dịch vụ bất động sản\nMã chứng khoán (-)\nTất cả\nCổ phiếu\nChỉ số\nChứng chỉ quỹ\nChứng quyền\nHợp đồng tương lai\nTrái phiếu\nXem thêm\nLãnh đạo (-)\nTất cả\nNgười nội bộ\nNgười liên quan\nCổ đông lớn\nXem thêm\nTin tức (-)\nXem thêm\nBài viết của tác giả (-)\nXem thêm\nBáo cáo phân tích (-)\nXem thêm\nThuật ngữ (-)\nXem thêm\nDịch vụ (-)\nĐào tạo\nKhóa học online - Phân tích Kỹ thuật Ứng dụng\nKhai giảng: 17/11/2025 |\nThời gian: Tối 2, 4, 6 |\nSố buổi: 7 |\nHọc phí: 3,825,000 đ\nKhóa học online - Đọc hiểu Báo cáo Tài chính\nKhai giảng: 25/11/2025 |\nThời gian: Tối 3, 5 |\nSố buổi: 3 |\nHọc phí: 1,530,000 đ\nKhóa học Online - Bắt đáy và Chốt lời Cổ phiếu\nKhai giảng: 13/12/2025 |\nThời gian: Thứ 7 |\nSố buổi: 3 |\nHọc phí: 1,870,000 đ\nKhóa học online - Phân tích Ngành và Dòng tiền Thị trường\nKhai giảng: 15/12/2025 |\nThời gian: Tối 2, 4, 6 |\nSố buổi: 6 |\nHọc phí: 3,570,000 đ\nKhóa học online - Phân tích Kỹ thuật Nâng cao\nKhai giảng: 03/11/2025 |\nThời gian: Tối 2, 4, 6 |\nSố buổi: 5 |\nHọc phí: 3,825,000 đ\nKhóa học online - Chứng khoán Cơ bản\nKhai giảng: 04/11/2025 |\nThời gian: Tối 3, 5 |\nSố buổi: 4 |\nHọc phí: 1,530,000 đ\nKhóa học online - Phân tích và Định giá Cổ phiếu\nKhai giảng: 21/10/2025 |\nThời gian: Tối 3, 5 |\nSố buổi: 4 |\nHọc phí: 1,870,000 đ\nKhóa học - Phân tích Kỹ thuật Ứng dụng - tại Tp. HCM\nKhai giảng: |\nThời gian: Tối 2, 4, 6 |\nSố buổi: 7 |\nHọc phí: 5,500,000 đ\nKhóa học online - Lướt sóng cổ phiếu nóng\nKhai giảng: 23/08/2025 |\nThời gian: Thứ 7 |\nSố buổi: 2 |\nHọc phí: 849,000 đ\nĐào tạo Phân tích và Đầu tư Chứng khoán IN - HOUSE\nKhai giảng: |\nThời gian: |\nSố buổi: 8 |\nHọc phí: 0 đ\nSách tài chính\nPhân tích kỹ thuật từ A đến Z\nVai trò của Quan hệ Nhà đầu tư (IR) trong việc Tối đa hóa Giá trị Doanh nghiệp\nCông cụ đầu tư\nVietstockUpdater\nVietstockFinance\nTruyền thông tài chính\nBanner Ads\nOnline PR\nQuan hệ nhà đầu tư\nBáo cáo phân tích\nDữ liệu tài chính\nDataFeed - Dữ liệu tài chính tích hợp chuyên nghiệp\nVietstockXLS - Dữ liệu Kinh tế Tài chính Chứng khoán theo yêu cầu\nInvestOnline - Giải pháp website tra cứu chứng khoán toàn diện\nIROnline - Giải pháp thuê ngoài website IR, website quan hệ cổ đông\nThông báo\nVietstock trân trọng thông báo đến Quý Khách hàng về việc áp dụng “Chính sách quyền riêng tư” căn cứ theo Nghị định số 13/2023/NĐ-CP v/v bảo vệ dữ liệu cá nhân được ban hành bởi Chính phủ.\nTrong quá trình thiết lập mối quan hệ giữa Vietstock và Khách hàng, Vietstock có thể thu thập và xử lý dữ liệu cá nhân của Khách hàng cho mục đích được xác định tại Chính sách quyền riêng tư (“CSQRT”) này. Trong trường hợp Khách hàng không đồng ý một phần hoặc toàn bộ quy định tại CSQRT, Vietstock không thể cung cấp sản phẩm và dịch vụ cho Khách hàng.\nVietstock cam kết luôn tôn trọng quyền riêng tư, bảo mật và an toàn thông tin cá nhân; đồng thời luôn nỗ lực bảo vệ dữ liệu cá nhân của Khách hàng, tuân thủ quy định pháp luật Việt Nam thông qua những biện pháp bảo vệ dữ liệu cá nhân đáp ứng và phù hợp với quy định pháp luật Việt Nam.\nChính sách quyền riêng tư là một phần không thể tách rời của các thỏa thuận, điều khoản và điều kiện chi phối mối quan hệ giữa Vietstock và Quý Khách hàng.\nQuý Khách hàng đã đọc kỹ, hiểu rõ và đồng ý với toàn bộ điều khoản của “Chính sách quyền riêng tư”. Chi tiết Chính sách quyền riêng tư xem tại đây.\nNếu không đồng ý với Chính sách quyền riêng tư này, Chúng tôi không thể cung cấp sản phẩm và dịch vụ cho Quý Khách hàng.\nTôi đã đọc kỹ, hiểu rõ và đồng ý với toàn bộ điều khoản của Chính sách quyền riêng tư\nĐồng ý\nTheo dấu dòng tiền cá mập 24/11: Dòng tiền tự doanh nỗ lực bám trụ khi khối ngoại xả ròng\nPhiên 24/11 chứng kiến khối ngoại tiếp tục bán ròng hơn 1.2 ngàn tỷ đồng, trong khi dòng tiền tự doanh công ty chứng khoán (CTCK) vẫn duy trì xu hướng mua ròng, tạo bức tranh thị trường trái chiều.\nCác ""cá mập"" nước ngoài lại vừa có phiên bán ròng mạnh, hơn 1.2 ngàn tỷ đồng. Tâm điểm là các cổ phiếu họ Vingroup, với VRE bị xả mạnh nhất, hơn 288 tỷ đồng, gần gấp đôi giá trị bán ra của VHM (151 tỷ đồng). STB và VIC cũng nằm trong nhóm bị bán ròng mạnh, mỗi cổ phiếu khoảng 120 tỷ đồng.\nTrong khi đó, dòng tiền ngoại vẫn săn tìm cơ hội ở nhóm công nghệ. FPT dẫn đầu lực mua với 158 tỷ đồng, nối dài chuỗi phiên gom ròng liên tục trong hàng chục phiên gần đây. VNM đứng ngay sau với 147 tỷ đồng, còn VPB được mua ròng 58 tỷ đồng.\nTính từ đầu tháng 11, khối ngoại đã gom ròng FPT hơn 1.78 ngàn tỷ đồng - dẫn đầu toàn sàn, trong khi HPG theo sát với gần 1.73 ngàn tỷ đồng. Ở chiều ngược lại, STB bị xả mạnh nhất với hơn 2 ngàn tỷ đồng. Tổng cộng, giá trị bán ròng của khối ngoại trong tháng 11 vượt 9 ngàn tỷ đồng.\nNhìn rộng hơn, từ đầu quý 4 đến nay, FPT đã được gom ròng gần 4 ngàn tỷ đồng. Mặt khác, MBB bị xả mạnh nhất với hơn 4.3 ngàn tỷ đồng, đẩy tổng giá trị bán ròng toàn quý lên hơn 32 ngàn tỷ đồng.\nKhối ngoại bán ròng hơn ngàn tỷ\nTop 10 cổ phiếu khối ngoại giao dịch ròng nhiều nhất phiên 24/11\nỞ chiều ngược lại, khối tự doanh tiếp tục duy trì đà mua ròng, đạt 380 tỷ đồng trên HOSE, ghi nhận phiên mua ròng thứ hai liên tiếp. HPG và VNM dẫn đầu lực gom với lần lượt 63 tỷ đồng và 62 tỷ đồng, MWG theo sau 43 tỷ đồng.\nTrong khi đó, CTCK bán ròng mạnh nhất là STB gần 32 tỷ đồng, tiếp theo là KBC và VRE với 11 tỷ và 10 tỷ đồng.\nTự doanh lại mua ròng mạnh\nTop 10 cổ phiếu tự doanh giao dịch ròng mạnh nhất trong phiên 24/11\nTử Kính\nFILI\n- 17:55 24/11/2025\ncá mập\ntheo dấu dòng tiền cá mập\ntự doanh\nkhối ngoại mua ròng\nbán ròng\ngiao dịch cổ phiếu\nMÃ CHỨNG KHOÁN LIÊN QUAN (11)\nFPT\n100,200\n-600\n-0.60%\nHPG\n27,100\n-300\n-1.09%\nKBC\n34,950\n50\n+0.14%\nMBB\n23,150\n-50\n-0.22%\nMWG\n79,300\n-700\n-0.88%\nSTB\n50,000\n-1,300\n-2.53%\nVHM\n102,700\n3,400\n+3.42%\nVIC\n239,500\n9,800\n+4.27%\nVNM\n63,000\n3,100\n+5.18%\nVPB\n29,000\n450\n+1.58%\nVRE\n34,450\n2,250\n+6.99%\nTIN TỨC MÃ CHỨNG KHOÁN\n1\nThị trường chứng quyền ngày 25/11/2025: Nhóm chứng quyền VRE bứt phá\n45 phút trước\n2\nAFIEX có gì trong tay trước khi lên sàn HOSE?\n1 giờ trước\n3\nPhân tích kỹ thuật phiên chiều 24/11: Test lại đường SMA 50 ngày\n24/11 13:02\n4\nCông ty bao bì Việt do người Thái nắm giữ xin hủy đại chúng và rời HOSE\n24/11 12:40\n5\n48 tấn sữa và nước uống của Vinamilk đến rốn lũ miền Trung và Tây Nguyên\n24/11 11:41\nTIN CÙNG CHUYÊN MỤC\nCỔ PHIẾU\n13 phút trước\nCổ phiếu thủy sản, thực phẩm có tuần hút tiền\nThanh khoản diễn biến trái chiều ở hai sàn HOSE và HNX trong tuần giao dịch 17 - 21/11. Dòng tiền vẫn đang duy trì xu hướng thận trọng. Tuần vừa qua, nhóm cổ phiếu...\nCỔ PHIẾU\n24/11 11:01\nAfiex rời UPCoM cuối tháng 11 để chuyển sang HOSE\nSở Giao dịch Chứng khoán Hà Nội (HNX) thông báo hủy giao dịch toàn bộ 35 triệu cp của CTCP Xuất nhập khẩu Nông sản Thực phẩm An Giang (Afiex, UPCoM: AFX) từ ngày...\nCỔ PHIẾU\n24/11 08:00\nTop cổ phiếu đáng chú ý đầu tuần 24/11\nDanh sách các mã cổ phiếu tăng và giảm mạnh nhất những phiên gần đây theo số liệu thống kê của Vietstock.\nCỔ PHIẾU\n24/11 06:02\n24/11: Đọc gì trước giờ giao dịch chứng khoán?\nCập nhật nhanh những diễn biến kinh tế, tài chính trong nước và thế giới những ngày cuối tuần trước khi thị trường mở cửa.\nCỔ PHIẾU\n22/11 20:30\nVIC dẫn dắt đà tăng, VN-Index có thêm gần 20 điểm trong tuần phân hóa\nVIC tiếp tục dẫn dắt với mức đóng góp vượt trội, cùng nhóm Vingroup là VHM và VPL củng cố đà tăng, giúp chỉ số VN-Index duy trì nhịp phục hồi trong tuần 17-21/11...\nCỔ PHIẾU\n22/11 08:00\nDNSE Future Tech Summit: Bước đệm cho kỷ nguyên giao dịch T+0 và thị trường “không độ trễ”\nChiều 21/11/2025, sự kiện công nghệ DNSE Future Tech Summit đã diễn ra tại TP. Hồ Chí Minh, quy tụ nhiều chuyên gia tài chính - công nghệ uy tín và trên 200 nhà đầu...\nCỔ PHIẾU\n21/11 22:32\nTheo dấu dòng tiền cá mập 21/11: Khối ngoại rút ròng VIX hơn 700 tỷ\nKhối ngoại quay lại bán ròng trong phiên 21/11 với tâm điểm là VIX, trái chiều với lực mua từ tự doanh các công ty chứng khoán (CTCK).\nCỔ PHIẾU\n21/11 13:02\nNhững dấu ấn của cổ phiếu thủy sản trong một năm thuế quan gây chao đảo\nGiữa một năm đầy biến động bởi chính sách thuế quan từ Mỹ, cổ phiếu thủy sản vẫn đang ghi những dấu ấn. 3/5 mã lớn của ngành vẫn giảm sâu trong khi ANV lại tìm thấy...\nCỔ PHIẾU\n21/11 10:32\nBầu Đức và “game” mới\nCổ phiếu HAG vừa đạt đỉnh 10 năm, bầu Đức tính chuyện niêm yết công ty con sau khi “cục máu đông” nợ tan được đôi phần.\nCỔ PHIẾU\n21/11 08:00\nTop cổ phiếu đáng chú ý đầu phiên 21/11\nDanh sách các mã cổ phiếu tăng và giảm mạnh nhất những phiên gần đây theo số liệu thống kê của Vietstock.\nXem thêm\nChỉ số thị trường\nTIN CHÍNH\nĐỌC NHIỀU NHẤT\n×\nBáo lỗi bài viết\nCám ơn bạn đã gửi báo lỗi bài viết.\nĐịa chỉ email\nHọ tên\nSố điện thoại\nNội dung\nGửi\nVietstock – Cổng thông tin tài chính và chứng khoán chính thức hoạt động từ ngày 02/08/2002, với định hướng trở thành người bạn đồng hành đáng tin cậy của nhà đầu tư. Ngay từ những ngày đầu, Vietstock đã không ngừng nỗ lực mang đến hệ thống thông tin và dữ liệu tài chính chính xác – cập nhật – đầy đủ, giúp nhà đầu tư hiểu đúng, nhìn rộng và tự tin đưa ra quyết định trong hành trình đầu tư của mình.\nTruyền Thông Tài Chính\nQuan hệ công chúng (PR)\nQuan hệ nhà đầu tư (IR)\nQuảng cáo banner\nBáo cáo phân tích\nDữ Liệu Tài Chính\nDataFeed\nVietstockXLS\nInvestOnline\nIROnline\nVietstockUpdater\nVietstockFinance\nSách tài chính\nPhân tích kỹ thuật từ A đến Z\nVai trò của Quan hệ Nhà đầu tư (IR) trong việc tối đa hóa giá trị doanh nghiệp\nVietstock\nQuảng cáo & Dịch vụ\n0908 169 898 - (028) 3848 7238\nkinhdoanh@vietstock.vn\nSáng tạo nội dung\n0938 046 488\ninfo@vietstock.vn\nVăn phòng giao dịch\n81/10B Hồ Văn Huê,\nPhường Đức Nhuận, Tp.HCM\nLớp học sắp khai giảng\n11/2025 Khóa học online - Phân tích Kỹ thuật Ứng dụng\nKhai giảng: 17/11/2025 |\nThời gian: Tối 2, 4, 6\n11/2025 Khóa học online - Đọc hiểu Báo cáo Tài chính\nKhai giảng: 25/11/2025 |\nThời gian: Tối 3, 5\n12/2025 Khóa học Online - Bắt đáy và Chốt lời Cổ phiếu\nKhai giảng: 13/12/2025 |\nThời gian: Thứ 7\n12/2025 Khóa học online - Phân tích Ngành và Dòng tiền Thị trường\nKhai giảng: 15/12/2025 |\nThời gian: Tối 2, 4, 6\n11/2025 Khóa học online - Phân tích Kỹ thuật Nâng cao\nKhai giảng: 03/11/2025 |\nThời gian: Tối 2, 4, 6\nSách tài chính\nPhân tích kỹ thuật từ A đến Z\nVai trò của Quan hệ Nhà đầu tư (IR) trong việc tối đa hóa giá trị doanh nghiệp\nVietstock\nVietstock\nVận hành bởi CTCP Tài Việt.\nTrụ sở: 28/47 Lê Thị Hồng, P.Gò Vấp, Tp.HCM\nTel: (84.28) 3848 7238 - Fax: (84.28) 3848 7237\nGiấy phép số 48/GP-STTTT ngày 04/11/2016\nQuyết định số 13/QĐ-STTTT ngày 02/11/2017\nQuyết định số 06/QĐ-STTTT-ICP ngày 20/07/2023\nĐược cấp bởi Sở Thông tin và Truyền thông TPHCM\nNgười chịu trách nhiệm\nBÀ PHẠM THỊ THANH NGA\nQuảng cáo & Dịch vụ\n0908 169 898 - (028) 3848 7238\nkinhdoanh@vietstock.vn\nSáng tạo nội dung\n0938 046 488\ninfo@vietstock.vn\nVăn phòng giao dịch\n81/10B Hồ Văn Huê,\nPhường Đức Nhuận, TPHCM\nSách tài chính\nPhân tích kỹ thuật từ A đến Z\nVai trò của Quan hệ Nhà đầu tư (IR) trong việc tối đa hóa giá trị doanh nghiệp\nVietstock\nVận hành bởi CTCP Tài Việt.\nTrụ sở: 28/47 Lê Thị Hồng, P.Gò Vấp, Tp.HCM\nTel: (84.28) 3848 7238 - Fax: (84.28) 3848 7237\nGiấy phép số 48/GP-STTTT ngày 04/11/2016\nQuyết định số 13/QĐ-STTTT ngày 02/11/2017\nQuyết định số 06/QĐ-STTTT-ICP ngày 20/07/2023\nĐược cấp bởi Sở Thông tin và Truyền thông TPHCM\nNgười chịu trách nhiệm\nBÀ PHẠM THỊ THANH NGA\n© Bản quyền thuộc về Vietstock\nSitemap\nVề chúng tôi\nChính sách quyền riêng tư\nQuảng cáo & Dịch vụ\n© Bản quyền thuộc về Vietstock\nHotline: 0908 16 98 98\nTất cả\nGiờ qua\n24 giờ qua\nTuần qua\nTháng qua\nNăm qua\nTất cả\nTính năng\nNgành\nMã chứng khoán\nLãnh đạo\nTin tức\nBáo cáo phân tích\nThuật ngữ\nDịch vụ\nTính năng (-)\nVietstock\nChứng khoán\nCổ phiếu\nGiao dịch nội bộ\nNiêm yết\nETF và các quỹ\nChứng khoán phái sinh\nChứng quyền\nÝ kiến chuyên gia\nCâu chuyện đầu tư\nChính sách\nTrái phiếu\nDoanh nghiệp\nHoạt động kinh doanh\nCổ tức\nTăng vốn - M&A\nIPO - Cổ phần hóa\nChứng khoán phái sinh\nNhân vật\nTrái phiếu doanh nghiệp\nBất động sản\nThị trường nhà đất\nQuy hoạch - Hạ tầng\nDự án\nBảo hiểm và thuế nhà đất\nTài chính\nNgân hàng\nBảo hiểm\nThuế và Ngân sách\nHàng hóa\nVàng và kim loại quý\nNhiên liệu\nKim loại\nNông sản thực phẩm\nKinh tế\nVĩ mô\nDữ liệu vĩ mô\nGDP\nCPI\nIIP\nBán lẻ\nXuất nhập khẩu\nFDI\nTín dụng\nThị trường mở\nTỷ giá - Lãi suất\nDân số và Lao động\nKinh tế - Đầu tư\nThế giới\nChứng khoán thế giới\nTiền kỹ thuật số\nTài chính quốc tế\nKinh tế - Đầu tư\nĐông dương\nVĩ mô\nTài chính - Ngân hàng\nThị trường chứng khoán\nKinh tế - Đầu tư\nTài chính cá nhân\nLàm chủ đồng tiền\nĐầu tư - Kinh doanh nhỏ\nDoanh nhân và khởi nghiệp\nChơi sang\nXe - Công nghệ\nTiêu dùng và lối sống\nVì cộng đồng\nPhân tích\nNhận định thị thường\nPhân tích cơ bản\nPhân tích kỹ thuật\nVietstockFinance\nVĩ mô\nDữ liệu vĩ mô\nGDP\nCPI\nIIP\nBán lẻ\nXuất nhập khẩu\nFDI\nTín dụng\nThị trường mở\nTỷ giá - Lãi suất\nDân số và Lao động\nNgành\nDữ liệu ngành\nNgành chi tiết\nDoanh nghiệp\nDoanh nghiệp A-Z\nHồ sơ lãnh đạo\nLịch sự kiện\nNiêm yết\nCổ tức và phát hành thêm\nĐại hội đồng cổ đông\nCập nhật lãi lỗ\nGiao dịch nội bộ\nCổ đông nội bộ\nNgười liên quan\nCổ đông lớn\nCổ phiếu quỹ\nTài liệu cổ đông\nBáo cáo tài chính\nGiải trình KQKD\nBáo cáo quản trị\nBáo cáo thường niên\nNghị quyết ĐHĐCĐ\nTài liệu ĐHĐCĐ\nNiên giám\nCổ phiếu\nThị trường cổ phiếu\nBản đồ thị trường\nTổng hợp thị trường\nThanh khoản\nĐịnh giá\nNước ngoài\nTự doanh\nTop cổ phiếu\nBản đồ ngành\nThống kê giao dịch\nGiá\nĐặt lệnh\nNước ngoài\nTự doanh\nẢnh hưởng chỉ số\nBiến động cổ phiếu\nGiao dịch nội bộ\nTrạng thái cổ phiếu\nQuy mô thị trường\nNiêm yết\nNiêm yết mới\nNiêm yết bổ sung\nHủy niêm yết\nTheo dõi đặc biệt\nKhông được ký quỹ\nETF\nCổ phiếu chi tiết\nTổng quan\nGiao dịch\nTài chính\nPhân tích kỹ thuật\nHồ sơ doanh nghiệp\nTin tức sự kiện\nTài liệu\nTâm lý thị trường\nPhái sinh\nHợp đồng tương lai\nTổng quan\nThống kê giao dịch\nKiến thức / Qui định\nChứng quyền\nTổng quan\nThống kê giao dịch\nBlackScholes\nTrái phiếu\nTổng quan\nTổ chức phát hành\nTrái phiếu A-Z\nThống kê giao dịch\nTin tức\nCông cụ đầu tư\nBản đồ thị trường\nSức mạnh giá RRG\nPhân tích kỹ thuật\nBảng giá trực tuyến\nBộ lọc cổ phiếu\nSo sánh cổ phiếu\nBáo cáo phân tích\nNghiên cứu - Phân tích\nVĩ mô - Chiến lược thị trường\nPhân tích ngành\nPhân tích doanh nghiệp\nTài liệu tham khảo\nBiểu đồ tài chính\nTruy xuất dữ liệu\nTổng hợp doanh nghiệp\nBáo cáo tài chính\nBáo cáo tài chính ngành\nVĩ mô\nNgành (-)\nVS-Sector\nNăng lượng\nNăng lượng\n-\xa0 Thiết bị và dịch vụ năng lượng\n-\xa0 Dầu khí\nNguyên vật liệu\nNguyên vật liệu\n-\xa0 Hóa chất\n-\xa0 Vật liệu xây dựng\n-\xa0 Bao bì và vật chứa\n-\xa0 Khai khoáng và luyện kim\n-\xa0 Gỗ và giấy\nCông nghiệp\nHàng hóa công nghiệp\n-\xa0 Thiết bị hàng không vũ trụ và quốc phòng\n-\xa0 Sản phẩm xây dựng\n-\xa0 Kỹ thuật xây dựng\n-\xa0 Thiết bị điện\n-\xa0 Tập đoàn đa ngành\n-\xa0 Máy móc công nghiệp\n-\xa0 Phân phối hàng công nghiệp\nDịch vụ thương mại và chuyên nghiệp\n-\xa0 Dịch vụ và thiết bị thương mại\n-\xa0 Dịch vụ chuyên nghiệp\nVận tải\n-\xa0 Vận tải và logistics hàng không\n-\xa0 Hãng hàng không chở khách\n-\xa0 Vận tải biển\n-\xa0 Vận tải mặt đất\n-\xa0 Hạ tầng giao thông\nTiêu dùng không thiết yếu\nXe và linh kiện\n-\xa0 Linh kiện xe\n-\xa0 Xe\nThời trang và hàng lâu bền\n-\xa0 Hàng tiêu dùng lâu bền\n-\xa0 Sản phẩm giải trí\n-\xa0 Thời trang và dệt may\nDịch vụ tiêu dùng\n-\xa0 Khách sạn, nhà hàng và giải trí\n-\xa0 Dịch vụ tiêu dùng khác\nThương mại hàng không thiết yếu\n-\xa0 Nhà phân phối\n-\xa0 Bán lẻ đa dạng\n-\xa0 Bán lẻ chuyên doanh\nTiêu dùng thiết yếu\nThương mại hàng thiết yếu\n-\xa0 Thương mại hàng thiết yếu\nThực phẩm, đồ uống và thuốc lá\n-\xa0 Đồ uống\n-\xa0 Thực phẩm\n-\xa0 Thuốc lá\nSản phẩm chăm sóc cá nhân và gia đình\n-\xa0 Sản phẩm chăm sóc gia đình\n-\xa0 Sản phẩm chăm sóc cá nhân\nChăm sóc sức khỏe\nThiết bị và dịch vụ chăm sóc sức khỏe\n-\xa0 Thiết bị và vật tư chăm sóc sức khỏe\n-\xa0 Thương mại và dịch vụ chăm sóc sức khỏe\n-\xa0 Công nghệ chăm sóc sức khỏe\nDược phẩm, công nghệ sinh học và khoa học sự sống\n-\xa0 Công nghệ sinh học\n-\xa0 Dược phẩm\n-\xa0 Công cụ và dịch vụ khoa học sự sống\nTài chính\nTổ chức tín dụng\n-\xa0 Ngân hàng\n-\xa0 Tín dụng phi ngân hàng\n-\xa0 Tín dụng khác\nDịch vụ tài chính\n-\xa0 Dịch vụ tài chính\n-\xa0 Thị trường vốn\n-\xa0 REIT thế chấp\nBảo hiểm\n-\xa0 Bảo hiểm\nCông nghệ thông tin\nPhần mềm và dịch vụ\n-\xa0 Dịch vụ CNTT\n-\xa0 Phần mềm\nPhần cứng và thiết bị\n-\xa0 Thiết bị viễn thông\n-\xa0 Phần cứng, bộ lưu trữ và thiết bị ngoại vi\n-\xa0 Điện tử\nBán dẫn\n-\xa0 Bán dẫn\nDịch vụ truyền thông\nDịch vụ viễn thông\n-\xa0 Dịch vụ viễn thông đa dạng\n-\xa0 Dịch vụ viễn thông không dây\nTruyền thông và giải trí\n-\xa0 Truyền thông\n-\xa0 Giải trí\n-\xa0 Truyền thông tương tác\nTiện ích\nTiện ích\n-\xa0 Điện\n-\xa0 Gas sinh hoạt\n-\xa0 Tiện tích tổng hợp\n-\xa0 Nước\n-\xa0 Phát điện độc lập và điện tái tạo\nBất động sản\nQuỹ REITs\n-\xa0 REITs bất động sản đa dạng\n-\xa0 REITs khu công nghiệp\n-\xa0 REITs khách sạn và khu nghỉ dưỡng\n-\xa0 REITs văn phòng\n-\xa0 REITs bất động sản y tế\n-\xa0 REITs nhà ở\n-\xa0 REITs bán lẻ\n-\xa0 REITs chuyên biệt\nBất động sản\n-\xa0 Quản lý và phát triển bất động sản\n-\xa0 Bất động sản đa dạng\n-\xa0 Dịch vụ bất động sản\nMã chứng khoán (-)\nTất cả\nCổ phiếu\nChỉ số\nChứng chỉ quỹ\nChứng quyền\nHợp đồng tương lai\nTrái phiếu\nXem thêm\nLãnh đạo (-)\nTất cả\nNgười nội bộ\nNgười liên quan\nCổ đông lớn\nXem thêm\nTin tức (-)\nXem thêm\nBài viết của tác giả (-)\nXem thêm\nBáo cáo phân tích (-)\nXem thêm\nThuật ngữ (-)\nXem thêm\nDịch vụ (-)\nĐào tạo\nKhóa học online - Phân tích Kỹ thuật Ứng dụng\nKhai giảng: 17/11/2025 |\nThời gian: Tối 2, 4, 6 |\nSố buổi: 7 |\nHọc phí: 3,825,000 đ\nKhóa học online - Đọc hiểu Báo cáo Tài chính\nKhai giảng: 25/11/2025 |\nThời gian: Tối 3, 5 |\nSố buổi: 3 |\nHọc phí: 1,530,000 đ\nKhóa học Online - Bắt đáy và Chốt lời Cổ phiếu\nKhai giảng: 13/12/2025 |\nThời gian: Thứ 7 |\nSố buổi: 3 |\nHọc phí: 1,870,000 đ\nKhóa học online - Phân tích Ngành và Dòng tiền Thị trường\nKhai giảng: 15/12/2025 |\nThời gian: Tối 2, 4, 6 |\nSố buổi: 6 |\nHọc phí: 3,570,000 đ\nKhóa học online - Phân tích Kỹ thuật Nâng cao\nKhai giảng: 03/11/2025 |\nThời gian: Tối 2, 4, 6 |\nSố buổi: 5 |\nHọc phí: 3,825,000 đ\nKhóa học online - Chứng khoán Cơ bản\nKhai giảng: 04/11/2025 |\nThời gian: Tối 3, 5 |\nSố buổi: 4 |\nHọc phí: 1,530,000 đ\nKhóa học online - Phân tích và Định giá Cổ phiếu\nKhai giảng: 21/10/2025 |\nThời gian: Tối 3, 5 |\nSố buổi: 4 |\nHọc phí: 1,870,000 đ\nKhóa học - Phân tích Kỹ thuật Ứng dụng - tại Tp. HCM\nKhai giảng: |\nThời gian: Tối 2, 4, 6 |\nSố buổi: 7 |\nHọc phí: 5,500,000 đ\nKhóa học online - Lướt sóng cổ phiếu nóng\nKhai giảng: 23/08/2025 |\nThời gian: Thứ 7 |\nSố buổi: 2 |\nHọc phí: 849,000 đ\nĐào tạo Phân tích và Đầu tư Chứng khoán IN - HOUSE\nKhai giảng: |\nThời gian: |\nSố buổi: 8 |\nHọc phí: 0 đ\nSách tài chính\nPhân tích kỹ thuật từ A đến Z\nVai trò của Quan hệ Nhà đầu tư (IR) trong việc Tối đa hóa Giá trị Doanh nghiệp\nCông cụ đầu tư\nVietstockUpdater\nVietstockFinance\nInvestOnline\nIROnline\nVietstockXLS\nTruyền thông tài chính\nBanner Ads\nOnline PR\nQuan hệ nhà đầu tư\nBáo cáo phân tích\nDữ liệu tài chính\nDataFeed - Dữ liệu tài chính tích hợp chuyên nghiệp\nVietstockXLS - Dữ liệu Kinh tế Tài chính Chứng khoán theo yêu cầu\nInvestOnline - Giải pháp website tra cứu chứng khoán toàn diện\nIROnline - Giải pháp thuê ngoài website IR, website quan hệ cổ đông\nThông báo\nVietstock trân trọng thông báo đến Quý Khách hàng về việc áp dụng “Chính sách quyền riêng tư” căn cứ theo Nghị định số 13/2023/NĐ-CP v/v bảo vệ dữ liệu cá nhân được ban hành bởi Chính phủ.\nTrong quá trình thiết lập mối quan hệ giữa Vietstock và Khách hàng, Vietstock có thể thu thập và xử lý dữ liệu cá nhân của Khách hàng cho mục đích được xác định tại Chính sách quyền riêng tư (“CSQRT”) này. Trong trường hợp Khách hàng không đồng ý một phần hoặc toàn bộ quy định tại CSQRT, Vietstock không thể cung cấp sản phẩm và dịch vụ cho Khách hàng.\nVietstock cam kết luôn tôn trọng quyền riêng tư, bảo mật và an toàn thông tin cá nhân; đồng thời luôn nỗ lực bảo vệ dữ liệu cá nhân của Khách hàng, tuân thủ quy định pháp luật Việt Nam thông qua những biện pháp bảo vệ dữ liệu cá nhân đáp ứng và phù hợp với quy định pháp luật Việt Nam.\nChính sách quyền riêng tư là một phần không thể tách rời của các thỏa thuận, điều khoản và điều kiện chi phối mối quan hệ giữa Vietstock và Quý Khách hàng.\nQuý Khách hàng đã đọc kỹ, hiểu rõ và đồng ý với toàn bộ điều khoản của “Chính sách quyền riêng tư”. Chi tiết Chính sách quyền riêng tư xem tại đây.\nNếu không đồng ý với Chính sách quyền riêng tư này, Chúng tôi không thể cung cấp sản phẩm và dịch vụ cho Quý Khách hàng.\nTôi đã đọc kỹ, hiểu rõ và đồng ý với toàn bộ điều khoản của Chính sách quyền riêng tư\nĐồng ý\nTheo dấu dòng tiền cá mập 24/11: Dòng tiền tự doanh nỗ lực bám trụ khi khối ngoại xả ròng\nPhiên 24/11 chứng kiến khối ngoại tiếp tục bán ròng hơn 1.2 ngàn tỷ đồng, trong khi dòng tiền tự doanh công ty chứng khoán (CTCK) vẫn duy trì xu hướng mua ròng, tạo bức tranh thị trường trái chiều.\nCác ""cá mập"" nước ngoài lại vừa có phiên bán ròng mạnh, hơn 1.2 ngàn tỷ đồng. Tâm điểm là các cổ phiếu họ Vingroup, với VRE bị xả mạnh nhất, hơn 288 tỷ đồng, gần gấp đôi giá trị bán ra của VHM (151 tỷ đồng). STB và VIC cũng nằm trong nhóm bị bán ròng mạnh, mỗi cổ phiếu khoảng 120 tỷ đồng.\nTrong khi đó, dòng tiền ngoại vẫn săn tìm cơ hội ở nhóm công nghệ. FPT dẫn đầu lực mua với 158 tỷ đồng, nối dài chuỗi phiên gom ròng liên tục trong hàng chục phiên gần đây. VNM đứng ngay sau với 147 tỷ đồng, còn VPB được mua ròng 58 tỷ đồng.\nTính từ đầu tháng 11, khối ngoại đã gom ròng FPT hơn 1.78 ngàn tỷ đồng - dẫn đầu toàn sàn, trong khi HPG theo sát với gần 1.73 ngàn tỷ đồng. Ở chiều ngược lại, STB bị xả mạnh nhất với hơn 2 ngàn tỷ đồng. Tổng cộng, giá trị bán ròng của khối ngoại trong tháng 11 vượt 9 ngàn tỷ đồng.\nNhìn rộng hơn, từ đầu quý 4 đến nay, FPT đã được gom ròng gần 4 ngàn tỷ đồng. Mặt khác, MBB bị xả mạnh nhất với hơn 4.3 ngàn tỷ đồng, đẩy tổng giá trị bán ròng toàn quý lên hơn 32 ngàn tỷ đồng.\nKhối ngoại bán ròng hơn ngàn tỷ\nTop 10 cổ phiếu khối ngoại giao dịch ròng nhiều nhất phiên 24/11\nỞ chiều ngược lại, khối tự doanh tiếp tục duy trì đà mua ròng, đạt 380 tỷ đồng trên HOSE, ghi nhận phiên mua ròng thứ hai liên tiếp. HPG và VNM dẫn đầu lực gom với lần lượt 63 tỷ đồng và 62 tỷ đồng, MWG theo sau 43 tỷ đồng.\nTrong khi đó, CTCK bán ròng mạnh nhất là STB gần 32 tỷ đồng, tiếp theo là KBC và VRE với 11 tỷ và 10 tỷ đồng.\nTự doanh lại mua ròng mạnh\nTop 10 cổ phiếu tự doanh giao dịch ròng mạnh nhất trong phiên 24/11\nTử Kính\nFILI\n- 17:55 24/11/2025\ncá mập\ntheo dấu dòng tiền cá mập\ntự doanh\nkhối ngoại mua ròng\nbán ròng\ngiao dịch cổ phiếu\nMÃ CHỨNG KHOÁN LIÊN QUAN (11)\nFPT\n100,200\n-600\n-0.60%\nHPG\n27,100\n-300\n-1.09%\nKBC\n34,950\n50\n+0.14%\nMBB\n23,150\n-50\n-0.22%\nMWG\n79,300\n-700\n-0.88%\nSTB\n50,000\n-1,300\n-2.53%\nVHM\n102,700\n3,400\n+3.42%\nVIC\n239,500\n9,800\n+4.27%\nVNM\n63,000\n3,100\n+5.18%\nVPB\n29,000\n450\n+1.58%\nVRE\n34,450\n2,250\n+6.99%\nTIN TỨC MÃ CHỨNG KHOÁN\n1\nThị trường chứng quyền ngày 25/11/2025: Nhóm chứng quyền VRE bứt phá\n45 phút trước\n2\nAFIEX có gì trong tay trước khi lên sàn HOSE?\n1 giờ trước\n3\nPhân tích kỹ thuật phiên chiều 24/11: Test lại đường SMA 50 ngày\n24/11 13:02\n4\nCông ty bao bì Việt do người Thái nắm giữ xin hủy đại chúng và rời HOSE\n24/11 12:40\n5\n48 tấn sữa và nước uống của Vinamilk đến rốn lũ miền Trung và Tây Nguyên\n24/11 11:41\nTIN CÙNG CHUYÊN MỤC\nCỔ PHIẾU\n13 phút trước\nCổ phiếu thủy sản, thực phẩm có tuần hút tiền\nThanh khoản diễn biến trái chiều ở hai sàn HOSE và HNX trong tuần giao dịch 17 - 21/11. Dòng tiền vẫn đang duy trì xu hướng thận trọng. Tuần vừa qua, nhóm cổ phiếu...\nCỔ PHIẾU\n24/11 11:01\nAfiex rời UPCoM cuối tháng 11 để chuyển sang HOSE\nSở Giao dịch Chứng khoán Hà Nội (HNX) thông báo hủy giao dịch toàn bộ 35 triệu cp của CTCP Xuất nhập khẩu Nông sản Thực phẩm An Giang (Afiex, UPCoM: AFX) từ ngày...\nCỔ PHIẾU\n24/11 08:00\nTop cổ phiếu đáng chú ý đầu tuần 24/11\nDanh sách các mã cổ phiếu tăng và giảm mạnh nhất những phiên gần đây theo số liệu thống kê của Vietstock.\nCỔ PHIẾU\n24/11 06:02\n24/11: Đọc gì trước giờ giao dịch chứng khoán?\nCập nhật nhanh những diễn biến kinh tế, tài chính trong nước và thế giới những ngày cuối tuần trước khi thị trường mở cửa.\nCỔ PHIẾU\n22/11 20:30\nVIC dẫn dắt đà tăng, VN-Index có thêm gần 20 điểm trong tuần phân hóa\nVIC tiếp tục dẫn dắt với mức đóng góp vượt trội, cùng nhóm Vingroup là VHM và VPL củng cố đà tăng, giúp chỉ số VN-Index duy trì nhịp phục hồi trong tuần 17-21/11...\nCỔ PHIẾU\n22/11 08:00\nDNSE Future Tech Summit: Bước đệm cho kỷ nguyên giao dịch T+0 và thị trường “không độ trễ”\nChiều 21/11/2025, sự kiện công nghệ DNSE Future Tech Summit đã diễn ra tại TP. Hồ Chí Minh, quy tụ nhiều chuyên gia tài chính - công nghệ uy tín và trên 200 nhà đầu...\nCỔ PHIẾU\n21/11 22:32\nTheo dấu dòng tiền cá mập 21/11: Khối ngoại rút ròng VIX hơn 700 tỷ\nKhối ngoại quay lại bán ròng trong phiên 21/11 với tâm điểm là VIX, trái chiều với lực mua từ tự doanh các công ty chứng khoán (CTCK).\nCỔ PHIẾU\n21/11 13:02\nNhững dấu ấn của cổ phiếu thủy sản trong một năm thuế quan gây chao đảo\nGiữa một năm đầy biến động bởi chính sách thuế quan từ Mỹ, cổ phiếu thủy sản vẫn đang ghi những dấu ấn. 3/5 mã lớn của ngành vẫn giảm sâu trong khi ANV lại tìm thấy...\nCỔ PHIẾU\n21/11 10:32\nBầu Đức và “game” mới\nCổ phiếu HAG vừa đạt đỉnh 10 năm, bầu Đức tính chuyện niêm yết công ty con sau khi “cục máu đông” nợ tan được đôi phần.\nCỔ PHIẾU\n21/11 08:00\nTop cổ phiếu đáng chú ý đầu phiên 21/11\nDanh sách các mã cổ phiếu tăng và giảm mạnh nhất những phiên gần đây theo số liệu thống kê của Vietstock.\nXem thêm\nChỉ số thị trường\nTIN CHÍNH\nĐỌC NHIỀU NHẤT\n×\nBáo lỗi bài viết\nCám ơn bạn đã gửi báo lỗi bài viết.\nĐịa chỉ email\nHọ tên\nSố điện thoại\nNội dung\nGửi\nVietstock – Cổng thông tin tài chính và chứng khoán chính thức hoạt động từ ngày 02/08/2002, với định hướng trở thành người bạn đồng hành đáng tin cậy của nhà đầu tư. Ngay từ những ngày đầu, Vietstock đã không ngừng nỗ lực mang đến hệ thống thông tin và dữ liệu tài chính chính xác – cập nhật – đầy đủ, giúp nhà đầu tư hiểu đúng, nhìn rộng và tự tin đưa ra quyết định trong hành trình đầu tư của mình.\nTruyền Thông Tài Chính\nQuan hệ công chúng (PR)\nQuan hệ nhà đầu tư (IR)\nQuảng cáo banner\nBáo cáo phân tích\nDữ Liệu Tài Chính\nDataFeed\nVietstockXLS\nInvestOnline\nIROnline\nVietstockUpdater\nVietstockFinance\nSách tài chính\nPhân tích kỹ thuật từ A đến Z\nVai trò của Quan hệ Nhà đầu tư (IR) trong việc tối đa hóa giá trị doanh nghiệp\nVietstock\nQuảng cáo & Dịch vụ\n0908 169 898 - (028) 3848 7238\nkinhdoanh@vietstock.vn\nSáng tạo nội dung\n0938 046 488\ninfo@vietstock.vn\nVăn phòng giao dịch\n81/10B Hồ Văn Huê,\nPhường Đức Nhuận, Tp.HCM\nLớp học sắp khai giảng\n11/2025 Khóa học online - Phân tích Kỹ thuật Ứng dụng\nKhai giảng: 17/11/2025 |\nThời gian: Tối 2, 4, 6\n11/2025 Khóa học online - Đọc hiểu Báo cáo Tài chính\nKhai giảng: 25/11/2025 |\nThời gian: Tối 3, 5\n12/2025 Khóa học Online - Bắt đáy và Chốt lời Cổ phiếu\nKhai giảng: 13/12/2025 |\nThời gian: Thứ 7\n12/2025 Khóa học online - Phân tích Ngành và Dòng tiền Thị trường\nKhai giảng: 15/12/2025 |\nThời gian: Tối 2, 4, 6\n11/2025 Khóa học online - Phân tích Kỹ thuật Nâng cao\nKhai giảng: 03/11/2025 |\nThời gian: Tối 2, 4, 6\nSách tài chính\nPhân tích kỹ thuật từ A đến Z\nVai trò của Quan hệ Nhà đầu tư (IR) trong việc tối đa hóa giá trị doanh nghiệp\nVietstock\nVietstock\nVận hành bởi CTCP Tài Việt.\nTrụ sở: 28/47 Lê Thị Hồng, P.Gò Vấp, Tp.HCM\nTel: (84.28) 3848 7238 - Fax: (84.28) 3848 7237\nGiấy phép số 48/GP-STTTT ngày 04/11/2016\nQuyết định số 13/QĐ-STTTT ngày 02/11/2017\nQuyết định số 06/QĐ-STTTT-ICP ngày 20/07/2023\nĐược cấp bởi Sở Thông tin và Truyền thông TPHCM\nNgười chịu trách nhiệm\nBÀ PHẠM THỊ THANH NGA\nQuảng cáo & Dịch vụ\n0908 169 898 - (028) 3848 7238\nkinhdoanh@vietstock.vn\nSáng tạo nội dung\n0938 046 488\ninfo@vietstock.vn\nVăn phòng giao dịch\n81/10B Hồ Văn Huê,\nPhường Đức Nhuận, TPHCM\nSách tài chính\nPhân tích kỹ thuật từ A đến Z\nVai trò của Quan hệ Nhà đầu tư (IR) trong việc tối đa hóa giá trị doanh nghiệp\nVietstock\nVận hành bởi CTCP Tài Việt.\nTrụ sở: 28/47 Lê Thị Hồng, P.Gò Vấp, Tp.HCM\nTel: (84.28) 3848 7238 - Fax: (84.28) 3848 7237\nGiấy phép số 48/GP-STTTT ngày 04/11/2016\nQuyết định số 13/QĐ-STTTT ngày 02/11/2017\nQuyết định số 06/QĐ-STTTT-ICP ngày 20/07/2023\nĐược cấp bởi Sở Thông tin và Truyền thông TPHCM\nNgười chịu trách nhiệm\nBÀ PHẠM THỊ THANH NGA\n© Bản quyền thuộc về Vietstock\nSitemap\nVề chúng tôi\nChính sách quyền riêng tư\nQuảng cáo & Dịch vụ\n© Bản quyền thuộc về Vietstock\nHotline: 0908 16 98 98\nTất cả\nGiờ qua\n24 giờ qua\nTuần qua\nTháng qua\nNăm qua\nTất cả\nTính năng\nNgành\nMã chứng khoán\nLãnh đạo\nTin tức\nBáo cáo phân tích\nThuật ngữ\nDịch vụ\nTính năng (-)\nVietstock\nChứng khoán\nCổ phiếu\nGiao dịch nội bộ\nNiêm yết\nETF và các quỹ\nChứng khoán phái sinh\nChứng quyền\nÝ kiến chuyên gia\nCâu chuyện đầu tư\nChính sách\nTrái phiếu\nDoanh nghiệp\nHoạt động kinh doanh\nCổ tức\nTăng vốn - M&A\nIPO - Cổ phần hóa\nChứng khoán phái sinh\nNhân vật\nTrái phiếu doanh nghiệp\nBất động sản\nThị trường nhà đất\nQuy hoạch - Hạ tầng\nDự án\nBảo hiểm và thuế nhà đất\nTài chính\nNgân hàng\nBảo hiểm\nThuế và Ngân sách\nHàng hóa\nVàng và kim loại quý\nNhiên liệu\nKim loại\nNông sản thực phẩm\nKinh tế\nVĩ mô\nDữ liệu vĩ mô\nGDP\nCPI\nIIP\nBán lẻ\nXuất nhập khẩu\nFDI\nTín dụng\nThị trường mở\nTỷ giá - Lãi suất\nDân số và Lao động\nKinh tế - Đầu tư\nThế giới\nChứng khoán thế giới\nTiền kỹ thuật số\nTài chính quốc tế\nKinh tế - Đầu tư\nĐông dương\nVĩ mô\nTài chính - Ngân hàng\nThị trường chứng khoán\nKinh tế - Đầu tư\nTài chính cá nhân\nLàm chủ đồng tiền\nĐầu tư - Kinh doanh nhỏ\nDoanh nhân và khởi nghiệp\nChơi sang\nXe - Công nghệ\nTiêu dùng và lối sống\nVì cộng đồng\nPhân tích\nNhận định thị thường\nPhân tích cơ bản\nPhân tích kỹ thuật\nVietstockFinance\nVĩ mô\nDữ liệu vĩ mô\nGDP\nCPI\nIIP\nBán lẻ\nXuất nhập khẩu\nFDI\nTín dụng\nThị trường mở\nTỷ giá - Lãi suất\nDân số và Lao động\nNgành\nDữ liệu ngành\nNgành chi tiết\nDoanh nghiệp\nDoanh nghiệp A-Z\nHồ sơ lãnh đạo\nLịch sự kiện\nNiêm yết\nCổ tức và phát hành thêm\nĐại hội đồng cổ đông\nCập nhật lãi lỗ\nGiao dịch nội bộ\nCổ đông nội bộ\nNgười liên quan\nCổ đông lớn\nCổ phiếu quỹ\nTài liệu cổ đông\nBáo cáo tài chính\nGiải trình KQKD\nBáo cáo quản trị\nBáo cáo thường niên\nNghị quyết ĐHĐCĐ\nTài liệu ĐHĐCĐ\nNiên giám\nCổ phiếu\nThị trường cổ phiếu\nBản đồ thị trường\nTổng hợp thị trường\nThanh khoản\nĐịnh giá\nNước ngoài\nTự doanh\nTop cổ phiếu\nBản đồ ngành\nThống kê giao dịch\nGiá\nĐặt lệnh\nNước ngoài\nTự doanh\nẢnh hưởng chỉ số\nBiến động cổ phiếu\nGiao dịch nội bộ\nTrạng thái cổ phiếu\nQuy mô thị trường\nNiêm yết\nNiêm yết mới\nNiêm yết bổ sung\nHủy niêm yết\nTheo dõi đặc biệt\nKhông được ký quỹ\nETF\nCổ phiếu chi tiết\nTổng quan\nGiao dịch\nTài chính\nPhân tích kỹ thuật\nHồ sơ doanh nghiệp\nTin tức sự kiện\nTài liệu\nTâm lý thị trường\nPhái sinh\nHợp đồng tương lai\nTổng quan\nThống kê giao dịch\nKiến thức / Qui định\nChứng quyền\nTổng quan\nThống kê giao dịch\nBlackScholes\nTrái phiếu\nTổng quan\nTổ chức phát hành\nTrái phiếu A-Z\nThống kê giao dịch\nTin tức\nCông cụ đầu tư\nBản đồ thị trường\nSức mạnh giá RRG\nPhân tích kỹ thuật\nBảng giá trực tuyến\nBộ lọc cổ phiếu\nSo sánh cổ phiếu\nBáo cáo phân tích\nNghiên cứu - Phân tích\nVĩ mô - Chiến lược thị trường\nPhân tích ngành\nPhân tích doanh nghiệp\nTài liệu tham khảo\nBiểu đồ tài chính\nTruy xuất dữ liệu\nTổng hợp doanh nghiệp\nBáo cáo tài chính\nBáo cáo tài chính ngành\nVĩ mô\nNgành (-)\nVS-Sector\nNăng lượng\nNăng lượng\n-\xa0 Thiết bị và dịch vụ năng lượng\n-\xa0 Dầu khí\nNguyên vật liệu\nNguyên vật liệu\n-\xa0 Hóa chất\n-\xa0 Vật liệu xây dựng\n-\xa0 Bao bì và vật chứa\n-\xa0 Khai khoáng và luyện kim\n-\xa0 Gỗ và giấy\nCông nghiệp\nHàng hóa công nghiệp\n-\xa0 Thiết bị hàng không vũ trụ và quốc phòng\n-\xa0 Sản phẩm xây dựng\n-\xa0 Kỹ thuật xây dựng\n-\xa0 Thiết bị điện\n-\xa0 Tập đoàn đa ngành\n-\xa0 Máy móc công nghiệp\n-\xa0 Phân phối hàng công nghiệp\nDịch vụ thương mại và chuyên nghiệp\n-\xa0 Dịch vụ và thiết bị thương mại\n-\xa0 Dịch vụ chuyên nghiệp\nVận tải\n-\xa0 Vận tải và logistics hàng không\n-\xa0 Hãng hàng không chở khách\n-\xa0 Vận tải biển\n-\xa0 Vận tải mặt đất\n-\xa0 Hạ tầng giao thông\nTiêu dùng không thiết yếu\nXe và linh kiện\n-\xa0 Linh kiện xe\n-\xa0 Xe\nThời trang và hàng lâu bền\n-\xa0 Hàng tiêu dùng lâu bền\n-\xa0 Sản phẩm giải trí\n-\xa0 Thời trang và dệt may\nDịch vụ tiêu dùng\n-\xa0 Khách sạn, nhà hàng và giải trí\n-\xa0 Dịch vụ tiêu dùng khác\nThương mại hàng không thiết yếu\n-\xa0 Nhà phân phối\n-\xa0 Bán lẻ đa dạng\n-\xa0 Bán lẻ chuyên doanh\nTiêu dùng thiết yếu\nThương mại hàng thiết yếu\n-\xa0 Thương mại hàng thiết yếu\nThực phẩm, đồ uống và thuốc lá\n-\xa0 Đồ uống\n-\xa0 Thực phẩm\n-\xa0 Thuốc lá\nSản phẩm chăm sóc cá nhân và gia đình\n-\xa0 Sản phẩm chăm sóc gia đình\n-\xa0 Sản phẩm chăm sóc cá nhân\nChăm sóc sức khỏe\nThiết bị và dịch vụ chăm sóc sức khỏe\n-\xa0 Thiết bị và vật tư chăm sóc sức khỏe\n-\xa0 Thương mại và dịch vụ chăm sóc sức khỏe\n-\xa0 Công nghệ chăm sóc sức khỏe\nDược phẩm, công nghệ sinh học và khoa học sự sống\n-\xa0 Công nghệ sinh học\n-\xa0 Dược phẩm\n-\xa0 Công cụ và dịch vụ khoa học sự sống\nTài chính\nTổ chức tín dụng\n-\xa0 Ngân hàng\n-\xa0 Tín dụng phi ngân hàng\n-\xa0 Tín dụng khác\nDịch vụ tài chính\n-\xa0 Dịch vụ tài chính\n-\xa0 Thị trường vốn\n-\xa0 REIT thế chấp\nBảo hiểm\n-\xa0 Bảo hiểm\nCông nghệ thông tin\nPhần mềm và dịch vụ\n-\xa0 Dịch vụ CNTT\n-\xa0 Phần mềm\nPhần cứng và thiết bị\n-\xa0 Thiết bị viễn thông\n-\xa0 Phần cứng, bộ lưu trữ và thiết bị ngoại vi\n-\xa0 Điện tử\nBán dẫn\n-\xa0 Bán dẫn\nDịch vụ truyền thông\nDịch vụ viễn thông\n-\xa0 Dịch vụ viễn thông đa dạng\n-\xa0 Dịch vụ viễn thông không dây\nTruyền thông và giải trí\n-\xa0 Truyền thông\n-\xa0 Giải trí\n-\xa0 Truyền thông tương tác\nTiện ích\nTiện ích\n-\xa0 Điện\n-\xa0 Gas sinh hoạt\n-\xa0 Tiện tích tổng hợp\n-\xa0 Nước\n-\xa0 Phát điện độc lập và điện tái tạo\nBất động sản\nQuỹ REITs\n-\xa0 REITs bất động sản đa dạng\n-\xa0 REITs khu công nghiệp\n-\xa0 REITs khách sạn và khu nghỉ dưỡng\n-\xa0 REITs văn phòng\n-\xa0 REITs bất động sản y tế\n-\xa0 REITs nhà ở\n-\xa0 REITs bán lẻ\n-\xa0 REITs chuyên biệt\nBất động sản\n-\xa0 Quản lý và phát triển bất động sản\n-\xa0 Bất động sản đa dạng\n-\xa0 Dịch vụ bất động sản\nMã chứng khoán (-)\nTất cả\nCổ phiếu\nChỉ số\nChứng chỉ quỹ\nChứng quyền\nHợp đồng tương lai\nTrái phiếu\nXem thêm\nLãnh đạo (-)\nTất cả\nNgười nội bộ\nNgười liên quan\nCổ đông lớn\nXem thêm\nTin tức (-)\nXem thêm\nBài viết của tác giả (-)\nXem thêm\nBáo cáo phân tích (-)\nXem thêm\nThuật ngữ (-)\nXem thêm\nDịch vụ (-)\nĐào tạo\nKhóa học online - Phân tích Kỹ thuật Ứng dụng\nKhai giảng: 17/11/2025 |\nThời gian: Tối 2, 4, 6 |\nSố buổi: 7 |\nHọc phí: 3,825,000 đ\nKhóa học online - Đọc hiểu Báo cáo Tài chính\nKhai giảng: 25/11/2025 |\nThời gian: Tối 3, 5 |\nSố buổi: 3 |\nHọc phí: 1,530,000 đ\nKhóa học Online - Bắt đáy và Chốt lời Cổ phiếu\nKhai giảng: 13/12/2025 |\nThời gian: Thứ 7 |\nSố buổi: 3 |\nHọc phí: 1,870,000 đ\nKhóa học online - Phân tích Ngành và Dòng tiền Thị trường\nKhai giảng: 15/12/2025 |\nThời gian: Tối 2, 4, 6 |\nSố buổi: 6 |\nHọc phí: 3,570,000 đ\nKhóa học online - Phân tích Kỹ thuật Nâng cao\nKhai giảng: 03/11/2025 |\nThời gian: Tối 2, 4, 6 |\nSố buổi: 5 |\nHọc phí: 3,825,000 đ\nKhóa học online - Chứng khoán Cơ bản\nKhai giảng: 04/11/2025 |\nThời gian: Tối 3, 5 |\nSố buổi: 4 |\nHọc phí: 1,530,000 đ\nKhóa học online - Phân tích và Định giá Cổ phiếu\nKhai giảng: 21/10/2025 |\nThời gian: Tối 3, 5 |\nSố buổi: 4 |\nHọc phí: 1,870,000 đ\nKhóa học - Phân tích Kỹ thuật Ứng dụng - tại Tp. HCM\nKhai giảng: |\nThời gian: Tối 2, 4, 6 |\nSố buổi: 7 |\nHọc phí: 5,500,000 đ\nKhóa học online - Lướt sóng cổ phiếu nóng\nKhai giảng: 23/08/2025 |\nThời gian: Thứ 7 |\nSố buổi: 2 |\nHọc phí: 849,000 đ\nĐào tạo Phân tích và Đầu tư Chứng khoán IN - HOUSE\nKhai giảng: |\nThời gian: |\nSố buổi: 8 |\nHọc phí: 0 đ\nSách tài chính\nPhân tích kỹ thuật từ A đến Z\nVai trò của Quan hệ Nhà đầu tư (IR) trong việc Tối đa hóa Giá trị Doanh nghiệp\nCông cụ đầu tư\nVietstockUpdater\nVietstockFinance\nInvestOnline\nIROnline\nVietstockXLS\nTruyền thông tài chính\nBanner Ads\nOnline PR\nQuan hệ nhà đầu tư\nBáo cáo phân tích\nDữ liệu tài chính\nDataFeed - Dữ liệu tài chính tích hợp chuyên nghiệp\nVietstockXLS - Dữ liệu Kinh tế Tài chính Chứng khoán theo yêu cầu\nInvestOnline - Giải pháp website tra cứu chứng khoán toàn diện\nIROnline - Giải pháp thuê ngoài website IR, website quan hệ cổ đông\nThông báo\nVietstock trân trọng thông báo đến Quý Khách hàng về việc áp dụng “Chính sách quyền riêng tư” căn cứ theo Nghị định số 13/2023/NĐ-CP v/v bảo vệ dữ liệu cá nhân được ban hành bởi Chính phủ.\nTrong quá trình thiết lập mối quan hệ giữa Vietstock và Khách hàng, Vietstock có thể thu thập và xử lý dữ liệu cá nhân của Khách hàng cho mục đích được xác định tại Chính sách quyền riêng tư (“CSQRT”) này. Trong trường hợp Khách hàng không đồng ý một phần hoặc toàn bộ quy định tại CSQRT, Vietstock không thể cung cấp sản phẩm và dịch vụ cho Khách hàng.\nVietstock cam kết luôn tôn trọng quyền riêng tư, bảo mật và an toàn thông tin cá nhân; đồng thời luôn nỗ lực bảo vệ dữ liệu cá nhân của Khách hàng, tuân thủ quy định pháp luật Việt Nam thông qua những biện pháp bảo vệ dữ liệu cá nhân đáp ứng và phù hợp với quy định pháp luật Việt Nam.\nChính sách quyền riêng tư là một phần không thể tách rời của các thỏa thuận, điều khoản và điều kiện chi phối mối quan hệ giữa Vietstock và Quý Khách hàng.\nQuý Khách hàng đã đọc kỹ, hiểu rõ và đồng ý với toàn bộ điều khoản của “Chính sách quyền riêng tư”. Chi tiết Chính sách quyền riêng tư xem tại đây.\nNếu không đồng ý với Chính sách quyền riêng tư này, Chúng tôi không thể cung cấp sản phẩm và dịch vụ cho Quý Khách hàng.\nTôi đã đọc kỹ, hiểu rõ và đồng ý với toàn bộ điều khoản của Chính sách quyền riêng tư\nĐồng ý\nTheo dấu dòng tiền cá mập 24/11: Dòng tiền tự doanh nỗ lực bám trụ khi khối ngoại xả ròng\nPhiên 24/11 chứng kiến khối ngoại tiếp tục bán ròng hơn 1.2 ngàn tỷ đồng, trong khi dòng tiền tự doanh công ty chứng khoán (CTCK) vẫn duy trì xu hướng mua ròng, tạo bức tranh thị trường trái chiều.\nCác ""cá mập"" nước ngoài lại vừa có phiên bán ròng mạnh, hơn 1.2 ngàn tỷ đồng. Tâm điểm là các cổ phiếu họ Vingroup, với VRE bị xả mạnh nhất, hơn 288 tỷ đồng, gần gấp đôi giá trị bán ra của VHM (151 tỷ đồng). STB và VIC cũng nằm trong nhóm bị bán ròng mạnh, mỗi cổ phiếu khoảng 120 tỷ đồng.\nTrong khi đó, dòng tiền ngoại vẫn săn tìm cơ hội ở nhóm công nghệ. FPT dẫn đầu lực mua với 158 tỷ đồng, nối dài chuỗi phiên gom ròng liên tục trong hàng chục phiên gần đây. VNM đứng ngay sau với 147 tỷ đồng, còn VPB được mua ròng 58 tỷ đồng.\nTính từ đầu tháng 11, khối ngoại đã gom ròng FPT hơn 1.78 ngàn tỷ đồng - dẫn đầu toàn sàn, trong khi HPG theo sát với gần 1.73 ngàn tỷ đồng. Ở chiều ngược lại, STB bị xả mạnh nhất với hơn 2 ngàn tỷ đồng. Tổng cộng, giá trị bán ròng của khối ngoại trong tháng 11 vượt 9 ngàn tỷ đồng.\nNhìn rộng hơn, từ đầu quý 4 đến nay, FPT đã được gom ròng gần 4 ngàn tỷ đồng. Mặt khác, MBB bị xả mạnh nhất với hơn 4.3 ngàn tỷ đồng, đẩy tổng giá trị bán ròng toàn quý lên hơn 32 ngàn tỷ đồng.\nKhối ngoại bán ròng hơn ngàn tỷ\nTop 10 cổ phiếu khối ngoại giao dịch ròng nhiều nhất phiên 24/11\nỞ chiều ngược lại, khối tự doanh tiếp tục duy trì đà mua ròng, đạt 380 tỷ đồng trên HOSE, ghi nhận phiên mua ròng thứ hai liên tiếp. HPG và VNM dẫn đầu lực gom với lần lượt 63 tỷ đồng và 62 tỷ đồng, MWG theo sau 43 tỷ đồng.\nTrong khi đó, CTCK bán ròng mạnh nhất là STB gần 32 tỷ đồng, tiếp theo là KBC và VRE với 11 tỷ và 10 tỷ đồng.\nTự doanh lại mua ròng mạnh\nTop 10 cổ phiếu tự doanh giao dịch ròng mạnh nhất trong phiên 24/11\nTử Kính\nFILI\n- 17:55 24/11/2025\ncá mập\ntheo dấu dòng tiền cá mập\ntự doanh\nkhối ngoại mua ròng\nbán ròng\ngiao dịch cổ phiếu\nMÃ CHỨNG KHOÁN LIÊN QUAN (11)\nFPT\n100,200\n-600\n-0.60%\nHPG\n27,100\n-300\n-1.09%\nKBC\n34,950\n50\n+0.14%\nMBB\n23,150\n-50\n-0.22%\nMWG\n79,300\n-700\n-0.88%\nSTB\n50,000\n-1,300\n-2.53%\nVHM\n102,700\n3,400\n+3.42%\nVIC\n239,500\n9,800\n+4.27%\nVNM\n63,000\n3,100\n+5.18%\nVPB\n29,000\n450\n+1.58%\nVRE\n34,450\n2,250\n+6.99%\nTIN TỨC MÃ CHỨNG KHOÁN\n1\nThị trường chứng quyền ngày 25/11/2025: Nhóm chứng quyền VRE bứt phá\n45 phút trước\n2\nAFIEX có gì trong tay trước khi lên sàn HOSE?\n1 giờ trước\n3\nPhân tích kỹ thuật phiên chiều 24/11: Test lại đường SMA 50 ngày\n24/11 13:02\n4\nCông ty bao bì Việt do người Thái nắm giữ xin hủy đại chúng và rời HOSE\n24/11 12:40\n5\n48 tấn sữa và nước uống của Vinamilk đến rốn lũ miền Trung và Tây Nguyên\n24/11 11:41\nTIN CÙNG CHUYÊN MỤC\nCỔ PHIẾU\n13 phút trước\nCổ phiếu thủy sản, thực phẩm có tuần hút tiền\nThanh khoản diễn biến trái chiều ở hai sàn HOSE và HNX trong tuần giao dịch 17 - 21/11. Dòng tiền vẫn đang duy trì xu hướng thận trọng. Tuần vừa qua, nhóm cổ phiếu...\nCỔ PHIẾU\n24/11 11:01\nAfiex rời UPCoM cuối tháng 11 để chuyển sang HOSE\nSở Giao dịch Chứng khoán Hà Nội (HNX) thông báo hủy giao dịch toàn bộ 35 triệu cp của CTCP Xuất nhập khẩu Nông sản Thực phẩm An Giang (Afiex, UPCoM: AFX) từ ngày...\nCỔ PHIẾU\n24/11 08:00\nTop cổ phiếu đáng chú ý đầu tuần 24/11\nDanh sách các mã cổ phiếu tăng và giảm mạnh nhất những phiên gần đây theo số liệu thống kê của Vietstock.\nCỔ PHIẾU\n24/11 06:02\n24/11: Đọc gì trước giờ giao dịch chứng khoán?\nCập nhật nhanh những diễn biến kinh tế, tài chính trong nước và thế giới những ngày cuối tuần trước khi thị trường mở cửa.\nCỔ PHIẾU\n22/11 20:30\nVIC dẫn dắt đà tăng, VN-Index có thêm gần 20 điểm trong tuần phân hóa\nVIC tiếp tục dẫn dắt với mức đóng góp vượt trội, cùng nhóm Vingroup là VHM và VPL củng cố đà tăng, giúp chỉ số VN-Index duy trì nhịp phục hồi trong tuần 17-21/11...\nCỔ PHIẾU\n22/11 08:00\nDNSE Future Tech Summit: Bước đệm cho kỷ nguyên giao dịch T+0 và thị trường “không độ trễ”\nChiều 21/11/2025, sự kiện công nghệ DNSE Future Tech Summit đã diễn ra tại TP. Hồ Chí Minh, quy tụ nhiều chuyên gia tài chính - công nghệ uy tín và trên 200 nhà đầu...\nCỔ PHIẾU\n21/11 22:32\nTheo dấu dòng tiền cá mập 21/11: Khối ngoại rút ròng VIX hơn 700 tỷ\nKhối ngoại quay lại bán ròng trong phiên 21/11 với tâm điểm là VIX, trái chiều với lực mua từ tự doanh các công ty chứng khoán (CTCK).\nCỔ PHIẾU\n21/11 13:02\nNhững dấu ấn của cổ phiếu thủy sản trong một năm thuế quan gây chao đảo\nGiữa một năm đầy biến động bởi chính sách thuế quan từ Mỹ, cổ phiếu thủy sản vẫn đang ghi những dấu ấn. 3/5 mã lớn của ngành vẫn giảm sâu trong khi ANV lại tìm thấy...\nCỔ PHIẾU\n21/11 10:32\nBầu Đức và “game” mới\nCổ phiếu HAG vừa đạt đỉnh 10 năm, bầu Đức tính chuyện niêm yết công ty con sau khi “cục máu đông” nợ tan được đôi phần.\nCỔ PHIẾU\n21/11 08:00\nTop cổ phiếu đáng chú ý đầu phiên 21/11\nDanh sách các mã cổ phiếu tăng và giảm mạnh nhất những phiên gần đây theo số liệu thống kê của Vietstock.\nXem thêm\nChỉ số thị trường\nTIN CHÍNH\nĐỌC NHIỀU NHẤT\n×\nBáo lỗi bài viết\nCám ơn bạn đã gửi báo lỗi bài viết.\nĐịa chỉ email\nHọ tên\nSố điện thoại\nNội dung\nGửi\nVietstock – Cổng thông tin tài chính và chứng khoán chính thức hoạt động từ ngày 02/08/2002, với định hướng trở thành người bạn đồng hành đáng tin cậy của nhà đầu tư. Ngay từ những ngày đầu, Vietstock đã không ngừng nỗ lực mang đến hệ thống thông tin và dữ liệu tài chính chính xác – cập nhật – đầy đủ, giúp nhà đầu tư hiểu đúng, nhìn rộng và tự tin đưa ra quyết định trong hành trình đầu tư của mình.\nTruyền Thông Tài Chính\nQuan hệ công chúng (PR)\nQuan hệ nhà đầu tư (IR)\nQuảng cáo banner\nBáo cáo phân tích\nDữ Liệu Tài Chính\nDataFeed\nVietstockXLS\nInvestOnline\nIROnline\nVietstockUpdater\nVietstockFinance\nSách tài chính\nPhân tích kỹ thuật từ A đến Z\nVai trò của Quan hệ Nhà đầu tư (IR) trong việc tối đa hóa giá trị doanh nghiệp\nVietstock\nQuảng cáo & Dịch vụ\n0908 169 898 - (028) 3848 7238\nkinhdoanh@vietstock.vn\nSáng tạo nội dung\n0938 046 488\ninfo@vietstock.vn\nVăn phòng giao dịch\n81/10B Hồ Văn Huê,\nPhường Đức Nhuận, Tp.HCM\nLớp học sắp khai giảng\n11/2025 Khóa học online - Phân tích Kỹ thuật Ứng dụng\nKhai giảng: 17/11/2025 |\nThời gian: Tối 2, 4, 6\n11/2025 Khóa học online - Đọc hiểu Báo cáo Tài chính\nKhai giảng: 25/11/2025 |\nThời gian: Tối 3, 5\n12/2025 Khóa học Online - Bắt đáy và Chốt lời Cổ phiếu\nKhai giảng: 13/12/2025 |\nThời gian: Thứ 7\n12/2025 Khóa học online - Phân tích Ngành và Dòng tiền Thị trường\nKhai giảng: 15/12/2025 |\nThời gian: Tối 2, 4, 6\n11/2025 Khóa học online - Phân tích Kỹ thuật Nâng cao\nKhai giảng: 03/11/2025 |\nThời gian: Tối 2, 4, 6\nSách tài chính\nPhân tích kỹ thuật từ A đến Z\nVai trò của Quan hệ Nhà đầu tư (IR) trong việc tối đa hóa giá trị doanh nghiệp\nVietstock\nVietstock\nVận hành bởi CTCP Tài Việt.\nTrụ sở: 28/47 Lê Thị Hồng, P.Gò Vấp, Tp.HCM\nTel: (84.28) 3848 7238 - Fax: (84.28) 3848 7237\nGiấy phép số 48/GP-STTTT ngày 04/11/2016\nQuyết định số 13/QĐ-STTTT ngày 02/11/2017\nQuyết định số 06/QĐ-STTTT-ICP ngày 20/07/2023\nĐược cấp bởi Sở Thông tin và Truyền thông TPHCM\nNgười chịu trách nhiệm\nBÀ PHẠM THỊ THANH NGA\nQuảng cáo & Dịch vụ\n0908 169 898 - (028) 3848 7238\nkinhdoanh@vietstock.vn\nSáng tạo nội dung\n0938 046 488\ninfo@vietstock.vn\nVăn phòng giao dịch\n81/10B Hồ Văn Huê,\nPhường Đức Nhuận, TPHCM\nSách tài chính\nPhân tích kỹ thuật từ A đến Z\nVai trò của Quan hệ Nhà đầu tư (IR) trong việc tối đa hóa giá trị doanh nghiệp\nVietstock\nVận hành bởi CTCP Tài Việt.\nTrụ sở: 28/47 Lê Thị Hồng, P.Gò Vấp, Tp.HCM\nTel: (84.28) 3848 7238 - Fax: (84.28) 3848 7237\nGiấy phép số 48/GP-STTTT ngày 04/11/2016\nQuyết định số 13/QĐ-STTTT ngày 02/11/2017\nQuyết định số 06/QĐ-STTTT-ICP ngày 20/07/2023\nĐược cấp bởi Sở Thông tin và Truyền thông TPHCM\nNgười chịu trách nhiệm\nBÀ PHẠM THỊ THANH NGA\n© Bản quyền thuộc về Vietstock\nSitemap\nVề chúng tôi\nChính sách quyền riêng tư\nQuảng cáo & Dịch vụ\n© Bản quyền thuộc về Vietstock\nHotline: 0908 16 98 98\nTất cả\nGiờ qua\n24 giờ qua\nTuần qua\nTháng qua\nNăm qua\nTất cả\nTính năng\nNgành\nMã chứng khoán\nLãnh đạo\nTin tức\nBáo cáo phân tích\nThuật ngữ\nDịch vụ\nTính năng (-)\nVietstock\nChứng khoán\nCổ phiếu\nGiao dịch nội bộ\nNiêm yết\nETF và các quỹ\nChứng khoán phái sinh\nChứng quyền\nÝ kiến chuyên gia\nCâu chuyện đầu tư\nChính sách\nTrái phiếu\nDoanh nghiệp\nHoạt động kinh doanh\nCổ tức\nTăng vốn - M&A\nIPO - Cổ phần hóa\nChứng khoán phái sinh\nNhân vật\nTrái phiếu doanh nghiệp\nBất động sản\nThị trường nhà đất\nQuy hoạch - Hạ tầng\nDự án\nBảo hiểm và thuế nhà đất\nTài chính\nNgân hàng\nBảo hiểm\nThuế và Ngân sách\nHàng hóa\nVàng và kim loại quý\nNhiên liệu\nKim loại\nNông sản thực phẩm\nKinh tế\nVĩ mô\nDữ liệu vĩ mô\nGDP\nCPI\nIIP\nBán lẻ\nXuất nhập khẩu\nFDI\nTín dụng\nThị trường mở\nTỷ giá - Lãi suất\nDân số và Lao động\nKinh tế - Đầu tư\nThế giới\nChứng khoán thế giới\nTiền kỹ thuật số\nTài chính quốc tế\nKinh tế - Đầu tư\nĐông dương\nVĩ mô\nTài chính - Ngân hàng\nThị trường chứng khoán\nKinh tế - Đầu tư\nTài chính cá nhân\nLàm chủ đồng tiền\nĐầu tư - Kinh doanh nhỏ\nDoanh nhân và khởi nghiệp\nChơi sang\nXe - Công nghệ\nTiêu dùng và lối sống\nVì cộng đồng\nPhân tích\nNhận định thị thường\nPhân tích cơ bản\nPhân tích kỹ thuật\nVietstockFinance\nVĩ mô\nDữ liệu vĩ mô\nGDP\nCPI\nIIP\nBán lẻ\nXuất nhập khẩu\nFDI\nTín dụng\nThị trường mở\nTỷ giá - Lãi suất\nDân số và Lao động\nNgành\nDữ liệu ngành\nNgành chi tiết\nDoanh nghiệp\nDoanh nghiệp A-Z\nHồ sơ lãnh đạo\nLịch sự kiện\nNiêm yết\nCổ tức và phát hành thêm\nĐại hội đồng cổ đông\nCập nhật lãi lỗ\nGiao dịch nội bộ\nCổ đông nội bộ\nNgười liên quan\nCổ đông lớn\nCổ phiếu quỹ\nTài liệu cổ đông\nBáo cáo tài chính\nGiải trình KQKD\nBáo cáo quản trị\nBáo cáo thường niên\nNghị quyết ĐHĐCĐ\nTài liệu ĐHĐCĐ\nNiên giám\nCổ phiếu\nThị trường cổ phiếu\nBản đồ thị trường\nTổng hợp thị trường\nThanh khoản\nĐịnh giá\nNước ngoài\nTự doanh\nTop cổ phiếu\nBản đồ ngành\nThống kê giao dịch\nGiá\nĐặt lệnh\nNước ngoài\nTự doanh\nẢnh hưởng chỉ số\nBiến động cổ phiếu\nGiao dịch nội bộ\nTrạng thái cổ phiếu\nQuy mô thị trường\nNiêm yết\nNiêm yết mới\nNiêm yết bổ sung\nHủy niêm yết\nTheo dõi đặc biệt\nKhông được ký quỹ\nETF\nCổ phiếu chi tiết\nTổng quan\nGiao dịch\nTài chính\nPhân tích kỹ thuật\nHồ sơ doanh nghiệp\nTin tức sự kiện\nTài liệu\nTâm lý thị trường\nPhái sinh\nHợp đồng tương lai\nTổng quan\nThống kê giao dịch\nKiến thức / Qui định\nChứng quyền\nTổng quan\nThống kê giao dịch\nBlackScholes\nTrái phiếu\nTổng quan\nTổ chức phát hành\nTrái phiếu A-Z\nThống kê giao dịch\nTin tức\nCông cụ đầu tư\nBản đồ thị trường\nSức mạnh giá RRG\nPhân tích kỹ thuật\nBảng giá trực tuyến\nBộ lọc cổ phiếu\nSo sánh cổ phiếu\nBáo cáo phân tích\nNghiên cứu - Phân tích\nVĩ mô - Chiến lược thị trường\nPhân tích ngành\nPhân tích doanh nghiệp\nTài liệu tham khảo\nBiểu đồ tài chính\nTruy xuất dữ liệu\nTổng hợp doanh nghiệp\nBáo cáo tài chính\nBáo cáo tài chính ngành\nVĩ mô\nNgành (-)\nVS-Sector\nNăng lượng\nNăng lượng\n-\xa0 Thiết bị và dịch vụ năng lượng\n-\xa0 Dầu khí\nNguyên vật liệu\nNguyên vật liệu\n-\xa0 Hóa chất\n-\xa0 Vật liệu xây dựng\n-\xa0 Bao bì và vật chứa\n-\xa0 Khai khoáng và luyện kim\n-\xa0 Gỗ và giấy\nCông nghiệp\nHàng hóa công nghiệp\n-\xa0 Thiết bị hàng không vũ trụ và quốc phòng\n-\xa0 Sản phẩm xây dựng\n-\xa0 Kỹ thuật xây dựng\n-\xa0 Thiết bị điện\n-\xa0 Tập đoàn đa ngành\n-\xa0 Máy móc công nghiệp\n-\xa0 Phân phối hàng công nghiệp\nDịch vụ thương mại và chuyên nghiệp\n-\xa0 Dịch vụ và thiết bị thương mại\n-\xa0 Dịch vụ chuyên nghiệp\nVận tải\n-\xa0 Vận tải và logistics hàng không\n-\xa0 Hãng hàng không chở khách\n-\xa0 Vận tải biển\n-\xa0 Vận tải mặt đất\n-\xa0 Hạ tầng giao thông\nTiêu dùng không thiết yếu\nXe và linh kiện\n-\xa0 Linh kiện xe\n-\xa0 Xe\nThời trang và hàng lâu bền\n-\xa0 Hàng tiêu dùng lâu bền\n-\xa0 Sản phẩm giải trí\n-\xa0 Thời trang và dệt may\nDịch vụ tiêu dùng\n-\xa0 Khách sạn, nhà hàng và giải trí\n-\xa0 Dịch vụ tiêu dùng khác\nThương mại hàng không thiết yếu\n-\xa0 Nhà phân phối\n-\xa0 Bán lẻ đa dạng\n-\xa0 Bán lẻ chuyên doanh\nTiêu dùng thiết yếu\nThương mại hàng thiết yếu\n-\xa0 Thương mại hàng thiết yếu\nThực phẩm, đồ uống và thuốc lá\n-\xa0 Đồ uống\n-\xa0 Thực phẩm\n-\xa0 Thuốc lá\nSản phẩm chăm sóc cá nhân và gia đình\n-\xa0 Sản phẩm chăm sóc gia đình\n-\xa0 Sản phẩm chăm sóc cá nhân\nChăm sóc sức khỏe\nThiết bị và dịch vụ chăm sóc sức khỏe\n-\xa0 Thiết bị và vật tư chăm sóc sức khỏe\n-\xa0 Thương mại và dịch vụ chăm sóc sức khỏe\n-\xa0 Công nghệ chăm sóc sức khỏe\nDược phẩm, công nghệ sinh học và khoa học sự sống\n-\xa0 Công nghệ sinh học\n-\xa0 Dược phẩm\n-\xa0 Công cụ và dịch vụ khoa học sự sống\nTài chính\nTổ chức tín dụng\n-\xa0 Ngân hàng\n-\xa0 Tín dụng phi ngân hàng\n-\xa0 Tín dụng khác\nDịch vụ tài chính\n-\xa0 Dịch vụ tài chính\n-\xa0 Thị trường vốn\n-\xa0 REIT thế chấp\nBảo hiểm\n-\xa0 Bảo hiểm\nCông nghệ thông tin\nPhần mềm và dịch vụ\n-\xa0 Dịch vụ CNTT\n-\xa0 Phần mềm\nPhần cứng và thiết bị\n-\xa0 Thiết bị viễn thông\n-\xa0 Phần cứng, bộ lưu trữ và thiết bị ngoại vi\n-\xa0 Điện tử\nBán dẫn\n-\xa0 Bán dẫn\nDịch vụ truyền thông\nDịch vụ viễn thông\n-\xa0 Dịch vụ viễn thông đa dạng\n-\xa0 Dịch vụ viễn thông không dây\nTruyền thông và giải trí\n-\xa0 Truyền thông\n-\xa0 Giải trí\n-\xa0 Truyền thông tương tác\nTiện ích\nTiện ích\n-\xa0 Điện\n-\xa0 Gas sinh hoạt\n-\xa0 Tiện tích tổng hợp\n-\xa0 Nước\n-\xa0 Phát điện độc lập và điện tái tạo\nBất động sản\nQuỹ REITs\n-\xa0 REITs bất động sản đa dạng\n-\xa0 REITs khu công nghiệp\n-\xa0 REITs khách sạn và khu nghỉ dưỡng\n-\xa0 REITs văn phòng\n-\xa0 REITs bất động sản y tế\n-\xa0 REITs nhà ở\n-\xa0 REITs bán lẻ\n-\xa0 REITs chuyên biệt\nBất động sản\n-\xa0 Quản lý và phát triển bất động sản\n-\xa0 Bất động sản đa dạng\n-\xa0 Dịch vụ bất động sản\nMã chứng khoán (-)\nTất cả\nCổ phiếu\nChỉ số\nChứng chỉ quỹ\nChứng quyền\nHợp đồng tương lai\nTrái phiếu\nXem thêm\nLãnh đạo (-)\nTất cả\nNgười nội bộ\nNgười liên quan\nCổ đông lớn\nXem thêm\nTin tức (-)\nXem thêm\nBài viết của tác giả (-)\nXem thêm\nBáo cáo phân tích (-)\nXem thêm\nThuật ngữ (-)\nXem thêm\nDịch vụ (-)\nĐào tạo\nKhóa học online - Phân tích Kỹ thuật Ứng dụng\nKhai giảng: 17/11/2025 |\nThời gian: Tối 2, 4, 6 |\nSố buổi: 7 |\nHọc phí: 3,825,000 đ\nKhóa học online - Đọc hiểu Báo cáo Tài chính\nKhai giảng: 25/11/2025 |\nThời gian: Tối 3, 5 |\nSố buổi: 3 |\nHọc phí: 1,530,000 đ\nKhóa học Online - Bắt đáy và Chốt lời Cổ phiếu\nKhai giảng: 13/12/2025 |\nThời gian: Thứ 7 |\nSố buổi: 3 |\nHọc phí: 1,870,000 đ\nKhóa học online - Phân tích Ngành và Dòng tiền Thị trường\nKhai giảng: 15/12/2025 |\nThời gian: Tối 2, 4, 6 |\nSố buổi: 6 |\nHọc phí: 3,570,000 đ\nKhóa học online - Phân tích Kỹ thuật Nâng cao\nKhai giảng: 03/11/2025 |\nThời gian: Tối 2, 4, 6 |\nSố buổi: 5 |\nHọc phí: 3,825,000 đ\nKhóa học online - Chứng khoán Cơ bản\nKhai giảng: 04/11/2025 |\nThời gian: Tối 3, 5 |\nSố buổi: 4 |\nHọc phí: 1,530,000 đ\nKhóa học online - Phân tích và Định giá Cổ phiếu\nKhai giảng: 21/10/2025 |\nThời gian: Tối 3, 5 |\nSố buổi: 4 |\nHọc phí: 1,870,000 đ\nKhóa học - Phân tích Kỹ thuật Ứng dụng - tại Tp. HCM\nKhai giảng: |\nThời gian: Tối 2, 4, 6 |\nSố buổi: 7 |\nHọc phí: 5,500,000 đ\nKhóa học online - Lướt sóng cổ phiếu nóng\nKhai giảng: 23/08/2025 |\nThời gian: Thứ 7 |\nSố buổi: 2 |\nHọc phí: 849,000 đ\nĐào tạo Phân tích và Đầu tư Chứng khoán IN - HOUSE\nKhai giảng: |\nThời gian: |\nSố buổi: 8 |\nHọc phí: 0 đ\nSách tài chính\nPhân tích kỹ thuật từ A đến Z\nVai trò của Quan hệ Nhà đầu tư (IR) trong việc Tối đa hóa Giá trị Doanh nghiệp\nCông cụ đầu tư\nVietstockUpdater\nVietstockFinance\nInvestOnline\nIROnline\nVietstockXLS\nTruyền thông tài chính\nBanner Ads\nOnline PR\nQuan hệ nhà đầu tư\nBáo cáo phân tích\nDữ liệu tài chính\nDataFeed - Dữ liệu tài chính tích hợp chuyên nghiệp\nVietstockXLS - Dữ liệu Kinh tế Tài chính Chứng khoán theo yêu cầu\nInvestOnline - Giải pháp website tra cứu chứng khoán toàn diện\nIROnline - Giải pháp thuê ngoài website IR, website quan hệ cổ đông\nThông báo\nVietstock trân trọng thông báo đến Quý Khách hàng về việc áp dụng “Chính sách quyền riêng tư” căn cứ theo Nghị định số 13/2023/NĐ-CP v/v bảo vệ dữ liệu cá nhân được ban hành bởi Chính phủ.\nTrong quá trình thiết lập mối quan hệ giữa Vietstock và Khách hàng, Vietstock có thể thu thập và xử lý dữ liệu cá nhân của Khách hàng cho mục đích được xác định tại Chính sách quyền riêng tư (“CSQRT”) này. Trong trường hợp Khách hàng không đồng ý một phần hoặc toàn bộ quy định tại CSQRT, Vietstock không thể cung cấp sản phẩm và dịch vụ cho Khách hàng.\nVietstock cam kết luôn tôn trọng quyền riêng tư, bảo mật và an toàn thông tin cá nhân; đồng thời luôn nỗ lực bảo vệ dữ liệu cá nhân của Khách hàng, tuân thủ quy định pháp luật Việt Nam thông qua những biện pháp bảo vệ dữ liệu cá nhân đáp ứng và phù hợp với quy định pháp luật Việt Nam.\nChính sách quyền riêng tư là một phần không thể tách rời của các thỏa thuận, điều khoản và điều kiện chi phối mối quan hệ giữa Vietstock và Quý Khách hàng.\nQuý Khách hàng đã đọc kỹ, hiểu rõ và đồng ý với toàn bộ điều khoản của “Chính sách quyền riêng tư”. Chi tiết Chính sách quyền riêng tư xem tại đây.\nNếu không đồng ý với Chính sách quyền riêng tư này, Chúng tôi không thể cung cấp sản phẩm và dịch vụ cho Quý Khách hàng.\nTôi đã đọc kỹ, hiểu rõ và đồng ý với toàn bộ điều khoản của Chính sách quyền riêng tư\nĐồng ý\nTheo dấu dòng tiền cá mập 24/11: Dòng tiền tự doanh nỗ lực bám trụ khi khối ngoại xả ròng\nPhiên 24/11 chứng kiến khối ngoại tiếp tục bán ròng hơn 1.2 ngàn tỷ đồng, trong khi dòng tiền tự doanh công ty chứng khoán (CTCK) vẫn duy trì xu hướng mua ròng, tạo bức tranh thị trường trái chiều.\nCác ""cá mập"" nước ngoài lại vừa có phiên bán ròng mạnh, hơn 1.2 ngàn tỷ đồng. Tâm điểm là các cổ phiếu họ Vingroup, với VRE bị xả mạnh nhất, hơn 288 tỷ đồng, gần gấp đôi giá trị bán ra của VHM (151 tỷ đồng). STB và VIC cũng nằm trong nhóm bị bán ròng mạnh, mỗi cổ phiếu khoảng 120 tỷ đồng.\nTrong khi đó, dòng tiền ngoại vẫn săn tìm cơ hội ở nhóm công nghệ. FPT dẫn đầu lực mua với 158 tỷ đồng, nối dài chuỗi phiên gom ròng liên tục trong hàng chục phiên gần đây. VNM đứng ngay sau với 147 tỷ đồng, còn VPB được mua ròng 58 tỷ đồng.\nTính từ đầu tháng 11, khối ngoại đã gom ròng FPT hơn 1.78 ngàn tỷ đồng - dẫn đầu toàn sàn, trong khi HPG theo sát với gần 1.73 ngàn tỷ đồng. Ở chiều ngược lại, STB bị xả mạnh nhất với hơn 2 ngàn tỷ đồng. Tổng cộng, giá trị bán ròng của khối ngoại trong tháng 11 vượt 9 ngàn tỷ đồng.\nNhìn rộng hơn, từ đầu quý 4 đến nay, FPT đã được gom ròng gần 4 ngàn tỷ đồng. Mặt khác, MBB bị xả mạnh nhất với hơn 4.3 ngàn tỷ đồng, đẩy tổng giá trị bán ròng toàn quý lên hơn 32 ngàn tỷ đồng.\nKhối ngoại bán ròng hơn ngàn tỷ\nTop 10 cổ phiếu khối ngoại giao dịch ròng nhiều nhất phiên 24/11\nỞ chiều ngược lại, khối tự doanh tiếp tục duy trì đà mua ròng, đạt 380 tỷ đồng trên HOSE, ghi nhận phiên mua ròng thứ hai liên tiếp. HPG và VNM dẫn đầu lực gom với lần lượt 63 tỷ đồng và 62 tỷ đồng, MWG theo sau 43 tỷ đồng.\nTrong khi đó, CTCK bán ròng mạnh nhất là STB gần 32 tỷ đồng, tiếp theo là KBC và VRE với 11 tỷ và 10 tỷ đồng.\nTự doanh lại mua ròng mạnh\nTop 10 cổ phiếu tự doanh giao dịch ròng mạnh nhất trong phiên 24/11\nTử Kính\nFILI\n- 17:55 24/11/2025\ncá mập\ntheo dấu dòng tiền cá mập\ntự doanh\nkhối ngoại mua ròng\nbán ròng\ngiao dịch cổ phiếu\nMÃ CHỨNG KHOÁN LIÊN QUAN (11)\nFPT\n100,200\n-600\n-0.60%\nHPG\n27,100\n-300\n-1.09%\nKBC\n34,950\n50\n+0.14%\nMBB\n23,150\n-50\n-0.22%\nMWG\n79,300\n-700\n-0.88%\nSTB\n50,000\n-1,300\n-2.53%\nVHM\n102,700\n3,400\n+3.42%\nVIC\n239,500\n9,800\n+4.27%\nVNM\n63,000\n3,100\n+5.18%\nVPB\n29,000\n450\n+1.58%\nVRE\n34,450\n2,250\n+6.99%\nTIN TỨC MÃ CHỨNG KHOÁN\n1\nThị trường chứng quyền ngày 25/11/2025: Nhóm chứng quyền VRE bứt phá\n45 phút trước\n2\nAFIEX có gì trong tay trước khi lên sàn HOSE?\n1 giờ trước\n3\nPhân tích kỹ thuật phiên chiều 24/11: Test lại đường SMA 50 ngày\n24/11 13:02\n4\nCông ty bao bì Việt do người Thái nắm giữ xin hủy đại chúng và rời HOSE\n24/11 12:40\n5\n48 tấn sữa và nước uống của Vinamilk đến rốn lũ miền Trung và Tây Nguyên\n24/11 11:41\nTIN CÙNG CHUYÊN MỤC\nCỔ PHIẾU\n13 phút trước\nCổ phiếu thủy sản, thực phẩm có tuần hút tiền\nThanh khoản diễn biến trái chiều ở hai sàn HOSE và HNX trong tuần giao dịch 17 - 21/11. Dòng tiền vẫn đang duy trì xu hướng thận trọng. Tuần vừa qua, nhóm cổ phiếu...\nCỔ PHIẾU\n24/11 11:01\nAfiex rời UPCoM cuối tháng 11 để chuyển sang HOSE\nSở Giao dịch Chứng khoán Hà Nội (HNX) thông báo hủy giao dịch toàn bộ 35 triệu cp của CTCP Xuất nhập khẩu Nông sản Thực phẩm An Giang (Afiex, UPCoM: AFX) từ ngày...\nCỔ PHIẾU\n24/11 08:00\nTop cổ phiếu đáng chú ý đầu tuần 24/11\nDanh sách các mã cổ phiếu tăng và giảm mạnh nhất những phiên gần đây theo số liệu thống kê của Vietstock.\nCỔ PHIẾU\n24/11 06:02\n24/11: Đọc gì trước giờ giao dịch chứng khoán?\nCập nhật nhanh những diễn biến kinh tế, tài chính trong nước và thế giới những ngày cuối tuần trước khi thị trường mở cửa.\nCỔ PHIẾU\n22/11 20:30\nVIC dẫn dắt đà tăng, VN-Index có thêm gần 20 điểm trong tuần phân hóa\nVIC tiếp tục dẫn dắt với mức đóng góp vượt trội, cùng nhóm Vingroup là VHM và VPL củng cố đà tăng, giúp chỉ số VN-Index duy trì nhịp phục hồi trong tuần 17-21/11...\nCỔ PHIẾU\n22/11 08:00\nDNSE Future Tech Summit: Bước đệm cho kỷ nguyên giao dịch T+0 và thị trường “không độ trễ”\nChiều 21/11/2025, sự kiện công nghệ DNSE Future Tech Summit đã diễn ra tại TP. Hồ Chí Minh, quy tụ nhiều chuyên gia tài chính - công nghệ uy tín và trên 200 nhà đầu...\nCỔ PHIẾU\n21/11 22:32\nTheo dấu dòng tiền cá mập 21/11: Khối ngoại rút ròng VIX hơn 700 tỷ\nKhối ngoại quay lại bán ròng trong phiên 21/11 với tâm điểm là VIX, trái chiều với lực mua từ tự doanh các công ty chứng khoán (CTCK).\nCỔ PHIẾU\n21/11 13:02\nNhững dấu ấn của cổ phiếu thủy sản trong một năm thuế quan gây chao đảo\nGiữa một năm đầy biến động bởi chính sách thuế quan từ Mỹ, cổ phiếu thủy sản vẫn đang ghi những dấu ấn. 3/5 mã lớn của ngành vẫn giảm sâu trong khi ANV lại tìm thấy...\nCỔ PHIẾU\n21/11 10:32\nBầu Đức và “game” mới\nCổ phiếu HAG vừa đạt đỉnh 10 năm, bầu Đức tính chuyện niêm yết công ty con sau khi “cục máu đông” nợ tan được đôi phần.\nCỔ PHIẾU\n21/11 08:00\nTop cổ phiếu đáng chú ý đầu phiên 21/11\nDanh sách các mã cổ phiếu tăng và giảm mạnh nhất những phiên gần đây theo số liệu thống kê của Vietstock.\nXem thêm\nChỉ số thị trường\nTIN CHÍNH\nĐỌC NHIỀU NHẤT\n×\nBáo lỗi bài viết\nCám ơn bạn đã gửi báo lỗi bài viết.\nĐịa chỉ email\nHọ tên\nSố điện thoại\nNội dung\nGửi\nVietstock – Cổng thông tin tài chính và chứng khoán chính thức hoạt động từ ngày 02/08/2002, với định hướng trở thành người bạn đồng hành đáng tin cậy của nhà đầu tư. Ngay từ những ngày đầu, Vietstock đã không ngừng nỗ lực mang đến hệ thống thông tin và dữ liệu tài chính chính xác – cập nhật – đầy đủ, giúp nhà đầu tư hiểu đúng, nhìn rộng và tự tin đưa ra quyết định trong hành trình đầu tư của mình.\nTruyền Thông Tài Chính\nQuan hệ công chúng (PR)\nQuan hệ nhà đầu tư (IR)\nQuảng cáo banner\nBáo cáo phân tích\nDữ Liệu Tài Chính\nDataFeed\nVietstockXLS\nInvestOnline\nIROnline\nVietstockUpdater\nVietstockFinance\nSách tài chính\nPhân tích kỹ thuật từ A đến Z\nVai trò của Quan hệ Nhà đầu tư (IR) trong việc tối đa hóa giá trị doanh nghiệp\nVietstock\nQuảng cáo & Dịch vụ\n0908 169 898 - (028) 3848 7238\nkinhdoanh@vietstock.vn\nSáng tạo nội dung\n0938 046 488\ninfo@vietstock.vn\nVăn phòng giao dịch\n81/10B Hồ Văn Huê,\nPhường Đức Nhuận, Tp.HCM\nLớp học sắp khai giảng\n11/2025 Khóa học online - Phân tích Kỹ thuật Ứng dụng\nKhai giảng: 17/11/2025 |\nThời gian: Tối 2, 4, 6\n11/2025 Khóa học online - Đọc hiểu Báo cáo Tài chính\nKhai giảng: 25/11/2025 |\nThời gian: Tối 3, 5\n12/2025 Khóa học Online - Bắt đáy và Chốt lời Cổ phiếu\nKhai giảng: 13/12/2025 |\nThời gian: Thứ 7\n12/2025 Khóa học online - Phân tích Ngành và Dòng tiền Thị trường\nKhai giảng: 15/12/2025 |\nThời gian: Tối 2, 4, 6\n11/2025 Khóa học online - Phân tích Kỹ thuật Nâng cao\nKhai giảng: 03/11/2025 |\nThời gian: Tối 2, 4, 6\nSách tài chính\nPhân tích kỹ thuật từ A đến Z\nVai trò của Quan hệ Nhà đầu tư (IR) trong việc tối đa hóa giá trị doanh nghiệp\nVietstock\nVietstock\nVận hành bởi CTCP Tài Việt.\nTrụ sở: 28/47 Lê Thị Hồng, P.Gò Vấp, Tp.HCM\nTel: (84.28) 3848 7238 - Fax: (84.28) 3848 7237\nGiấy phép số 48/GP-STTTT ngày 04/11/2016\nQuyết định số 13/QĐ-STTTT ngày 02/11/2017\nQuyết định số 06/QĐ-STTTT-ICP ngày 20/07/2023\nĐược cấp bởi Sở Thông tin và Truyền thông TPHCM\nNgười chịu trách nhiệm\nBÀ PHẠM THỊ THANH NGA\nQuảng cáo & Dịch vụ\n0908 169 898 - (028) 3848 7238\nkinhdoanh@vietstock.vn\nSáng tạo nội dung\n0938 046 488\ninfo@vietstock.vn\nVăn phòng giao dịch\n81/10B Hồ Văn Huê,\nPhường Đức Nhuận, TPHCM\nSách tài chính\nPhân tích kỹ thuật từ A đến Z\nVai trò của Quan hệ Nhà đầu tư (IR) trong việc tối đa hóa giá trị doanh nghiệp\nVietstock\nVận hành bởi CTCP Tài Việt.\nTrụ sở: 28/47 Lê Thị Hồng, P.Gò Vấp, Tp.HCM\nTel: (84.28) 3848 7238 - Fax: (84.28) 3848 7237\nGiấy phép số 48/GP-STTTT ngày 04/11/2016\nQuyết định số 13/QĐ-STTTT ngày 02/11/2017\nQuyết định số 06/QĐ-STTTT-ICP ngày 20/07/2023\nĐược cấp bởi Sở Thông tin và Truyền thông TPHCM\nNgười chịu trách nhiệm\nBÀ PHẠM THỊ THANH NGA\n© Bản quyền thuộc về Vietstock\nSitemap\nVề chúng tôi\nChính sách quyền riêng tư\nQuảng cáo & Dịch vụ\n© Bản quyền thuộc về Vietstock\nHotline: 0908 16 98 98\nTất cả\nGiờ qua\n24 giờ qua\nTuần qua\nTháng qua\nNăm qua\nTất cả\nTính năng\nNgành\nMã chứng khoán\nLãnh đạo\nTin tức\nBáo cáo phân tích\nThuật ngữ\nDịch vụ\nTính năng (-)\nVietstock\nChứng khoán\nCổ phiếu\nGiao dịch nội bộ\nNiêm yết\nETF và các quỹ\nChứng khoán phái sinh\nChứng quyền\nÝ kiến chuyên gia\nCâu chuyện đầu tư\nChính sách\nTrái phiếu\nDoanh nghiệp\nHoạt động kinh doanh\nCổ tức\nTăng vốn - M&A\nIPO - Cổ phần hóa\nChứng khoán phái sinh\nNhân vật\nTrái phiếu doanh nghiệp\nBất động sản\nThị trường nhà đất\nQuy hoạch - Hạ tầng\nDự án\nBảo hiểm và thuế nhà đất\nTài chính\nNgân hàng\nBảo hiểm\nThuế và Ngân sách\nHàng hóa\nVàng và kim loại quý\nNhiên liệu\nKim loại\nNông sản thực phẩm\nKinh tế\nVĩ mô\nDữ liệu vĩ mô\nGDP\nCPI\nIIP\nBán lẻ\nXuất nhập khẩu\nFDI\nTín dụng\nThị trường mở\nTỷ giá - Lãi suất\nDân số và Lao động\nKinh tế - Đầu tư\nThế giới\nChứng khoán thế giới\nTiền kỹ thuật số\nTài chính quốc tế\nKinh tế - Đầu tư\nĐông dương\nVĩ mô\nTài chính - Ngân hàng\nThị trường chứng khoán\nKinh tế - Đầu tư\nTài chính cá nhân\nLàm chủ đồng tiền\nĐầu tư - Kinh doanh nhỏ\nDoanh nhân và khởi nghiệp\nChơi sang\nXe - Công nghệ\nTiêu dùng và lối sống\nVì cộng đồng\nPhân tích\nNhận định thị thường\nPhân tích cơ bản\nPhân tích kỹ thuật\nVietstockFinance\nVĩ mô\nDữ liệu vĩ mô\nGDP\nCPI\nIIP\nBán lẻ\nXuất nhập khẩu\nFDI\nTín dụng\nThị trường mở\nTỷ giá - Lãi suất\nDân số và Lao động\nNgành\nDữ liệu ngành\nNgành chi tiết\nDoanh nghiệp\nDoanh nghiệp A-Z\nHồ sơ lãnh đạo\nLịch sự kiện\nNiêm yết\nCổ tức và phát hành thêm\nĐại hội đồng cổ đông\nCập nhật lãi lỗ\nGiao dịch nội bộ\nCổ đông nội bộ\nNgười liên quan\nCổ đông lớn\nCổ phiếu quỹ\nTài liệu cổ đông\nBáo cáo tài chính\nGiải trình KQKD\nBáo cáo quản trị\nBáo cáo thường niên\nNghị quyết ĐHĐCĐ\nTài liệu ĐHĐCĐ\nNiên giám\nCổ phiếu\nThị trường cổ phiếu\nBản đồ thị trường\nTổng hợp thị trường\nThanh khoản\nĐịnh giá\nNước ngoài\nTự doanh\nTop cổ phiếu\nBản đồ ngành\nThống kê giao dịch\nGiá\nĐặt lệnh\nNước ngoài\nTự doanh\nẢnh hưởng chỉ số\nBiến động cổ phiếu\nGiao dịch nội bộ\nTrạng thái cổ phiếu\nQuy mô thị trường\nNiêm yết\nNiêm yết mới\nNiêm yết bổ sung\nHủy niêm yết\nTheo dõi đặc biệt\nKhông được ký quỹ\nETF\nCổ phiếu chi tiết\nTổng quan\nGiao dịch\nTài chính\nPhân tích kỹ thuật\nHồ sơ doanh nghiệp\nTin tức sự kiện\nTài liệu\nTâm lý thị trường\nPhái sinh\nHợp đồng tương lai\nTổng quan\nThống kê giao dịch\nKiến thức / Qui định\nChứng quyền\nTổng quan\nThống kê giao dịch\nBlackScholes\nTrái phiếu\nTổng quan\nTổ chức phát hành\nTrái phiếu A-Z\nThống kê giao dịch\nTin tức\nCông cụ đầu tư\nBản đồ thị trường\nSức mạnh giá RRG\nPhân tích kỹ thuật\nBảng giá trực tuyến\nBộ lọc cổ phiếu\nSo sánh cổ phiếu\nBáo cáo phân tích\nNghiên cứu - Phân tích\nVĩ mô - Chiến lược thị trường\nPhân tích ngành\nPhân tích doanh nghiệp\nTài liệu tham khảo\nBiểu đồ tài chính\nTruy xuất dữ liệu\nTổng hợp doanh nghiệp\nBáo cáo tài chính\nBáo cáo tài chính ngành\nVĩ mô\nNgành (-)\nVS-Sector\nNăng lượng\nNăng lượng\n-\xa0 Thiết bị và dịch vụ năng lượng\n-\xa0 Dầu khí\nNguyên vật liệu\nNguyên vật liệu\n-\xa0 Hóa chất\n-\xa0 Vật liệu xây dựng\n-\xa0 Bao bì và vật chứa\n-\xa0 Khai khoáng và luyện kim\n-\xa0 Gỗ và giấy\nCông nghiệp\nHàng hóa công nghiệp\n-\xa0 Thiết bị hàng không vũ trụ và quốc phòng\n-\xa0 Sản phẩm xây dựng\n-\xa0 Kỹ thuật xây dựng\n-\xa0 Thiết bị điện\n-\xa0 Tập đoàn đa ngành\n-\xa0 Máy móc công nghiệp\n-\xa0 Phân phối hàng công nghiệp\nDịch vụ thương mại và chuyên nghiệp\n-\xa0 Dịch vụ và thiết bị thương mại\n-\xa0 Dịch vụ chuyên nghiệp\nVận tải\n-\xa0 Vận tải và logistics hàng không\n-\xa0 Hãng hàng không chở khách\n-\xa0 Vận tải biển\n-\xa0 Vận tải mặt đất\n-\xa0 Hạ tầng giao thông\nTiêu dùng không thiết yếu\nXe và linh kiện\n-\xa0 Linh kiện xe\n-\xa0 Xe\nThời trang và hàng lâu bền\n-\xa0 Hàng tiêu dùng lâu bền\n-\xa0 Sản phẩm giải trí\n-\xa0 Thời trang và dệt may\nDịch vụ tiêu dùng\n-\xa0 Khách sạn, nhà hàng và giải trí\n-\xa0 Dịch vụ tiêu dùng khác\nThương mại hàng không thiết yếu\n-\xa0 Nhà phân phối\n-\xa0 Bán lẻ đa dạng\n-\xa0 Bán lẻ chuyên doanh\nTiêu dùng thiết yếu\nThương mại hàng thiết yếu\n-\xa0 Thương mại hàng thiết yếu\nThực phẩm, đồ uống và thuốc lá\n-\xa0 Đồ uống\n-\xa0 Thực phẩm\n-\xa0 Thuốc lá\nSản phẩm chăm sóc cá nhân và gia đình\n-\xa0 Sản phẩm chăm sóc gia đình\n-\xa0 Sản phẩm chăm sóc cá nhân\nChăm sóc sức khỏe\nThiết bị và dịch vụ chăm sóc sức khỏe\n-\xa0 Thiết bị và vật tư chăm sóc sức khỏe\n-\xa0 Thương mại và dịch vụ chăm sóc sức khỏe\n-\xa0 Công nghệ chăm sóc sức khỏe\nDược phẩm, công nghệ sinh học và khoa học sự sống\n-\xa0 Công nghệ sinh học\n-\xa0 Dược phẩm\n-\xa0 Công cụ và dịch vụ khoa học sự sống\nTài chính\nTổ chức tín dụng\n-\xa0 Ngân hàng\n-\xa0 Tín dụng phi ngân hàng\n-\xa0 Tín dụng khác\nDịch vụ tài chính\n-\xa0 Dịch vụ tài chính\n-\xa0 Thị trường vốn\n-\xa0 REIT thế chấp\nBảo hiểm\n-\xa0 Bảo hiểm\nCông nghệ thông tin\nPhần mềm và dịch vụ\n-\xa0 Dịch vụ CNTT\n-\xa0 Phần mềm\nPhần cứng và thiết bị\n-\xa0 Thiết bị viễn thông\n-\xa0 Phần cứng, bộ lưu trữ và thiết bị ngoại vi\n-\xa0 Điện tử\nBán dẫn\n-\xa0 Bán dẫn\nDịch vụ truyền thông\nDịch vụ viễn thông\n-\xa0 Dịch vụ viễn thông đa dạng\n-\xa0 Dịch vụ viễn thông không dây\nTruyền thông và giải trí\n-\xa0 Truyền thông\n-\xa0 Giải trí\n-\xa0 Truyền thông tương tác\nTiện ích\nTiện ích\n-\xa0 Điện\n-\xa0 Gas sinh hoạt\n-\xa0 Tiện tích tổng hợp\n-\xa0 Nước\n-\xa0 Phát điện độc lập và điện tái tạo\nBất động sản\nQuỹ REITs\n-\xa0 REITs bất động sản đa dạng\n-\xa0 REITs khu công nghiệp\n-\xa0 REITs khách sạn và khu nghỉ dưỡng\n-\xa0 REITs văn phòng\n-\xa0 REITs bất động sản y tế\n-\xa0 REITs nhà ở\n-\xa0 REITs bán lẻ\n-\xa0 REITs chuyên biệt\nBất động sản\n-\xa0 Quản lý và phát triển bất động sản\n-\xa0 Bất động sản đa dạng\n-\xa0 Dịch vụ bất động sản\nMã chứng khoán (-)\nTất cả\nCổ phiếu\nChỉ số\nChứng chỉ quỹ\nChứng quyền\nHợp đồng tương lai\nTrái phiếu\nXem thêm\nLãnh đạo (-)\nTất cả\nNgười nội bộ\nNgười liên quan\nCổ đông lớn\nXem thêm\nTin tức (-)\nXem thêm\nBài viết của tác giả (-)\nXem thêm\nBáo cáo phân tích (-)\nXem thêm\nThuật ngữ (-)\nXem thêm\nDịch vụ (-)\nĐào tạo\nKhóa học online - Phân tích Kỹ thuật Ứng dụng\nKhai giảng: 17/11/2025 |\nThời gian: Tối 2, 4, 6 |\nSố buổi: 7 |\nHọc phí: 3,825,000 đ\nKhóa học online - Đọc hiểu Báo cáo Tài chính\nKhai giảng: 25/11/2025 |\nThời gian: Tối 3, 5 |\nSố buổi: 3 |\nHọc phí: 1,530,000 đ\nKhóa học Online - Bắt đáy và Chốt lời Cổ phiếu\nKhai giảng: 13/12/2025 |\nThời gian: Thứ 7 |\nSố buổi: 3 |\nHọc phí: 1,870,000 đ\nKhóa học online - Phân tích Ngành và Dòng tiền Thị trường\nKhai giảng: 15/12/2025 |\nThời gian: Tối 2, 4, 6 |\nSố buổi: 6 |\nHọc phí: 3,570,000 đ\nKhóa học online - Phân tích Kỹ thuật Nâng cao\nKhai giảng: 03/11/2025 |\nThời gian: Tối 2, 4, 6 |\nSố buổi: 5 |\nHọc phí: 3,825,000 đ\nKhóa học online - Chứng khoán Cơ bản\nKhai giảng: 04/11/2025 |\nThời gian: Tối 3, 5 |\nSố buổi: 4 |\nHọc phí: 1,530,000 đ\nKhóa học online - Phân tích và Định giá Cổ phiếu\nKhai giảng: 21/10/2025 |\nThời gian: Tối 3, 5 |\nSố buổi: 4 |\nHọc phí: 1,870,000 đ\nKhóa học - Phân tích Kỹ thuật Ứng dụng - tại Tp. HCM\nKhai giảng: |\nThời gian: Tối 2, 4, 6 |\nSố buổi: 7 |\nHọc phí: 5,500,000 đ\nKhóa học online - Lướt sóng cổ phiếu nóng\nKhai giảng: 23/08/2025 |\nThời gian: Thứ 7 |\nSố buổi: 2 |\nHọc phí: 849,000 đ\nĐào tạo Phân tích và Đầu tư Chứng khoán IN - HOUSE\nKhai giảng: |\nThời gian: |\nSố buổi: 8 |\nHọc phí: 0 đ\nSách tài chính\nPhân tích kỹ thuật từ A đến Z\nVai trò của Quan hệ Nhà đầu tư (IR) trong việc Tối đa hóa Giá trị Doanh nghiệp\nCông cụ đầu tư\nVietstockUpdater\nVietstockFinance\nInvestOnline\nIROnline\nVietstockXLS\nTruyền thông tài chính\nBanner Ads\nOnline PR\nQuan hệ nhà đầu tư\nBáo cáo phân tích\nDữ liệu tài chính\nDataFeed - Dữ liệu tài chính tích hợp chuyên nghiệp\nVietstockXLS - Dữ liệu Kinh tế Tài chính Chứng khoán theo yêu cầu\nInvestOnline - Giải pháp website tra cứu chứng khoán toàn diện\nIROnline - Giải pháp thuê ngoài website IR, website quan hệ cổ đông\nThông báo\nVietstock trân trọng thông báo đến Quý Khách hàng về việc áp dụng “Chính sách quyền riêng tư” căn cứ theo Nghị định số 13/2023/NĐ-CP v/v bảo vệ dữ liệu cá nhân được ban hành bởi Chính phủ.\nTrong quá trình thiết lập mối quan hệ giữa Vietstock và Khách hàng, Vietstock có thể thu thập và xử lý dữ liệu cá nhân của Khách hàng cho mục đích được xác định tại Chính sách quyền riêng tư (“CSQRT”) này. Trong trường hợp Khách hàng không đồng ý một phần hoặc toàn bộ quy định tại CSQRT, Vietstock không thể cung cấp sản phẩm và dịch vụ cho Khách hàng.\nVietstock cam kết luôn tôn trọng quyền riêng tư, bảo mật và an toàn thông tin cá nhân; đồng thời luôn nỗ lực bảo vệ dữ liệu cá nhân của Khách hàng, tuân thủ quy định pháp luật Việt Nam thông qua những biện pháp bảo vệ dữ liệu cá nhân đáp ứng và phù hợp với quy định pháp luật Việt Nam.\nChính sách quyền riêng tư là một phần không thể tách rời của các thỏa thuận, điều khoản và điều kiện chi phối mối quan hệ giữa Vietstock và Quý Khách hàng.\nQuý Khách hàng đã đọc kỹ, hiểu rõ và đồng ý với toàn bộ điều khoản của “Chính sách quyền riêng tư”. Chi tiết Chính sách quyền riêng tư xem tại đây.\nNếu không đồng ý với Chính sách quyền riêng tư này, Chúng tôi không thể cung cấp sản phẩm và dịch vụ cho Quý Khách hàng.\nTôi đã đọc kỹ, hiểu rõ và đồng ý với toàn bộ điều khoản của Chính sách quyền riêng tư\nĐồng ý\nTheo dấu dòng tiền cá mập 24/11: Dòng tiền tự doanh nỗ lực bám trụ khi khối ngoại xả ròng\nPhiên 24/11 chứng kiến khối ngoại tiếp tục bán ròng hơn 1.2 ngàn tỷ đồng, trong khi dòng tiền tự doanh công ty chứng khoán (CTCK) vẫn duy trì xu hướng mua ròng, tạo bức tranh thị trường trái chiều.\nCác ""cá mập"" nước ngoài lại vừa có phiên bán ròng mạnh, hơn 1.2 ngàn tỷ đồng. Tâm điểm là các cổ phiếu họ Vingroup, với VRE bị xả mạnh nhất, hơn 288 tỷ đồng, gần gấp đôi giá trị bán ra của VHM (151 tỷ đồng). STB và VIC cũng nằm trong nhóm bị bán ròng mạnh, mỗi cổ phiếu khoảng 120 tỷ đồng.\nTrong khi đó, dòng tiền ngoại vẫn săn tìm cơ hội ở nhóm công nghệ. FPT dẫn đầu lực mua với 158 tỷ đồng, nối dài chuỗi phiên gom ròng liên tục trong hàng chục phiên gần đây. VNM đứng ngay sau với 147 tỷ đồng, còn VPB được mua ròng 58 tỷ đồng.\nTính từ đầu tháng 11, khối ngoại đã gom ròng FPT hơn 1.78 ngàn tỷ đồng - dẫn đầu toàn sàn, trong khi HPG theo sát với gần 1.73 ngàn tỷ đồng. Ở chiều ngược lại, STB bị xả mạnh nhất với hơn 2 ngàn tỷ đồng. Tổng cộng, giá trị bán ròng của khối ngoại trong tháng 11 vượt 9 ngàn tỷ đồng.\nNhìn rộng hơn, từ đầu quý 4 đến nay, FPT đã được gom ròng gần 4 ngàn tỷ đồng. Mặt khác, MBB bị xả mạnh nhất với hơn 4.3 ngàn tỷ đồng, đẩy tổng giá trị bán ròng toàn quý lên hơn 32 ngàn tỷ đồng.\nKhối ngoại bán ròng hơn ngàn tỷ\nTop 10 cổ phiếu khối ngoại giao dịch ròng nhiều nhất phiên 24/11\nỞ chiều ngược lại, khối tự doanh tiếp tục duy trì đà mua ròng, đạt 380 tỷ đồng trên HOSE, ghi nhận phiên mua ròng thứ hai liên tiếp. HPG và VNM dẫn đầu lực gom với lần lượt 63 tỷ đồng và 62 tỷ đồng, MWG theo sau 43 tỷ đồng.\nTrong khi đó, CTCK bán ròng mạnh nhất là STB gần 32 tỷ đồng, tiếp theo là KBC và VRE với 11 tỷ và 10 tỷ đồng.\nTự doanh lại mua ròng mạnh\nTop 10 cổ phiếu tự doanh giao dịch ròng mạnh nhất trong phiên 24/11\nTử Kính\nFILI\n- 17:55 24/11/2025\ncá mập\ntheo dấu dòng tiền cá mập\ntự doanh\nkhối ngoại mua ròng\nbán ròng\ngiao dịch cổ phiếu\nMÃ CHỨNG KHOÁN LIÊN QUAN (11)\nFPT\n100,200\n-600\n-0.60%\nHPG\n27,100\n-300\n-1.09%\nKBC\n34,950\n50\n+0.14%\nMBB\n23,150\n-50\n-0.22%\nMWG\n79,300\n-700\n-0.88%\nSTB\n50,000\n-1,300\n-2.53%\nVHM\n102,700\n3,400\n+3.42%\nVIC\n239,500\n9,800\n+4.27%\nVNM\n63,000\n3,100\n+5.18%\nVPB\n29,000\n450\n+1.58%\nVRE\n34,450\n2,250\n+6.99%\nTIN TỨC MÃ CHỨNG KHOÁN\n1\nThị trường chứng quyền ngày 25/11/2025: Nhóm chứng quyền VRE bứt phá\n45 phút trước\n2\nAFIEX có gì trong tay trước khi lên sàn HOSE?\n1 giờ trước\n3\nPhân tích kỹ thuật phiên chiều 24/11: Test lại đường SMA 50 ngày\n24/11 13:02\n4\nCông ty bao bì Việt do người Thái nắm giữ xin hủy đại chúng và rời HOSE\n24/11 12:40\n5\n48 tấn sữa và nước uống của Vinamilk đến rốn lũ miền Trung và Tây Nguyên\n24/11 11:41\nTIN CÙNG CHUYÊN MỤC\nCỔ PHIẾU\n13 phút trước\nCổ phiếu thủy sản, thực phẩm có tuần hút tiền\nThanh khoản diễn biến trái chiều ở hai sàn HOSE và HNX trong tuần giao dịch 17 - 21/11. Dòng tiền vẫn đang duy trì xu hướng thận trọng. Tuần vừa qua, nhóm cổ phiếu...\nCỔ PHIẾU\n24/11 11:01\nAfiex rời UPCoM cuối tháng 11 để chuyển sang HOSE\nSở Giao dịch Chứng khoán Hà Nội (HNX) thông báo hủy giao dịch toàn bộ 35 triệu cp của CTCP Xuất nhập khẩu Nông sản Thực phẩm An Giang (Afiex, UPCoM: AFX) từ ngày...\nCỔ PHIẾU\n24/11 08:00\nTop cổ phiếu đáng chú ý đầu tuần 24/11\nDanh sách các mã cổ phiếu tăng và giảm mạnh nhất những phiên gần đây theo số liệu thống kê của Vietstock.\nCỔ PHIẾU\n24/11 06:02\n24/11: Đọc gì trước giờ giao dịch chứng khoán?\nCập nhật nhanh những diễn biến kinh tế, tài chính trong nước và thế giới những ngày cuối tuần trước khi thị trường mở cửa.\nCỔ PHIẾU\n22/11 20:30\nVIC dẫn dắt đà tăng, VN-Index có thêm gần 20 điểm trong tuần phân hóa\nVIC tiếp tục dẫn dắt với mức đóng góp vượt trội, cùng nhóm Vingroup là VHM và VPL củng cố đà tăng, giúp chỉ số VN-Index duy trì nhịp phục hồi trong tuần 17-21/11...\nCỔ PHIẾU\n22/11 08:00\nDNSE Future Tech Summit: Bước đệm cho kỷ nguyên giao dịch T+0 và thị trường “không độ trễ”\nChiều 21/11/2025, sự kiện công nghệ DNSE Future Tech Summit đã diễn ra tại TP. Hồ Chí Minh, quy tụ nhiều chuyên gia tài chính - công nghệ uy tín và trên 200 nhà đầu...\nCỔ PHIẾU\n21/11 22:32\nTheo dấu dòng tiền cá mập 21/11: Khối ngoại rút ròng VIX hơn 700 tỷ\nKhối ngoại quay lại bán ròng trong phiên 21/11 với tâm điểm là VIX, trái chiều với lực mua từ tự doanh các công ty chứng khoán (CTCK).\nCỔ PHIẾU\n21/11 13:02\nNhững dấu ấn của cổ phiếu thủy sản trong một năm thuế quan gây chao đảo\nGiữa một năm đầy biến động bởi chính sách thuế quan từ Mỹ, cổ phiếu thủy sản vẫn đang ghi những dấu ấn. 3/5 mã lớn của ngành vẫn giảm sâu trong khi ANV lại tìm thấy...\nCỔ PHIẾU\n21/11 10:32\nBầu Đức và “game” mới\nCổ phiếu HAG vừa đạt đỉnh 10 năm, bầu Đức tính chuyện niêm yết công ty con sau khi “cục máu đông” nợ tan được đôi phần.\nCỔ PHIẾU\n21/11 08:00\nTop cổ phiếu đáng chú ý đầu phiên 21/11\nDanh sách các mã cổ phiếu tăng và giảm mạnh nhất những phiên gần đây theo số liệu thống kê của Vietstock.\nXem thêm\nChỉ số thị trường\nTIN CHÍNH\nĐỌC NHIỀU NHẤT\n×\nBáo lỗi bài viết\nCám ơn bạn đã gửi báo lỗi bài viết.\nĐịa chỉ email\nHọ tên\nSố điện thoại\nNội dung\nGửi\nVietstock – Cổng thông tin tài chính và chứng khoán chính thức hoạt động từ ngày 02/08/2002, với định hướng trở thành người bạn đồng hành đáng tin cậy của nhà đầu tư. Ngay từ những ngày đầu, Vietstock đã không ngừng nỗ lực mang đến hệ thống thông tin và dữ liệu tài chính chính xác – cập nhật – đầy đủ, giúp nhà đầu tư hiểu đúng, nhìn rộng và tự tin đưa ra quyết định trong hành trình đầu tư của mình.\nTruyền Thông Tài Chính\nQuan hệ công chúng (PR)\nQuan hệ nhà đầu tư (IR)\nQuảng cáo banner\nBáo cáo phân tích\nDữ Liệu Tài Chính\nDataFeed\nVietstockXLS\nInvestOnline\nIROnline\nVietstockUpdater\nVietstockFinance\nSách tài chính\nPhân tích kỹ thuật từ A đến Z\nVai trò của Quan hệ Nhà đầu tư (IR) trong việc tối đa hóa giá trị doanh nghiệp\nVietstock\nQuảng cáo & Dịch vụ\n0908 169 898 - (028) 3848 7238\nkinhdoanh@vietstock.vn\nSáng tạo nội dung\n0938 046 488\ninfo@vietstock.vn\nVăn phòng giao dịch\n81/10B Hồ Văn Huê,\nPhường Đức Nhuận, Tp.HCM\nLớp học sắp khai giảng\n11/2025 Khóa học online - Phân tích Kỹ thuật Ứng dụng\nKhai giảng: 17/11/2025 |\nThời gian: Tối 2, 4, 6\n11/2025 Khóa học online - Đọc hiểu Báo cáo Tài chính\nKhai giảng: 25/11/2025 |\nThời gian: Tối 3, 5\n12/2025 Khóa học Online - Bắt đáy và Chốt lời Cổ phiếu\nKhai giảng: 13/12/2025 |\nThời gian: Thứ 7\n12/2025 Khóa học online - Phân tích Ngành và Dòng tiền Thị trường\nKhai giảng: 15/12/2025 |\nThời gian: Tối 2, 4, 6\n11/2025 Khóa học online - Phân tích Kỹ thuật Nâng cao\nKhai giảng: 03/11/2025 |\nThời gian: Tối 2, 4, 6\nSách tài chính\nPhân tích kỹ thuật từ A đến Z\nVai trò của Quan hệ Nhà đầu tư (IR) trong việc tối đa hóa giá trị doanh nghiệp\nVietstock\nVietstock\nVận hành bởi CTCP Tài Việt.\nTrụ sở: 28/47 Lê Thị Hồng, P.Gò Vấp, Tp.HCM\nTel: (84.28) 3848 7238 - Fax: (84.28) 3848 7237\nGiấy phép số 48/GP-STTTT ngày 04/11/2016\nQuyết định số 13/QĐ-STTTT ngày 02/11/2017\nQuyết định số 06/QĐ-STTTT-ICP ngày 20/07/2023\nĐược cấp bởi Sở Thông tin và Truyền thông TPHCM\nNgười chịu trách nhiệm\nBÀ PHẠM THỊ THANH NGA\nQuảng cáo & Dịch vụ\n0908 169 898 - (028) 3848 7238\nkinhdoanh@vietstock.vn\nSáng tạo nội dung\n0938 046 488\ninfo@vietstock.vn\nVăn phòng giao dịch\n81/10B Hồ Văn Huê,\nPhường Đức Nhuận, TPHCM\nSách tài chính\nPhân tích kỹ thuật từ A đến Z\nVai trò của Quan hệ Nhà đầu tư (IR) trong việc tối đa hóa giá trị doanh nghiệp\nVietstock\nVận hành bởi CTCP Tài Việt.\nTrụ sở: 28/47 Lê Thị Hồng, P.Gò Vấp, Tp.HCM\nTel: (84.28) 3848 7238 - Fax: (84.28) 3848 7237\nGiấy phép số 48/GP-STTTT ngày 04/11/2016\nQuyết định số 13/QĐ-STTTT ngày 02/11/2017\nQuyết định số 06/QĐ-STTTT-ICP ngày 20/07/2023\nĐược cấp bởi Sở Thông tin và Truyền thông TPHCM\nNgười chịu trách nhiệm\nBÀ PHẠM THỊ THANH NGA\n© Bản quyền thuộc về Vietstock\nSitemap\nVề chúng tôi\nChính sách quyền riêng tư\nQuảng cáo & Dịch vụ\n© Bản quyền thuộc về Vietstock\nHotline: 0908 16 98 98\nTất cả\nGiờ qua\n24 giờ qua\nTuần qua\nTháng qua\nNăm qua\nTất cả\nTính năng\nNgành\nMã chứng khoán\nLãnh đạo\nTin tức\nBáo cáo phân tích\nThuật ngữ\nDịch vụ\nTính năng (-)\nVietstock\nChứng khoán\nCổ phiếu\nGiao dịch nội bộ\nNiêm yết\nETF và các quỹ\nChứng khoán phái sinh\nChứng quyền\nÝ kiến chuyên gia\nCâu chuyện đầu tư\nChính sách\nTrái phiếu\nDoanh nghiệp\nHoạt động kinh doanh\nCổ tức\nTăng vốn - M&A\nIPO - Cổ phần hóa\nChứng khoán phái sinh\nNhân vật\nTrái phiếu doanh nghiệp\nBất động sản\nThị trường nhà đất\nQuy hoạch - Hạ tầng\nDự án\nBảo hiểm và thuế nhà đất\nTài chính\nNgân hàng\nBảo hiểm\nThuế và Ngân sách\nHàng hóa\nVàng và kim loại quý\nNhiên liệu\nKim loại\nNông sản thực phẩm\nKinh tế\nVĩ mô\nDữ liệu vĩ mô\nGDP\nCPI\nIIP\nBán lẻ\nXuất nhập khẩu\nFDI\nTín dụng\nThị trường mở\nTỷ giá - Lãi suất\nDân số và Lao động\nKinh tế - Đầu tư\nThế giới\nChứng khoán thế giới\nTiền kỹ thuật số\nTài chính quốc tế\nKinh tế - Đầu tư\nĐông dương\nVĩ mô\nTài chính - Ngân hàng\nThị trường chứng khoán\nKinh tế - Đầu tư\nTài chính cá nhân\nLàm chủ đồng tiền\nĐầu tư - Kinh doanh nhỏ\nDoanh nhân và khởi nghiệp\nChơi sang\nXe - Công nghệ\nTiêu dùng và lối sống\nVì cộng đồng\nPhân tích\nNhận định thị thường\nPhân tích cơ bản\nPhân tích kỹ thuật\nVietstockFinance\nVĩ mô\nDữ liệu vĩ mô\nGDP\nCPI\nIIP\nBán lẻ\nXuất nhập khẩu\nFDI\nTín dụng\nThị trường mở\nTỷ giá - Lãi suất\nDân số và Lao động\nNgành\nDữ liệu ngành\nNgành chi tiết\nDoanh nghiệp\nDoanh nghiệp A-Z\nHồ sơ lãnh đạo\nLịch sự kiện\nNiêm yết\nCổ tức và phát hành thêm\nĐại hội đồng cổ đông\nCập nhật lãi lỗ\nGiao dịch nội bộ\nCổ đông nội bộ\nNgười liên quan\nCổ đông lớn\nCổ phiếu quỹ\nTài liệu cổ đông\nBáo cáo tài chính\nGiải trình KQKD\nBáo cáo quản trị\nBáo cáo thường niên\nNghị quyết ĐHĐCĐ\nTài liệu ĐHĐCĐ\nNiên giám\nCổ phiếu\nThị trường cổ phiếu\nBản đồ thị trường\nTổng hợp thị trường\nThanh khoản\nĐịnh giá\nNước ngoài\nTự doanh\nTop cổ phiếu\nBản đồ ngành\nThống kê giao dịch\nGiá\nĐặt lệnh\nNước ngoài\nTự doanh\nẢnh hưởng chỉ số\nBiến động cổ phiếu\nGiao dịch nội bộ\nTrạng thái cổ phiếu\nQuy mô thị trường\nNiêm yết\nNiêm yết mới\nNiêm yết bổ sung\nHủy niêm yết\nTheo dõi đặc biệt\nKhông được ký quỹ\nETF\nCổ phiếu chi tiết\nTổng quan\nGiao dịch\nTài chính\nPhân tích kỹ thuật\nHồ sơ doanh nghiệp\nTin tức sự kiện\nTài liệu\nTâm lý thị trường\nPhái sinh\nHợp đồng tương lai\nTổng quan\nThống kê giao dịch\nKiến thức / Qui định\nChứng quyền\nTổng quan\nThống kê giao dịch\nBlackScholes\nTrái phiếu\nTổng quan\nTổ chức phát hành\nTrái phiếu A-Z\nThống kê giao dịch\nTin tức\nCông cụ đầu tư\nBản đồ thị trường\nSức mạnh giá RRG\nPhân tích kỹ thuật\nBảng giá trực tuyến\nBộ lọc cổ phiếu\nSo sánh cổ phiếu\nBáo cáo phân tích\nNghiên cứu - Phân tích\nVĩ mô - Chiến lược thị trường\nPhân tích ngành\nPhân tích doanh nghiệp\nTài liệu tham khảo\nBiểu đồ tài chính\nTruy xuất dữ liệu\nTổng hợp doanh nghiệp\nBáo cáo tài chính\nBáo cáo tài chính ngành\nVĩ mô\nNgành (-)\nVS-Sector\nNăng lượng\nNăng lượng\n-\xa0 Thiết bị và dịch vụ năng lượng\n-\xa0 Dầu khí\nNguyên vật liệu\nNguyên vật liệu\n-\xa0 Hóa chất\n-\xa0 Vật liệu xây dựng\n-\xa0 Bao bì và vật chứa\n-\xa0 Khai khoáng và luyện kim\n-\xa0 Gỗ và giấy\nCông nghiệp\nHàng hóa công nghiệp\n-\xa0 Thiết bị hàng không vũ trụ và quốc phòng\n-\xa0 Sản phẩm xây dựng\n-\xa0 Kỹ thuật xây dựng\n-\xa0 Thiết bị điện\n-\xa0 Tập đoàn đa ngành\n-\xa0 Máy móc công nghiệp\n-\xa0 Phân phối hàng công nghiệp\nDịch vụ thương mại và chuyên nghiệp\n-\xa0 Dịch vụ và thiết bị thương mại\n-\xa0 Dịch vụ chuyên nghiệp\nVận tải\n-\xa0 Vận tải và logistics hàng không\n-\xa0 Hãng hàng không chở khách\n-\xa0 Vận tải biển\n-\xa0 Vận tải mặt đất\n-\xa0 Hạ tầng giao thông\nTiêu dùng không thiết yếu\nXe và linh kiện\n-\xa0 Linh kiện xe\n-\xa0 Xe\nThời trang và hàng lâu bền\n-\xa0 Hàng tiêu dùng lâu bền\n-\xa0 Sản phẩm giải trí\n-\xa0 Thời trang và dệt may\nDịch vụ tiêu dùng\n-\xa0 Khách sạn, nhà hàng và giải trí\n-\xa0 Dịch vụ tiêu dùng khác\nThương mại hàng không thiết yếu\n-\xa0 Nhà phân phối\n-\xa0 Bán lẻ đa dạng\n-\xa0 Bán lẻ chuyên doanh\nTiêu dùng thiết yếu\nThương mại hàng thiết yếu\n-\xa0 Thương mại hàng thiết yếu\nThực phẩm, đồ uống và thuốc lá\n-\xa0 Đồ uống\n-\xa0 Thực phẩm\n-\xa0 Thuốc lá\nSản phẩm chăm sóc cá nhân và gia đình\n-\xa0 Sản phẩm chăm sóc gia đình\n-\xa0 Sản phẩm chăm sóc cá nhân\nChăm sóc sức khỏe\nThiết bị và dịch vụ chăm sóc sức khỏe\n-\xa0 Thiết bị và vật tư chăm sóc sức khỏe\n-\xa0 Thương mại và dịch vụ chăm sóc sức khỏe\n-\xa0 Công nghệ chăm sóc sức khỏe\nDược phẩm, công nghệ sinh học và khoa học sự sống\n-\xa0 Công nghệ sinh học\n-\xa0 Dược phẩm\n-\xa0 Công cụ và dịch vụ khoa học sự sống\nTài chính\nTổ chức tín dụng\n-\xa0 Ngân hàng\n-\xa0 Tín dụng phi ngân hàng\n-\xa0 Tín dụng khác\nDịch vụ tài chính\n-\xa0 Dịch vụ tài chính\n-\xa0 Thị trường vốn\n-\xa0 REIT thế chấp\nBảo hiểm\n-\xa0 Bảo hiểm\nCông nghệ thông tin\nPhần mềm và dịch vụ\n-\xa0 Dịch vụ CNTT\n-\xa0 Phần mềm\nPhần cứng và thiết bị\n-\xa0 Thiết bị viễn thông\n-\xa0 Phần cứng, bộ lưu trữ và thiết bị ngoại vi\n-\xa0 Điện tử\nBán dẫn\n-\xa0 Bán dẫn\nDịch vụ truyền thông\nDịch vụ viễn thông\n-\xa0 Dịch vụ viễn thông đa dạng\n-\xa0 Dịch vụ viễn thông không dây\nTruyền thông và giải trí\n-\xa0 Truyền thông\n-\xa0 Giải trí\n-\xa0 Truyền thông tương tác\nTiện ích\nTiện ích\n-\xa0 Điện\n-\xa0 Gas sinh hoạt\n-\xa0 Tiện tích tổng hợp\n-\xa0 Nước\n-\xa0 Phát điện độc lập và điện tái tạo\nBất động sản\nQuỹ REITs\n-\xa0 REITs bất động sản đa dạng\n-\xa0 REITs khu công nghiệp\n-\xa0 REITs khách sạn và khu nghỉ dưỡng\n-\xa0 REITs văn phòng\n-\xa0 REITs bất động sản y tế\n-\xa0 REITs nhà ở\n-\xa0 REITs bán lẻ\n-\xa0 REITs chuyên biệt\nBất động sản\n-\xa0 Quản lý và phát triển bất động sản\n-\xa0 Bất động sản đa dạng\n-\xa0 Dịch vụ bất động sản\nMã chứng khoán (-)\nTất cả\nCổ phiếu\nChỉ số\nChứng chỉ quỹ\nChứng quyền\nHợp đồng tương lai\nTrái phiếu\nXem thêm\nLãnh đạo (-)\nTất cả\nNgười nội bộ\nNgười liên quan\nCổ đông lớn\nXem thêm\nTin tức (-)\nXem thêm\nBài viết của tác giả (-)\nXem thêm\nBáo cáo phân tích (-)\nXem thêm\nThuật ngữ (-)\nXem thêm\nDịch vụ (-)\nĐào tạo\nKhóa học online - Phân tích Kỹ thuật Ứng dụng\nKhai giảng: 17/11/2025 |\nThời gian: Tối 2, 4, 6 |\nSố buổi: 7 |\nHọc phí: 3,825,000 đ\nKhóa học online - Đọc hiểu Báo cáo Tài chính\nKhai giảng: 25/11/2025 |\nThời gian: Tối 3, 5 |\nSố buổi: 3 |\nHọc phí: 1,530,000 đ\nKhóa học Online - Bắt đáy và Chốt lời Cổ phiếu\nKhai giảng: 13/12/2025 |\nThời gian: Thứ 7 |\nSố buổi: 3 |\nHọc phí: 1,870,000 đ\nKhóa học online - Phân tích Ngành và Dòng tiền Thị trường\nKhai giảng: 15/12/2025 |\nThời gian: Tối 2, 4, 6 |\nSố buổi: 6 |\nHọc phí: 3,570,000 đ\nKhóa học online - Phân tích Kỹ thuật Nâng cao\nKhai giảng: 03/11/2025 |\nThời gian: Tối 2, 4, 6 |\nSố buổi: 5 |\nHọc phí: 3,825,000 đ\nKhóa học online - Chứng khoán Cơ bản\nKhai giảng: 04/11/2025 |\nThời gian: Tối 3, 5 |\nSố buổi: 4 |\nHọc phí: 1,530,000 đ\nKhóa học online - Phân tích và Định giá Cổ phiếu\nKhai giảng: 21/10/2025 |\nThời gian: Tối 3, 5 |\nSố buổi: 4 |\nHọc phí: 1,870,000 đ\nKhóa học - Phân tích Kỹ thuật Ứng dụng - tại Tp. HCM\nKhai giảng: |\nThời gian: Tối 2, 4, 6 |\nSố buổi: 7 |\nHọc phí: 5,500,000 đ\nKhóa học online - Lướt sóng cổ phiếu nóng\nKhai giảng: 23/08/2025 |\nThời gian: Thứ 7 |\nSố buổi: 2 |\nHọc phí: 849,000 đ\nĐào tạo Phân tích và Đầu tư Chứng khoán IN - HOUSE\nKhai giảng: |\nThời gian: |\nSố buổi: 8 |\nHọc phí: 0 đ\nSách tài chính\nPhân tích kỹ thuật từ A đến Z\nVai trò của Quan hệ Nhà đầu tư (IR) trong việc Tối đa hóa Giá trị Doanh nghiệp\nCông cụ đầu tư\nVietstockUpdater\nVietstockFinance\nInvestOnline\nIROnline\nVietstockXLS\nTruyền thông tài chính\nBanner Ads\nOnline PR\nQuan hệ nhà đầu tư\nBáo cáo phân tích\nDữ liệu tài chính\nDataFeed - Dữ liệu tài chính tích hợp chuyên nghiệp\nVietstockXLS - Dữ liệu Kinh tế Tài chính Chứng khoán theo yêu cầu\nInvestOnline - Giải pháp website tra cứu chứng khoán toàn diện\nIROnline - Giải pháp thuê ngoài website IR, website quan hệ cổ đông\nThông báo\nVietstock trân trọng thông báo đến Quý Khách hàng về việc áp dụng “Chính sách quyền riêng tư” căn cứ theo Nghị định số 13/2023/NĐ-CP v/v bảo vệ dữ liệu cá nhân được ban hành bởi Chính phủ.\nTrong quá trình thiết lập mối quan hệ giữa Vietstock và Khách hàng, Vietstock có thể thu thập và xử lý dữ liệu cá nhân của Khách hàng cho mục đích được xác định tại Chính sách quyền riêng tư (“CSQRT”) này. Trong trường hợp Khách hàng không đồng ý một phần hoặc toàn bộ quy định tại CSQRT, Vietstock không thể cung cấp sản phẩm và dịch vụ cho Khách hàng.\nVietstock cam kết luôn tôn trọng quyền riêng tư, bảo mật và an toàn thông tin cá nhân; đồng thời luôn nỗ lực bảo vệ dữ liệu cá nhân của Khách hàng, tuân thủ quy định pháp luật Việt Nam thông qua những biện pháp bảo vệ dữ liệu cá nhân đáp ứng và phù hợp với quy định pháp luật Việt Nam.\nChính sách quyền riêng tư là một phần không thể tách rời của các thỏa thuận, điều khoản và điều kiện chi phối mối quan hệ giữa Vietstock và Quý Khách hàng.\nQuý Khách hàng đã đọc kỹ, hiểu rõ và đồng ý với toàn bộ điều khoản của “Chính sách quyền riêng tư”. Chi tiết Chính sách quyền riêng tư xem tại đây.\nNếu không đồng ý với Chính sách quyền riêng tư này, Chúng tôi không thể cung cấp sản phẩm và dịch vụ cho Quý Khách hàng.\nTôi đã đọc kỹ, hiểu rõ và đồng ý với toàn bộ điều khoản của Chính sách quyền riêng tư\nĐồng ý\nTheo dấu dòng tiền cá mập 24/11: Dòng tiền tự doanh nỗ lực bám trụ khi khối ngoại xả ròng\nPhiên 24/11 chứng kiến khối ngoại tiếp tục bán ròng hơn 1.2 ngàn tỷ đồng, trong khi dòng tiền tự doanh công ty chứng khoán (CTCK) vẫn duy trì xu hướng mua ròng, tạo bức tranh thị trường trái chiều.\nCác ""cá mập"" nước ngoài lại vừa có phiên bán ròng mạnh, hơn 1.2 ngàn tỷ đồng. Tâm điểm là các cổ phiếu họ Vingroup, với VRE bị xả mạnh nhất, hơn 288 tỷ đồng, gần gấp đôi giá trị bán ra của VHM (151 tỷ đồng). STB và VIC cũng nằm trong nhóm bị bán ròng mạnh, mỗi cổ phiếu khoảng 120 tỷ đồng.\nTrong khi đó, dòng tiền ngoại vẫn săn tìm cơ hội ở nhóm công nghệ. FPT dẫn đầu lực mua với 158 tỷ đồng, nối dài chuỗi phiên gom ròng liên tục trong hàng chục phiên gần đây. VNM đứng ngay sau với 147 tỷ đồng, còn VPB được mua ròng 58 tỷ đồng.\nTính từ đầu tháng 11, khối ngoại đã gom ròng FPT hơn 1.78 ngàn tỷ đồng - dẫn đầu toàn sàn, trong khi HPG theo sát với gần 1.73 ngàn tỷ đồng. Ở chiều ngược lại, STB bị xả mạnh nhất với hơn 2 ngàn tỷ đồng. Tổng cộng, giá trị bán ròng của khối ngoại trong tháng 11 vượt 9 ngàn tỷ đồng.\nNhìn rộng hơn, từ đầu quý 4 đến nay, FPT đã được gom ròng gần 4 ngàn tỷ đồng. Mặt khác, MBB bị xả mạnh nhất với hơn 4.3 ngàn tỷ đồng, đẩy tổng giá trị bán ròng toàn quý lên hơn 32 ngàn tỷ đồng.\nKhối ngoại bán ròng hơn ngàn tỷ\nTop 10 cổ phiếu khối ngoại giao dịch ròng nhiều nhất phiên 24/11\nỞ chiều ngược lại, khối tự doanh tiếp tục duy trì đà mua ròng, đạt 380 tỷ đồng trên HOSE, ghi nhận phiên mua ròng thứ hai liên tiếp. HPG và VNM dẫn đầu lực gom với lần lượt 63 tỷ đồng và 62 tỷ đồng, MWG theo sau 43 tỷ đồng.\nTrong khi đó, CTCK bán ròng mạnh nhất là STB gần 32 tỷ đồng, tiếp theo là KBC và VRE với 11 tỷ và 10 tỷ đồng.\nTự doanh lại mua ròng mạnh\nTop 10 cổ phiếu tự doanh giao dịch ròng mạnh nhất trong phiên 24/11\nTử Kính\nFILI\n- 17:55 24/11/2025\ncá mập\ntheo dấu dòng tiền cá mập\ntự doanh\nkhối ngoại mua ròng\nbán ròng\ngiao dịch cổ phiếu\nMÃ CHỨNG KHOÁN LIÊN QUAN (11)\nFPT\n100,200\n-600\n-0.60%\nHPG\n27,100\n-300\n-1.09%\nKBC\n34,950\n50\n+0.14%\nMBB\n23,150\n-50\n-0.22%\nMWG\n79,300\n-700\n-0.88%\nSTB\n50,000\n-1,300\n-2.53%\nVHM\n102,700\n3,400\n+3.42%\nVIC\n239,500\n9,800\n+4.27%\nVNM\n63,000\n3,100\n+5.18%\nVPB\n29,000\n450\n+1.58%\nVRE\n34,450\n2,250\n+6.99%\nTIN TỨC MÃ CHỨNG KHOÁN\n1\nThị trường chứng quyền ngày 25/11/2025: Nhóm chứng quyền VRE bứt phá\n45 phút trước\n2\nAFIEX có gì trong tay trước khi lên sàn HOSE?\n1 giờ trước\n3\nPhân tích kỹ thuật phiên chiều 24/11: Test lại đường SMA 50 ngày\n24/11 13:02\n4\nCông ty bao bì Việt do người Thái nắm giữ xin hủy đại chúng và rời HOSE\n24/11 12:40\n5\n48 tấn sữa và nước uống của Vinamilk đến rốn lũ miền Trung và Tây Nguyên\n24/11 11:41\nTIN CÙNG CHUYÊN MỤC\nCỔ PHIẾU\n13 phút trước\nCổ phiếu thủy sản, thực phẩm có tuần hút tiền\nThanh khoản diễn biến trái chiều ở hai sàn HOSE và HNX trong tuần giao dịch 17 - 21/11. Dòng tiền vẫn đang duy trì xu hướng thận trọng. Tuần vừa qua, nhóm cổ phiếu...\nCỔ PHIẾU\n24/11 11:01\nAfiex rời UPCoM cuối tháng 11 để chuyển sang HOSE\nSở Giao dịch Chứng khoán Hà Nội (HNX) thông báo hủy giao dịch toàn bộ 35 triệu cp của CTCP Xuất nhập khẩu Nông sản Thực phẩm An Giang (Afiex, UPCoM: AFX) từ ngày...\nCỔ PHIẾU\n24/11 08:00\nTop cổ phiếu đáng chú ý đầu tuần 24/11\nDanh sách các mã cổ phiếu tăng và giảm mạnh nhất những phiên gần đây theo số liệu thống kê của Vietstock.\nCỔ PHIẾU\n24/11 06:02\n24/11: Đọc gì trước giờ giao dịch chứng khoán?\nCập nhật nhanh những diễn biến kinh tế, tài chính trong nước và thế giới những ngày cuối tuần trước khi thị trường mở cửa.\nCỔ PHIẾU\n22/11 20:30\nVIC dẫn dắt đà tăng, VN-Index có thêm gần 20 điểm trong tuần phân hóa\nVIC tiếp tục dẫn dắt với mức đóng góp vượt trội, cùng nhóm Vingroup là VHM và VPL củng cố đà tăng, giúp chỉ số VN-Index duy trì nhịp phục hồi trong tuần 17-21/11...\nCỔ PHIẾU\n22/11 08:00\nDNSE Future Tech Summit: Bước đệm cho kỷ nguyên giao dịch T+0 và thị trường “không độ trễ”\nChiều 21/11/2025, sự kiện công nghệ DNSE Future Tech Summit đã diễn ra tại TP. Hồ Chí Minh, quy tụ nhiều chuyên gia tài chính - công nghệ uy tín và trên 200 nhà đầu...\nCỔ PHIẾU\n21/11 22:32\nTheo dấu dòng tiền cá mập 21/11: Khối ngoại rút ròng VIX hơn 700 tỷ\nKhối ngoại quay lại bán ròng trong phiên 21/11 với tâm điểm là VIX, trái chiều với lực mua từ tự doanh các công ty chứng khoán (CTCK).\nCỔ PHIẾU\n21/11 13:02\nNhững dấu ấn của cổ phiếu thủy sản trong một năm thuế quan gây chao đảo\nGiữa một năm đầy biến động bởi chính sách thuế quan từ Mỹ, cổ phiếu thủy sản vẫn đang ghi những dấu ấn. 3/5 mã lớn của ngành vẫn giảm sâu trong khi ANV lại tìm thấy...\nCỔ PHIẾU\n21/11 10:32\nBầu Đức và “game” mới\nCổ phiếu HAG vừa đạt đỉnh 10 năm, bầu Đức tính chuyện niêm yết công ty con sau khi “cục máu đông” nợ tan được đôi phần.\nCỔ PHIẾU\n21/11 08:00\nTop cổ phiếu đáng chú ý đầu phiên 21/11\nDanh sách các mã cổ phiếu tăng và giảm mạnh nhất những phiên gần đây theo số liệu thống kê của Vietstock.\nXem thêm\nChỉ số thị trường\nTIN CHÍNH\nĐỌC NHIỀU NHẤT\n×\nBáo lỗi bài viết\nCám ơn bạn đã gửi báo lỗi bài viết.\nĐịa chỉ email\nHọ tên\nSố điện thoại\nNội dung\nGửi\nVietstock – Cổng thông tin tài chính và chứng khoán chính thức hoạt động từ ngày 02/08/2002, với định hướng trở thành người bạn đồng hành đáng tin cậy của nhà đầu tư. Ngay từ những ngày đầu, Vietstock đã không ngừng nỗ lực mang đến hệ thống thông tin và dữ liệu tài chính chính xác – cập nhật – đầy đủ, giúp nhà đầu tư hiểu đúng, nhìn rộng và tự tin đưa ra quyết định trong hành trình đầu tư của mình.\nTruyền Thông Tài Chính\nQuan hệ công chúng (PR)\nQuan hệ nhà đầu tư (IR)\nQuảng cáo banner\nBáo cáo phân tích\nDữ Liệu Tài Chính\nDataFeed\nVietstockXLS\nInvestOnline\nIROnline\nVietstockUpdater\nVietstockFinance\nSách tài chính\nPhân tích kỹ thuật từ A đến Z\nVai trò của Quan hệ Nhà đầu tư (IR) trong việc tối đa hóa giá trị doanh nghiệp\nVietstock\nQuảng cáo & Dịch vụ\n0908 169 898 - (028) 3848 7238\nkinhdoanh@vietstock.vn\nSáng tạo nội dung\n0938 046 488\ninfo@vietstock.vn\nVăn phòng giao dịch\n81/10B Hồ Văn Huê,\nPhường Đức Nhuận, Tp.HCM\nSách tài chính\nPhân tích kỹ thuật từ A đến Z\nVai trò của Quan hệ Nhà đầu tư (IR) trong việc tối đa hóa giá trị doanh nghiệp\nVietstock\nVận hành bởi CTCP Tài Việt.\nTrụ sở: 28/47 Lê Thị Hồng, P.Gò Vấp, Tp.HCM\nTel: (84.28) 3848 7238 - Fax: (84.28) 3848 7237\nGiấy phép số 48/GP-STTTT ngày 04/11/2016\nQuyết định số 13/QĐ-STTTT ngày 02/11/2017\nQuyết định số 06/QĐ-STTTT-ICP ngày 20/07/2023\nĐược cấp bởi Sở Thông tin và Truyền thông TPHCM\nNgười chịu trách nhiệm\nBÀ PHẠM THỊ THANH NGA\n© Bản quyền thuộc về Vietstock\nSitemap\nVề chúng tôi\nChính sách quyền riêng tư\nQuảng cáo & Dịch vụ\n© Bản quyền thuộc về Vietstock\nHotline: 0908 16 98 98\nTất cả\nGiờ qua\n24 giờ qua\nTuần qua\nTháng qua\nNăm qua\nTất cả\nTính năng\nNgành\nMã chứng khoán\nLãnh đạo\nTin tức\nBáo cáo phân tích\nThuật ngữ\nDịch vụ\nTính năng (-)\nVietstock\nChứng khoán\nCổ phiếu\nGiao dịch nội bộ\nNiêm yết\nETF và các quỹ\nChứng khoán phái sinh\nChứng quyền\nÝ kiến chuyên gia\nCâu chuyện đầu tư\nChính sách\nTrái phiếu\nDoanh nghiệp\nHoạt động kinh doanh\nCổ tức\nTăng vốn - M&A\nIPO - Cổ phần hóa\nChứng khoán phái sinh\nNhân vật\nTrái phiếu doanh nghiệp\nBất động sản\nThị trường nhà đất\nQuy hoạch - Hạ tầng\nDự án\nBảo hiểm và thuế nhà đất\nTài chính\nNgân hàng\nBảo hiểm\nThuế và Ngân sách\nHàng hóa\nVàng và kim loại quý\nNhiên liệu\nKim loại\nNông sản thực phẩm\nKinh tế\nVĩ mô\nDữ liệu vĩ mô\nGDP\nCPI\nIIP\nBán lẻ\nXuất nhập khẩu\nFDI\nTín dụng\nThị trường mở\nTỷ giá - Lãi suất\nDân số và Lao động\nKinh tế - Đầu tư\nThế giới\nChứng khoán thế giới\nTiền kỹ thuật số\nTài chính quốc tế\nKinh tế - Đầu tư\nĐông dương\nVĩ mô\nTài chính - Ngân hàng\nThị trường chứng khoán\nKinh tế - Đầu tư\nTài chính cá nhân\nLàm chủ đồng tiền\nĐầu tư - Kinh doanh nhỏ\nDoanh nhân và khởi nghiệp\nChơi sang\nXe - Công nghệ\nTiêu dùng và lối sống\nVì cộng đồng\nPhân tích\nNhận định thị thường\nPhân tích cơ bản\nPhân tích kỹ thuật\nVietstockFinance\nVĩ mô\nDữ liệu vĩ mô\nGDP\nCPI\nIIP\nBán lẻ\nXuất nhập khẩu\nFDI\nTín dụng\nThị trường mở\nTỷ giá - Lãi suất\nDân số và Lao động\nNgành\nDữ liệu ngành\nNgành chi tiết\nDoanh nghiệp\nDoanh nghiệp A-Z\nHồ sơ lãnh đạo\nLịch sự kiện\nNiêm yết\nCổ tức và phát hành thêm\nĐại hội đồng cổ đông\nCập nhật lãi lỗ\nGiao dịch nội bộ\nCổ đông nội bộ\nNgười liên quan\nCổ đông lớn\nCổ phiếu quỹ\nTài liệu cổ đông\nBáo cáo tài chính\nGiải trình KQKD\nBáo cáo quản trị\nBáo cáo thường niên\nNghị quyết ĐHĐCĐ\nTài liệu ĐHĐCĐ\nNiên giám\nCổ phiếu\nThị trường cổ phiếu\nBản đồ thị trường\nTổng hợp thị trường\nThanh khoản\nĐịnh giá\nNước ngoài\nTự doanh\nTop cổ phiếu\nBản đồ ngành\nThống kê giao dịch\nGiá\nĐặt lệnh\nNước ngoài\nTự doanh\nẢnh hưởng chỉ số\nBiến động cổ phiếu\nGiao dịch nội bộ\nTrạng thái cổ phiếu\nQuy mô thị trường\nNiêm yết\nNiêm yết mới\nNiêm yết bổ sung\nHủy niêm yết\nTheo dõi đặc biệt\nKhông được ký quỹ\nETF\nCổ phiếu chi tiết\nTổng quan\nGiao dịch\nTài chính\nPhân tích kỹ thuật\nHồ sơ doanh nghiệp\nTin tức sự kiện\nTài liệu\nTâm lý thị trường\nPhái sinh\nHợp đồng tương lai\nTổng quan\nThống kê giao dịch\nKiến thức / Qui định\nChứng quyền\nTổng quan\nThống kê giao dịch\nBlackScholes\nTrái phiếu\nTổng quan\nTổ chức phát hành\nTrái phiếu A-Z\nThống kê giao dịch\nTin tức\nCông cụ đầu tư\nBản đồ thị trường\nSức mạnh giá RRG\nPhân tích kỹ thuật\nBảng giá trực tuyến\nBộ lọc cổ phiếu\nSo sánh cổ phiếu\nBáo cáo phân tích\nNghiên cứu - Phân tích\nVĩ mô - Chiến lược thị trường\nPhân tích ngành\nPhân tích doanh nghiệp\nTài liệu tham khảo\nBiểu đồ tài chính\nTruy xuất dữ liệu\nTổng hợp doanh nghiệp\nBáo cáo tài chính\nBáo cáo tài chính ngành\nVĩ mô\nNgành (-)\nVS-Sector\nNăng lượng\nNăng lượng\n-\xa0 Thiết bị và dịch vụ năng lượng\n-\xa0 Dầu khí\nNguyên vật liệu\nNguyên vật liệu\n-\xa0 Hóa chất\n-\xa0 Vật liệu xây dựng\n-\xa0 Bao bì và vật chứa\n-\xa0 Khai khoáng và luyện kim\n-\xa0 Gỗ và giấy\nCông nghiệp\nHàng hóa công nghiệp\n-\xa0 Thiết bị hàng không vũ trụ và quốc phòng\n-\xa0 Sản phẩm xây dựng\n-\xa0 Kỹ thuật xây dựng\n-\xa0 Thiết bị điện\n-\xa0 Tập đoàn đa ngành\n-\xa0 Máy móc công nghiệp\n-\xa0 Phân phối hàng công nghiệp\nDịch vụ thương mại và chuyên nghiệp\n-\xa0 Dịch vụ và thiết bị thương mại\n-\xa0 Dịch vụ chuyên nghiệp\nVận tải\n-\xa0 Vận tải và logistics hàng không\n-\xa0 Hãng hàng không chở khách\n-\xa0 Vận tải biển\n-\xa0 Vận tải mặt đất\n-\xa0 Hạ tầng giao thông\nTiêu dùng không thiết yếu\nXe và linh kiện\n-\xa0 Linh kiện xe\n-\xa0 Xe\nThời trang và hàng lâu bền\n-\xa0 Hàng tiêu dùng lâu bền\n-\xa0 Sản phẩm giải trí\n-\xa0 Thời trang và dệt may\nDịch vụ tiêu dùng\n-\xa0 Khách sạn, nhà hàng và giải trí\n-\xa0 Dịch vụ tiêu dùng khác\nThương mại hàng không thiết yếu\n-\xa0 Nhà phân phối\n-\xa0 Bán lẻ đa dạng\n-\xa0 Bán lẻ chuyên doanh\nTiêu dùng thiết yếu\nThương mại hàng thiết yếu\n-\xa0 Thương mại hàng thiết yếu\nThực phẩm, đồ uống và thuốc lá\n-\xa0 Đồ uống\n-\xa0 Thực phẩm\n-\xa0 Thuốc lá\nSản phẩm chăm sóc cá nhân và gia đình\n-\xa0 Sản phẩm chăm sóc gia đình\n-\xa0 Sản phẩm chăm sóc cá nhân\nChăm sóc sức khỏe\nThiết bị và dịch vụ chăm sóc sức khỏe\n-\xa0 Thiết bị và vật tư chăm sóc sức khỏe\n-\xa0 Thương mại và dịch vụ chăm sóc sức khỏe\n-\xa0 Công nghệ chăm sóc sức khỏe\nDược phẩm, công nghệ sinh học và khoa học sự sống\n-\xa0 Công nghệ sinh học\n-\xa0 Dược phẩm\n-\xa0 Công cụ và dịch vụ khoa học sự sống\nTài chính\nTổ chức tín dụng\n-\xa0 Ngân hàng\n-\xa0 Tín dụng phi ngân hàng\n-\xa0 Tín dụng khác\nDịch vụ tài chính\n-\xa0 Dịch vụ tài chính\n-\xa0 Thị trường vốn\n-\xa0 REIT thế chấp\nBảo hiểm\n-\xa0 Bảo hiểm\nCông nghệ thông tin\nPhần mềm và dịch vụ\n-\xa0 Dịch vụ CNTT\n-\xa0 Phần mềm\nPhần cứng và thiết bị\n-\xa0 Thiết bị viễn thông\n-\xa0 Phần cứng, bộ lưu trữ và thiết bị ngoại vi\n-\xa0 Điện tử\nBán dẫn\n-\xa0 Bán dẫn\nDịch vụ truyền thông\nDịch vụ viễn thông\n-\xa0 Dịch vụ viễn thông đa dạng\n-\xa0 Dịch vụ viễn thông không dây\nTruyền thông và giải trí\n-\xa0 Truyền thông\n-\xa0 Giải trí\n-\xa0 Truyền thông tương tác\nTiện ích\nTiện ích\n-\xa0 Điện\n-\xa0 Gas sinh hoạt\n-\xa0 Tiện tích tổng hợp\n-\xa0 Nước\n-\xa0 Phát điện độc lập và điện tái tạo\nBất động sản\nQuỹ REITs\n-\xa0 REITs bất động sản đa dạng\n-\xa0 REITs khu công nghiệp\n-\xa0 REITs khách sạn và khu nghỉ dưỡng\n-\xa0 REITs văn phòng\n-\xa0 REITs bất động sản y tế\n-\xa0 REITs nhà ở\n-\xa0 REITs bán lẻ\n-\xa0 REITs chuyên biệt\nBất động sản\n-\xa0 Quản lý và phát triển bất động sản\n-\xa0 Bất động sản đa dạng\n-\xa0 Dịch vụ bất động sản\nMã chứng khoán (-)\nTất cả\nCổ phiếu\nChỉ số\nChứng chỉ quỹ\nChứng quyền\nHợp đồng tương lai\nTrái phiếu\nXem thêm\nLãnh đạo (-)\nTất cả\nNgười nội bộ\nNgười liên quan\nCổ đông lớn\nXem thêm\nTin tức (-)\nXem thêm\nBài viết của tác giả (-)\nXem thêm\nBáo cáo phân tích (-)\nXem thêm\nThuật ngữ (-)\nXem thêm\nDịch vụ (-)\nĐào tạo\nKhóa học online - Phân tích Kỹ thuật Ứng dụng\nKhai giảng: 17/11/2025 |\nThời gian: Tối 2, 4, 6 |\nSố buổi: 7 |\nHọc phí: 3,825,000 đ\nKhóa học online - Đọc hiểu Báo cáo Tài chính\nKhai giảng: 25/11/2025 |\nThời gian: Tối 3, 5 |\nSố buổi: 3 |\nHọc phí: 1,530,000 đ\nKhóa học Online - Bắt đáy và Chốt lời Cổ phiếu\nKhai giảng: 13/12/2025 |\nThời gian: Thứ 7 |\nSố buổi: 3 |\nHọc phí: 1,870,000 đ\nKhóa học online - Phân tích Ngành và Dòng tiền Thị trường\nKhai giảng: 15/12/2025 |\nThời gian: Tối 2, 4, 6 |\nSố buổi: 6 |\nHọc phí: 3,570,000 đ\nKhóa học online - Phân tích Kỹ thuật Nâng cao\nKhai giảng: 03/11/2025 |\nThời gian: Tối 2, 4, 6 |\nSố buổi: 5 |\nHọc phí: 3,825,000 đ\nKhóa học online - Chứng khoán Cơ bản\nKhai giảng: 04/11/2025 |\nThời gian: Tối 3, 5 |\nSố buổi: 4 |\nHọc phí: 1,530,000 đ\nKhóa học online - Phân tích và Định giá Cổ phiếu\nKhai giảng: 21/10/2025 |\nThời gian: Tối 3, 5 |\nSố buổi: 4 |\nHọc phí: 1,870,000 đ\nKhóa học - Phân tích Kỹ thuật Ứng dụng - tại Tp. HCM\nKhai giảng: |\nThời gian: Tối 2, 4, 6 |\nSố buổi: 7 |\nHọc phí: 5,500,000 đ\nKhóa học online - Lướt sóng cổ phiếu nóng\nKhai giảng: 23/08/2025 |\nThời gian: Thứ 7 |\nSố buổi: 2 |\nHọc phí: 849,000 đ\nĐào tạo Phân tích và Đầu tư Chứng khoán IN - HOUSE\nKhai giảng: |\nThời gian: |\nSố buổi: 8 |\nHọc phí: 0 đ\nSách tài chính\nPhân tích kỹ thuật từ A đến Z\nVai trò của Quan hệ Nhà đầu tư (IR) trong việc Tối đa hóa Giá trị Doanh nghiệp\nCông cụ đầu tư\nVietstockUpdater\nVietstockFinance\nInvestOnline\nIROnline\nVietstockXLS\nTruyền thông tài chính\nBanner Ads\nOnline PR\nQuan hệ nhà đầu tư\nBáo cáo phân tích\nDữ liệu tài chính\nDataFeed - Dữ liệu tài chính tích hợp chuyên nghiệp\nVietstockXLS - Dữ liệu Kinh tế Tài chính Chứng khoán theo yêu cầu\nInvestOnline - Giải pháp website tra cứu chứng khoán toàn diện\nIROnline - Giải pháp thuê ngoài website IR, website quan hệ cổ đông\nThông báo\nVietstock trân trọng thông báo đến Quý Khách hàng về việc áp dụng “Chính sách quyền riêng tư” căn cứ theo Nghị định số 13/2023/NĐ-CP v/v bảo vệ dữ liệu cá nhân được ban hành bởi Chính phủ.\nTrong quá trình thiết lập mối quan hệ giữa Vietstock và Khách hàng, Vietstock có thể thu thập và xử lý dữ liệu cá nhân của Khách hàng cho mục đích được xác định tại Chính sách quyền riêng tư (“CSQRT”) này. Trong trường hợp Khách hàng không đồng ý một phần hoặc toàn bộ quy định tại CSQRT, Vietstock không thể cung cấp sản phẩm và dịch vụ cho Khách hàng.\nVietstock cam kết luôn tôn trọng quyền riêng tư, bảo mật và an toàn thông tin cá nhân; đồng thời luôn nỗ lực bảo vệ dữ liệu cá nhân của Khách hàng, tuân thủ quy định pháp luật Việt Nam thông qua những biện pháp bảo vệ dữ liệu cá nhân đáp ứng và phù hợp với quy định pháp luật Việt Nam.\nChính sách quyền riêng tư là một phần không thể tách rời của các thỏa thuận, điều khoản và điều kiện chi phối mối quan hệ giữa Vietstock và Quý Khách hàng.\nQuý Khách hàng đã đọc kỹ, hiểu rõ và đồng ý với toàn bộ điều khoản của “Chính sách quyền riêng tư”. Chi tiết Chính sách quyền riêng tư xem tại đây.\nNếu không đồng ý với Chính sách quyền riêng tư này, Chúng tôi không thể cung cấp sản phẩm và dịch vụ cho Quý Khách hàng.\nTôi đã đọc kỹ, hiểu rõ và đồng ý với toàn bộ điều khoản của Chính sách quyền riêng tư\nĐồng ý\nTheo dấu dòng tiền cá mập 24/11: Dòng tiền tự doanh nỗ lực bám trụ khi khối ngoại xả ròng\nPhiên 24/11 chứng kiến khối ngoại tiếp tục bán ròng hơn 1.2 ngàn tỷ đồng, trong khi dòng tiền tự doanh công ty chứng khoán (CTCK) vẫn duy trì xu hướng mua ròng, tạo bức tranh thị trường trái chiều.\nCác ""cá mập"" nước ngoài lại vừa có phiên bán ròng mạnh, hơn 1.2 ngàn tỷ đồng. Tâm điểm là các cổ phiếu họ Vingroup, với VRE bị xả mạnh nhất, hơn 288 tỷ đồng, gần gấp đôi giá trị bán ra của VHM (151 tỷ đồng). STB và VIC cũng nằm trong nhóm bị bán ròng mạnh, mỗi cổ phiếu khoảng 120 tỷ đồng.\nTrong khi đó, dòng tiền ngoại vẫn săn tìm cơ hội ở nhóm công nghệ. FPT dẫn đầu lực mua với 158 tỷ đồng, nối dài chuỗi phiên gom ròng liên tục trong hàng chục phiên gần đây. VNM đứng ngay sau với 147 tỷ đồng, còn VPB được mua ròng 58 tỷ đồng.\nTính từ đầu tháng 11, khối ngoại đã gom ròng FPT hơn 1.78 ngàn tỷ đồng - dẫn đầu toàn sàn, trong khi HPG theo sát với gần 1.73 ngàn tỷ đồng. Ở chiều ngược lại, STB bị xả mạnh nhất với hơn 2 ngàn tỷ đồng. Tổng cộng, giá trị bán ròng của khối ngoại trong tháng 11 vượt 9 ngàn tỷ đồng.\nNhìn rộng hơn, từ đầu quý 4 đến nay, FPT đã được gom ròng gần 4 ngàn tỷ đồng. Mặt khác, MBB bị xả mạnh nhất với hơn 4.3 ngàn tỷ đồng, đẩy tổng giá trị bán ròng toàn quý lên hơn 32 ngàn tỷ đồng.\nKhối ngoại bán ròng hơn ngàn tỷ\nTop 10 cổ phiếu khối ngoại giao dịch ròng nhiều nhất phiên 24/11\nỞ chiều ngược lại, khối tự doanh tiếp tục duy trì đà mua ròng, đạt 380 tỷ đồng trên HOSE, ghi nhận phiên mua ròng thứ hai liên tiếp. HPG và VNM dẫn đầu lực gom với lần lượt 63 tỷ đồng và 62 tỷ đồng, MWG theo sau 43 tỷ đồng.\nTrong khi đó, CTCK bán ròng mạnh nhất là STB gần 32 tỷ đồng, tiếp theo là KBC và VRE với 11 tỷ và 10 tỷ đồng.\nTự doanh lại mua ròng mạnh\nTop 10 cổ phiếu tự doanh giao dịch ròng mạnh nhất trong phiên 24/11\nTử Kính\nFILI\n- 17:55 24/11/2025\ncá mập\ntheo dấu dòng tiền cá mập\ntự doanh\nkhối ngoại mua ròng\nbán ròng\ngiao dịch cổ phiếu\nMÃ CHỨNG KHOÁN LIÊN QUAN (11)\nFPT\n100,200\n-600\n-0.60%\nHPG\n27,100\n-300\n-1.09%\nKBC\n34,950\n50\n+0.14%\nMBB\n23,150\n-50\n-0.22%\nMWG\n79,300\n-700\n-0.88%\nSTB\n50,000\n-1,300\n-2.53%\nVHM\n102,700\n3,400\n+3.42%\nVIC\n239,500\n9,800\n+4.27%\nVNM\n63,000\n3,100\n+5.18%\nVPB\n29,000\n450\n+1.58%\nVRE\n34,450\n2,250\n+6.99%\nTIN TỨC MÃ CHỨNG KHOÁN\n1\nThị trường chứng quyền ngày 25/11/2025: Nhóm chứng quyền VRE bứt phá\n45 phút trước\n2\nAFIEX có gì trong tay trước khi lên sàn HOSE?\n1 giờ trước\n3\nPhân tích kỹ thuật phiên chiều 24/11: Test lại đường SMA 50 ngày\n24/11 13:02\n4\nCông ty bao bì Việt do người Thái nắm giữ xin hủy đại chúng và rời HOSE\n24/11 12:40\n5\n48 tấn sữa và nước uống của Vinamilk đến rốn lũ miền Trung và Tây Nguyên\n24/11 11:41\nTIN CÙNG CHUYÊN MỤC\nCỔ PHIẾU\n13 phút trước\nCổ phiếu thủy sản, thực phẩm có tuần hút tiền\nThanh khoản diễn biến trái chiều ở hai sàn HOSE và HNX trong tuần giao dịch 17 - 21/11. Dòng tiền vẫn đang duy trì xu hướng thận trọng. Tuần vừa qua, nhóm cổ phiếu...\nCỔ PHIẾU\n24/11 11:01\nAfiex rời UPCoM cuối tháng 11 để chuyển sang HOSE\nSở Giao dịch Chứng khoán Hà Nội (HNX) thông báo hủy giao dịch toàn bộ 35 triệu cp của CTCP Xuất nhập khẩu Nông sản Thực phẩm An Giang (Afiex, UPCoM: AFX) từ ngày...\nCỔ PHIẾU\n24/11 08:00\nTop cổ phiếu đáng chú ý đầu tuần 24/11\nDanh sách các mã cổ phiếu tăng và giảm mạnh nhất những phiên gần đây theo số liệu thống kê của Vietstock.\nCỔ PHIẾU\n24/11 06:02\n24/11: Đọc gì trước giờ giao dịch chứng khoán?\nCập nhật nhanh những diễn biến kinh tế, tài chính trong nước và thế giới những ngày cuối tuần trước khi thị trường mở cửa.\nCỔ PHIẾU\n22/11 20:30\nVIC dẫn dắt đà tăng, VN-Index có thêm gần 20 điểm trong tuần phân hóa\nVIC tiếp tục dẫn dắt với mức đóng góp vượt trội, cùng nhóm Vingroup là VHM và VPL củng cố đà tăng, giúp chỉ số VN-Index duy trì nhịp phục hồi trong tuần 17-21/11...\nCỔ PHIẾU\n22/11 08:00\nDNSE Future Tech Summit: Bước đệm cho kỷ nguyên giao dịch T+0 và thị trường “không độ trễ”\nChiều 21/11/2025, sự kiện công nghệ DNSE Future Tech Summit đã diễn ra tại TP. Hồ Chí Minh, quy tụ nhiều chuyên gia tài chính - công nghệ uy tín và trên 200 nhà đầu...\nCỔ PHIẾU\n21/11 22:32\nTheo dấu dòng tiền cá mập 21/11: Khối ngoại rút ròng VIX hơn 700 tỷ\nKhối ngoại quay lại bán ròng trong phiên 21/11 với tâm điểm là VIX, trái chiều với lực mua từ tự doanh các công ty chứng khoán (CTCK).\nCỔ PHIẾU\n21/11 13:02\nNhững dấu ấn của cổ phiếu thủy sản trong một năm thuế quan gây chao đảo\nGiữa một năm đầy biến động bởi chính sách thuế quan từ Mỹ, cổ phiếu thủy sản vẫn đang ghi những dấu ấn. 3/5 mã lớn của ngành vẫn giảm sâu trong khi ANV lại tìm thấy...\nCỔ PHIẾU\n21/11 10:32\nBầu Đức và “game” mới\nCổ phiếu HAG vừa đạt đỉnh 10 năm, bầu Đức tính chuyện niêm yết công ty con sau khi “cục máu đông” nợ tan được đôi phần.\nCỔ PHIẾU\n21/11 08:00\nTop cổ phiếu đáng chú ý đầu phiên 21/11\nDanh sách các mã cổ phiếu tăng và giảm mạnh nhất những phiên gần đây theo số liệu thống kê của Vietstock.\nXem thêm\nChỉ số thị trường\nTIN CHÍNH\nĐỌC NHIỀU NHẤT\n×\nBáo lỗi bài viết\nCám ơn bạn đã gửi báo lỗi bài viết.\nĐịa chỉ email\nHọ tên\nSố điện thoại\nNội dung\nGửi\nVietstock – Cổng thông tin tài chính và chứng khoán chính thức hoạt động từ ngày 02/08/2002, với định hướng trở thành người bạn đồng hành đáng tin cậy của nhà đầu tư. Ngay từ những ngày đầu, Vietstock đã không ngừng nỗ lực mang đến hệ thống thông tin và dữ liệu tài chính chính xác – cập nhật – đầy đủ, giúp nhà đầu tư hiểu đúng, nhìn rộng và tự tin đưa ra quyết định trong hành trình đầu tư của mình.\nTruyền Thông Tài Chính\nQuan hệ công chúng (PR)\nQuan hệ nhà đầu tư (IR)\nQuảng cáo banner\nBáo cáo phân tích\nDữ Liệu Tài Chính\nDataFeed\nVietstockXLS\nInvestOnline\nIROnline\nVietstockUpdater\nVietstockFinance\nSách tài chính\nPhân tích kỹ thuật từ A đến Z\nVai trò của Quan hệ Nhà đầu tư (IR) trong việc tối đa hóa giá trị doanh nghiệp\nVietstock\nQuảng cáo & Dịch vụ\n0908 169 898 - (028) 3848 7238\nkinhdoanh@vietstock.vn\nSáng tạo nội dung\n0938 046 488\ninfo@vietstock.vn\nVăn phòng giao dịch\n81/10B Hồ Văn Huê,\nPhường Đức Nhuận, Tp.HCM\nSách tài chính\nPhân tích kỹ thuật từ A đến Z\nVai trò của Quan hệ Nhà đầu tư (IR) trong việc tối đa hóa giá trị doanh nghiệp\nVietstock\nVận hành bởi CTCP Tài Việt.\nTrụ sở: 28/47 Lê Thị Hồng, P.Gò Vấp, Tp.HCM\nTel: (84.28) 3848 7238 - Fax: (84.28) 3848 7237\nGiấy phép số 48/GP-STTTT ngày 04/11/2016\nQuyết định số 13/QĐ-STTTT ngày 02/11/2017\nQuyết định số 06/QĐ-STTTT-ICP ngày 20/07/2023\nĐược cấp bởi Sở Thông tin và Truyền thông TPHCM\nNgười chịu trách nhiệm\nBÀ PHẠM THỊ THANH NGA\n© Bản quyền thuộc về Vietstock\nSitemap\nVề chúng tôi\nChính sách quyền riêng tư\nQuảng cáo & Dịch vụ\n© Bản quyền thuộc về Vietstock\nHotline: 0908 16 98 98\nTất cả\nGiờ qua\n24 giờ qua\nTuần qua\nTháng qua\nNăm qua\nTất cả\nTính năng\nNgành\nMã chứng khoán\nLãnh đạo\nTin tức\nBáo cáo phân tích\nThuật ngữ\nDịch vụ\nTính năng (-)\nVietstock\nChứng khoán\nCổ phiếu\nGiao dịch nội bộ\nNiêm yết\nETF và các quỹ\nChứng khoán phái sinh\nChứng quyền\nÝ kiến chuyên gia\nCâu chuyện đầu tư\nChính sách\nTrái phiếu\nDoanh nghiệp\nHoạt động kinh doanh\nCổ tức\nTăng vốn - M&A\nIPO - Cổ phần hóa\nChứng khoán phái sinh\nNhân vật\nTrái phiếu doanh nghiệp\nBất động sản\nThị trường nhà đất\nQuy hoạch - Hạ tầng\nDự án\nBảo hiểm và thuế nhà đất\nTài chính\nNgân hàng\nBảo hiểm\nThuế và Ngân sách\nHàng hóa\nVàng và kim loại quý\nNhiên liệu\nKim loại\nNông sản thực phẩm\nKinh tế\nVĩ mô\nDữ liệu vĩ mô\nGDP\nCPI\nIIP\nBán lẻ\nXuất nhập khẩu\nFDI\nTín dụng\nThị trường mở\nTỷ giá - Lãi suất\nDân số và Lao động\nKinh tế - Đầu tư\nThế giới\nChứng khoán thế giới\nTiền kỹ thuật số\nTài chính quốc tế\nKinh tế - Đầu tư\nĐông dương\nVĩ mô\nTài chính - Ngân hàng\nThị trường chứng khoán\nKinh tế - Đầu tư\nTài chính cá nhân\nLàm chủ đồng tiền\nĐầu tư - Kinh doanh nhỏ\nDoanh nhân và khởi nghiệp\nChơi sang\nXe - Công nghệ\nTiêu dùng và lối sống\nVì cộng đồng\nPhân tích\nNhận định thị thường\nPhân tích cơ bản\nPhân tích kỹ thuật\nVietstockFinance\nVĩ mô\nDữ liệu vĩ mô\nGDP\nCPI\nIIP\nBán lẻ\nXuất nhập khẩu\nFDI\nTín dụng\nThị trường mở\nTỷ giá - Lãi suất\nDân số và Lao động\nNgành\nDữ liệu ngành\nNgành chi tiết\nDoanh nghiệp\nDoanh nghiệp A-Z\nHồ sơ lãnh đạo\nLịch sự kiện\nNiêm yết\nCổ tức và phát hành thêm\nĐại hội đồng cổ đông\nCập nhật lãi lỗ\nGiao dịch nội bộ\nCổ đông nội bộ\nNgười liên quan\nCổ đông lớn\nCổ phiếu quỹ\nTài liệu cổ đông\nBáo cáo tài chính\nGiải trình KQKD\nBáo cáo quản trị\nBáo cáo thường niên\nNghị quyết ĐHĐCĐ\nTài liệu ĐHĐCĐ\nNiên giám\nCổ phiếu\nThị trường cổ phiếu\nBản đồ thị trường\nTổng hợp thị trường\nThanh khoản\nĐịnh giá\nNước ngoài\nTự doanh\nTop cổ phiếu\nBản đồ ngành\nThống kê giao dịch\nGiá\nĐặt lệnh\nNước ngoài\nTự doanh\nẢnh hưởng chỉ số\nBiến động cổ phiếu\nGiao dịch nội bộ\nTrạng thái cổ phiếu\nQuy mô thị trường\nNiêm yết\nNiêm yết mới\nNiêm yết bổ sung\nHủy niêm yết\nTheo dõi đặc biệt\nKhông được ký quỹ\nETF\nCổ phiếu chi tiết\nTổng quan\nGiao dịch\nTài chính\nPhân tích kỹ thuật\nHồ sơ doanh nghiệp\nTin tức sự kiện\nTài liệu\nTâm lý thị trường\nPhái sinh\nHợp đồng tương lai\nTổng quan\nThống kê giao dịch\nKiến thức / Qui định\nChứng quyền\nTổng quan\nThống kê giao dịch\nBlackScholes\nTrái phiếu\nTổng quan\nTổ chức phát hành\nTrái phiếu A-Z\nThống kê giao dịch\nTin tức\nCông cụ đầu tư\nBản đồ thị trường\nSức mạnh giá RRG\nPhân tích kỹ thuật\nBảng giá trực tuyến\nBộ lọc cổ phiếu\nSo sánh cổ phiếu\nBáo cáo phân tích\nNghiên cứu - Phân tích\nVĩ mô - Chiến lược thị trường\nPhân tích ngành\nPhân tích doanh nghiệp\nTài liệu tham khảo\nBiểu đồ tài chính\nTruy xuất dữ liệu\nTổng hợp doanh nghiệp\nBáo cáo tài chính\nBáo cáo tài chính ngành\nVĩ mô\nNgành (-)\nVS-Sector\nNăng lượng\nNăng lượng\n-\xa0 Thiết bị và dịch vụ năng lượng\n-\xa0 Dầu khí\nNguyên vật liệu\nNguyên vật liệu\n-\xa0 Hóa chất\n-\xa0 Vật liệu xây dựng\n-\xa0 Bao bì và vật chứa\n-\xa0 Khai khoáng và luyện kim\n-\xa0 Gỗ và giấy\nCông nghiệp\nHàng hóa công nghiệp\n-\xa0 Thiết bị hàng không vũ trụ và quốc phòng\n-\xa0 Sản phẩm xây dựng\n-\xa0 Kỹ thuật xây dựng\n-\xa0 Thiết bị điện\n-\xa0 Tập đoàn đa ngành\n-\xa0 Máy móc công nghiệp\n-\xa0 Phân phối hàng công nghiệp\nDịch vụ thương mại và chuyên nghiệp\n-\xa0 Dịch vụ và thiết bị thương mại\n-\xa0 Dịch vụ chuyên nghiệp\nVận tải\n-\xa0 Vận tải và logistics hàng không\n-\xa0 Hãng hàng không chở khách\n-\xa0 Vận tải biển\n-\xa0 Vận tải mặt đất\n-\xa0 Hạ tầng giao thông\nTiêu dùng không thiết yếu\nXe và linh kiện\n-\xa0 Linh kiện xe\n-\xa0 Xe\nThời trang và hàng lâu bền\n-\xa0 Hàng tiêu dùng lâu bền\n-\xa0 Sản phẩm giải trí\n-\xa0 Thời trang và dệt may\nDịch vụ tiêu dùng\n-\xa0 Khách sạn, nhà hàng và giải trí\n-\xa0 Dịch vụ tiêu dùng khác\nThương mại hàng không thiết yếu\n-\xa0 Nhà phân phối\n-\xa0 Bán lẻ đa dạng\n-\xa0 Bán lẻ chuyên doanh\nTiêu dùng thiết yếu\nThương mại hàng thiết yếu\n-\xa0 Thương mại hàng thiết yếu\nThực phẩm, đồ uống và thuốc lá\n-\xa0 Đồ uống\n-\xa0 Thực phẩm\n-\xa0 Thuốc lá\nSản phẩm chăm sóc cá nhân và gia đình\n-\xa0 Sản phẩm chăm sóc gia đình\n-\xa0 Sản phẩm chăm sóc cá nhân\nChăm sóc sức khỏe\nThiết bị và dịch vụ chăm sóc sức khỏe\n-\xa0 Thiết bị và vật tư chăm sóc sức khỏe\n-\xa0 Thương mại và dịch vụ chăm sóc sức khỏe\n-\xa0 Công nghệ chăm sóc sức khỏe\nDược phẩm, công nghệ sinh học và khoa học sự sống\n-\xa0 Công nghệ sinh học\n-\xa0 Dược phẩm\n-\xa0 Công cụ và dịch vụ khoa học sự sống\nTài chính\nTổ chức tín dụng\n-\xa0 Ngân hàng\n-\xa0 Tín dụng phi ngân hàng\n-\xa0 Tín dụng khác\nDịch vụ tài chính\n-\xa0 Dịch vụ tài chính\n-\xa0 Thị trường vốn\n-\xa0 REIT thế chấp\nBảo hiểm\n-\xa0 Bảo hiểm\nCông nghệ thông tin\nPhần mềm và dịch vụ\n-\xa0 Dịch vụ CNTT\n-\xa0 Phần mềm\nPhần cứng và thiết bị\n-\xa0 Thiết bị viễn thông\n-\xa0 Phần cứng, bộ lưu trữ và thiết bị ngoại vi\n-\xa0 Điện tử\nBán dẫn\n-\xa0 Bán dẫn\nDịch vụ truyền thông\nDịch vụ viễn thông\n-\xa0 Dịch vụ viễn thông đa dạng\n-\xa0 Dịch vụ viễn thông không dây\nTruyền thông và giải trí\n-\xa0 Truyền thông\n-\xa0 Giải trí\n-\xa0 Truyền thông tương tác\nTiện ích\nTiện ích\n-\xa0 Điện\n-\xa0 Gas sinh hoạt\n-\xa0 Tiện tích tổng hợp\n-\xa0 Nước\n-\xa0 Phát điện độc lập và điện tái tạo\nBất động sản\nQuỹ REITs\n-\xa0 REITs bất động sản đa dạng\n-\xa0 REITs khu công nghiệp\n-\xa0 REITs khách sạn và khu nghỉ dưỡng\n-\xa0 REITs văn phòng\n-\xa0 REITs bất động sản y tế\n-\xa0 REITs nhà ở\n-\xa0 REITs bán lẻ\n-\xa0 REITs chuyên biệt\nBất động sản\n-\xa0 Quản lý và phát triển bất động sản\n-\xa0 Bất động sản đa dạng\n-\xa0 Dịch vụ bất động sản\nMã chứng khoán (-)\nTất cả\nCổ phiếu\nChỉ số\nChứng chỉ quỹ\nChứng quyền\nHợp đồng tương lai\nTrái phiếu\nXem thêm\nLãnh đạo (-)\nTất cả\nNgười nội bộ\nNgười liên quan\nCổ đông lớn\nXem thêm\nTin tức (-)\nXem thêm\nBài viết của tác giả (-)\nXem thêm\nBáo cáo phân tích (-)\nXem thêm\nThuật ngữ (-)\nXem thêm\nDịch vụ (-)\nĐào tạo\nKhóa học online - Phân tích Kỹ thuật Ứng dụng\nKhai giảng: 17/11/2025 |\nThời gian: Tối 2, 4, 6 |\nSố buổi: 7 |\nHọc phí: 3,825,000 đ\nKhóa học online - Đọc hiểu Báo cáo Tài chính\nKhai giảng: 25/11/2025 |\nThời gian: Tối 3, 5 |\nSố buổi: 3 |\nHọc phí: 1,530,000 đ\nKhóa học Online - Bắt đáy và Chốt lời Cổ phiếu\nKhai giảng: 13/12/2025 |\nThời gian: Thứ 7 |\nSố buổi: 3 |\nHọc phí: 1,870,000 đ\nKhóa học online - Phân tích Ngành và Dòng tiền Thị trường\nKhai giảng: 15/12/2025 |\nThời gian: Tối 2, 4, 6 |\nSố buổi: 6 |\nHọc phí: 3,570,000 đ\nKhóa học online - Phân tích Kỹ thuật Nâng cao\nKhai giảng: 03/11/2025 |\nThời gian: Tối 2, 4, 6 |\nSố buổi: 5 |\nHọc phí: 3,825,000 đ\nKhóa học online - Chứng khoán Cơ bản\nKhai giảng: 04/11/2025 |\nThời gian: Tối 3, 5 |\nSố buổi: 4 |\nHọc phí: 1,530,000 đ\nKhóa học online - Phân tích và Định giá Cổ phiếu\nKhai giảng: 21/10/2025 |\nThời gian: Tối 3, 5 |\nSố buổi: 4 |\nHọc phí: 1,870,000 đ\nKhóa học - Phân tích Kỹ thuật Ứng dụng - tại Tp. HCM\nKhai giảng: |\nThời gian: Tối 2, 4, 6 |\nSố buổi: 7 |\nHọc phí: 5,500,000 đ\nKhóa học online - Lướt sóng cổ phiếu nóng\nKhai giảng: 23/08/2025 |\nThời gian: Thứ 7 |\nSố buổi: 2 |\nHọc phí: 849,000 đ\nĐào tạo Phân tích và Đầu tư Chứng khoán IN - HOUSE\nKhai giảng: |\nThời gian: |\nSố buổi: 8 |\nHọc phí: 0 đ\nSách tài chính\nPhân tích kỹ thuật từ A đến Z\nVai trò của Quan hệ Nhà đầu tư (IR) trong việc Tối đa hóa Giá trị Doanh nghiệp\nCông cụ đầu tư\nVietstockUpdater\nVietstockFinance\nInvestOnline\nIROnline\nVietstockXLS\nTruyền thông tài chính\nBanner Ads\nOnline PR\nQuan hệ nhà đầu tư\nBáo cáo phân tích\nDữ liệu tài chính\nDataFeed - Dữ liệu tài chính tích hợp chuyên nghiệp\nVietstockXLS - Dữ liệu Kinh tế Tài chính Chứng khoán theo yêu cầu\nInvestOnline - Giải pháp website tra cứu chứng khoán toàn diện\nIROnline - Giải pháp thuê ngoài website IR, website quan hệ cổ đông\nThông báo\nVietstock trân trọng thông báo đến Quý Khách hàng về việc áp dụng “Chính sách quyền riêng tư” căn cứ theo Nghị định số 13/2023/NĐ-CP v/v bảo vệ dữ liệu cá nhân được ban hành bởi Chính phủ.\nTrong quá trình thiết lập mối quan hệ giữa Vietstock và Khách hàng, Vietstock có thể thu thập và xử lý dữ liệu cá nhân của Khách hàng cho mục đích được xác định tại Chính sách quyền riêng tư (“CSQRT”) này. Trong trường hợp Khách hàng không đồng ý một phần hoặc toàn bộ quy định tại CSQRT, Vietstock không thể cung cấp sản phẩm và dịch vụ cho Khách hàng.\nVietstock cam kết luôn tôn trọng quyền riêng tư, bảo mật và an toàn thông tin cá nhân; đồng thời luôn nỗ lực bảo vệ dữ liệu cá nhân của Khách hàng, tuân thủ quy định pháp luật Việt Nam thông qua những biện pháp bảo vệ dữ liệu cá nhân đáp ứng và phù hợp với quy định pháp luật Việt Nam.\nChính sách quyền riêng tư là một phần không thể tách rời của các thỏa thuận, điều khoản và điều kiện chi phối mối quan hệ giữa Vietstock và Quý Khách hàng.\nQuý Khách hàng đã đọc kỹ, hiểu rõ và đồng ý với toàn bộ điều khoản của “Chính sách quyền riêng tư”. Chi tiết Chính sách quyền riêng tư xem tại đây.\nNếu không đồng ý với Chính sách quyền riêng tư này, Chúng tôi không thể cung cấp sản phẩm và dịch vụ cho Quý Khách hàng.\nTôi đã đọc kỹ, hiểu rõ và đồng ý với toàn bộ điều khoản của Chính sách quyền riêng tư\nĐồng ý\nTheo dấu dòng tiền cá mập 24/11: Dòng tiền tự doanh nỗ lực bám trụ khi khối ngoại xả ròng\nPhiên 24/11 chứng kiến khối ngoại tiếp tục bán ròng hơn 1.2 ngàn tỷ đồng, trong khi dòng tiền tự doanh công ty chứng khoán (CTCK) vẫn duy trì xu hướng mua ròng, tạo bức tranh thị trường trái chiều.\nCác ""cá mập"" nước ngoài lại vừa có phiên bán ròng mạnh, hơn 1.2 ngàn tỷ đồng. Tâm điểm là các cổ phiếu họ Vingroup, với VRE bị xả mạnh nhất, hơn 288 tỷ đồng, gần gấp đôi giá trị bán ra của VHM (151 tỷ đồng). STB và VIC cũng nằm trong nhóm bị bán ròng mạnh, mỗi cổ phiếu khoảng 120 tỷ đồng.\nTrong khi đó, dòng tiền ngoại vẫn săn tìm cơ hội ở nhóm công nghệ. FPT dẫn đầu lực mua với 158 tỷ đồng, nối dài chuỗi phiên gom ròng liên tục trong hàng chục phiên gần đây. VNM đứng ngay sau với 147 tỷ đồng, còn VPB được mua ròng 58 tỷ đồng.\nTính từ đầu tháng 11, khối ngoại đã gom ròng FPT hơn 1.78 ngàn tỷ đồng - dẫn đầu toàn sàn, trong khi HPG theo sát với gần 1.73 ngàn tỷ đồng. Ở chiều ngược lại, STB bị xả mạnh nhất với hơn 2 ngàn tỷ đồng. Tổng cộng, giá trị bán ròng của khối ngoại trong tháng 11 vượt 9 ngàn tỷ đồng.\nNhìn rộng hơn, từ đầu quý 4 đến nay, FPT đã được gom ròng gần 4 ngàn tỷ đồng. Mặt khác, MBB bị xả mạnh nhất với hơn 4.3 ngàn tỷ đồng, đẩy tổng giá trị bán ròng toàn quý lên hơn 32 ngàn tỷ đồng.\nKhối ngoại bán ròng hơn ngàn tỷ\nTop 10 cổ phiếu khối ngoại giao dịch ròng nhiều nhất phiên 24/11\nỞ chiều ngược lại, khối tự doanh tiếp tục duy trì đà mua ròng, đạt 380 tỷ đồng trên HOSE, ghi nhận phiên mua ròng thứ hai liên tiếp. HPG và VNM dẫn đầu lực gom với lần lượt 63 tỷ đồng và 62 tỷ đồng, MWG theo sau 43 tỷ đồng.\nTrong khi đó, CTCK bán ròng mạnh nhất là STB gần 32 tỷ đồng, tiếp theo là KBC và VRE với 11 tỷ và 10 tỷ đồng.\nTự doanh lại mua ròng mạnh\nTop 10 cổ phiếu tự doanh giao dịch ròng mạnh nhất trong phiên 24/11\nTử Kính\nFILI\n- 17:55 24/11/2025\ncá mập\ntheo dấu dòng tiền cá mập\ntự doanh\nkhối ngoại mua ròng\nbán ròng\ngiao dịch cổ phiếu\nMÃ CHỨNG KHOÁN LIÊN QUAN (11)\nFPT\n100,200\n-600\n-0.60%\nHPG\n27,100\n-300\n-1.09%\nKBC\n34,950\n50\n+0.14%\nMBB\n23,150\n-50\n-0.22%\nMWG\n79,300\n-700\n-0.88%\nSTB\n50,000\n-1,300\n-2.53%\nVHM\n102,700\n3,400\n+3.42%\nVIC\n239,500\n9,800\n+4.27%\nVNM\n63,000\n3,100\n+5.18%\nVPB\n29,000\n450\n+1.58%\nVRE\n34,450\n2,250\n+6.99%\nTIN TỨC MÃ CHỨNG KHOÁN\n1\nThị trường chứng quyền ngày 25/11/2025: Nhóm chứng quyền VRE bứt phá\n45 phút trước\n2\nAFIEX có gì trong tay trước khi lên sàn HOSE?\n1 giờ trước\n3\nPhân tích kỹ thuật phiên chiều 24/11: Test lại đường SMA 50 ngày\n24/11 13:02\n4\nCông ty bao bì Việt do người Thái nắm giữ xin hủy đại chúng và rời HOSE\n24/11 12:40\n5\n48 tấn sữa và nước uống của Vinamilk đến rốn lũ miền Trung và Tây Nguyên\n24/11 11:41\nTIN CÙNG CHUYÊN MỤC\nCỔ PHIẾU\n13 phút trước\nCổ phiếu thủy sản, thực phẩm có tuần hút tiền\nThanh khoản diễn biến trái chiều ở hai sàn HOSE và HNX trong tuần giao dịch 17 - 21/11. Dòng tiền vẫn đang duy trì xu hướng thận trọng. Tuần vừa qua, nhóm cổ phiếu...\nCỔ PHIẾU\n24/11 11:01\nAfiex rời UPCoM cuối tháng 11 để chuyển sang HOSE\nSở Giao dịch Chứng khoán Hà Nội (HNX) thông báo hủy giao dịch toàn bộ 35 triệu cp của CTCP Xuất nhập khẩu Nông sản Thực phẩm An Giang (Afiex, UPCoM: AFX) từ ngày...\nCỔ PHIẾU\n24/11 08:00\nTop cổ phiếu đáng chú ý đầu tuần 24/11\nDanh sách các mã cổ phiếu tăng và giảm mạnh nhất những phiên gần đây theo số liệu thống kê của Vietstock.\nCỔ PHIẾU\n24/11 06:02\n24/11: Đọc gì trước giờ giao dịch chứng khoán?\nCập nhật nhanh những diễn biến kinh tế, tài chính trong nước và thế giới những ngày cuối tuần trước khi thị trường mở cửa.\nCỔ PHIẾU\n22/11 20:30\nVIC dẫn dắt đà tăng, VN-Index có thêm gần 20 điểm trong tuần phân hóa\nVIC tiếp tục dẫn dắt với mức đóng góp vượt trội, cùng nhóm Vingroup là VHM và VPL củng cố đà tăng, giúp chỉ số VN-Index duy trì nhịp phục hồi trong tuần 17-21/11...\nCỔ PHIẾU\n22/11 08:00\nDNSE Future Tech Summit: Bước đệm cho kỷ nguyên giao dịch T+0 và thị trường “không độ trễ”\nChiều 21/11/2025, sự kiện công nghệ DNSE Future Tech Summit đã diễn ra tại TP. Hồ Chí Minh, quy tụ nhiều chuyên gia tài chính - công nghệ uy tín và trên 200 nhà đầu...\nCỔ PHIẾU\n21/11 22:32\nTheo dấu dòng tiền cá mập 21/11: Khối ngoại rút ròng VIX hơn 700 tỷ\nKhối ngoại quay lại bán ròng trong phiên 21/11 với tâm điểm là VIX, trái chiều với lực mua từ tự doanh các công ty chứng khoán (CTCK).\nCỔ PHIẾU\n21/11 13:02\nNhững dấu ấn của cổ phiếu thủy sản trong một năm thuế quan gây chao đảo\nGiữa một năm đầy biến động bởi chính sách thuế quan từ Mỹ, cổ phiếu thủy sản vẫn đang ghi những dấu ấn. 3/5 mã lớn của ngành vẫn giảm sâu trong khi ANV lại tìm thấy...\nCỔ PHIẾU\n21/11 10:32\nBầu Đức và “game” mới\nCổ phiếu HAG vừa đạt đỉnh 10 năm, bầu Đức tính chuyện niêm yết công ty con sau khi “cục máu đông” nợ tan được đôi phần.\nCỔ PHIẾU\n21/11 08:00\nTop cổ phiếu đáng chú ý đầu phiên 21/11\nDanh sách các mã cổ phiếu tăng và giảm mạnh nhất những phiên gần đây theo số liệu thống kê của Vietstock.\nXem thêm\nChỉ số thị trường\nTIN CHÍNH\nĐỌC NHIỀU NHẤT\n×\nBáo lỗi bài viết\nCám ơn bạn đã gửi báo lỗi bài viết.\nĐịa chỉ email\nHọ tên\nSố điện thoại\nNội dung\nGửi\nVietstock – Cổng thông tin tài chính và chứng khoán chính thức hoạt động từ ngày 02/08/2002, với định hướng trở thành người bạn đồng hành đáng tin cậy của nhà đầu tư. Ngay từ những ngày đầu, Vietstock đã không ngừng nỗ lực mang đến hệ thống thông tin và dữ liệu tài chính chính xác – cập nhật – đầy đủ, giúp nhà đầu tư hiểu đúng, nhìn rộng và tự tin đưa ra quyết định trong hành trình đầu tư của mình.\nTruyền Thông Tài Chính\nQuan hệ công chúng (PR)\nQuan hệ nhà đầu tư (IR)\nQuảng cáo banner\nBáo cáo phân tích\nDữ Liệu Tài Chính\nDataFeed\nVietstockXLS\nInvestOnline\nIROnline\nVietstockUpdater\nVietstockFinance\nSách tài chính\nPhân tích kỹ thuật từ A đến Z\nVai trò của Quan hệ Nhà đầu tư (IR) trong việc tối đa hóa giá trị doanh nghiệp\nVietstock\nQuảng cáo & Dịch vụ\n0908 169 898 - (028) 3848 7238\nkinhdoanh@vietstock.vn\nSáng tạo nội dung\n0938 046 488\ninfo@vietstock.vn\nVăn phòng giao dịch\n81/10B Hồ Văn Huê,\nPhường Đức Nhuận, Tp.HCM\nSách tài chính\nPhân tích kỹ thuật từ A đến Z\nVai trò của Quan hệ Nhà đầu tư (IR) trong việc tối đa hóa giá trị doanh nghiệp\nVietstock\nVận hành bởi CTCP Tài Việt.\nTrụ sở: 28/47 Lê Thị Hồng, P.Gò Vấp, Tp.HCM\nTel: (84.28) 3848 7238 - Fax: (84.28) 3848 7237\nGiấy phép số 48/GP-STTTT ngày 04/11/2016\nQuyết định số 13/QĐ-STTTT ngày 02/11/2017\nQuyết định số 06/QĐ-STTTT-ICP ngày 20/07/2023\nĐược cấp bởi Sở Thông tin và Truyền thông TPHCM\nNgười chịu trách nhiệm\nBÀ PHẠM THỊ THANH NGA\n© Bản quyền thuộc về Vietstock\nSitemap\nVề chúng tôi\nChính sách quyền riêng tư\nQuảng cáo & Dịch vụ\n© Bản quyền thuộc về Vietstock\nHotline: 0908 16 98 98\nTất cả\nGiờ qua\n24 giờ qua\nTuần qua\nTháng qua\nNăm qua\nTất cả\nTính năng\nNgành\nMã chứng khoán\nLãnh đạo\nTin tức\nBáo cáo phân tích\nThuật ngữ\nDịch vụ\nTính năng (-)\nVietstock\nChứng khoán\nCổ phiếu\nGiao dịch nội bộ\nNiêm yết\nETF và các quỹ\nChứng khoán phái sinh\nChứng quyền\nÝ kiến chuyên gia\nCâu chuyện đầu tư\nChính sách\nTrái phiếu\nDoanh nghiệp\nHoạt động kinh doanh\nCổ tức\nTăng vốn - M&A\nIPO - Cổ phần hóa\nChứng khoán phái sinh\nNhân vật\nTrái phiếu doanh nghiệp\nBất động sản\nThị trường nhà đất\nQuy hoạch - Hạ tầng\nDự án\nBảo hiểm và thuế nhà đất\nTài chính\nNgân hàng\nBảo hiểm\nThuế và Ngân sách\nHàng hóa\nVàng và kim loại quý\nNhiên liệu\nKim loại\nNông sản thực phẩm\nKinh tế\nVĩ mô\nDữ liệu vĩ mô\nGDP\nCPI\nIIP\nBán lẻ\nXuất nhập khẩu\nFDI\nTín dụng\nThị trường mở\nTỷ giá - Lãi suất\nDân số và Lao động\nKinh tế - Đầu tư\nThế giới\nChứng khoán thế giới\nTiền kỹ thuật số\nTài chính quốc tế\nKinh tế - Đầu tư\nĐông dương\nVĩ mô\nTài chính - Ngân hàng\nThị trường chứng khoán\nKinh tế - Đầu tư\nTài chính cá nhân\nLàm chủ đồng tiền\nĐầu tư - Kinh doanh nhỏ\nDoanh nhân và khởi nghiệp\nChơi sang\nXe - Công nghệ\nTiêu dùng và lối sống\nVì', '[TECHNICAL REPORT]: ![Biểu đồ ACB](charts/ACB_20251124.png)\n\n**Phân tích kỹ thuật chuyên sâu cho mã cổ phiếu ACB:**\n\n**1. Xu hướng hiện tại:**\n   - Xu hướng hiện tại của ACB là **Uptrend (Tăng)**. Điều này được xác nhận bởi giá hiện tại nằm trên tất cả các đường trung bình động quan trọng.\n\n**2. Vị thế giá so với các đường MA:**\n   - Giá đóng cửa gần nhất của ACB là **24.50**.\n   - MA 20: 24.00\n   - MA 50: 23.50\n   - MA 100: 23.00\n   - MA 200: 22.00\n   - Giá hiện tại (24.50) đang nằm trên tất cả các đường MA (MA20, MA50, MA100, MA200), cho thấy một xu hướng tăng mạnh mẽ và bền vững.\n\n**3. RSI đang ở vùng nào:**\n   - Chỉ số RSI (14) của ACB là **65.00**.\n   - RSI đang nằm trong vùng **Trung tính**, chưa có dấu hiệu quá mua (>70) hay quá bán (<30). Điều này cho thấy cổ phiếu vẫn còn dư địa tăng trưởng.\n\n**4. Xác định các vùng Hỗ trợ cứng và Kháng cự cứng:**\n   - Vùng **Hỗ trợ cứng:** **22.50**\n   - Vùng **Kháng cự cứng:** **25.00**\n\n**Nhận định:**\nDựa trên phân tích kỹ thuật, ACB đang trong một xu hướng tăng rõ ràng, với giá nằm trên các đường MA quan trọng. RSI ở vùng trung tính cho thấy cổ phiếu chưa bị quá mua. MACD cũng xác nhận xu hướng tăng. Vùng kháng cự gần nhất là 25.00.\n\n**Khuyến nghị:** **MUA**', '[FINANCIAL REPORT]: Nhận định chung về vị thế tài chính:\nACB hiện đang thể hiện hiệu quả sử dụng vốn chủ sở hữu khá tốt với ROE 20.40%, cao hơn VCB (17.00%), BID (17.80%) và TCB (14.30%), VPB (14.20%), nhưng thấp hơn CTG (21.60%). Tuy nhiên, việc thiếu dữ liệu P/E và P/B khiến việc đánh giá định giá của ACB và các đối thủ trở nên khó khăn.\n\nChuyển động đối thủ:\n\nVCB (Ngân hàng TMCP Ngoại thương Việt Nam):\n1. Vietcombank sắp chi hơn 3,700 tỷ trả cổ tức bằng tiền mặt.\n2. VCB hoàn tất tăng vốn lên hơn 83.000 tỷ đồng.\n3. Vietcombank triển khai chương trình ưu đãi lãi suất cho vay ngắn hạn sản xuất kinh doanh với quy mô lên tới 160.000 tỷ đồng.\n\nBID (Ngân hàng TMCP Đầu tư và Phát triển Việt Nam):\n1. BIDV đặt mục tiêu tăng lãi mạnh, lên 20.600 tỷ đồng.\n2. BID: Với hơn 7021 tỷ cổ phiếu đang lưu hành, ngân hàng này dự kiến chi hơn 3.159 tỷ đồng để trả cổ tức tiền mặt cho cổ đông.\n3. VietinBank và BIDV cùng trả cổ tức 2024 với tỷ lệ 4,5%.\n\nCTG (Ngân hàng TMCP Công Thương Việt Nam):\n1. CTG - VietinBank sẽ chi hơn 2.400 tỷ đồng trả cổ tức tiền mặt năm 2024, sau lần gần nhất cách đây 4 năm.\n2. CTG: Nghị quyết HĐQT nhất trí thông qua Hợp đồng thuế chấp với Công ty Cho thuê tài chính TNHH MTV VietinBank - VietinBank Leasing.\n3. VietinBank sắp chào bán 4.000 tỷ đồng trái phiếu ra công chúng.\n\nBảng so sánh chỉ số tài chính:\n\n| Chỉ số | ACB | VCB | BID | CTG | TCB | VPB |\n| --- | --- | --- | --- | --- | --- | --- |\n| **P/E** | N/A | N/A | N/A | N/A | N/A | N/A |\n| **P/B** | N/A | N/A | N/A | N/A | N/A | N/A |\n| **ROE** | 20.40% | 17.00% | 17.80% | 21.60% | 14.30% | 14.20% |\n| **Biên LNG** | N/A | N/A | N/A | N/A | N/A | N/A |', '[RAG DATA]: Dưới đây là các số liệu của ACB tính đến Lũy kế từ đầu năm đến cuối Quý III năm 2025 hoặc tại ngày 30 tháng 9 năm 2025:\n\n*   **Doanh thu:** Thu nhập lãi và các khoản thu nhập tương tự: 42.675.405 Triệu đồng (Lũy kế từ đầu năm đến cuối Quý III năm 2025)\n*   **Lợi nhuận:**\n    *   Tổng lợi nhuận trước thuế: 16.071.749 Triệu đồng (Lũy kế từ đầu năm đến cuối Quý III năm 2025)\n    *   Lợi nhuận sau thuế: 12.840.014 Triệu đồng (Lũy kế từ đầu năm đến cuối Quý III năm 2025)\n*   **Tổng tài sản:** 948.549.176 Triệu đồng (Tại ngày 30 tháng 9 năm 2025)\n*   **Nợ:** Tổng nợ phải trả: 857.133.676 Triệu đồng (Tại ngày 30 tháng 9 năm 2025)\n*   **Dòng tiền:**\n    *   Lưu chuyển tiền thuần từ hoạt động kinh doanh: (21.190.910) Triệu đồng (Lũy kế từ đầu năm đến cuối Quý III năm 2025)\n    *   Lưu chuyển tiền thuần từ hoạt động đầu tư: (90.542) Triệu đồng (Lũy kế từ đầu năm đến cuối Quý III năm 2025)\n    *   Lưu chuyển tiền thuần từ hoạt động tài chính: (4.466.658) Triệu đồng (Lũy kế từ đầu năm đến cuối Quý III năm 2025)\n    *   Lưu chuyển tiền thuần trong kỳ: (25.748.110) Triệu đồng (Lũy kế từ đầu năm đến cuối Quý III năm 2025)']","# 🇻🇳 BÁO CÁO PHÂN TÍCH: ACB
*(Ngày: 24/11/2025)*

## 1. 📰 Điểm tin Vĩ mô & Ngành

Thị trường chứng khoán phiên 24/11/2025 ghi nhận sự đối lập trong dòng tiền của các nhà đầu tư lớn. Khối ngoại tiếp tục xu hướng bán ròng mạnh với giá trị hơn **1,200 tỷ đồng**, tập trung vào các cổ phiếu nhóm Vingroup (VRE, VHM) và một số mã ngân hàng như STB. Lũy kế từ đầu tháng 11, khối ngoại đã bán ròng hơn **9,000 tỷ đồng**, tạo áp lực không nhỏ lên chỉ số chung.

Ở chiều ngược lại, khối tự doanh các công ty chứng khoán lại là điểm sáng khi mua ròng phiên thứ hai liên tiếp, đạt **380 tỷ đồng**. Dòng tiền nội này cho thấy sự nỗ lực nâng đỡ thị trường, tập trung vào các cổ phiếu đầu ngành như HPG và VNM. Sự giằng co này cho thấy tâm lý thị trường đang trong giai đoạn phân hóa, đòi hỏi nhà đầu tư cần lựa chọn cổ phiếu một cách cẩn trọng.

## 2. 🏢 Sức khỏe Tài chính & Vị thế

- **Kết quả kinh doanh:** Theo BCTC hợp nhất, lũy kế 9 tháng đầu năm 2025, ACB ghi nhận kết quả kinh doanh tăng trưởng tích cực. Thu nhập lãi và các khoản tương tự đạt **42,675.4 tỷ đồng**. Lợi nhuận trước thuế đạt **16,071.7 tỷ đồng**, và lợi nhuận sau thuế là **12,840.0 tỷ đồng**.
- **Lưu ý về dòng tiền:** Mặc dù lợi nhuận tăng trưởng tốt, báo cáo lưu chuyển tiền tệ cho thấy dòng tiền thuần từ hoạt động kinh doanh của ACB đang âm **21,190.9 tỷ đồng**. Đây là một chỉ số quan trọng nhà đầu tư cần theo dõi chặt chẽ trong các quý tới để đánh giá khả năng tạo tiền thực tế từ hoạt động cốt lõi của ngân hàng.
- **Định giá và Hiệu quả hoạt động:** ACB thể hiện khả năng sinh lời trên vốn chủ sở hữu (ROE) ở mức **20.40%**, một con số ấn tượng và cao hơn đáng kể so với nhiều đối thủ cùng ngành, cho thấy hiệu quả sử dụng vốn vượt trội.
- **Chuyển động Đối thủ:** Các ngân hàng lớn khác như Vietcombank (VCB), BIDV (BID), và VietinBank (CTG) đều có kế hoạch trả cổ tức bằng tiền mặt và tăng vốn trong thời gian tới, thể hiện sự lạc quan chung về triển vọng của ngành ngân hàng.

**So sánh Hiệu quả Sinh lời (ROE)**

| Chỉ số | ACB | VCB | BID | CTG | TCB | VPB |
| :--- | :---: | :---: | :---: | :---: | :---: | :---: |
| **ROE** | **20.40%** | 17.00% | 17.80% | 21.60% | 14.30% | 14.20% |

## 3. 📈 Góc nhìn Kỹ thuật

- **Xu hướng & Chỉ báo:** Cổ phiếu ACB đang trong một xu hướng tăng giá (Uptrend) rõ ràng và mạnh mẽ. Giá đóng cửa gần nhất **24,500 đồng/cổ phiếu** đang vận động phía trên tất cả các đường trung bình động quan trọng (MA20, MA50, MA100, MA200), là một tín hiệu xác nhận sức mạnh của xu hướng tăng. Chỉ báo RSI (14) đang ở mức 65, cho thấy cổ phiếu chưa đi vào vùng quá mua và vẫn còn dư địa tăng trưởng.
- **Vùng giá quan trọng:**
    - **Vùng hỗ trợ cứng:** **22,500 đồng**.
    - **Vùng kháng cự cứng:** **25,000 đồng**.

![Biểu đồ Kỹ thuật ACB](charts/ACB_20251124.png)

## 4. 🎯 KẾT LUẬN & KHUYẾN NGHỊ

**Khuyến nghị: MUA TÍCH LŨY**

Dựa trên các phân tích, chúng tôi đưa ra khuyến nghị **MUA TÍCH LŨY** đối với cổ phiếu ACB với các luận điểm chính sau:

1.  **Nền tảng cơ bản vững chắc:** ACB tiếp tục duy trì hiệu quả hoạt động ở mức cao với chỉ số ROE vượt trội so với trung bình ngành. Kết quả kinh doanh 9 tháng đầu năm 2025 tăng trưởng tốt, khẳng định vị thế là một trong những ngân hàng bán lẻ hàng đầu.
2.  **Tín hiệu kỹ thuật tích cực:** Cổ phiếu đang có xu hướng tăng giá mạnh mẽ và bền vững, được hỗ trợ bởi các chỉ báo kỹ thuật đáng tin cậy. Dòng tiền tham gia tốt cho thấy kỳ vọng của thị trường vào đà tăng trưởng của cổ phiếu.
3.  **Rủi ro cần giám sát:** Mặc dù có nhiều điểm sáng, nhà đầu tư cần lưu ý đến dòng tiền từ hoạt động kinh doanh đang âm. Đây là yếu tố cần được theo dõi sát sao trong các báo cáo tài chính tiếp theo.

**Hành động:**
- **Vùng mua:** Quanh mức giá **24,000 - 24,500 đồng/cổ phiếu**.
- **Mục tiêu ngắn hạn:** **25,000 đồng/cổ phiếu**.
- **Cắt lỗ:** Khi giá phá vỡ vùng hỗ trợ **22,500 đồng/cổ phiếu**.",0.43859649122807015,0.6432778128183317
AUTO_ANALYSIS_BCM_1,Phân tích tổng hợp cổ phiếu BCM,"[""[MARKET REPORT]: - **Lãi suất ngân hàng hôm nay 24/11/2025: 'Ông lớn' tăng mạnh tất cả kỳ hạn.**\n    - **Đánh giá tác động:** Tiêu cực. Việc các ngân hàng lớn tăng lãi suất huy động cho thấy áp lực lên chi phí vốn của doanh nghiệp sẽ tăng lên, đồng thời làm giảm sức hấp dẫn của kênh đầu tư chứng khoán so với kênh tiền gửi. Điều này có thể dẫn đến dòng tiền rút khỏi thị trường chứng khoán hoặc làm chậm lại đà tăng trưởng của các doanh nghiệp niêm yết.\n\n- **Giá USD hôm nay 24.11.2025: Giữ đà tăng cao (Tỷ giá USD/VND tăng).**\n    - **Đánh giá tác động:** Tiêu cực. Tỷ giá USD/VND tiếp tục tăng cao gây áp lực lên lạm phát nhập khẩu, làm tăng chi phí nguyên vật liệu cho các doanh nghiệp phụ thuộc vào nhập khẩu. Đồng thời, việc VND mất giá có thể khiến nhà đầu tư nước ngoài thận trọng hơn khi đầu tư vào Việt Nam, dẫn đến dòng vốn ngoại có thể bị rút ròng hoặc giảm tốc độ giải ngân. Tuy nhiên, các doanh nghiệp xuất khẩu có thể hưởng lợi từ việc tỷ giá tăng.\n\n- **Chính phủ yêu cầu tăng tốc giải ngân đầu tư công và kiên trì điều hành CPI năm 2025 theo phương án tăng khoảng 3,3%.**\n    - **Đánh giá tác động:** Tích cực. Việc đẩy mạnh giải ngân đầu tư công sẽ bơm một lượng lớn tiền vào nền kinh tế, kích thích tổng cầu và tạo động lực tăng trưởng cho nhiều ngành như xây dựng, vật liệu xây dựng, hạ tầng. Điều này tạo ra kỳ vọng về kết quả kinh doanh tốt hơn cho các doanh nghiệp liên quan. Đồng thời, việc kiên trì kiểm soát lạm phát ở mức mục tiêu 3,3% cho thấy sự ổn định vĩ mô, tạo môi trường kinh doanh thuận lợi và củng cố niềm tin cho nhà đầu tư."", '[TECHNICAL REPORT]: ![Biểu đồ BCM](charts/BCM_20251124.png)\n\n### Phân tích Kỹ thuật Chuyên sâu cho BCM\n\n**1. Xu hướng hiện tại:**\n*   **Dài hạn:** GIẢM\n*   **Trung hạn:** GIẢM\n*   **Ngắn hạn:** Giá đóng cửa gần nhất (66.70) thấp hơn MA20 (67.50), cho thấy xu hướng giảm trong ngắn hạn.\n\n**2. Vị thế giá so với các đường MA:**\n*   Giá đóng cửa gần nhất của BCM là **66.70 VND**.\n*   Giá đang nằm dưới cả ba đường trung bình động quan trọng:\n    *   Dưới MA20 (67.50 VND)\n    *   Dưới MA50 (68.20 VND)\n    *   Dưới MA200 (72.10 VND)\n    Điều này củng cố mạnh mẽ cho một xu hướng giảm giá trên cả khung thời gian ngắn, trung và dài hạn.\n\n**3. RSI:**\n*   Chỉ số RSI hiện tại là **48.78**.\n*   RSI đang nằm trong vùng **TRUNG TÍNH** (không quá mua >70, không quá bán <30). Điều này cho thấy không có áp lực mua hoặc bán quá mức tại thời điểm hiện tại, nhưng cũng không cung cấp tín hiệu đảo chiều mạnh mẽ.\n\n**4. MACD:**\n*   MACD đang cho tín hiệu **TIÊU CỰC**, xác nhận thêm xu hướng giảm giá.\n\n**5. Các vùng Hỗ trợ cứng và Kháng cự cứng:**\n*   **Kháng cự cứng:**\n    *   R1: **70 VND**\n    *   R2: **77 VND**\n    *   R3: **82 VND**\n*   **Hỗ trợ cứng:**\n    *   S1: **66 VND**\n    *   S2: **58 VND**\n    *   S3: **50 VND**\n\n---\n\n**Nhận định:**\n\nBCM đang trong một xu hướng giảm rõ ràng trên cả khung thời gian dài hạn và trung hạn. Giá hiện tại đang giao dịch dưới tất cả các đường trung bình động quan trọng (MA20, MA50, MA200), cho thấy áp lực bán mạnh mẽ. Tín hiệu MACD tiêu cực cũng củng cố cho nhận định này.\n\nGiá đóng cửa gần nhất (66.70 VND) đang rất gần với vùng hỗ trợ cứng S1 (66 VND). Nếu vùng hỗ trợ này bị phá vỡ, giá có thể tiếp tục giảm sâu hơn về các vùng hỗ trợ tiếp theo là S2 (58 VND) và S3 (50 VND). Mặc dù RSI đang ở vùng trung tính, nhưng điều này không đủ để tạo ra một tín hiệu mua mạnh mẽ trong bối cảnh xu hướng giảm hiện tại.\n\n**Khuyến nghị:** **CHỜ MUA**.\n\nHiện tại không phải là thời điểm thích hợp để mua vào BCM. Nhà đầu tư nên kiên nhẫn chờ đợi các tín hiệu đảo chiều rõ ràng hơn, chẳng hạn như giá vượt lên trên các đường MA quan trọng, hoặc chờ giá về các vùng hỗ trợ sâu hơn (S2, S3) và có dấu hiệu hình thành đáy, kèm theo các tín hiệu tích cực từ các chỉ báo kỹ thuật khác.', '[FINANCIAL REPORT]: \n', '[RAG DATA]: Dưới đây là các số liệu được trích xuất từ thông tin được cung cấp:\n\n*   **Doanh thu:**\n    *   Doanh thu bán hàng và cung cấp dịch vụ (Lũy kế từ đầu năm đến cuối kỳ này): 4.866.103.112.951 VND\n*   **Lợi nhuận:**\n    *   Lợi nhuận sau thuế thu nhập doanh nghiệp (Lũy kế từ đầu năm đến cuối kỳ này): 1.249.130.709.992 VND\n*   **Tổng tài sản:**\n    *   TỔNG CỘNG TÀI SẢN (Số cuối kỳ): 50.321.178.875.075 VND\n*   **Nợ:**\n    *   C - NỢ PHẢI TRẢ (Số cuối kỳ): 34.694.406.192.723 VND\n*   **Dòng tiền:**\n    *   Lưu chuyển tiền thuần từ hoạt động kinh doanh (Lũy kế từ đầu năm đến cuối kỳ này): (398.631.979.587) VND\n    *   Lưu chuyển tiền thuần từ hoạt động đầu tư (Lũy kế từ đầu năm đến cuối kỳ này): (214.661.353.822) VND\n    *   Lưu chuyển tiền thuần từ hoạt động tài chính (Lũy kế từ đầu năm đến cuối kỳ này): 318.253.878.564 VND']","# 🇻🇳 BÁO CÁO PHÂN TÍCH: BCM
*(Ngày: 24/11/2025)*

## 1. 📰 Điểm tin Vĩ mô & Ngành

Bối cảnh vĩ mô đang có những diễn biến trái chiều, tác động trực tiếp đến các doanh nghiệp hạ tầng khu công nghiệp như BCM:

*   **Động lực từ Đầu tư công:** Chủ trương đẩy mạnh giải ngân đầu tư công của Chính phủ là yếu tố hỗ trợ tích cực, hứa hẹn thúc đẩy nhu cầu về hạ tầng, xây dựng và bất động sản công nghiệp trong thời gian tới.
*   **Áp lực từ Môi trường Lãi suất & Tỷ giá:** Việc các ngân hàng lớn đồng loạt tăng lãi suất huy động và tỷ giá USD/VND tiếp tục leo thang tạo ra hai thách thức lớn: (1) Tăng chi phí vốn vay của doanh nghiệp, đặc biệt với các công ty có tỷ lệ đòn bẩy cao; (2) Giảm sức hấp dẫn của kênh chứng khoán so với kênh tiết kiệm và có thể ảnh hưởng đến dòng vốn ngoại.

## 2. 🏢 Sức khỏe Tài chính & Vị thế

- **Kết quả kinh doanh:** Theo số liệu lũy kế gần nhất, BCM ghi nhận kết quả kinh doanh có phần tích cực về mặt lợi nhuận nhưng tiềm ẩn rủi ro về dòng tiền.
    - **Doanh thu:** Đạt **4,866 tỷ đồng**.
    - **Lợi nhuận sau thuế:** Đạt **1,249 tỷ đồng**.
    - **Cấu trúc tài sản:** Tổng tài sản đạt **50,321 tỷ đồng**, tuy nhiên Nợ phải trả chiếm tỷ trọng lớn ở mức **34,694 tỷ đồng** (tương đương 69% tổng tài sản).
    - **Dòng tiền:** Đây là điểm đáng lưu ý nhất. **Lưu chuyển tiền thuần từ hoạt động kinh doanh đang âm 399 tỷ đồng**. Điều này cho thấy dù có lãi trên sổ sách, công ty đang gặp khó khăn trong việc thu hồi công nợ hoặc quản lý hàng tồn kho, phải bù đắp bằng dòng tiền từ hoạt động tài chính (vay nợ, phát hành thêm).

- **Định giá:** Hiện tại chưa có đủ dữ liệu so sánh P/E và P/B trong ngành để đưa ra nhận định chi tiết.

- **Chuyển động Đối thủ:** Chưa có thông tin nổi bật về các đối thủ cạnh tranh trong giai đoạn gần đây.

## 3. 📈 Góc nhìn Kỹ thuật

![Biểu đồ Kỹ thuật BCM](charts/BCM_20251124.png)

- **Xu hướng & Chỉ báo:**
    - Xu hướng chủ đạo trên cả 3 khung thời gian (dài, trung, ngắn hạn) đều là **GIẢM**.
    - Giá cổ phiếu hiện đang vận động dưới tất cả các đường trung bình động quan trọng (MA20, MA50, MA200), xác nhận áp lực bán đang chiếm ưu thế tuyệt đối.
    - Chỉ báo MACD cho tín hiệu **TIÊU CỰC**, củng cố cho xu hướng giảm hiện tại.
    - Chỉ báo RSI ở mức 48.78, vùng trung tính, chưa cho thấy tín hiệu đảo chiều rõ ràng.

- **Vùng giá quan trọng:**
    - **Vùng Hỗ trợ:** **66,000 đồng** (S1) và **58,000 đồng** (S2).
    - **Vùng Kháng cự:** **70,000 đồng** (R1) và **77,000 đồng** (R2).

Giá đang kiểm tra vùng hỗ trợ quan trọng 66,000 đồng. Nếu vùng này bị phá vỡ, rủi ro giảm sâu về vùng 58,000 đồng là rất cao.

## 4. 🎯 KẾT LUẬN & KHUYẾN NGHỊ

**KHUYẾN NGHỊ: THEO DÕI**

Mặc dù BCM có thể hưởng lợi từ câu chuyện đầu tư công trong dài hạn, các rủi ro trong ngắn và trung hạn đang ở mức cao, không phù hợp để giải ngân ở thời điểm hiện tại.

**Luận điểm:**

1.  **Rủi ro Tài chính Cốt lõi:** Dòng tiền từ hoạt động kinh doanh âm là một cảnh báo nghiêm trọng về sức khỏe tài chính thực của doanh nghiệp. Lợi nhuận ghi nhận có thể không bền vững nếu không sớm cải thiện được khả năng tạo tiền mặt từ hoạt động chính. Tỷ lệ Nợ/Tổng tài sản ở mức 69% cũng là một rủi ro cần lưu tâm trong bối cảnh lãi suất tăng.
2.  **Áp lực Kỹ thuật:** Cổ phiếu đang trong một xu hướng giảm giá rõ ràng và chưa có bất kỳ tín hiệu kỹ thuật nào cho thấy sự đảo chiều. Việc mua vào lúc này có rủi ro bắt dao rơi rất lớn.

**Hành động đề xuất:** Nhà đầu tư nên đứng ngoài quan sát, chờ đợi những tín hiệu cải thiện rõ rệt hơn: (1) Về cơ bản, báo cáo tài chính quý tới cho thấy dòng tiền kinh doanh dương trở lại; (2) Về kỹ thuật, giá phải vượt lên trên các vùng kháng cự quan trọng (đặc biệt là MA50 và MA200) kèm theo khối lượng giao dịch thuyết phục.",0.6756756756756757,0.6639756080917301
AUTO_ANALYSIS_BID_2,Phân tích tổng hợp cổ phiếu BID,"['[MARKET REPORT]: - **Tin tức 1: Tình hình kinh tế vĩ mô Việt Nam tháng 11 và 11 tháng đầu năm 2025 cho thấy sự phục hồi mạnh mẽ.**\n    - **Nội dung chính:** Các chỉ số kinh tế vĩ mô Việt Nam tháng 11/2025 và 11 tháng đầu năm 2025 cho thấy nền kinh tế đang cải thiện tích cực. Khu vực dịch vụ trở lại mức tăng trưởng trên 8%, với bán lẻ hàng hóa tăng 8.27% so với cùng kỳ (svck) và du lịch bứt phá với mức tăng trưởng trên 12% (lượng khách quốc tế tăng 38.8% svck). Khu vực công nghiệp và xây dựng tăng trưởng gần 9% – mức cao nhất trong các tháng 11 của giai đoạn 5 năm, trong đó công nghiệp chế biến chế tạo tăng 11.22% (cao nhất trong 3 năm qua). Lạm phát duy trì ổn định ở mức thấp, chỉ số giá tiêu dùng (CPI) chỉ tăng 2.77% svck.\n    - **Đánh giá tác động:** Tích cực. Các số liệu vĩ mô cho thấy nền kinh tế Việt Nam đang trên đà phục hồi mạnh mẽ và ổn định, với động lực đến từ cả tiêu dùng nội địa (bán lẻ, du lịch) và sản xuất công nghiệp. Việc lạm phát được kiểm soát tốt tạo dư địa cho Chính phủ tiếp tục các chính sách hỗ trợ tăng trưởng. Điều này củng cố niềm tin của nhà đầu tư vào triển vọng kinh tế, thúc đẩy dòng tiền vào thị trường chứng khoán, đặc biệt là các nhóm ngành hưởng lợi từ tiêu dùng và sản xuất.\n\n- **Tin tức 2: Xuất nhập khẩu Việt Nam 10 tháng đầu năm 2025 đạt kỷ lục, Mỹ là thị trường xuất khẩu lớn nhất.**\n    - **Nội dung chính:** Trong 10 tháng năm 2025, kim ngạch xuất khẩu hàng Việt Nam sang thị trường Mỹ đã vượt 126 tỷ USD, tăng 28% so với cùng kỳ năm 2024 và là mức cao nhất từ trước tới nay. Các lĩnh vực công nghiệp chế biến - chế tạo, đặc biệt là điện tử, máy móc và công nghệ, đóng vai trò mũi nhọn. Tổng kim ngạch xuất nhập khẩu hàng hóa của cả nước đạt khoảng 761,4 tỷ USD, tăng 17,5% svck, trong đó xuất khẩu đạt 390 tỷ USD (tăng 16%) và nhập khẩu đạt 371,3 tỷ USD (tăng 18,7%). Thu ngân sách từ hoạt động xuất – nhập khẩu đạt gần 380.000 tỷ đồng, tăng khoảng 32.400 tỷ đồng svck. Thương mại với các nước thành viên CPTPP cũng tăng trưởng bùng nổ, đạt 102,8 tỷ USD, tăng 20,6% svck.\n    - **Đánh giá tác động:** Tích cực. Hoạt động xuất nhập khẩu tăng trưởng mạnh mẽ, đặc biệt là xuất khẩu sang các thị trường lớn như Mỹ và khối CPTPP, cho thấy khả năng phục hồi và cạnh tranh của kinh tế Việt Nam trên trường quốc tế. Điều này không chỉ mang lại nguồn thu ngoại tệ dồi dào mà còn thúc đẩy sản xuất trong nước, tạo việc làm và tăng trưởng GDP. Các doanh nghiệp xuất khẩu sẽ hưởng lợi trực tiếp, kéo theo sự quan tâm của nhà đầu tư đến nhóm cổ phiếu này.\n\n- **Tin tức 3: Kỳ vọng lãi suất Fed có sự dịch chuyển mạnh mẽ, tín hiệu cắt giảm lãi suất xuất hiện.**\n    - **Nội dung chính:** Kỳ vọng về khả năng Cục Dự trữ Liên bang Mỹ (Fed) sẽ giảm lãi suất trong cuộc họp sắp tới đã có những thay đổi mạnh mẽ theo cả hai chiều hướng, phản ánh sự không chắc chắn của thị trường về lộ trình chính sách tiền tệ. Tuy nhiên, một quan chức cấp cao của Fed đã đưa ra tín hiệu về khả năng cơ quan này có thể tiến hành cắt giảm lãi suất ngay trong cuộc họp tháng 12 tới, khiến thị trường chứng khoán Mỹ hồi phục mạnh mẽ.\n    - **Đánh giá tác động:** Trung lập đến Tích cực. Mặc dù có sự không chắc chắn về lộ trình chính sách của Fed, nhưng tín hiệu về khả năng cắt giảm lãi suất (dù chỉ là từ một quan chức) đã tạo ra tâm lý tích cực cho thị trường chứng khoán Mỹ. Nếu Fed thực sự nới lỏng chính sách tiền tệ, điều này sẽ tạo ra một môi trường thuận lợi hơn cho các thị trường mới nổi như Việt Nam, thu hút dòng vốn đầu tư nước ngoài và giảm áp lực tỷ giá. Tuy nhiên, nhà đầu tư cần theo dõi sát các thông tin chính thức từ Fed để đánh giá rủi ro biến động. Trong ngắn hạn, tín hiệu nới lỏng có thể tạo tâm lý tích cực cho thị trường toàn cầu và Việt Nam.', '[TECHNICAL REPORT]: ![Biểu đồ BID](charts/BID_20251124.png)\n\n**Phân tích Kỹ thuật Chuyên sâu cho BID**\n\n**1. Xu hướng hiện tại:**\n*   **Xu hướng dài hạn:** GIẢM\n*   **Xu hướng trung hạn:** GIẢM\n*   Nhận định: BID đang trong một xu hướng giảm rõ ràng cả về dài hạn và trung hạn, cho thấy áp lực bán vẫn đang chiếm ưu thế trên thị trường.\n\n**2. Vị thế giá so với các đường MA:**\n*   Giá đóng cửa gần nhất của BID là 37.65 VND.\n*   Dựa trên biểu đồ, giá hiện tại đang nằm dưới cả đường SMA20 (đường màu xanh) và SMA50 (đường màu đỏ), củng cố thêm cho nhận định về xu hướng giảm. Điều này cho thấy động lực tăng giá ngắn hạn và trung hạn đều yếu.\n\n**3. RSI:**\n*   Chỉ số RSI hiện tại là **46.75**.\n*   Nhận định: RSI đang ở vùng TRUNG TÍNH (không quá mua >70, không quá bán <30). Điều này cho thấy không có áp lực mua hoặc bán quá mức từ chỉ báo này tại thời điểm hiện tại, và giá có thể tiếp tục di chuyển theo xu hướng chính.\n\n**4. MACD:**\n*   MACD đang cho tín hiệu **TÍCH CỰC**.\n*   Nhận định: Mặc dù xu hướng chung là giảm, tín hiệu MACD tích cực có thể báo hiệu một sự hồi phục ngắn hạn hoặc một nhịp điều chỉnh tăng trong xu hướng giảm. Tuy nhiên, cần kết hợp với các yếu tố khác để xác nhận.\n\n**5. Các vùng Hỗ trợ cứng và Kháng cự cứng:**\n*   **Kháng cự cứng:**\n    *   R1: 40 VND\n    *   R2: 45 VND\n*   **Hỗ trợ cứng:**\n    *   S1: 34 VND\n    *   S2: 32 VND\n    *   S3: 31 VND\n*   Nhận định: Giá hiện tại (37.65 VND) đang nằm giữa vùng hỗ trợ S1 (34 VND) và kháng cự R1 (40 VND). Vùng 34 VND là một ngưỡng hỗ trợ quan trọng cần theo dõi.\n\n**Nhận định chung và Khuyến nghị:**\n\nBID đang trong xu hướng giảm rõ ràng cả về dài hạn và trung hạn, với giá nằm dưới các đường MA quan trọng. Mặc dù MACD cho tín hiệu tích cực và RSI ở vùng trung tính, nhưng xu hướng chính vẫn là giảm.\n\nVới vai trò là CMT, tôi luôn ưu tiên giao dịch theo xu hướng. Việc mua vào trong xu hướng giảm tiềm ẩn rủi ro cao. Giá hiện tại đang nằm trên vùng hỗ trợ S1 (34 VND) nhưng vẫn dưới kháng cự R1 (40 VND).\n\n**Khuyến nghị:** **CHỜ MUA**\n\n*   **Lý do:** Xu hướng giảm vẫn đang chiếm ưu thế. Mặc dù có tín hiệu MACD tích cực, nhưng chưa đủ mạnh để đảo ngược xu hướng chính.\n*   **Chiến lược:** Nên chờ đợi giá tiếp cận các vùng hỗ trợ mạnh hơn như S2 (32 VND) hoặc S3 (31 VND) và xuất hiện các tín hiệu đảo chiều rõ ràng (ví dụ: mô hình nến đảo chiều tăng, khối lượng giao dịch tăng đột biến tại vùng hỗ trợ) trước khi xem xét vị thế mua.\n*   **Rủi ro:** Nếu giá phá vỡ S1 (34 VND), xu hướng giảm có thể tiếp tục sâu hơn.', '[FINANCIAL REPORT]: Nhận định chung về vị thế tài chính\nBID có ROE 17.80%, cho thấy khả năng sinh lời trên vốn chủ sở hữu khá tốt. So với các đối thủ lớn như VCB (17.00%), CTG (21.60%), MBB (20.80%), BID đang ở mức cạnh tranh, tuy nhiên vẫn thấp hơn CTG và MBB. Việc thiếu dữ liệu P/E và P/B khiến việc đánh giá định giá thị trường của BID so với các đối thủ trở nên khó khăn.\n\nChuyển động đối thủ\n\nVCB (Ngân hàng TMCP Ngoại thương Việt Nam):\n1.  **Tăng vốn và trả cổ tức:** Vietcombank đã hoàn tất tăng vốn lên hơn 83.000 tỷ đồng và sắp chi hơn 3.700 tỷ đồng trả cổ tức bằng tiền mặt (450 đồng/cổ phiếu) cho năm 2024. Điều này cho thấy ngân hàng có nền tảng tài chính vững chắc và khả năng chia sẻ lợi nhuận với cổ đông.\n2.  **Ưu đãi lãi suất cho vay:** Từ ngày 01/01/2024, Vietcombank triển khai chương trình ưu đãi lãi suất cho vay ngắn hạn sản xuất kinh doanh với quy mô lên tới 160.000 tỷ đồng, nhằm hỗ trợ doanh nghiệp và thúc đẩy tăng trưởng tín dụng.\n3.  **Duy trì vị thế môi trường làm việc tốt nhất:** Vietcombank tiếp tục giữ vững vị thế Ngân hàng có môi trường làm việc tốt nhất Việt Nam, cho thấy sự chú trọng vào phát triển nguồn nhân lực và văn hóa doanh nghiệp.\n\nCTG (Ngân hàng TMCP Công Thương Việt Nam - VietinBank):\n1.  **Chào bán cổ phiếu SGP:** VietinBank công bố thông tin về việc chào bán cổ phiếu SGP của Công ty cổ phần Cảng Sài Gòn (Saigon Port), có thể là một động thái tái cơ cấu danh mục đầu tư hoặc thu về vốn.\n2.  **Trả cổ tức tiền mặt:** VietinBank sẽ chi hơn 2.400 tỷ đồng trả cổ tức tiền mặt năm 2024 (450 đồng/cổ phiếu), sau lần gần nhất cách đây 4 năm. Điều này cho thấy sự cải thiện về khả năng chi trả cổ tức và niềm tin vào kết quả kinh doanh.\n3.  **Kỷ niệm 15 năm niêm yết:** Năm 2024 đánh dấu 15 năm mã cổ phiếu CTG của VietinBank niêm yết trên sàn chứng khoán Việt Nam, cho thấy quá trình phát triển mạnh mẽ và bền vững của ngân hàng trên thị trường.\n\nMBB (Ngân hàng TMCP Quân đội):\n1.  **Kết quả kinh doanh tích cực:** MB công bố kết quả kinh doanh hợp nhất 9 tháng đầu năm 2025 ghi nhận tăng trưởng tích cực trên cả quy mô và lợi nhuận, với lợi nhuận trước thuế đạt hơn 23.000 tỷ đồng, tăng 12% so với cùng kỳ.\n2.  **Trả cổ tức:** MB dự kiến trả cổ tức năm 2024 bằng cổ phiếu (tỷ lệ 100:32) và bằng tiền mặt (300 đồng/cổ phiếu), thể hiện cam kết với cổ đông và sự tự tin vào dòng tiền.\n3.  **Tất toán trái phiếu và kế hoạch bán cổ phiếu MBS:** MB đã tất toán lô trái phiếu 500 tỷ đồng sau 2 năm phát hành. Đồng thời, MBB đăng ký bán ra 60 triệu cổ phiếu MBS (CTCP Chứng khoán MB), có thể nhằm tái cơ cấu danh mục đầu tư hoặc tối ưu hóa vốn.\n\nBảng so sánh chỉ số tài chính\n\n| Chỉ số | BID | VCB | CTG | MBB |\n| --- | --- | --- | --- | --- |\n| **P/E** | N/A | N/A | N/A | N/A |\n| **P/B** | N/A | N/A | N/A | N/A |\n| **ROE** | 17.80% | 17.00% | 21.60% | 20.80% |', '[RAG DATA]: Dưới đây là số liệu của BID được trích xuất từ thông tin cung cấp:\n\n*   **Doanh thu:**\n    *   Thu nhập lãi và các khoản thu nhập tương tự (Từ 01/01/2025 đến 30/9/2025): 111,258,037 Triệu VND (Trang 27)\n*   **Lợi nhuận:**\n    *   Lợi nhuận sau thuế hợp nhất (Quý 3 năm 2025): 6.086.910 triệu VND (Trang 36)\n*   **Tổng tài sản:**\n    *   TỔNG TÀI SẢN CÓ (tại ngày 30/09/2025): 3,071,970,196 Triệu VND (Trang 4)\n*   **Nợ:**\n    *   Tổng nợ phải trả (tại ngày 30/09/2025): 2,903,983,495 Triệu VND (Trang 30)\n*   **Dòng tiền (Từ 01/01/2025 đến 30/09/2025):**\n    *   Lưu chuyển tiền thuần từ hoạt động kinh doanh: 111,840,462 Triệu VND (Trang 8)\n    *   Lưu chuyển tiền thuần từ hoạt động đầu tư: (1,286,335) Triệu VND (Trang 8)\n    *   Lưu chuyển tiền thuần từ hoạt động tài chính: 14,306,655 Triệu VND (Trang 8)\n    *   Lưu chuyển tiền thuần trong kỳ: 124,860,782 Triệu VND (Trang 8)']","# 🇻🇳 BÁO CÁO PHÂN TÍCH: BID
*(Ngày: 24/11/2025)*

## 1. 📰 Điểm tin Vĩ mô & Ngành

Bối cảnh kinh tế Việt Nam 11 tháng đầu năm 2025 cho thấy sự phục hồi mạnh mẽ và toàn diện. Tăng trưởng được thúc đẩy bởi cả khu vực dịch vụ (bán lẻ tăng 8.27%, du lịch quốc tế tăng 38.8%) và sản xuất công nghiệp (tăng gần 9%). Đáng chú ý, lạm phát được kiểm soát tốt ở mức thấp (CPI tăng 2.77%) tạo dư địa cho các chính sách hỗ trợ tăng trưởng.

Hoạt động ngoại thương tiếp tục là điểm sáng với kim ngạch xuất khẩu sang Mỹ trong 10 tháng đạt kỷ lục 126 tỷ USD. Điều này không chỉ củng cố nguồn thu ngoại tệ mà còn khẳng định sức cạnh tranh của hàng hóa Việt Nam, tạo điều kiện thuận lợi cho các doanh nghiệp trong nước, qua đó tác động tích cực đến ngành ngân hàng.

Trên bình diện quốc tế, thị trường đang có những kỳ vọng về việc Fed có thể sớm cắt giảm lãi suất. Nếu điều này xảy ra, áp lực lên tỷ giá sẽ giảm và dòng vốn ngoại có thể quay trở lại các thị trường mới nổi như Việt Nam, tạo tâm lý tích cực cho thị trường chứng khoán.

## 2. 🏢 Sức khỏe Tài chính & Vị thế

- **Kết quả kinh doanh:** Theo BCTC hợp nhất, 9 tháng đầu năm 2025, BID ghi nhận thu nhập lãi và các khoản tương tự đạt **111,258 tỷ đồng**. Lợi nhuận sau thuế riêng quý 3/2025 đạt **6,087 tỷ đồng**. Tại ngày 30/09/2025, tổng tài sản của ngân hàng đạt **3,071,970 tỷ đồng** và tổng nợ phải trả là **2,903,983 tỷ đồng**. Dòng tiền thuần trong kỳ 9 tháng ghi nhận dương **124,861 tỷ đồng**, cho thấy hoạt động kinh doanh tạo ra dòng tiền tốt.

- **Định giá:** Chỉ số ROE của BID đạt 17.80%, một mức sinh lời trên vốn chủ sở hữu khá tốt và cạnh tranh trong ngành, dù vẫn thấp hơn một chút so với các đối thủ như CTG (21.60%) và MBB (20.80%). Việc thiếu dữ liệu P/E và P/B tại thời điểm này gây khó khăn cho việc đánh giá sâu hơn về định giá thị trường.

- **Chuyển động Đối thủ:** Ngành ngân hàng đang chứng kiến sự cạnh tranh mạnh mẽ. VCB và CTG đều thực hiện trả cổ tức bằng tiền mặt, cho thấy nền tảng tài chính vững chắc. MBB công bố lợi nhuận 9 tháng tăng trưởng 12% và cũng có kế hoạch trả cổ tức bằng cả tiền và cổ phiếu. Các động thái này cho thấy các ngân hàng lớn đều đang tập trung vào việc tối ưu hóa hiệu quả hoạt động và gia tăng giá trị cho cổ đông.

**Bảng so sánh chỉ số tài chính**

| Chỉ số | BID | VCB | CTG | MBB |
| --- | --- | --- | --- | --- |
| **ROE** | 17.80% | 17.00% | 21.60% | 20.80% |

## 3. 📈 Góc nhìn Kỹ thuật

- **Xu hướng & Chỉ báo:** Cổ phiếu BID đang trong một xu hướng giảm rõ ràng cả trong trung và dài hạn. Giá hiện tại (37,650 đồng) đang vận động bên dưới các đường trung bình động quan trọng (SMA20, SMA50), xác nhận áp lực bán vẫn đang chiếm ưu thế. Chỉ báo RSI ở mức 46.75 (vùng trung tính), trong khi MACD cho tín hiệu tích cực nhẹ, có thể báo hiệu một nhịp hồi phục kỹ thuật ngắn hạn.

- **Vùng giá quan trọng:**
    - **Vùng kháng cự:** 40,000 đồng.
    - **Vùng hỗ trợ:** 34,000 đồng (hỗ trợ gần nhất) và 31,000 - 32,000 đồng (hỗ trợ mạnh hơn).

![Biểu đồ BID](charts/BID_20251124.png)

## 4. 🎯 KẾT LUẬN & KHUYẾN NGHỊ

**Khuyến nghị: CHỜ MUA**

**Luận điểm:**
1.  **Nền tảng cơ bản tốt:** BID là một trong những ngân hàng hàng đầu với kết quả kinh doanh ổn định, được hỗ trợ bởi bối cảnh vĩ mô trong nước đang phục hồi tích cực.
2.  **Rủi ro kỹ thuật ngắn hạn:** Mặc dù nền tảng cơ bản vững chắc, xu hướng giá cổ phiếu hiện tại đang là giảm. Việc mua vào khi xu hướng giảm chưa có dấu hiệu kết thúc tiềm ẩn rủi ro cao. Tín hiệu tích cực từ MACD chưa đủ mạnh để xác nhận sự đảo chiều.

**Chiến lược hành động:** Nhà đầu tư nên kiên nhẫn quan sát, **chờ đợi cổ phiếu điều chỉnh về các vùng hỗ trợ mạnh hơn tại 32,000 - 34,000 đồng**. Chỉ xem xét giải ngân khi xuất hiện các tín hiệu đảo chiều đáng tin cậy tại vùng giá này (ví dụ: mẫu nến tăng giá mạnh, khối lượng giao dịch đột biến).",0.8714285714285714,0.6318601416977029
AUTO_ANALYSIS_CTG_3,Phân tích tổng hợp cổ phiếu CTG,"['[MARKET REPORT]: - **Tin tức 1: VN-Index tăng mạnh nhờ nhóm cổ phiếu Vingroup, nhưng thị trường ""xanh vỏ đỏ lòng"" và thanh khoản thấp kỷ lục.**\n    *   **Nội dung:** Phiên giao dịch ngày 24/11/2025, VN-Index tăng hơn 13 điểm, đóng cửa tại 1.667,98 điểm. Đà tăng này chủ yếu được dẫn dắt bởi nhóm cổ phiếu Vingroup (VIC, VHM, VRE, VPL), đóng góp tới 14,7 điểm. Tuy nhiên, số mã giảm nhiều hơn số mã tăng, cho thấy sự phân hóa mạnh của thị trường. Thanh khoản giao dịch chạm mức thấp nhất trong 6 tháng qua, và khối ngoại tiếp tục bán ròng trên toàn thị trường.\n    *   **Đánh giá tác động:** Tiêu cực. Mặc dù chỉ số tăng điểm, nhưng việc tăng điểm tập trung vào một nhóm cổ phiếu lớn (Vingroup) trong khi phần lớn thị trường giảm điểm (""xanh vỏ đỏ lòng"") và thanh khoản thấp cho thấy dòng tiền không lan tỏa. Điều này phản ánh tâm lý thận trọng của nhà đầu tư và tiềm ẩn rủi ro điều chỉnh nếu nhóm cổ phiếu dẫn dắt mất đà. Việc khối ngoại bán ròng cũng là một tín hiệu tiêu cực về dòng vốn.\n\n- **Tin tức 2: Tỷ giá USD/VND trên thị trường tự do tiếp tục tăng cao, áp sát mốc 28.000 đồng/USD.**\n    *   **Nội dung:** Ngày 24/11/2025, tỷ giá USD/VND trên thị trường tự do tiếp tục đà tăng mạnh, áp sát đỉnh cũ và được ghi nhận ở mức mua vào khoảng 27.750 - 27.800 đồng/USD và bán ra khoảng 27.870 - 27.900 đồng/USD. Tỷ giá trung tâm do Ngân hàng Nhà nước công bố cũng tăng 8 đồng lên 25.144 VND/USD. Các ngân hàng thương mại cũng đồng loạt điều chỉnh tăng giá bán USD.\n    *   **Đánh giá tác động:** Tiêu cực. Tỷ giá tăng cao gây áp lực lên chi phí nhập khẩu, có thể đẩy lạm phát tăng và ảnh hưởng đến lợi nhuận của các doanh nghiệp có nợ vay hoặc nguyên liệu nhập khẩu bằng USD. Điều này cũng có thể khiến Ngân hàng Nhà nước phải can thiệp bằng các biện pháp thắt chặt tiền tệ, gây áp lực lên lãi suất và thanh khoản thị trường, không có lợi cho chứng khoán.\n\n- **Tin tức 3: Giao dịch của các quỹ đầu tư nghiêng về phía bán trong tuần 17-21/11/2025 với khối lượng thấp.**\n    *   **Nội dung:** Trong tuần từ 17-21/11/2025, các quỹ đầu tư có xu hướng bán ròng trong bối cảnh VN-Index dao động quanh 1.620–1.650 điểm, trùng với tuần đáo hạn hợp đồng tương lai VN30. Khối lượng giao dịch từ các quỹ này khá thấp, chỉ vài chục đến vài trăm nghìn cổ phiếu mỗi lệnh.\n    *   **Đánh giá tác động:** Tiêu cực. Việc các quỹ đầu tư (thường là nhà đầu tư tổ chức lớn) bán ròng, dù với khối lượng thấp, cho thấy họ đang có xu hướng rút vốn hoặc thận trọng với triển vọng thị trường. Điều này có thể tạo áp lực lên tâm lý nhà đầu tư cá nhân và hạn chế đà tăng của thị trường trong ngắn hạn.', '[TECHNICAL REPORT]: ![Biểu đồ CTG](charts/CTG_20251124.png)\n\n### Phân tích Kỹ thuật Chuyên sâu cho CTG (Ngày 2025-11-24)\n\n**1. Xu hướng hiện tại:**\n*   **Xu hướng dài hạn:** TĂNG.\n*   **Xu hướng trung hạn:** GIẢM.\n*   Giá đóng cửa gần nhất là 48.80 VND. Giá đang nằm trên MA20 (48.50) và MA200 (45.10), nhưng dưới MA50 (49.20). Điều này cho thấy CTG đang trong một xu hướng tăng dài hạn nhưng đang trải qua giai đoạn điều chỉnh hoặc tích lũy trong trung hạn.\n\n**2. Vị thế giá so với các đường MA:**\n*   Giá (48.80) đang nằm trên MA20 (48.50), cho thấy áp lực bán ngắn hạn đã giảm bớt và có dấu hiệu phục hồi.\n*   Giá (48.80) đang nằm dưới MA50 (49.20), cho thấy xu hướng trung hạn vẫn còn yếu và MA50 đang đóng vai trò là kháng cự.\n*   Giá (48.80) đang nằm trên MA200 (45.10), củng cố nhận định về xu hướng tăng dài hạn.\n\n**3. RSI:**\n*   RSI hiện tại là 42.77, nằm trong vùng TRUNG TÍNH (30-70). Điều này cho thấy cổ phiếu không bị quá mua hay quá bán, có dư địa cho cả hai chiều.\n\n**4. MACD:**\n*   MACD đang cho tín hiệu TÍCH CỰC. Điều này ủng hộ khả năng giá có thể tăng trở lại trong thời gian tới.\n\n**5. Các vùng Hỗ trợ cứng và Kháng cự cứng:**\n*   **Kháng cự:**\n    *   R1: 49 VND (Kháng cự gần nhất, trùng với MA50)\n    *   R2: 52 VND\n    *   R3: 56 VND\n*   **Hỗ trợ:**\n    *   S1: 48 VND (Hỗ trợ gần nhất)\n    *   S2: 43 VND\n    *   S3: 40 VND\n\n**Nhận định:**\nCTG đang ở trong một giai đoạn khá nhạy cảm. Mặc dù xu hướng dài hạn vẫn là tăng và MACD cho tín hiệu tích cực, giá đang đối mặt với kháng cự mạnh tại vùng 49 VND (gần MA50). Việc giá nằm trên MA20 nhưng dưới MA50 cho thấy sự lưỡng lự của thị trường. RSI trung tính không đưa ra tín hiệu rõ ràng về quá mua hay quá bán.\n\n**Khuyến nghị:** CHỜ MUA.\n\n**Giải thích:**\n*   **CHỜ MUA:** Nên chờ đợi tín hiệu rõ ràng hơn.\n    *   Nếu giá vượt qua vùng kháng cự 49 VND (và MA50) một cách dứt khoát với khối lượng giao dịch lớn, đó sẽ là tín hiệu MUA mạnh mẽ cho xu hướng tăng tiếp diễn.\n    *   Hoặc, nếu giá điều chỉnh về vùng hỗ trợ 48 VND và có tín hiệu bật tăng trở lại (ví dụ: nến rút chân, khối lượng tăng), có thể xem xét MUA tại vùng này.\n*   **BÁN:** Chưa có tín hiệu BÁN rõ ràng cho nhà đầu tư dài hạn. Tuy nhiên, nếu giá phá vỡ vùng hỗ trợ 48 VND và tiếp tục giảm, có thể xem xét giảm tỷ trọng để quản lý rủi ro.', '[FINANCIAL REPORT]: Nhận định chung về vị thế tài chính:\nCTG hiện đang thể hiện khả năng sinh lời trên vốn chủ sở hữu (ROE) rất tốt, đạt 21.60%, cao hơn so với các đối thủ cạnh tranh chính như VCB (17.00%), BID (17.80%) và MBB (20.80%). Điều này cho thấy CTG đang sử dụng vốn của cổ đông một cách hiệu quả để tạo ra lợi nhuận. Tuy nhiên, việc thiếu dữ liệu về P/E và P/B khiến việc đánh giá định giá thị trường của CTG và các đối thủ trở nên khó khăn. Nhìn chung, ngành ngân hàng đang có ROE khá tốt, cho thấy sự ổn định và hiệu quả trong hoạt động kinh doanh.\n\nChuyển động đối thủ:\n\nVCB (Ngân hàng TMCP Ngoại thương Việt Nam):\n*   Vietcombank sắp chi hơn 3,700 tỷ trả cổ tức bằng tiền mặt.\n*   VCB hoàn tất tăng vốn lên hơn 83.000 tỷ đồng và đã chia cổ tức theo tỷ lệ 1.000:495.\n*   Từ ngày 01/01/2024, Vietcombank triển khai chương trình ưu đãi lãi suất cho vay ngắn hạn sản xuất kinh doanh với quy mô lên tới 160.000 tỷ đồng.\n\nBID (Ngân hàng TMCP Đầu tư và Phát triển Việt Nam):\n*   BIDV đặt mục tiêu tăng lãi mạnh, lên 20.600 tỷ đồng trong năm nay, tăng 52% so với năm ngoái.\n*   BID dự kiến chi hơn 3.159 tỷ đồng để trả cổ tức tiền mặt cho cổ đông.\n*   BIDV sẽ thanh toán cổ tức 2024 với tỷ lệ 4,5%, tương ứng 450 đồng/cổ phiếu.\n\nMBB (Ngân hàng TMCP Quân đội):\n*   MB báo lãi hơn 23.000 tỷ đồng, tăng 12% so với cùng kỳ.\n*   CTCP Chứng khoán MB (MBS) vừa hoàn tất chào bán 68,73 triệu cổ phiếu, thu về 687,3 tỷ đồng và nâng vốn điều lệ lên 6.587,2 tỷ đồng.\n*   MBB đăng ký bán ra 60 triệu cổ phiếu MBS.\n\nBảng so sánh chỉ số tài chính:\n\n| Chỉ số | CTG | VCB | BID | MBB |\n| --- | --- | --- | --- | --- |\n| **P/E** | N/A | N/A | N/A | N/A |\n| **P/B** | N/A | N/A | N/A | N/A |\n| **ROE** | 21.60% | 17.00% | 17.80% | 20.80% |', '[RAG DATA]: CTG:\n*   **Doanh thu:** NO_DATA_FOUND\n*   **Lợi nhuận:**\n    *   Lợi nhuận sau thuế TNDN (từ 01/01/2025 đến hết 30/09/2025): 23.763.855 triệu đồng (trang 6)\n    *   Lợi nhuận sau thuế TNDN (từ 01/01/2024 đến hết 30/09/2024): 15.604.395 triệu đồng (trang 6)\n*   **Tổng tài sản:**\n    *   Tổng tài sản Có (Ngày 30 tháng 09 năm 2025): 2.761.550.938 triệu đồng (trang 3)\n    *   Tổng tài sản Có (Ngày 31 tháng 12 năm 2024): 2.385.387.732 triệu đồng (trang 3)\n*   **Nợ:**\n    *   Tổng Nợ phải trả (Ngày 30 tháng 09 năm 2025): 2.591.669.938 triệu đồng (trang 4)\n    *   Tổng Nợ phải trả (Ngày 31 tháng 12 năm 2024): 2.236.883.024 triệu đồng (trang 4)\n*   **Dòng tiền:**\n    *   Lưu chuyển tiền thuần từ hoạt động kinh doanh (từ 01/01/2025 đến 30/09/2025): 85.022.836 triệu đồng (trang 8)\n    *   Lưu chuyển tiền thuần từ hoạt động kinh doanh (từ 01/01/2024 đến 30/09/2024): 100.518.480 triệu đồng (trang 8)\n    *   Lưu chuyển tiền thuần từ hoạt động đầu tư (từ 01/01/2025 đến 30/09/2025): (1.154.686) triệu đồng (trang 8)\n    *   Lưu chuyển tiền thuần từ hoạt động đầu tư (từ 01/01/2024 đến 30/09/2024): (606.368) triệu đồng (trang 8)\n    *   Lưu chuyển tiền thuần từ hoạt động tài chính (từ 01/01/2025 đến 30/09/2025): - triệu đồng (trang 8)\n    *   Lưu chuyển tiền thuần từ hoạt động tài chính (từ 01/01/2024 đến 30/09/2024): 1.537 triệu đồng (trang 8)\n    *   Lưu chuyển tiền thuần trong kỳ (từ 01/01/2025 đến 30/09/2025): 83.868.150 triệu đồng (trang 9)\n    *   Lưu chuyển tiền thuần trong kỳ (từ 01/01/2024 đến 30/09/2024): 99.913.649 triệu đồng (trang 9)']","# 🇻🇳 BÁO CÁO PHÂN TÍCH: CTG
*(Ngày: 24/11/2025)*

## 1. 📰 Điểm tin Vĩ mô & Ngành

Thị trường chứng khoán đang trong giai đoạn nhạy cảm và tiềm ẩn rủi ro. Mặc dù chỉ số VN-Index tăng điểm trong phiên gần nhất, đà tăng này chủ yếu đến từ một vài cổ phiếu vốn hóa lớn, trong khi phần lớn thị trường chìm trong sắc đỏ (""xanh vỏ đỏ lòng""). Thanh khoản ở mức thấp kỷ lục 6 tháng và khối ngoại liên tục bán ròng cho thấy tâm lý nhà đầu tư đang rất thận trọng.

Thêm vào đó, áp lực vĩ mô đang gia tăng khi tỷ giá USD/VND trên thị trường tự do liên tục leo thang, áp sát mốc 28,000. Điều này có thể gây sức ép lên lạm phát và buộc Ngân hàng Nhà nước phải có những biện pháp thắt chặt tiền tệ, ảnh hưởng tiêu cực đến thanh khoản và lãi suất trên thị trường.

## 2. 🏢 Sức khỏe Tài chính & Vị thế

- **Kết quả kinh doanh:** CTG ghi nhận kết quả kinh doanh 9 tháng đầu năm 2025 cực kỳ ấn tượng. Lợi nhuận sau thuế đạt **23,764 tỷ đồng**, tăng trưởng mạnh mẽ **52.3%** so với cùng kỳ năm 2024 (15,604 tỷ đồng). Tổng tài sản tính đến cuối Quý 3/2025 đạt **2,761,551 tỷ đồng**, tăng 15.8% so với đầu năm.

- **Định giá & Hiệu quả hoạt động:** Chỉ số sinh lời trên vốn chủ sở hữu (ROE) của CTG đang ở mức **21.60%**, không chỉ cao mà còn dẫn đầu so với các đối thủ lớn trong ngành như VCB (17.00%) và BID (17.80%). Điều này cho thấy VietinBank đang sử dụng vốn của cổ đông một cách rất hiệu quả để tạo ra lợi nhuận.

- **Chuyển động Đối thủ:** Ngành ngân hàng vẫn đang sôi động với các kế hoạch trả cổ tức bằng tiền mặt (VCB, BID) và tăng vốn (VCB, MBS). Các ngân hàng lớn đều đặt mục tiêu tăng trưởng lợi nhuận cao, cho thấy sự cạnh tranh và kỳ vọng tích cực vào triển vọng ngành.

**Bảng so sánh hiệu quả hoạt động:**

| Chỉ số | CTG | VCB | BID | MBB |
| --- | --- | --- | --- | --- |
| **ROE** | **21.60%** | 17.00% | 17.80% | 20.80% |

## 3. 📈 Góc nhìn Kỹ thuật

- **Xu hướng & Chỉ báo:** Cổ phiếu CTG vẫn đang duy trì xu hướng tăng trong dài hạn (giá trên MA200). Tuy nhiên, trong trung hạn, cổ phiếu đang trong giai đoạn điều chỉnh và gặp khó khăn. Giá hiện tại đang kẹp giữa MA20 (hỗ trợ) và MA50 (kháng cự), cho thấy sự giằng co và thiếu quyết đoán của dòng tiền. Chỉ báo MACD cho tín hiệu tích cực nhưng RSI vẫn ở mức trung tính, chưa xác nhận phe mua chiếm ưu thế.

- **Vùng giá quan trọng:**
    *   **Kháng cự mạnh:** **49,000 đồng/cp** (trùng với đường MA50).
    *   **Hỗ trợ gần nhất:** **48,000 đồng/cp**.

![Biểu đồ CTG](charts/CTG_20251124.png)

## 4. 🎯 KẾT LUẬN & KHUYẾN NGHỊ

**Khuyến nghị: CHỜ MUA**

**Luận điểm:**

1.  **Nền tảng cơ bản xuất sắc:** CTG đang có một năm kinh doanh đột phá với mức tăng trưởng lợi nhuận trên 52% và chỉ số ROE dẫn đầu ngành. Đây là yếu tố nền tảng vững chắc cho tiềm năng tăng giá trong dài hạn.

2.  **Rủi ro thị trường và kỹ thuật ngắn hạn:** Mặc dù nội tại doanh nghiệp rất tốt, bối cảnh thị trường chung đang không thuận lợi (thanh khoản thấp, tâm lý thận trọng). Về mặt kỹ thuật, CTG đang đối mặt với vùng kháng cự quan trọng 49,000 đồng và chưa có tín hiệu bứt phá rõ ràng.

Do đó, chiến lược phù hợp nhất lúc này là **CHỜ MUA**. Nhà đầu tư nên kiên nhẫn quan sát và chỉ giải ngân khi:
*   **Kịch bản 1:** Cổ phiếu vượt dứt khoát vùng kháng cự **49,000 đồng** với khối lượng giao dịch tăng mạnh, xác nhận quay trở lại xu hướng tăng.
*   **Kịch bản 2:** Cổ phiếu điều chỉnh về vùng hỗ trợ **48,000 đồng** và xuất hiện các tín hiệu đảo chiều đáng tin cậy (nến rút chân, lực mua gia tăng).",0.9333333333333333,0.6292934282125021
AUTO_ANALYSIS_DGC_4,Phân tích tổng hợp cổ phiếu DGC,"['[MARKET REPORT]: - **Tin tức 1: Chủ tịch Fed New York John Williams phát biểu có thể giảm lãi suất thêm (ngày 21/11/2025)**\n    - **Đánh giá tác động:** Tích cực. Phát biểu này của một quan chức cấp cao Cục Dự trữ Liên bang Mỹ (Fed) cho thấy khả năng Fed sẽ nới lỏng chính sách tiền tệ trong thời gian tới, với lý do thị trường lao động đang yếu đi. Điều này làm giảm áp lực lên tỷ giá USD/VND, tạo điều kiện thuận lợi hơn cho Ngân hàng Nhà nước Việt Nam trong việc điều hành chính sách tiền tệ, có thể giảm lãi suất điều hành hoặc giữ ổn định ở mức thấp. Dòng vốn ngoại có thể quay trở lại các thị trường mới nổi như Việt Nam khi lãi suất toàn cầu có xu hướng giảm, hỗ trợ tâm lý nhà đầu tư và thanh khoản thị trường chứng khoán.\n\n- **Tin tức 2: Tín dụng tăng mạnh và sức ép thanh khoản của hệ thống ngân hàng (Báo cáo tài chính quý 3/2025)**\n    - **Đánh giá tác động:** Tiêu cực nhẹ đến trung lập. Báo cáo cho thấy huy động vốn của 27 ngân hàng niêm yết chỉ tăng 10.2% so với đầu năm 2025, trong khi 21 ngân hàng có tốc độ tăng trưởng dư nợ cho vay cao hơn tăng trưởng tiền gửi khách hàng. Điều này cho thấy hệ thống ngân hàng đang đối mặt với sức ép về thanh khoản khi tín dụng tăng trưởng nhanh hơn huy động. Nếu tình trạng này tiếp diễn, các ngân hàng có thể phải tăng lãi suất huy động để thu hút tiền gửi, từ đó có thể đẩy lãi suất cho vay lên cao hơn, ảnh hưởng đến chi phí vốn của doanh nghiệp và khả năng hấp thụ vốn của nền kinh tế. Tuy nhiên, tỷ lệ bao phủ nợ xấu quý 3 tiếp tục được cải thiện là một điểm sáng, cho thấy chất lượng tài sản của ngân hàng đang được kiểm soát tốt hơn.\n\n- **Tin tức 3: Dự thảo Nghị định về tài sản mã hóa: Tổ chức vi phạm có thể bị phạt đến 200 triệu đồng (Nghị quyết 05/2025/NQ-CP ban hành 09/09/2025, được nhắc lại trong bản tin 24/11/2025)**\n    - **Đánh giá tác động:** Trung lập đến tích cực về dài hạn. Việc Chính phủ ban hành Nghị quyết thí điểm thị trường tài sản mã hóa và đang xây dựng Nghị định xử phạt vi phạm hành chính cho thấy sự nghiêm túc trong việc quản lý và phát triển thị trường này. Mặc dù các quy định xử phạt có thể khiến một số nhà đầu tư thận trọng hơn trong ngắn hạn, nhưng về dài hạn, khung pháp lý rõ ràng sẽ giúp thị trường tài sản mã hóa tại Việt Nam minh bạch hơn, giảm thiểu rủi ro lừa đảo và thu hút các nhà đầu tư tổ chức, tạo tiền đề cho sự phát triển bền vững. Điều này cũng có thể gián tiếp ảnh hưởng đến dòng tiền đầu tư vào các tài sản rủi ro khác như chứng khoán, khi một kênh đầu tư mới được quản lý chặt chẽ hơn.', '[TECHNICAL REPORT]: ![Biểu đồ DGC](charts/DGC_20251124.png)\n\n### Phân tích Kỹ thuật Chuyên sâu cho DGC (Ngày 2025-11-24)\n\n**1. Xu hướng hiện tại:**\n*   **Xu hướng dài hạn:** GIẢM.\n*   **Xu hướng trung hạn:** TĂNG.\n*   **Nhận định:** DGC đang trong giai đoạn chuyển giao xu hướng. Mặc dù xu hướng dài hạn vẫn là giảm, nhưng động lực tăng trong trung hạn đang khá rõ ràng. Giá hiện tại đang cố gắng vượt qua kháng cự dài hạn.\n\n**2. Vị thế giá so với các đường MA:**\n*   **Giá đóng cửa gần nhất (96.00 VND):**\n    *   Nằm trên MA20 (94.50 VND)\n    *   Nằm trên MA50 (92.00 VND)\n    *   Nằm dưới MA200 (98.00 VND)\n*   **Nhận định:** Vị thế giá cho thấy DGC đang có động lực tăng tích cực trong ngắn hạn và trung hạn khi giá nằm trên cả MA20 và MA50. Tuy nhiên, việc giá vẫn nằm dưới MA200 cho thấy xu hướng dài hạn vẫn còn tiêu cực và MA200 đang đóng vai trò là một kháng cự mạnh cần phải vượt qua để xác nhận xu hướng tăng bền vững.\n\n**3. RSI (Chỉ số sức mạnh tương đối):**\n*   **RSI:** 53.98\n*   **Vùng:** TRUNG TÍNH.\n*   **Nhận định:** RSI ở mức trung tính, không nằm trong vùng quá mua (>70) hay quá bán (<30). Điều này cho thấy cổ phiếu không bị mua quá mức hay bán quá mức, còn dư địa cho cả hai chiều và không có tín hiệu đảo chiều mạnh mẽ từ chỉ báo này.\n\n**4. MACD (Đường trung bình động hội tụ phân kỳ):**\n*   **Tín hiệu:** TÍCH CỰC.\n*   **Nhận định:** MACD đang cho tín hiệu tích cực, củng cố thêm cho nhận định về động lượng tăng giá trong ngắn và trung hạn. Điều này cho thấy phe mua đang chiếm ưu thế.\n\n**5. Các vùng Hỗ trợ cứng và Kháng cự cứng:**\n*   **Kháng cự cứng:**\n    *   R1: 98 VND (Đây là vùng kháng cự quan trọng, trùng với MA200)\n    *   R2: 107 VND\n    *   R3: 112 VND\n*   **Hỗ trợ cứng:**\n    *   S1: 95 VND\n    *   S2: 91 VND (Gần với MA50, có thể là hỗ trợ tốt)\n    *   S3: 87 VND\n\n---\n\n**Nhận định tổng thể và Khuyến nghị:**\n\nDGC đang cho thấy những dấu hiệu tích cực trong ngắn và trung hạn với giá nằm trên MA20, MA50 và MACD cho tín hiệu mua. Tuy nhiên, cổ phiếu đang đối mặt với một kháng cự mạnh tại vùng 98 VND (trùng với MA200 và R1). Việc vượt qua vùng này một cách dứt khoát sẽ là yếu tố then chốt để xác nhận xu hướng tăng dài hạn. RSI ở mức trung tính cho thấy còn dư địa cho sự biến động giá.\n\n**Khuyến nghị:** **CHỜ MUA**\n\n*   **Lý do:** DGC đang ở một điểm nhạy cảm, gần vùng kháng cự mạnh 98 VND. Việc mua vào tại thời điểm này có rủi ro nếu cổ phiếu không thể vượt qua kháng cự này.\n*   **Chiến lược:**\n    *   **Chờ mua:** Quan sát hành động giá tại vùng 98 VND. Nếu DGC có thể vượt qua vùng kháng cự này một cách dứt khoát với khối lượng giao dịch lớn, đây sẽ là tín hiệu xác nhận xu hướng tăng và là điểm mua tiềm năng.\n    *   **Tránh mua/Chờ điều chỉnh:** Nếu giá không thể vượt qua 98 VND và quay đầu giảm, có thể xem xét chờ đợi tại các vùng hỗ trợ S1 (95 VND) hoặc S2 (91 VND) để tìm điểm vào với rủi ro thấp hơn.', '[FINANCIAL REPORT]: Nhận định chung về vị thế tài chính:\nDGC hiện đang thể hiện khả năng sinh lời trên vốn chủ sở hữu (ROE) rất tốt với 21.50%, cao hơn đáng kể so với các đối thủ cạnh tranh trực tiếp trong ngành hóa chất và phân bón như GVR (11.40%), DCM (18.60%), DPM (7.40%), PHR (16.90%). Đặc biệt, DGC chỉ đứng sau DDV (28.80%) về chỉ số ROE. Tuy nhiên, việc thiếu dữ liệu về P/E và P/B cho tất cả các công ty gây khó khăn trong việc đánh giá định giá thị trường và so sánh toàn diện hơn về sức khỏe tài chính.\n\nChuyển động đối thủ:\n\n**DDV (CTCP DAP - VINACHEM)**\n1.  **Thay đổi nhân sự cấp cao:** DDV đã có thông báo về việc thay đổi nhân sự vào ngày 21/11/2025, cụ thể là bổ nhiệm Bà Lê Thị Hiền giữ chức vụ Kế toán trưởng. Điều này có thể ảnh hưởng đến định hướng tài chính và quản trị của công ty trong tương lai.\n2.  **Lợi nhuận tăng trưởng mạnh mẽ:** Quý III/2025, DDV ghi nhận lợi nhuận tăng ""khủng"" gần 1000% so với cùng kỳ, đạt doanh thu gần 1.400 tỷ đồng, tăng 85% so với cùng kỳ năm 2024. Sự tăng trưởng này chủ yếu nhờ giá bán và sản lượng DAP phục hồi mạnh mẽ.\n3.  **Ngành phân bón lãi kỷ lục:** DDV nằm trong nhóm các doanh nghiệp phân bón có lợi nhuận kỷ lục trong quý III/2025, cho thấy sự hưởng lợi từ chu kỳ giá phân bón thuận lợi.\n\n**DCM (CTCP Phân bón Dầu khí Cà Mau)**\n1.  **Kỳ vọng biên lợi nhuận gộp cải thiện:** BVSC dự báo biên lợi nhuận gộp năm 2025 của DCM có thể đạt 22,9%, tăng mạnh nhờ giá bán urê cải thiện. Điều này cho thấy triển vọng tích cực về hiệu quả hoạt động.\n2.  **Doanh thu 9 tháng đầu năm vượt kế hoạch:** Kết thúc 9 tháng năm 2025, DCM ghi nhận doanh thu hợp nhất hơn 12,8 nghìn tỷ đồng, vượt 22% kế hoạch và tăng 33% so với cùng kỳ năm 2024, cho thấy hoạt động kinh doanh ổn định và tăng trưởng.\n3.  **Động thái mở rộng kinh doanh:** DCM đã hoàn thành giao dịch mua 100% vốn góp tại một công ty TNHH, đây là một bước đi chiến lược nhằm mở rộng quy mô và đa dạng hóa hoạt động kinh doanh.\n\n**PHR (CTCP Cao su Phước Hòa)**\n1.  **Lợi nhuận quý III/2025 tăng trưởng ấn tượng:** PHR công bố kết quả kinh doanh quý III/2025 với lợi nhuận thuần tăng 164% và doanh thu tăng 50% so với cùng kỳ, đạt 259 tỷ đồng lợi nhuận và 617 tỷ đồng doanh thu. Sự tăng trưởng này được cho là nhờ giá cao su và tiền đền bù đất.\n2.  **Tiềm năng lớn từ dự án khu công nghiệp:** BVSC nhận định PHR có thể hưởng lợi 3.400 tỷ đồng lợi nhuận từ cả vòng đời dự án VSIP 3 và đang ấp ủ phát triển 3 dự án khu công nghiệp khác với quy mô 3.000ha. Điều này cho thấy tiềm năng chuyển đổi cơ cấu doanh thu và lợi nhuận từ mảng cao su sang bất động sản khu công nghiệp.\n3.  **Báo cáo tài chính quý 3 năm 2025:** PHR đã công bố BCTC quý 3 năm 2025 vào ngày 29/10/2025, cung cấp cái nhìn chi tiết về hiệu quả hoạt động trong giai đoạn này.\n\nBảng so sánh chỉ số tài chính:\n\n| Chỉ số | DGC | GVR | DCM | DPM | PHR | DDV |\n| --- | --- | --- | --- | --- | --- | --- |\n| **P/E** | N/A | N/A | N/A | N/A | N/A | N/A |\n| **P/B** | N/A | N/A | N/A | N/A | N/A | N/A |\n| **ROE** | 21.50% | 11.40% | 18.60% | 7.40% | 16.90% | 28.80% |\n| **Biên LNG** | N/A | N/A | N/A | N/A | N/A | N/A |', '[RAG DATA]: DGC:\n*   **Doanh thu thuần về bán hàng và cung cấp dịch vụ (Lũy kế từ 1.1.2025 đến 30.9.2025):** 8.521.424.300.743 VND\n*   **Lợi nhuận sau thuế TNDN (Lũy kế từ 1.1.2025 đến 30.9.2025):** 2.532.041.213.611 VND\n*   **Tổng tài sản (Tại ngày 30.9.2025):** 19.424.382.428.034 VND\n*   **Nợ phải trả (Tại ngày 30.9.2025):** 3.413.453.381.832 VND\n*   **Lưu chuyển tiền thuần trong kỳ (Từ 1.1.2025 đến 30.9.2025):** 223.211.025.883 VND']","# 🇻🇳 BÁO CÁO PHÂN TÍCH: DGC
*(Ngày: 24/11/2025)*

## 1. 📰 Điểm tin Vĩ mô & Ngành

*   **Tín hiệu tích cực từ FED:** Phát biểu của Chủ tịch Fed New York về khả năng giảm lãi suất trong tương lai đang tạo ra tâm lý lạc quan trên thị trường toàn cầu. Điều này giúp giảm áp lực lên tỷ giá USD/VND, tạo điều kiện cho Ngân hàng Nhà nước Việt Nam duy trì chính sách tiền tệ nới lỏng, hỗ trợ cho thị trường chứng khoán.
*   **Thận trọng với thanh khoản hệ thống ngân hàng:** Tăng trưởng tín dụng trong Quý 3/2025 cao hơn tăng trưởng huy động vốn đang tạo ra áp lực thanh khoản cho các ngân hàng. Mặc dù tỷ lệ bao phủ nợ xấu được cải thiện, rủi ro về việc lãi suất huy động có thể tăng trở lại cần được theo dõi sát sao, vì có thể ảnh hưởng đến chi phí vốn của các doanh nghiệp.
*   **Khung pháp lý cho tài sản số:** Việc Chính phủ xây dựng Nghị định quản lý và xử phạt trong thị trường tài sản mã hóa cho thấy nỗ lực minh bạch hóa kênh đầu tư mới này. Về dài hạn, một hành lang pháp lý rõ ràng sẽ giúp thị trường phát triển bền vững và ổn định dòng tiền.

## 2. 🏢 Sức khỏe Tài chính & Vị thế

*   **Kết quả kinh doanh:** Theo BCTC gốc, kết quả kinh doanh 9 tháng đầu năm 2025 của DGC rất ấn tượng:
    *   **Doanh thu thuần:** Đạt **8,521.4 tỷ đồng**.
    *   **Lợi nhuận sau thuế:** Đạt **2,532.0 tỷ đồng**.
    *   Cấu trúc tài chính lành mạnh với **Tổng tài sản** đạt **19,424.4 tỷ đồng** và **Nợ phải trả** chỉ chiếm **3,413.5 tỷ đồng** (tương đương 17.6% tổng tài sản), cho thấy công ty có nền tảng tài chính vững chắc.

*   **Định giá:** Dù thiếu dữ liệu P/E và P/B để so sánh định giá một cách toàn diện, chỉ số **ROE (21.50%)** của DGC thể hiện khả năng sinh lời trên vốn chủ sở hữu vượt trội so với phần lớn các doanh nghiệp cùng ngành như GVR (11.40%), DCM (18.60%) và DPM (7.40%). Điều này khẳng định vị thế và hiệu quả hoạt động hàng đầu của DGC.

*   **Chuyển động Đối thủ:** Ngành hóa chất - phân bón đang trong giai đoạn kinh doanh thuận lợi. Các đối thủ như **DDV** và **PHR** đều báo cáo lợi nhuận tăng trưởng đột biến trong Quý 3/2025. **DCM** cũng ghi nhận doanh thu vượt kế hoạch và đang có động thái mở rộng kinh doanh. Môi trường ngành cạnh tranh nhưng đầy tiềm năng tăng trưởng.

**Bảng so sánh hiệu quả hoạt động (ROE)**

| Chỉ số | DGC | GVR | DCM | DPM | PHR | DDV |
| :--- | :---: | :---: | :---: | :---: | :---: | :---: |
| **ROE** | **21.50%** | 11.40% | 18.60% | 7.40% | 16.90% | 28.80% |

## 3. 📈 Góc nhìn Kỹ thuật

*   **Xu hướng & Chỉ báo:** DGC đang trong giai đoạn chuyển giao xu hướng. Mặc dù xu hướng dài hạn vẫn là giảm, động lực tăng trong trung hạn đang rất tích cực khi giá đã vượt lên trên các đường MA20 và MA50. Chỉ báo MACD cho tín hiệu mua, trong khi RSI ở mức trung tính (53.98), cho thấy cổ phiếu còn dư địa tăng trưởng và chưa đi vào vùng quá mua.

*   **Vùng giá quan trọng:** Cổ phiếu đang đối mặt với vùng **kháng cự cứng tại 98,000 đồng**, đây là nơi hội tụ của đường MA200 và đỉnh giá cũ. Việc vượt qua ngưỡng này một cách dứt khoát sẽ là tín hiệu xác nhận xu hướng tăng bền vững. Các vùng hỗ trợ quan trọng cần chú ý là **95,000 đồng** và **91,000 đồng**.

![Biểu đồ DGC](charts/DGC_20251124.png)

## 4. 🎯 KẾT LUẬN & KHUYẾN NGHỊ

**Khuyến nghị: CHỜ MUA**

DGC là một doanh nghiệp có nền tảng cơ bản xuất sắc, thể hiện qua kết quả kinh doanh 9 tháng đầu năm 2025 và chỉ số ROE vượt trội so với ngành. Tuy nhiên, về mặt kỹ thuật, cổ phiếu đang ở một điểm quyết định, ngay dưới vùng kháng cự mạnh dài hạn.

**Luận điểm đầu tư:**

1.  **Chờ xác nhận xu hướng:** Rủi ro khi mua tại vùng giá hiện tại là cổ phiếu có thể không vượt qua được kháng cự **98,000 đồng** và quay đầu điều chỉnh. Do đó, chiến lược an toàn là chờ đợi một phiên bứt phá dứt khoát qua vùng giá này với khối lượng giao dịch lớn để xác nhận xu hướng tăng.
2.  **Tìm điểm vào tối ưu:** Trong trường hợp giá điều chỉnh, nhà đầu tư có thể cân nhắc mở vị thế mua khi cổ phiếu lùi về các vùng hỗ trợ mạnh quanh **95,000 đồng** hoặc **91,000 đồng** để có mức giá vốn tốt hơn và quản trị rủi ro hiệu quả.",0.8333333333333334,0.6242817152718261
AUTO_ANALYSIS_FPT_0,Phân tích tổng hợp cổ phiếu FPT,"['[MARKET REPORT]: - **Bộ Tài chính đề nghị tăng doanh thu miễn thuế lên 500 triệu đồng/năm.**\n    *   **Đánh giá tác động:** Tin này tích cực. Việc tăng ngưỡng doanh thu miễn thuế sẽ giúp giảm gánh nặng thuế cho các hộ kinh doanh cá thể và doanh nghiệp nhỏ và vừa (SMEs), đặc biệt là trong bối cảnh kinh tế còn nhiều thách thức. Điều này có thể kích thích hoạt động sản xuất kinh doanh, tăng thu nhập khả dụng cho người dân và doanh nghiệp, từ đó thúc đẩy tiêu dùng và đầu tư. Đối với thị trường chứng khoán, các doanh nghiệp nhỏ và vừa có thể có lợi nhuận tốt hơn, tạo tâm lý tích cực cho nhà đầu tư vào các cổ phiếu liên quan đến nhóm ngành này hoặc các ngành tiêu dùng.\n\n- **Thủ tướng: Đưa Việt Nam trở thành trung tâm logistics hàng đầu khu vực, châu lục và thế giới.**\n    *   **Đánh giá tác động:** Tin này tích cực về dài hạn. Định hướng chiến lược của Thủ tướng Chính phủ nhằm phát triển ngành logistics sẽ tạo ra cơ hội lớn cho các doanh nghiệp trong lĩnh vực vận tải, kho bãi, cảng biển, hàng không và các dịch vụ liên quan. Việc đầu tư vào hạ tầng logistics, chuyển đổi số và chuyển đổi xanh sẽ nâng cao năng lực cạnh tranh của Việt Nam, giảm chi phí logistics, hỗ trợ xuất nhập khẩu và thu hút đầu tư nước ngoài. Trên thị trường chứng khoán, các cổ phiếu thuộc nhóm ngành logistics (cảng biển, vận tải biển, kho bãi, dịch vụ logistics) có thể nhận được sự quan tâm lớn từ nhà đầu tư, với kỳ vọng về tăng trưởng lợi nhuận và giá trị trong tương lai.\n\n- **Tỷ giá USD/VND biến động, Ngân hàng Nhà nước nâng tỷ giá trung tâm, đồng USD suy yếu trên thị trường quốc tế nhưng tỷ giá trong nước vẫn có áp lực.**\n    *   **Đánh giá tác động:** Tin này có tác động phức tạp, thiên về tiêu cực trong ngắn hạn nhưng có thể ổn định hơn về dài hạn.\n        *   **Tiêu cực:** Việc Ngân hàng Nhà nước nâng tỷ giá trung tâm cho thấy áp lực lên tỷ giá vẫn còn, dù đồng USD trên thị trường quốc tế có dấu hiệu suy yếu. Điều này có thể do chênh lệch lãi suất giữa VND và USD, hoặc nhu cầu ngoại tệ trong nước vẫn cao. Áp lực tỷ giá tăng có thể làm tăng chi phí nhập khẩu, ảnh hưởng đến lạm phát và lợi nhuận của các doanh nghiệp có nợ ngoại tệ hoặc phụ thuộc nhiều vào nguyên liệu nhập khẩu. Dòng vốn ngoại có thể thận trọng hơn khi đầu tư vào Việt Nam nếu lo ngại về biến động tỷ giá.\n        *   **Tích cực (tiềm năng):** Nếu đồng USD toàn cầu tiếp tục suy yếu do kỳ vọng Fed hạ lãi suất, áp lực lên tỷ giá VND có thể giảm bớt trong tương lai. Tuy nhiên, trong ngắn hạn, sự biến động và áp lực vẫn là yếu tố cần theo dõi chặt chẽ, có thể gây ra tâm lý thận trọng cho nhà đầu tư trên thị trường chứng khoán, đặc biệt là các cổ phiếu có liên quan đến xuất nhập khẩu và nợ ngoại tệ.', '[TECHNICAL REPORT]: ![Biểu đồ FPT](charts/FPT_20251129.png)\n\n### Báo cáo Phân tích Kỹ thuật Chuyên sâu cho FPT (Ngày 2025-11-29)\n\n**1. Tổng quan:**\n*   **Giá đóng cửa gần nhất:** 96.10 VND\n*   **Ngành:** Technology\n\n**2. Phân tích Xu hướng:**\n*   **Xu hướng dài hạn:** GIẢM\n*   **Xu hướng trung hạn:** GIẢM\n*   **Nhận định:** FPT đang trong một xu hướng giảm rõ ràng cả về dài hạn và trung hạn.\n\n**3. Vị thế giá so với các đường Trung bình Động (MA):**\n*   **Giá đóng cửa:** 96.10 VND\n*   **MA20:** 97.50 VND\n*   **MA50:** 99.20 VND\n*   **MA200:** 101.80 VND\n*   **Nhận định:** Giá hiện tại của FPT (96.10 VND) đang nằm dưới tất cả các đường MA quan trọng (MA20, MA50, MA200). Điều này củng cố thêm cho nhận định về xu hướng giảm và cho thấy áp lực bán đang chiếm ưu thế mạnh mẽ trên thị trường.\n\n**4. Chỉ số Sức mạnh Tương đối (RSI):**\n*   **RSI:** 52.38\n*   **Nhận định:** RSI đang ở vùng Trung tính (52.38), không nằm trong vùng quá mua (>70) hay quá bán (<30). Điều này cho thấy chưa có tín hiệu rõ ràng về việc cổ phiếu bị mua quá mức hay bán quá mức từ chỉ báo này.\n\n**5. Chỉ báo Phân kỳ/Hội tụ Trung bình Động (MACD):**\n*   **MACD:** Tín hiệu TIÊU CỰC\n*   **Nhận định:** Tín hiệu tiêu cực từ MACD xác nhận thêm áp lực giảm giá và cho thấy động lượng giảm đang chiếm ưu thế.\n\n**6. Các vùng Hỗ trợ và Kháng cự quan trọng:**\n*   **Vùng Kháng cự cứng:**\n    *   R1: 105 VND\n    *   R2: 112 VND\n    *   R3: 122 VND\n*   **Vùng Hỗ trợ cứng:**\n    *   S1: 90 VND\n    *   S2: 86 VND\n    *   S3: 83 VND\n\n**7. Nhận định chung và Khuyến nghị:**\nDựa trên phân tích kỹ thuật chuyên sâu, cổ phiếu FPT đang trong một xu hướng giảm rõ ràng cả về dài hạn và trung hạn. Giá hiện tại nằm dưới tất cả các đường MA quan trọng, cho thấy áp lực bán mạnh mẽ. Chỉ báo MACD cũng đưa ra tín hiệu tiêu cực. Mặc dù RSI đang ở vùng trung tính, nhưng với các yếu tố khác, rủi ro khi mua vào ở thời điểm hiện tại là khá cao.\n\n**Khuyến nghị:** **CHỜ MUA**.\nNhà đầu tư nên kiên nhẫn chờ đợi các tín hiệu đảo chiều rõ ràng hơn, hoặc giá điều chỉnh về các vùng hỗ trợ mạnh hơn (đặc biệt là S1: 90 VND hoặc S2: 86 VND) và có dấu hiệu bật tăng trở lại với khối lượng lớn trước khi xem xét mở vị thế mua. Hiện tại, không nên vội vàng mua vào.', '[FINANCIAL REPORT]: Nhận định chung về vị thế tài chính:\nFPT là một trong những công ty công nghệ hàng đầu Việt Nam, thể hiện qua chỉ số ROE vượt trội 27.40%, cao hơn đáng kể so với các đối thủ cùng ngành như CMG (13.40%), SAM (1.60%), VEC (0.90%), ELC (11.70%) và SGT (23.60%). Điều này cho thấy FPT có khả năng sinh lời trên vốn chủ sở hữu rất hiệu quả. Tuy nhiên, việc thiếu dữ liệu về P/E và P/B cho FPT và các đối thủ khiến việc đánh giá định giá tương đối trở nên khó khăn.\n\nChuyển động đối thủ:\n\n**CMG (Tập đoàn Công nghệ CMC)**\n1.  **Phát hành trái phiếu:** CMG đã phát hành thành công 1.250 tỷ đồng trái phiếu, kỳ hạn 10 năm, với lãi suất cố định 5,5%/năm. Điều này cho thấy công ty đang huy động vốn để phục vụ các kế hoạch phát triển dài hạn.\n2.  **Mua lại cổ phần:** CMG chi hơn 106 tỷ đồng để mua lại cổ phần CMC Telecom từ công ty con, củng cố quyền sở hữu và kiểm soát đối với một trong những mảng kinh doanh cốt lõi.\n3.  **Đại hội đồng cổ đông thường niên:** CMC đã tổ chức ĐHĐCĐ thường niên, thông qua việc chia cổ tức 12% bằng tiền mặt và cổ phiếu thưởng 20,2%, thể hiện cam kết chia sẻ lợi nhuận với cổ đông.\n\n**SGT (Công ty Cổ phần Công nghệ Viễn thông Sài Gòn)**\n1.  **Dừng chào bán cổ phiếu quỹ:** SGT đã quyết định dừng triển khai chào bán 310 cổ phiếu quỹ và sẽ xem xét thực hiện vào thời điểm phù hợp hơn, có thể do điều kiện thị trường chưa thuận lợi.\n2.  **Giao dịch cổ phiếu của lãnh đạo:** Ông Đặng Thành Tâm, Chủ tịch HĐQT Saigontel, đăng ký bán 25 triệu cổ phiếu SGT, tương đương 16,8% cổ phần. Động thái này có thể ảnh hưởng đến tâm lý nhà đầu tư.\n3.  **Dự án bất động sản:** Doanh nghiệp của sếp cũ Saigontel đang triển khai khu dân cư hơn 1.1 ngàn tỷ ở Hải Phòng, cho thấy sự mở rộng sang các lĩnh vực khác ngoài công nghệ viễn thông.\n\n**ELC (Công ty Cổ phần Đầu tư Phát triển Công nghệ Điện tử Viễn thông)**\n1.  **Nhận chuyển nhượng dự án:** ELC đã nhận chuyển nhượng một phần Dự án Khu Trung tâm Khu đô thị Tây Hồ Tây - Giai đoạn 1, cho thấy sự tham gia vào lĩnh vực bất động sản hoặc phát triển hạ tầng.\n2.  **Kết quả kinh doanh ấn tượng:** ELCOM dự kiến lãi quý III/2025 tăng hơn 300%, doanh thu đạt 428 tỷ đồng, cho thấy sự tăng trưởng mạnh mẽ trong hoạt động kinh doanh cốt lõi.\n3.  **Mục tiêu vốn hóa:** ELCOM đặt mục tiêu đạt 10.000 tỷ đồng vốn hóa vào năm 2025, thể hiện tham vọng lớn về quy mô và giá trị doanh nghiệp trong tương lai.\n\nBảng so sánh chỉ số tài chính:\n\n| Chỉ số | FPT | CMG | SAM | VEC | SGT | ELC |\n| --- | --- | --- | --- | --- | --- | --- |\n| **P/E** | N/A | N/A | N/A | N/A | N/A | N/A |\n| **P/B** | N/A | N/A | N/A | N/A | N/A | N/A |\n| **ROE** | 27.40% | 13.40% | 1.60% | 0.90% | 23.60% | 11.70% |\n| **Biên LNG** | N/A | N/A | N/A | N/A | N/A | N/A |', '[RAG DATA]: Dưới đây là các số liệu được trích xuất từ thông tin được cung cấp:\n\n**Doanh thu:**\n*   Doanh thu thuần về bán hàng và cung cấp dịch vụ lũy kế 9 tháng năm 2025: 49.887.375.207.829 VND (Trang 7)\n*   Doanh thu thuần về bán hàng và cung cấp dịch vụ lũy kế 9 tháng năm 2024: 45.240.976.545.476 VND (Trang 7)\n\n**Lợi nhuận:**\n*   Lợi nhuận sau thuế thu nhập doanh nghiệp lũy kế 9 tháng năm 2025: 8.237.374.633.637 VND (Trang 7)\n*   Lợi nhuận sau thuế thu nhập doanh nghiệp lũy kế 9 tháng năm 2024: 6.926.576.046.926 VND (Trang 7)\n*   Tổng lợi nhuận kế toán trước thuế lũy kế 9 tháng năm 2025: 9.540.464.693.399 VND (Trang 7)\n*   Tổng lợi nhuận kế toán trước thuế lũy kế 9 tháng năm 2024: 8.111.171.239.750 VND (Trang 7)\n\n**Tổng tài sản:**\n*   Tổng cộng tài sản tại ngày 30/9/2025: 82.738.304.930.449 VND (Trang 5)\n*   Tổng cộng tài sản tại ngày 31/12/2024: 71.999.995.678.620 VND (Trang 5)\n\n**Nợ:**\n*   Tổng cộng nợ phải trả tại ngày 30/9/2025: 39.907.781.019.976 VND (Trang 6)\n*   Tổng cộng nợ phải trả tại ngày 31/12/2024: 36.272.455.573.820 VND (Trang 6)\n\n**Dòng tiền:**\n*   Lưu chuyển tiền thuần từ hoạt động kinh doanh lũy kế 9 tháng năm 2025: 6.027.593.339.108 VND (Trang 9)\n*   Lưu chuyển tiền thuần từ hoạt động kinh doanh lũy kế 9 tháng năm 2024: 6.307.220.990.306 VND (Trang 9)\n*   Lưu chuyển tiền thuần từ hoạt động đầu tư lũy kế 9 tháng năm 2025: (8.331.251.633.195) VND (Trang 10)\n*   Lưu chuyển tiền thuần từ hoạt động đầu tư lũy kế 9 tháng năm 2024: (5.358.456.477.320) VND (Trang 10)\n*   Lưu chuyển tiền thuần từ hoạt động tài chính lũy kế 9 tháng năm 2025: 2.852.472.112.488 VND (Trang 10)\n*   Lưu chuyển tiền thuần từ hoạt động tài chính lũy kế 9 tháng năm 2024: (1.216.601.709.566) VND (Trang 10)\n*   Lưu chuyển tiền thuần trong kỳ lũy kế 9 tháng năm 2025: 548.813.818.401 VND (Trang 10)\n*   Lưu chuyển tiền thuần trong kỳ lũy kế 9 tháng năm 2024: (267.837.196.580) VND (Trang 10)']","# 🇻🇳 BÁO CÁO PHÂN TÍCH: FPT
*(Ngày: 29/11/2025)*

## 1. 📰 Điểm tin Vĩ mô & Ngành

*   **Vĩ mô trong nước:** Đề xuất tăng ngưỡng doanh thu miễn thuế lên 500 triệu đồng/năm là một tín hiệu tích cực, kỳ vọng sẽ hỗ trợ các doanh nghiệp nhỏ và vừa, qua đó kích thích tiêu dùng và hoạt động kinh doanh chung. Về dài hạn, định hướng chiến lược của Chính phủ đưa Việt Nam trở thành trung tâm logistics hàng đầu khu vực sẽ mở ra cơ hội tăng trưởng cho các ngành liên quan.
*   **Tỷ giá:** Áp lực tỷ giá USD/VND vẫn hiện hữu trong ngắn hạn dù đồng USD quốc tế suy yếu. Việc NHNN nâng tỷ giá trung tâm cho thấy sự thận trọng trong điều hành. Yếu tố này có thể ảnh hưởng đến các doanh nghiệp có nợ vay bằng ngoại tệ hoặc phụ thuộc vào nguyên vật liệu nhập khẩu.

## 2. 🏢 Sức khỏe Tài chính & Vị thế

*   **Kết quả kinh doanh:** FPT tiếp tục duy trì đà tăng trưởng mạnh mẽ. Lũy kế 9 tháng đầu năm 2025, công ty ghi nhận:
    *   **Doanh thu thuần:** Đạt **49,887 tỷ đồng**, tăng trưởng **10.3%** so với cùng kỳ năm 2024 (45,241 tỷ đồng).
    *   **Lợi nhuận sau thuế:** Đạt **8,237 tỷ đồng**, tăng trưởng ấn tượng **18.9%** so với cùng kỳ (6,927 tỷ đồng).
    *   Các số liệu này khẳng định nền tảng kinh doanh vững chắc và khả năng mở rộng hiệu quả của FPT.

*   **Định giá & Hiệu quả hoạt động:** FPT thể hiện khả năng sinh lời vượt trội với chỉ số **ROE (Tỷ suất sinh lời trên vốn chủ sở hữu) đạt 27.40%**, cao hơn đáng kể so với các đối thủ cùng ngành. Điều này cho thấy FPT sử dụng vốn cổ đông một cách rất hiệu quả. Tuy nhiên, việc thiếu dữ liệu P/E và P/B tại thời điểm báo cáo gây khó khăn cho việc so sánh định giá tương đối.

*   **Chuyển động Đối thủ:**
    *   **CMG:** Tích cực huy động vốn dài hạn qua trái phiếu (1,250 tỷ đồng) và củng cố quyền sở hữu tại các công ty con cốt lõi, đồng thời duy trì chính sách cổ tức hấp dẫn.
    *   **SGT:** Có động thái đáng chú ý từ ban lãnh đạo khi Chủ tịch HĐQT đăng ký bán lượng lớn cổ phiếu (16.8% cổ phần), có thể gây áp lực lên giá cổ phiếu trong ngắn hạn.
    *   **ELC:** Ghi nhận kết quả kinh doanh quý III/2025 dự kiến tăng trưởng đột biến và đặt mục tiêu vốn hóa tham vọng, cho thấy tiềm năng phát triển mạnh mẽ.

**Bảng so sánh Hiệu quả hoạt động**

| Chỉ số | **FPT** | CMG | SGT | ELC | SAM | VEC |
| :--- | :--- | :--- | :--- | :--- | :--- | :--- |
| **ROE** | **27.40%** | 13.40% | 23.60% | 11.70% | 1.60% | 0.90% |

## 3. 📈 Góc nhìn Kỹ thuật

*   **Xu hướng & Chỉ báo:**
    *   Cổ phiếu FPT đang trong **xu hướng giảm** cả trong trung và dài hạn.
    *   Giá đóng cửa **96,100 đồng** hiện đang nằm dưới tất cả các đường trung bình động quan trọng (MA20, MA50, MA200), xác nhận áp lực bán đang chiếm ưu thế.
    *   Chỉ báo **MACD** cho tín hiệu tiêu cực, củng cố cho xu hướng giảm. Trong khi đó, **RSI** đang ở vùng trung tính (52.38), chưa cho thấy tín hiệu quá mua hay quá bán.

*   **Vùng giá quan trọng:**
    *   **Vùng Hỗ trợ:** 90,000 đồng / 86,000 đồng.
    *   **Vùng Kháng cự:** 105,000 đồng / 112,000 đồng.

![Biểu đồ FPT](charts/FPT_20251129.png)

## 4. 🎯 KẾT LUẬN & KHUYẾN NGHỊ

**KHUYẾN NGHỊ: THEO DÕI (CHỜ MUA)**

*   **Luận điểm:** FPT đang cho thấy sự đối lập giữa hai yếu tố:
    1.  **Nền tảng cơ bản:** Rất vững chắc, với tăng trưởng doanh thu và lợi nhuận hai con số, cùng hiệu quả sinh lời ROE dẫn đầu ngành. Đây là cơ sở cho tiềm năng tăng trưởng giá trị trong dài hạn.
    2.  **Phân tích kỹ thuật:** Tiêu cực trong ngắn hạn, với xu hướng giảm rõ ràng và giá nằm dưới các ngưỡng kháng cự quan trọng.

*   **Hành động:** Sự mâu thuẫn này tạo ra cơ hội cho nhà đầu tư dài hạn kiên nhẫn. Thay vì mua đuổi ở thời điểm hiện tại, nhà đầu tư nên **THEO DÕI** chặt chẽ diễn biến giá. Việc mở vị thế mua mới sẽ hợp lý hơn khi cổ phiếu điều chỉnh về các **vùng hỗ trợ mạnh quanh 90,000 đồng** và xuất hiện các tín hiệu đảo chiều đáng tin cậy (nến tăng giá mạnh, khối lượng giao dịch đột biến).",0.8055555555555556,0.664277216402659
AUTO_ANALYSIS_GAS_1,Phân tích tổng hợp cổ phiếu GAS,"['[MARKET REPORT]: - **Cải cách quy trình IPO và nâng hạng thị trường chứng khoán Việt Nam**\n    - **Nội dung:** Nghị định 245/2025/NĐ-CP có hiệu lực, rút ngắn quy trình IPO-niêm yết, nâng cao chuẩn minh bạch. Đồng thời, FTSE Russell chính thức nâng hạng Việt Nam từ thị trường cận biên lên thị trường mới nổi thứ cấp.\n    - **Đánh giá tác động:** Tích cực. Việc rút ngắn quy trình IPO và nâng cao chuẩn minh bạch giúp doanh nghiệp dễ dàng huy động vốn hơn, tăng nguồn cung hàng hóa chất lượng cho thị trường. Đặc biệt, việc FTSE Russell nâng hạng mở ra kỳ vọng về làn sóng vốn quốc tế quy mô lớn đổ vào Việt Nam trong năm 2026, thúc đẩy thanh khoản và định giá thị trường.\n\n- **Ngân hàng Nhà nước đề xuất tiếp tục hạ lãi suất**\n    - **Nội dung:** Ngân hàng Nhà nước (NHNN) đang đề xuất tiếp tục hạ thêm 1% lãi suất, tính tổng là giảm 3% và kéo dài thêm thời hạn 5 năm nữa thành 10 năm để gia tăng tính hấp dẫn của vốn vay. Đề xuất này nhằm hỗ trợ tăng trưởng kinh tế, kiểm soát lạm phát và thúc đẩy phát triển bền vững.\n    - **Đánh giá tác động:** Tích cực. Nếu đề xuất được thông qua, chi phí vốn của doanh nghiệp sẽ giảm, khuyến khích đầu tư sản xuất kinh doanh và kích thích tăng trưởng tín dụng. Điều này sẽ tạo động lực cho thị trường chứng khoán, đặc biệt là các ngành nhạy cảm với lãi suất như bất động sản, sản xuất.\n\n- **Thị trường tiền tệ tháng 11/2025: NHNN bơm ròng lớn, lãi suất liên ngân hàng và huy động tăng**\n    - **Nội dung:** Trong tháng 11/2025, Ngân hàng Nhà nước đã phải bơm ròng hơn 106.000 tỷ đồng vào hệ thống để hỗ trợ thanh khoản. Lãi suất liên ngân hàng nhiều kỳ hạn đã vượt 6,5%. Đồng thời, nhiều ngân hàng thương mại, bao gồm cả các ""ông lớn"", đã đồng loạt tăng lãi suất huy động trong tháng 11, với mức tăng đáng kể ở các kỳ hạn ngắn và dài.\n    - **Đánh giá tác động:** Tiêu cực. Việc NHNN phải bơm ròng lượng lớn tiền cho thấy thanh khoản hệ thống đang căng thẳng. Lãi suất liên ngân hàng và lãi suất huy động tăng cao sẽ làm tăng chi phí vốn của các ngân hàng và doanh nghiệp, gây áp lực lên lợi nhuận và khả năng hấp thụ vốn của nền kinh tế. Điều này có thể ảnh hưởng tiêu cực đến tâm lý nhà đầu tư và dòng tiền trên thị trường chứng khoán trong ngắn hạn.', '[TECHNICAL REPORT]: ### I. Tổng Quan Thị Trường Phiên Gần Nhất\n\n- **VN-Index:** 1690.99 điểm (+7.22 điểm, +0.43%)\n- **Khối lượng:** 723,199,925 cổ phiếu\n\n### II. Biểu Đồ Kỹ Thuật Cổ Phiếu GAS\n\n- Khoảng thời gian: **2024-11-29** → **2025-11-29**\n\n![Biểu đồ nến của GAS](charts/GAS_20251129.png)\n\n### III. Phân Tích Kỹ Thuật Chuyên Sâu cho GAS\n\n**1. Xu hướng hiện tại:**\n*   **Dài hạn và Trung hạn:** Cổ phiếu GAS đang trong xu hướng TĂNG rõ ràng. Điều này được xác nhận bởi việc giá hiện tại nằm trên cả ba đường trung bình động quan trọng (MA20, MA50, MA200).\n\n**2. Vị thế giá so với các đường MA:**\n*   **Giá đóng cửa gần nhất:** 63.40 VND\n*   **MA20:** 62.15 VND\n*   **MA50:** 60.30 VND\n*   **MA200:** 58.90 VND\n*   **Nhận định:** Giá hiện tại (63.40) đang nằm trên tất cả các đường MA (MA20, MA50, MA200). Đây là một tín hiệu rất tích cực, cho thấy cổ phiếu đang duy trì đà tăng mạnh mẽ và có sự hỗ trợ tốt từ các đường trung bình động.\n\n**3. RSI (Chỉ số sức mạnh tương đối):**\n*   **RSI hiện tại:** 65.71\n*   **Nhận định:** RSI đang ở vùng TRUNG TÍNH. Mặc dù đang tiến gần đến vùng quá mua (>70), nhưng chưa đạt đến mức đó, cho thấy cổ phiếu vẫn còn dư địa tăng trưởng mà không bị coi là quá nóng hoặc có nguy cơ điều chỉnh mạnh ngay lập tức.\n\n**4. MACD (Đường trung bình động hội tụ phân kỳ):**\n*   **Tín hiệu MACD:** TÍCH CỰC\n*   **Nhận định:** Tín hiệu MACD tích cực củng cố thêm cho xu hướng tăng giá hiện tại của GAS, cho thấy động lực tăng vẫn đang được duy trì.\n\n**5. Các vùng Hỗ trợ cứng và Kháng cự cứng:**\n*   **Kháng cự cứng (R1):** 65 VND. Đây là mức giá mà cổ phiếu có thể gặp áp lực bán và khó khăn để vượt qua trong ngắn hạn.\n*   **Hỗ trợ cứng (S1):** 62 VND. Đây là vùng hỗ trợ gần nhất, nếu giá có sự điều chỉnh, có thể tìm thấy lực cầu tại mức này.\n*   **Hỗ trợ cứng (S2):** 56 VND.\n*   **Hỗ trợ cứng (S3):** 51 VND.\n\n### IV. Nhận định và Khuyến nghị\n\n**Nhận định:**\nCổ phiếu GAS đang thể hiện một sức mạnh đáng kể với xu hướng tăng rõ ràng trên cả khung thời gian trung và dài hạn. Giá đang giao dịch trên tất cả các đường MA quan trọng, RSI ở vùng trung tính và MACD cho tín hiệu tích cực. Tuy nhiên, giá hiện tại đang tiệm cận vùng kháng cự 65 VND.\n\n**Khuyến nghị:**\nCHỜ MUA.\n*   **Lý do:** Mặc dù xu hướng tăng là mạnh mẽ, việc giá đang gần vùng kháng cự 65 VND có thể dẫn đến một nhịp điều chỉnh hoặc tích lũy.\n*   **Chiến lược:**\n    *   Nhà đầu tư có thể cân nhắc **chờ đợi một nhịp điều chỉnh về vùng hỗ trợ 62 VND** để tìm kiếm điểm mua an toàn hơn với rủi ro thấp hơn.\n    *   Hoặc, **chờ đợi giá bứt phá dứt khoát qua vùng kháng cự 65 VND** với khối lượng giao dịch lớn để xác nhận đà tăng tiếp diễn, sau đó có thể xem xét MUA.', '[FINANCIAL REPORT]: Nhận định chung về vị thế tài chính:\nGAS có ROE 19.60%, cao nhất trong số các công ty được so sánh, cho thấy hiệu quả sử dụng vốn rất tốt. DNH cũng có ROE khá cao, đạt 19.00%, cho thấy sự cạnh tranh về hiệu quả hoạt động trong ngành tiện ích. POW và REE có ROE thấp hơn đáng kể so với GAS và DNH. Tuy nhiên, do thiếu dữ liệu P/E và P/B, việc đánh giá định giá của các công ty này còn hạn chế.\n\nChuyển động đối thủ:\n\nPOW (Tổng Công ty Điện lực Dầu khí Việt Nam - CTCP):\n1.  **Chào bán cổ phiếu và tăng vốn:** POW sẽ chào bán hơn 281 triệu cổ phiếu trong quý IV/2025 và phát hành gần 726 triệu cổ phiếu để tăng vốn, bao gồm phát hành 93,6 triệu cổ phiếu để trả cổ tức với tỷ lệ 4%. Tổng vốn điều lệ dự kiến tăng từ 23.418 tỷ lên 30.678 tỷ đồng.\n2.  **Dự án Nhơn Trạch 3 và Nhơn Trạch 4:** POW dự kiến dùng 2.810 tỷ đồng từ vốn huy động để thanh toán các hợp đồng ký kết với các đối tác để triển khai dự án Nhà máy điện Nhơn Trạch 3 và Nhơn Trạch 4.\n3.  **Ước đạt kế hoạch lợi nhuận:** POW ước đạt 560% kế hoạch lợi nhuận năm, với doanh thu đến ngày 27/11 đạt 31.900 tỷ đồng.\n\nREE (CTCP Cơ Điện Lạnh):\n1.  **Hoạt động M&A và thoái vốn:** REE tiếp tục thực hiện các hoạt động M&A rải đều trong các mảng và sẽ thoái vốn khỏi nhiệt điện.\n2.  **Tăng vốn điều lệ REE Energy:** HĐQT REE đã thông qua việc tăng vốn điều lệ của REE Energy từ 7.248 tỷ đồng lên mức 10.500 tỷ đồng.\n3.  **Khai trương dự án bất động sản:** Công ty TNHH Bất động sản REE (REE Land) đã tổ chức lễ khai trương dự án The Light Square tại trung tâm thành phố Thái Bình.\n\nDNH (CTCP Thủy điện Đa Nhim - Hàm Thuận - Đa Mi):\n1.  **Tạm ứng cổ tức:** DNH dự chi hơn 422 tỷ đồng tạm ứng cổ tức. Công ty cũng chuẩn bị chi gần 845 tỷ đồng tạm ứng cổ tức đợt 1 năm 2023.\n2.  **Điều chỉnh cổ tức kế hoạch:** HĐQT DNH thông qua nội dung lấy ý kiến cổ đông bằng văn bản điều chỉnh mức cổ tức kế hoạch năm 2023 từ 20% lên 24%.\n3.  **Tình hình kinh doanh 9 tháng đầu năm 2023:** DNH ghi nhận doanh thu đạt 1.846 tỷ đồng, giảm 18% so với cùng kỳ.\n\nBảng so sánh chỉ số tài chính:\n\n| Chỉ số | GAS | POW | REE | DNH |\n| --- | --- | --- | --- | --- |\n| **ROE** | 19.60% | 5.80% | 13.40% | 19.00% |', '[RAG DATA]: Dưới đây là các số liệu được trích xuất từ thông tin được cung cấp:\n\n*   **Doanh thu:** 91.445.984.719.394 VND (Lũy kế từ đầu năm đến cuối quý này, Năm nay)\n*   **Lợi nhuận:** 10.184.201.250.527 VND (Lợi nhuận sau thuế TNDN, Lũy kế từ đầu năm đến cuối quý này, Năm nay)\n*   **Tổng tài sản:** 93.864.613.349.663 VND (TÔNG TÀI SÁN (270=100+200), Tại ngày 30 tháng 09 năm 2025)\n*   **Nợ:** 27.487.308.376.982 VND (A. NỢ PHẢI TRÁ (300=310+330), Tại ngày 30 tháng 09 năm 2025)\n*   **Dòng tiền:** 6.071.511.142.513 (Lưu chuyển tiền thuần trong năm, Từ 01/01/2025 đến 30/09/2025)']","# 🇻🇳 BÁO CÁO PHÂN TÍCH: GAS
*(Ngày: 29/11/2025)*

## 1. 📰 Điểm tin Vĩ mô & Ngành

- **Tích cực dài hạn:** Việc FTSE Russell chính thức nâng hạng thị trường chứng khoán Việt Nam lên ""Thị trường mới nổi thứ cấp"" cùng với cải cách quy trình IPO được kỳ vọng sẽ thu hút dòng vốn ngoại quy mô lớn trong năm 2026, tác động tích cực đến thanh khoản và định giá chung của thị trường.
- **Tích cực trung hạn:** Đề xuất tiếp tục hạ lãi suất điều hành của Ngân hàng Nhà nước (NHNN), nếu được thông qua, sẽ giúp giảm chi phí vốn cho các doanh nghiệp, kích thích đầu tư và sản xuất, tạo môi trường thuận lợi cho tăng trưởng.
- **Tiêu cực ngắn hạn:** Trong tháng 11, thanh khoản hệ thống ngân hàng có dấu hiệu căng thẳng, buộc NHNN phải bơm ròng hơn 106,000 tỷ đồng. Việc lãi suất liên ngân hàng và lãi suất huy động tăng có thể gây áp lực lên chi phí vốn và tâm lý thị trường trong ngắn hạn.

## 2. 🏢 Sức khỏe Tài chính & Vị thế

- **Kết quả kinh doanh:** Theo số liệu lũy kế 9 tháng đầu năm 2025, GAS ghi nhận kết quả kinh doanh rất tích cực và duy trì nền tảng tài chính vững chắc:
    - **Doanh thu:** Đạt **91,446 tỷ đồng**.
    - **Lợi nhuận sau thuế:** Đạt **10,184 tỷ đồng**.
    - **Tổng tài sản:** **93,865 tỷ đồng**.
    - **Tổng nợ phải trả:** **27,487 tỷ đồng**.
    - **Dòng tiền thuần trong kỳ:** Dương **6,072 tỷ đồng**, cho thấy khả năng tạo tiền mạnh mẽ từ hoạt động kinh doanh.

- **Định giá:** GAS thể hiện hiệu quả sử dụng vốn vượt trội với chỉ số **ROE đạt 19.60%**, cao nhất trong nhóm các doanh nghiệp cùng ngành được so sánh. Điều này cho thấy khả năng sinh lời trên vốn chủ sở hữu của GAS đang dẫn đầu.

- **Chuyển động Đối thủ:**
    - **POW:** Lên kế hoạch tăng vốn điều lệ mạnh mẽ thông qua chào bán và phát hành cổ phiếu để tài trợ cho các dự án trọng điểm Nhơn Trạch 3 & 4. Doanh thu và lợi nhuận ước tính vượt xa kế hoạch năm.
    - **REE:** Tiếp tục chiến lược M&A, tái cơ cấu danh mục đầu tư theo hướng thoái vốn khỏi nhiệt điện và tăng vốn cho mảng năng lượng (REE Energy). Đồng thời mở rộng sang lĩnh vực bất động sản.
    - **DNH:** Ghi nhận doanh thu 9 tháng sụt giảm so với cùng kỳ nhưng vẫn thực hiện tạm ứng cổ tức tỷ lệ cao cho cổ đông.

**Bảng so sánh chỉ số tài chính**

| Chỉ số | GAS | POW | REE | DNH |
| --- | --- | --- | --- | --- |
| **ROE** | **19.60%** | 5.80% | 13.40% | 19.00% |

## 3. 📈 Góc nhìn Kỹ thuật

- **Xu hướng & Chỉ báo:**
    - **Xu hướng:** Cổ phiếu đang trong xu hướng **TĂNG** rõ ràng ở cả trung và dài hạn, với giá vận động ổn định phía trên các đường trung bình động quan trọng (MA20, MA50, MA200).
    - **Sức mạnh giá (RSI):** Chỉ số RSI ở mức 65.71, nằm trong vùng trung tính nhưng đang tiến gần đến vùng quá mua. Điều này cho thấy đà tăng vẫn còn nhưng cần cẩn trọng với áp lực chốt lời.
    - **Động lượng (MACD):** Cho tín hiệu **TÍCH CỰC**, củng cố cho xu hướng tăng giá hiện tại.

- **Vùng giá quan trọng:**
    - **Kháng cự mạnh:** **65,000 đồng/cổ phiếu**.
    - **Hỗ trợ gần nhất:** **62,000 đồng/cổ phiếu**.
    - **Hỗ trợ sâu hơn:** **56,000 đồng/cổ phiếu**.

![Biểu đồ kỹ thuật cổ phiếu GAS](charts/GAS_20251129.png)

## 4. 🎯 KẾT LUẬN & KHUYẾN NGHỊ

**KHUYẾN NGHỊ: CHỜ MUA**

- **Luận điểm:**
    1.  **Nền tảng cơ bản vững chắc:** GAS sở hữu sức khỏe tài chính lành mạnh, kết quả kinh doanh tăng trưởng tốt và hiệu quả sinh lời (ROE) dẫn đầu ngành.
    2.  **Xu hướng kỹ thuật tích cực:** Cổ phiếu đang duy trì xu hướng tăng giá mạnh mẽ, được xác nhận bởi các chỉ báo kỹ thuật quan trọng.
    3.  **Rủi ro ngắn hạn:** Giá cổ phiếu đang tiệm cận vùng kháng cự mạnh 65,000 đồng, có khả năng xảy ra nhịp điều chỉnh hoặc tích lũy trước khi có thể bứt phá xa hơn.

- **Chiến lược hành động:**
    - **Kịch bản 1 (Ưu tiên):** Nhà đầu tư nên kiên nhẫn chờ đợi một nhịp điều chỉnh của cổ phiếu về vùng hỗ trợ **62,000 đồng** để mở vị thế mua mới với mức giá tối ưu hơn.
    - **Kịch bản 2:** Mở vị thế mua khi giá có phiên bứt phá dứt khoát qua vùng kháng cự **65,000 đồng** với khối lượng giao dịch tăng đột biến, xác nhận đà tăng tiếp diễn.",0.8904109589041096,0.6412652134928855
AUTO_ANALYSIS_GVR_2,Phân tích tổng hợp cổ phiếu GVR,"['[MARKET REPORT]: - **Tin tức 1: Thị trường tiền tệ tháng 11/2025: Ngân hàng Nhà nước bơm ròng hơn 106.000 tỷ đồng, lãi suất liên ngân hàng khó hạ, tỷ giá trung tâm tăng.**\n    *   **Nội dung chính:** Trong tháng 11/2025, Ngân hàng Nhà nước (NHNN) đã bơm ròng 106.427,6 tỷ đồng vào hệ thống thông qua thị trường mở, kéo dài kỳ hạn đấu thầu lên 105 ngày nhằm ổn định thanh khoản. Lãi suất liên ngân hàng nhiều kỳ hạn vượt 6%, và lãi suất huy động của các ngân hàng thương mại (bao gồm cả ""big 4"" như VietinBank) cũng đồng loạt tăng. Tăng trưởng tín dụng đến cuối tháng 10/2025 đạt 14,77%. Về tỷ giá, NHNN nâng tỷ giá trung tâm lên 25.155 VND/USD (tăng 62 đồng trong tháng 11), trong khi USD tự do ""hạ sốt"" sau chuỗi tăng nóng.\n    *   **Đánh giá tác động:**\n        *   **Tiêu cực (ngắn hạn):** Việc NHNN phải bơm ròng lượng lớn tiền và lãi suất liên ngân hàng, lãi suất huy động tăng cho thấy áp lực thanh khoản trong hệ thống ngân hàng vẫn còn căng thẳng. Điều này có thể dẫn đến áp lực tăng lãi suất cho vay vào đầu năm 2026, ảnh hưởng đến chi phí vốn của doanh nghiệp và cá nhân, từ đó tác động tiêu cực đến tăng trưởng kinh tế và lợi nhuận doanh nghiệp niêm yết.\n        *   **Tích cực (dài hạn/ổn định):** Hành động bơm ròng của NHNN cho thấy sự chủ động trong việc hỗ trợ thanh khoản, ngăn chặn tình trạng thiếu hụt vốn nghiêm trọng hơn. Việc kéo dài kỳ hạn OMO cũng thể hiện nỗ lực ổn định mặt bằng lãi suất trong dài hạn hơn. Tỷ giá trung tâm tăng nhưng USD tự do hạ nhiệt cho thấy NHNN đang điều hành linh hoạt để ổn định thị trường ngoại hối, giảm bớt áp lực lên tỷ giá.\n\n- **Tin tức 2: Kinh tế Việt Nam tháng 11 và 11 tháng 2025: FDI tăng 15,6%.**\n    *   **Nội dung chính:** Tổng vốn đầu tư nước ngoài (FDI) đăng ký vào Việt Nam tính đến ngày 31/10/2025 đạt 31,52 tỷ USD, tăng 15,6% so với cùng kỳ năm trước.\n    *   **Đánh giá tác động:**\n        *   **Tích cực:** Dòng vốn FDI tăng mạnh là một tín hiệu cực kỳ tích cực cho nền kinh tế Việt Nam. Nó thể hiện niềm tin của nhà đầu tư nước ngoài vào môi trường kinh doanh, triển vọng tăng trưởng và sự ổn định vĩ mô của Việt Nam. FDI tăng sẽ thúc đẩy sản xuất, tạo việc làm, chuyển giao công nghệ và tăng cường năng lực xuất khẩu. Điều này tạo nền tảng vững chắc cho tăng trưởng GDP, hỗ trợ thị trường chứng khoán trong dài hạn thông qua việc cải thiện kết quả kinh doanh của các doanh nghiệp liên quan đến chuỗi cung ứng FDI và tăng cường sức hấp dẫn của thị trường Việt Nam đối với nhà đầu tư nước ngoài.\n\n- **Tin tức 3: Vingroup trở thành doanh nghiệp Việt Nam đầu tiên vốn hóa trên 1 triệu tỷ đồng.**\n    *   **Nội dung chính:** Phiên giao dịch ngày 28/11/2025, cổ phiếu VIC của Tập đoàn Vingroup tiếp tục bứt phá, ghi nhận 10 phiên tăng liên tiếp và thiết lập mức giá kỷ lục 260.490 đồng/cổ phiếu. Nhờ đà tăng này, vốn hóa của Vingroup chính thức vượt mốc 1 triệu tỷ đồng (khoảng 40 tỷ USD), trở thành doanh nghiệp Việt Nam đầu tiên đạt cột mốc lịch sử này. Chủ tịch Phạm Nhật Vượng cũng chính thức lọt Top 100 người giàu nhất thế giới theo bảng xếp hạng của Forbes với tài sản 23,6 tỷ USD. Vingroup công bố kết quả kinh doanh 9 tháng đầu năm 2025 ấn tượng với tổng doanh thu thuần hợp nhất đạt 169.611 tỷ đồng (tăng 34% so với cùng kỳ) và lợi nhuận sau thuế 7.565 tỷ đồng (gấp 1,9 lần năm 2024). Tập đoàn cũng đang mở rộng hệ sinh thái sang nhiều lĩnh vực mới như thép (VinMetal), dưỡng lão (Vin New Horizon), giải trí (V-Film), hàng không - vũ trụ (VinSpace) và hạ tầng (VinSpeed, Vinhomes Hà Tĩnh).\n    *   **Đánh giá tác động:**\n        *   **Tích cực:** Đây là một sự kiện mang tính biểu tượng và có tác động tâm lý rất tích cực đến thị trường chứng khoán Việt Nam. Việc một doanh nghiệp Việt Nam đạt vốn hóa 1 triệu tỷ đồng cho thấy sự lớn mạnh của các tập đoàn trong nước, tạo niềm tin và sự hứng khởi cho nhà đầu tư, đặc biệt là vào nhóm cổ phiếu vốn hóa lớn (blue-chips). Đà tăng của VIC và nhóm Vingroup có thể thu hút dòng tiền vào các cổ phiếu trụ, giúp nâng đỡ chỉ số VN-Index. Sự mở rộng sang các lĩnh vực mới của Vingroup cũng cho thấy tiềm năng phát triển của nhiều ngành kinh tế khác trong tương lai.', '[TECHNICAL REPORT]: ![Biểu đồ GVR](charts/GVR_20251129.png)\n\n### Phân tích Kỹ thuật Chuyên sâu cho GVR (Ngày 2025-11-29)\n\n**1. Xu hướng hiện tại:**\n*   **Xu hướng dài hạn:** GIẢM\n*   **Xu hướng trung hạn:** GIẢM\n*   **Nhận định:** GVR đang trong một xu hướng giảm rõ ràng trên cả khung thời gian dài hạn và trung hạn, cho thấy áp lực bán đang chiếm ưu thế.\n\n**2. Vị thế giá so với các đường MA:**\n*   **Giá đóng cửa gần nhất:** 27.30 VND\n*   **MA20:** 27.85 VND\n*   **MA50:** 28.50 VND\n*   **MA200:** 29.10 VND\n*   **Nhận định:** Giá hiện tại (27.30 VND) đang nằm dưới tất cả các đường trung bình động quan trọng (MA20, MA50, MA200). Điều này củng cố thêm cho nhận định về xu hướng giảm và cho thấy cổ phiếu đang chịu áp lực giảm giá mạnh mẽ.\n\n**3. RSI (Relative Strength Index):**\n*   **Chỉ số RSI:** 47.52\n*   **Vùng RSI:** TRUNG TÍNH\n*   **Nhận định:** RSI đang ở mức trung tính, không nằm trong vùng quá mua (>70) hay quá bán (<30). Điều này cho thấy chưa có tín hiệu rõ ràng về việc cổ phiếu bị mua quá mức hay bán quá mức trong ngắn hạn.\n\n**4. MACD (Moving Average Convergence Divergence):**\n*   **Tín hiệu MACD:** TIÊU CỰC\n*   **Nhận định:** Tín hiệu MACD tiêu cực cho thấy động lượng giảm giá đang chiếm ưu thế và có thể tiếp tục duy trì.\n\n**5. Các vùng Hỗ trợ cứng và Kháng cự cứng:**\n*   **Kháng cự cứng:**\n    *   R1: 31 VND\n    *   R2: 35 VND\n*   **Hỗ trợ cứng:**\n    *   S1: 24 VND\n    *   S2: 21 VND\n*   **Nhận định:** Các vùng kháng cự trên cho thấy các mức giá mà tại đó áp lực bán có thể gia tăng nếu giá cố gắng phục hồi. Ngược lại, các vùng hỗ trợ dưới là các mức giá mà tại đó áp lực mua có thể xuất hiện để ngăn chặn đà giảm.\n\n---\n\n**Nhận định chung và Khuyến nghị:**\n\nDựa trên phân tích kỹ thuật chuyên sâu, mã cổ phiếu GVR đang trong một xu hướng giảm rõ ràng trên cả khung thời gian dài hạn và trung hạn. Giá hiện tại nằm dưới tất cả các đường trung bình động quan trọng, và chỉ báo MACD cũng cho tín hiệu tiêu cực. Mặc dù RSI đang ở vùng trung tính, nhưng các yếu tố khác đều cho thấy rủi ro cao khi tham gia mua vào ở thời điểm hiện tại.\n\n**Khuyến nghị:** **CHỜ MUA**\n\nNhà đầu tư nên kiên nhẫn chờ đợi các tín hiệu đảo chiều rõ ràng hơn trước khi xem xét vị thế mua. Các tín hiệu này có thể bao gồm:\n*   Giá vượt lên trên các đường MA quan trọng (MA20, MA50).\n*   MACD chuyển sang tín hiệu tích cực.\n*   RSI tiến vào vùng quá bán (<30) và sau đó có dấu hiệu phục hồi mạnh mẽ.\n*   Giá kiểm định thành công các vùng hỗ trợ cứng (S1: 24 VND, S2: 21 VND) và hình thành các mẫu hình nến đảo chiều tăng giá.', '[FINANCIAL REPORT]: Nhận định chung về vị thế tài chính\n\nGVR hoạt động trong ngành Chemicals. Dựa trên dữ liệu có sẵn, GVR có ROE là 11.40%, thấp hơn so với các đối thủ chính như DGC (21.50%), DCM (18.60%) và PHR (16.90%). Điều này cho thấy GVR có thể đang tạo ra lợi nhuận trên vốn chủ sở hữu kém hiệu quả hơn so với các đối thủ hàng đầu trong ngành. Đáng chú ý là các chỉ số P/E và P/B không có sẵn cho GVR và các đối thủ, điều này hạn chế khả năng đánh giá toàn diện về định giá và hiệu quả hoạt động dựa trên thị trường.\n\nChuyển động đối thủ\n\n**1. DGC (Tập đoàn Hóa chất Đức Giang)**\n*   **Kết quả kinh doanh quý III/2025:** DGC công bố doanh thu thuần 2.817 tỷ đồng, tăng 10% so với cùng kỳ, cho thấy sự tăng trưởng ổn định.\n*   **Định hướng bất động sản:** Chủ tịch DGC tiết lộ về dự án bất động sản tiềm năng lãi 1.000 tỷ đồng, cho thấy công ty đang đa dạng hóa nguồn thu và tận dụng quỹ đất hiện có.\n*   **Tham vọng sản xuất pin lithium và hợp tác VinFast:** Đại hội cổ đông DGC đã thông qua việc nâng tỷ lệ chia cổ tức lên 40% và công bố tham vọng sản xuất pin lithium cho xe điện, cùng với tiến độ hợp tác với VinFast, mở ra hướng đi mới trong lĩnh vực công nghệ cao và năng lượng sạch.\n\n**2. DCM (CTCP Phân bón Dầu khí Cà Mau)**\n*   **Kết quả kinh doanh 9 tháng đầu năm:** DCM đạt doanh thu 12.432 tỷ đồng, tăng 35% so với cùng kỳ và lãi sau thuế gần 1.528 tỷ đồng, tăng 45%, cho thấy hiệu quả hoạt động và tăng trưởng lợi nhuận mạnh mẽ.\n*   **Hoạt động M&A:** DCM đã hoàn thành giao dịch mua 100% vốn góp tại một công ty con, cho thấy chiến lược mở rộng quy mô và củng cố vị thế trên thị trường.\n*   **Chuyển đổi cơ cấu tổ chức:** PVCFC (DCM) chính thức trở thành Tổng công ty Phân bón Dầu khí Cà Mau, đánh dấu bước chuyển mình quan trọng trong chiến lược phát triển và quản trị doanh nghiệp.\n\n**3. PHR (CTCP Cao su Phước Hòa)**\n*   **Kết quả kinh doanh quý IV/2024 và lũy kế năm 2024:** PHR ghi nhận lãi 242 tỷ đồng trong quý IV, nhưng lũy kế cả năm 2024 đạt 494,95 tỷ đồng, giảm 25,2% so với cùng kỳ, cho thấy một năm kinh doanh có phần sụt giảm.\n*   **Tiềm năng từ dự án VSIP 3 và các dự án mới:** BVSC nhận định PHR có thể hưởng 3.400 tỷ lợi nhuận từ cả vòng đời VSIP 3 và đang ấp ủ phát triển 3 dự án quy mô 3.000ha, cho thấy tiềm năng lớn từ việc chuyển đổi đất cao su sang khu công nghiệp.\n*   **Thu hồi đất cho dự án KCN VSIP III:** PHR đã nhận quyết định thu hồi đất để thực hiện dự án Khu công nghiệp Việt Nam-Singapore III, khẳng định việc chuyển đổi mục đích sử dụng đất và phát triển bất động sản công nghiệp là trọng tâm chiến lược.\n\nBảng so sánh chỉ số tài chính\n\n| Chỉ số | GVR | DGC | DCM | PHR |\n| --- | --- | --- | --- | --- |\n| **P/E** | N/A | N/A | N/A | N/A |\n| **P/B** | N/A | N/A | N/A | N/A |\n| **ROE** | 11.40% | 21.50% | 18.60% | 16.90% |\n| **Biên LNG** | N/A | N/A | N/A | N/A |', '[RAG DATA]: Dưới đây là các số liệu được trích xuất từ thông tin cung cấp:\n\n*   **Doanh thu thuần bán hàng và cung cấp dịch vụ (09 tháng đầu năm 2025):** 20.433.592.115.694 VND\n*   **Lợi nhuận sau thuế thu nhập doanh nghiệp (09 tháng đầu năm 2025):** 5.217.316.335.497 VND\n*   **Tổng tài sản (tại ngày 30/09/2025):** 84.839.406.230.403 VND\n*   **Tổng nợ phải trả (tại ngày 30/09/2025):** 20.906.425.637.178 VND\n*   **Lưu chuyển tiền thuần từ hoạt động kinh doanh (09 tháng đầu năm 2025):** 4.348.387.841.590 VND\n*   **Lưu chuyển tiền thuần từ hoạt động đầu tư (09 tháng đầu năm 2025):** 1.356.463.589.948 VND\n*   **Lưu chuyển tiền thuần từ hoạt động tài chính (09 tháng đầu năm 2025):** (4.415.856.299.951) VND']","# 🇻🇳 BÁO CÁO PHÂN TÍCH: GVR
*(Ngày: 29/11/2025)*

## 1. 📰 Điểm tin Vĩ mô & Ngành

*   **Áp lực lãi suất ngắn hạn:** Trong tháng 11, NHNN đã phải bơm ròng hơn 106,000 tỷ đồng để hỗ trợ thanh khoản, đẩy lãi suất liên ngân hàng và lãi suất huy động tăng. Điều này có thể tạo áp lực lên chi phí vốn của các doanh nghiệp trong những tháng tới. Tuy nhiên, hành động quyết liệt của NHNN cũng cho thấy nỗ lực ổn định thị trường.
*   **Dòng vốn FDI là điểm sáng:** Vốn FDI đăng ký 11 tháng đầu năm 2025 tăng trưởng 15.6% so với cùng kỳ, đạt 31.52 tỷ USD. Đây là tín hiệu cực kỳ tích cực, khẳng định niềm tin của nhà đầu tư quốc tế vào triển vọng kinh tế Việt Nam, tạo nền tảng vững chắc cho sự tăng trưởng của các doanh nghiệp trong chuỗi cung ứng.
*   **Tâm lý thị trường tích cực từ nhóm Blue-chips:** Sự kiện vốn hóa Vingroup (VIC) vượt mốc 1 triệu tỷ đồng đã tạo hiệu ứng tâm lý tích cực, củng cố niềm tin vào các cổ phiếu đầu ngành và có thể thu hút dòng tiền quay trở lại nhóm VN30.

## 2. 🏢 Sức khỏe Tài chính & Vị thế

*   **Kết quả kinh doanh:** Theo BCTC, 9 tháng đầu năm 2025, GVR ghi nhận kết quả kinh doanh vững chắc với **Doanh thu thuần đạt 20,433.6 tỷ đồng** và **Lợi nhuận sau thuế đạt 5,217.3 tỷ đồng**. Dòng tiền từ hoạt động kinh doanh dương hơn 4,348 tỷ đồng là một điểm cộng, cho thấy sức khỏe tài chính ổn định. Tại ngày 30/09/2025, tổng tài sản của GVR đạt 84,839.4 tỷ đồng và tổng nợ phải trả là 20,906.4 tỷ đồng, duy trì cơ cấu vốn an toàn.

*   **Định giá & Hiệu quả hoạt động:** Các chỉ số định giá P/E và P/B hiện chưa có dữ liệu đầy đủ để so sánh. Tuy nhiên, chỉ số hiệu quả sinh lời trên vốn chủ sở hữu (ROE) của GVR ở mức 11.40%, thấp hơn đáng kể so với các doanh nghiệp cùng ngành như DGC (21.50%) và PHR (16.90%), cho thấy GVR cần cải thiện hiệu quả sử dụng vốn.

*   **Chuyển động Đối thủ:**
    *   **DGC & DCM:** Các đối thủ trong mảng hóa chất - phân bón như DGC và DCM đều cho thấy kết quả kinh doanh tăng trưởng ấn tượng và có những chiến lược mở rộng tham vọng (DGC lấn sân sang pin lithium, DCM thực hiện M&A).
    *   **PHR:** Mặc dù lợi nhuận năm 2024 sụt giảm, PHR sở hữu tiềm năng tăng trưởng đột phá trong tương lai từ việc chuyển đổi đất cao su sang bất động sản khu công nghiệp, đặc biệt là dự án VSIP III. Đây là hướng đi tương đồng với GVR và tạo ra sự cạnh tranh trực tiếp.

**Bảng so sánh chỉ số tài chính**

| Chỉ số | GVR | DGC | DCM | PHR |
| :--- | :---: | :---: | :---: | :---: |
| **ROE** | 11.40% | 21.50% | 18.60% | 16.90% |

## 3. 📈 Góc nhìn Kỹ thuật

*   **Xu hướng & Chỉ báo:** GVR đang trong một xu hướng giảm giá rõ ràng trên cả khung thời gian trung và dài hạn. Giá cổ phiếu hiện đang vận động dưới tất cả các đường trung bình động quan trọng (MA20, MA50, MA200), cho thấy áp lực bán đang hoàn toàn chiếm ưu thế. Chỉ báo MACD cũng đang cho tín hiệu tiêu cực, củng cố cho xu hướng giảm này.

*   **Vùng giá quan trọng:**
    *   **Vùng kháng cự:** **31,000 đồng** – **35,000 đồng**.
    *   **Vùng hỗ trợ:** **24,000 đồng** – **21,000 đồng**.

![Biểu đồ GVR](charts/GVR_20251129.png)

## 4. 🎯 KẾT LUẬN & KHUYẾN NGHỊ

**KHUYẾN NGHỊ: CHỜ MUA**

Dù GVR có nền tảng cơ bản vững chắc với kết quả kinh doanh 9 tháng đầu năm 2025 khả quan, các yếu tố kỹ thuật lại đang cho thấy rủi ro rất lớn trong ngắn hạn.

*   **Luận điểm 1 (Cơ bản):** Nền tảng tài chính của GVR ổn định, tuy nhiên hiệu quả sinh lời (ROE) còn khiêm tốn so với các doanh nghiệp đầu ngành khác.
*   **Luận điểm 2 (Kỹ thuật):** Cổ phiếu đang trong xu hướng giảm giá mạnh và chưa có dấu hiệu tạo đáy. Việc mua vào ở thời điểm hiện tại tiềm ẩn rủi ro thua lỗ cao.

**Hành động đề xuất:** Nhà đầu tư nên kiên nhẫn đứng ngoài quan sát, chờ đợi cổ phiếu kiểm định lại các vùng hỗ trợ mạnh quanh **24,000 đồng**. Chỉ xem xét giải ngân khi xuất hiện các tín hiệu đảo chiều đáng tin cậy như giá vượt lên trên đường MA20 kèm khối lượng giao dịch lớn hoặc hình thành các mẫu nến tăng giá thuyết phục.",0.7619047619047619,0.64763108874612
AUTO_ANALYSIS_HDB_3,Phân tích tổng hợp cổ phiếu HDB,"['[MARKET REPORT]: - **Tin tức 1: Ngân hàng Nhà nước bơm ròng mạnh, lãi suất liên ngân hàng và huy động tăng**\n    *   **Nội dung:** Trong tháng 11/2025, Ngân hàng Nhà nước (NHNN) đã bơm ròng hơn 106.000 tỷ đồng vào hệ thống thông qua thị trường mở, đặc biệt ưu tiên các kỳ hạn dài (91 ngày chiếm 46%). Động thái này nhằm ổn định thanh khoản và lãi suất liên ngân hàng trong bối cảnh nhu cầu vốn ngắn hạn gia tăng do tín dụng tăng tốc cuối năm. Lãi suất liên ngân hàng nhiều kỳ hạn đã vượt 6%. Đồng thời, nhiều ngân hàng thương mại, bao gồm cả ""big 4"" như VietinBank, đã điều chỉnh tăng lãi suất huy động. Tỷ giá trung tâm tăng 62 đồng trong tháng 11, nhưng USD tự do ""hạ sốt"" sau hai tuần giảm liên tiếp, một phần do kỳ vọng Fed cắt giảm lãi suất trong tháng 12.\n    *   **Đánh giá tác động:** Tin này **tiêu cực** đối với thị trường chứng khoán.\n        *   Việc NHNN bơm ròng mạnh cho thấy thanh khoản hệ thống đang căng thẳng, buộc NHNN phải can thiệp để hỗ trợ.\n        *   Lãi suất liên ngân hàng và lãi suất huy động tăng sẽ làm tăng chi phí vốn của các doanh nghiệp và ngân hàng, ảnh hưởng đến lợi nhuận và khả năng mở rộng kinh doanh. Điều này có thể khiến dòng tiền chảy ra khỏi kênh chứng khoán để tìm kiếm lợi suất cao hơn ở kênh tiền gửi hoặc trái phiếu.\n        *   Áp lực tăng lãi suất cho vay có thể hiện hữu vào đầu năm 2026, ảnh hưởng đến tăng trưởng tín dụng và hoạt động sản xuất kinh doanh.\n\n- **Tin tức 2: Vốn đầu tư trực tiếp nước ngoài (FDI) đăng ký tăng trưởng mạnh**\n    *   **Nội dung:** Tính đến ngày 31/10/2025, tổng vốn đầu tư nước ngoài đăng ký vào Việt Nam đạt 31,52 tỷ USD, tăng 15,6% so với cùng kỳ năm trước.\n    *   **Đánh giá tác động:** Tin này **tích cực** đối với thị trường chứng khoán.\n        *   Sự tăng trưởng mạnh mẽ của FDI cho thấy niềm tin của nhà đầu tư nước ngoài vào môi trường kinh doanh và tiềm năng phát triển của Việt Nam.\n        *   Dòng vốn FDI đổ vào sẽ thúc đẩy sản xuất, tạo việc làm, tăng trưởng xuất khẩu và chuyển giao công nghệ, qua đó hỗ trợ tăng trưởng kinh tế vĩ mô.\n        *   Điều này cũng có thể gián tiếp hỗ trợ các ngành liên quan đến sản xuất, công nghiệp, bất động sản khu công nghiệp trên thị trường chứng khoán.\n\n- **Tin tức 3: GDP quý III/2025 ước tăng 7,56%**\n    *   **Nội dung:** Tổng sản phẩm trong nước (GDP) quý III/2025 ước tăng 7,56%, cho thấy nền kinh tế đang phục hồi mạnh mẽ sau giai đoạn đầu năm. Tăng trưởng GDP 9 tháng phản ánh sự phục hồi bền vững của nền kinh tế.\n    *   **Đánh giá tác động:** Tin này **tích cực** đối với thị trường chứng khoán.\n        *   Mức tăng trưởng GDP ấn tượng trong quý III/2025 là tín hiệu mạnh mẽ về sự phục hồi và sức khỏe của nền kinh tế Việt Nam.\n        *   Tăng trưởng kinh tế cao thường đi kèm với kỳ vọng về lợi nhuận doanh nghiệp tốt hơn, thu hút dòng tiền vào thị trường chứng khoán.\n        *   Điều này củng cố niềm tin của nhà đầu tư vào triển vọng dài hạn của thị trường.', '[TECHNICAL REPORT]: ![Biểu đồ HDB](charts/HDB_20251129.png)\n\n### Phân tích Kỹ thuật Chuyên sâu cho HDB (Ngày 2025-11-29)\n\n**1. Xu hướng hiện tại:**\n*   **Xu hướng dài hạn:** TĂNG (Uptrend)\n*   **Xu hướng trung hạn:** TĂNG (Uptrend)\n*   **Nhận định:** HDB đang trong một xu hướng tăng mạnh mẽ cả về dài hạn và trung hạn, cho thấy sức khỏe tốt của cổ phiếu.\n\n**2. Vị thế giá so với các đường MA (SMA20 & SMA50):**\n*   Dựa trên xu hướng tăng và biểu đồ, giá hiện tại của HDB (32.00 VND) đang nằm trên cả đường SMA20 và SMA50. Điều này củng cố thêm cho nhận định về xu hướng tăng và cho thấy động lực tăng giá vẫn đang được duy trì.\n\n**3. RSI đang ở vùng nào:**\n*   **RSI:** 75.53\n*   **Nhận định:** RSI đang nằm trong vùng QUÁ MUA (>70). Điều này cho thấy cổ phiếu đã tăng giá mạnh trong thời gian gần đây và có thể đối mặt với áp lực điều chỉnh giảm trong ngắn hạn để hạ nhiệt chỉ báo.\n\n**4. Xác định các vùng Hỗ trợ cứng và Kháng cự cứng:**\n*   **Kháng cự cứng (R1):** 34 VND\n*   **Hỗ trợ cứng (S1):** 30 VND\n*   **Hỗ trợ cứng (S2):** 29 VND\n*   **Hỗ trợ cứng (S3):** 23 VND\n\n**5. Nhận định: MUA, BÁN hay CHỜ MUA**\n\nDựa trên phân tích kỹ thuật chuyên sâu:\n\n*   **CHỜ MUA:** Hiện tại, với RSI đang ở vùng quá mua (75.53), HDB có khả năng cao sẽ có một nhịp điều chỉnh trong ngắn hạn. Nhà đầu tư nên chờ đợi giá điều chỉnh về các vùng hỗ trợ mạnh hơn như S1 (30 VND) hoặc S2 (29 VND) và quan sát tín hiệu đảo chiều tăng trở lại (ví dụ: nến pin bar, nến nhấn chìm tăng) trước khi xem xét vị thế mua.\n*   **MUA:** Có thể xem xét mua nếu giá điều chỉnh về vùng 30 VND hoặc 29 VND và xuất hiện các tín hiệu xác nhận đảo chiều tăng.\n*   **BÁN:** Nếu giá không thể vượt qua kháng cự R1 (34 VND) và xuất hiện các tín hiệu đảo chiều giảm mạnh, nhà đầu tư có thể cân nhắc chốt lời một phần.', '[FINANCIAL REPORT]: Nhận định chung về vị thế tài chính:\nHDB có chỉ số ROE cao nhất trong số các ngân hàng được so sánh (24.80%), cho thấy hiệu quả sử dụng vốn của ngân hàng này khá tốt so với các đối thủ lớn như VCB, CTG, BID, TCB, VPB. Tuy nhiên, các chỉ số P/E và P/B không có sẵn để so sánh, điều này hạn chế khả năng đánh giá định giá thị trường của HDB so với các đối thủ.\n\nChuyển động đối thủ:\n\n**Vietcombank (VCB):**\n1. Từ ngày 01/01/2024, Vietcombank triển khai chương trình ưu đãi lãi suất cho vay ngắn hạn sản xuất kinh doanh với quy mô lên tới 160.000 tỷ đồng, cho thấy nỗ lực hỗ trợ doanh nghiệp và mở rộng tín dụng.\n2. Vietcombank sắp chi hơn 3.700 tỷ đồng trả cổ tức bằng tiền mặt, thể hiện cam kết chia sẻ lợi nhuận với cổ đông.\n3. Vietcombank Quảng Trị bị chỉ ra loạt vi phạm trong cho vay; đồng thời ngân hàng cũng hợp tác triển khai hỗ trợ hộ kinh doanh chuyển đổi số, cho thấy cả thách thức trong quản lý rủi ro và nỗ lực thích ứng với xu hướng số hóa.\n\n**VietinBank (CTG):**\n1. VietinBank (CTG) tất toán 3.000 tỷ đồng trái phiếu, khởi động kế hoạch huy động vốn mới quy mô lớn, cho thấy hoạt động tái cơ cấu nguồn vốn và chuẩn bị cho các kế hoạch tăng trưởng.\n2. VietinBank sẽ chi hơn 2.400 tỷ đồng trả cổ tức tiền mặt năm 2024, sau lần gần nhất cách đây 4 năm, đây là một tín hiệu tích cực cho cổ đông sau thời gian dài không chia cổ tức tiền mặt.\n3. CTG: Nghị quyết HĐQT nhất trí thông qua Hợp đồng thế chấp với Công ty Cho thuê tài chính TNHH MTV VietinBank - VietinBank Leasing, cho thấy sự mở rộng hoạt động kinh doanh thông qua các công ty con.\n\n**BIDV (BID):**\n1. BIDV đặt mục tiêu tăng lãi mạnh, lên 20.600 tỷ đồng, tăng 52% so với năm ngoái, thể hiện tham vọng tăng trưởng lợi nhuận ấn tượng.\n2. BIDV dự kiến chi hơn 3.159 tỷ đồng để trả cổ tức tiền mặt cho cổ đông, cho thấy khả năng sinh lời và cam kết với nhà đầu tư.\n3. BID: Nghị quyết HĐQT về việc thông qua Hồ sơ đăng ký chào bán trái phiếu tăng vốn BIDV ra công chúng, cho thấy kế hoạch tăng cường nguồn vốn để phục vụ cho các hoạt động kinh doanh và mở rộng.\n\nBảng so sánh chỉ số tài chính:\n\n| Chỉ số | HDB | VCB | CTG | BID | TCB | VPB |\n| --- | --- | --- | --- | --- | --- | --- |\n| **P/E** | N/A | N/A | N/A | N/A | N/A | N/A |\n| **P/B** | N/A | N/A | N/A | N/A | N/A | N/A |\n| **ROE** | 24.80% | 17.00% | 21.60% | 17.80% | 14.30% | 14.20% |\n| **Biên LNG** | N/A | N/A | N/A | N/A | N/A | N/A |', '[RAG DATA]: Dưới đây là các số liệu của HDB:\n\n*   **Doanh thu**: 22.562.390 Triệu đồng (Lợi nhuận thuần từ hoạt động kinh doanh trước chi phí dự phòng rủi ro tín dụng)\n*   **Lợi nhuận**: 11.832.548 Triệu đồng (Lợi nhuận sau thuế)\n*   **Tổng tài sản**: 781.937.368 Triệu đồng\n*   **Nợ**: 713.530.315 Triệu đồng (Tổng nợ phải trả)\n*   **Dòng tiền**: 31.389.002 Triệu đồng (Lưu chuyển tiền thuần trong kỳ)']","# 🇻🇳 BÁO CÁO PHÂN TÍCH: HDB
*(Ngày: 29/11/2025)*

## 1. 📰 Điểm tin Vĩ mô & Ngành

Bối cảnh vĩ mô và ngành ngân hàng đang có những diễn biến trái chiều. Về mặt tích cực, nền kinh tế Việt Nam cho thấy sức phục hồi mạnh mẽ với **GDP quý III/2025 ước tăng 7.56%** và dòng vốn **FDI đăng ký 10 tháng đầu năm đạt 31.52 tỷ USD (tăng 15.6%)**. Điều này củng cố niềm tin vào triển vọng tăng trưởng tín dụng và chất lượng tài sản của ngành ngân hàng trong dài hạn.

Tuy nhiên, trong ngắn hạn, thị trường đang đối mặt với áp lực từ việc **Ngân hàng Nhà nước (NHNN) bơm ròng hơn 106,000 tỷ đồng** trong tháng 11 để ổn định thanh khoản. Động thái này đã đẩy lãi suất liên ngân hàng và lãi suất huy động tăng lên, có thể làm tăng chi phí vốn (CASA) của các ngân hàng và tạo áp lực lên biên lãi ròng (NIM) trong các quý tới.

## 2. 🏢 Sức khỏe Tài chính & Vị thế

- **Kết quả kinh doanh:** Dựa trên báo cáo tài chính gần nhất, HDB ghi nhận kết quả kinh doanh vững chắc:
    - **Lợi nhuận thuần từ HĐKD (trước dự phòng):** 22,562 tỷ đồng
    - **Lợi nhuận sau thuế:** 11,833 tỷ đồng
    - **Tổng tài sản:** 781,937 tỷ đồng
    - **Tổng nợ phải trả:** 713,530 tỷ đồng
    - **Lưu chuyển tiền thuần trong kỳ:** 31,389 tỷ đồng

- **Định giá & Hiệu quả hoạt động:** HDB nổi bật với chỉ số **ROE đạt 24.80%**, cao nhất so với các ngân hàng lớn trong ngành. Điều này cho thấy khả năng sử dụng vốn chủ sở hữu để tạo ra lợi nhuận của HDB đang rất hiệu quả, vượt trội hơn các đối thủ cạnh tranh.

- **Chuyển động Đối thủ:** Ngành ngân hàng đang rất năng động. Các đối thủ lớn như Vietcombank (VCB), VietinBank (CTG), và BIDV (BID) đều đang tích cực triển khai các gói cho vay ưu đãi, trả cổ tức tiền mặt cho cổ đông và lên kế hoạch huy động vốn mới. Điều này cho thấy sự cạnh tranh gay gắt nhưng cũng phản ánh kỳ vọng tăng trưởng của toàn ngành.

**Bảng so sánh chỉ số tài chính:**

| Chỉ số | HDB | VCB | CTG | BID | TCB | VPB |
| :--- | :---: | :---: | :---: | :---: | :---: | :---: |
| **ROE** | **24.80%** | 17.00% | 21.60% | 17.80% | 14.30% | 14.20% |

## 3. 📈 Góc nhìn Kỹ thuật

- **Xu hướng & Chỉ báo:** Cổ phiếu HDB đang duy trì một **xu hướng tăng (Uptrend)** mạnh mẽ trong cả trung và dài hạn. Giá hiện tại đang vận động phía trên các đường trung bình động quan trọng (SMA20, SMA50), xác nhận sức mạnh của xu hướng. Tuy nhiên, chỉ báo sức mạnh tương đối **RSI đang ở mức 75.53**, cho thấy cổ phiếu đã đi vào vùng **quá mua**, tiềm ẩn rủi ro điều chỉnh trong ngắn hạn.

- **Vùng giá quan trọng:**
    - **Kháng cự mạnh:** 34,000 đồng
    - **Hỗ trợ gần:** 30,000 đồng
    - **Hỗ trợ sâu hơn:** 29,000 đồng

![Biểu đồ HDB](charts/HDB_20251129.png)

## 4. 🎯 KẾT LUẬN & KHUYẾN NGHỊ

**Khuyến nghị: CHỜ MUA**

**Luận điểm đầu tư:**

1.  **Nền tảng cơ bản vững chắc:** HDB là một trong những ngân hàng có hiệu quả hoạt động cao nhất ngành, thể hiện qua chỉ số ROE vượt trội (24.80%). Kết quả kinh doanh tăng trưởng ổn định là điểm tựa vững chắc cho giá cổ phiếu trong dài hạn.
2.  **Rủi ro điều chỉnh ngắn hạn:** Về mặt kỹ thuật, cổ phiếu đang trong vùng quá mua (RSI > 70). Điều này cho thấy áp lực chốt lời có thể gia tăng và một nhịp điều chỉnh là cần thiết để giá cổ phiếu có thể đi lên bền vững hơn.

**Chiến lược hành động:** Nhà đầu tư nên kiên nhẫn chờ đợi HDB điều chỉnh về các vùng hỗ trợ kỹ thuật mạnh quanh **29,000 - 30,000 đồng/cổ phiếu**. Đây là vùng giá hấp dẫn hơn để xem xét mở vị thế mua mới, đón đầu nhịp tăng tiếp theo của cổ phiếu.",0.8548387096774194,0.6259607574884722
AUTO_ANALYSIS_HPG_4,Phân tích tổng hợp cổ phiếu HPG,"['[MARKET REPORT]:  Chia sẻ bài viết này: Tin liên quan Tin mới nhất Tin đọc nhiều nhất Tin tức khác Tin tức cùng chuyên mục Tin tức khác Tin tức cùng chuyên mục Tin tức khác Tin tức cùng chuyên mục Tin tức khác Tin tức cùng chuyên mục Tin tức khác Tin tức cùng chuyên mục Tin tức khác Tin tức cùng chuyên mục Tin tức khác Tin tức cùng chuyên mục Tin tức khác Tin tức cùng chuyên mục Tin tức khác Tin tức cùng chuyên mục Tin tức khác Tin tức cùng chuyên mục Tin tức khác Tin tức cùng chuyên mục Tin tức khác Tin tức cùng chuyên mục Tin tức khác Tin tức cùng chuyên mục Tin tức khác Tin tức cùng chuyên mục Tin tức khác Tin tức cùng chuyên mục Tin tức khác Tin tức cùng chuyên mục Tin tức khác Tin tức cùng chuyên mục Tin tức khác Tin tức cùng chuyên mục Tin tức khác Tin tức cùng chuyên mục Tin tức khác Tin tức cùng chuyên mục Tin tức khác Tin tức cùng chuyên mục Tin tức khác Tin tức cùng chuyên mục Tin tức khác Tin tức cùng chuyên mục Tin tức khác Tin tức cùng chuyên mục Tin tức khác Tin tức cùng chuyên mục Tin tức khác Tin tức cùng chuyên mục Tin tức khác Tin tức cùng chuyên mục Tin tức khác Tin tức cùng chuyên mục Tin tức khác Tin tức cùng chuyên mục Tin tức khác Tin tức cùng chuyên mục Tin tức khác Tin tức cùng chuyên mục Tin tức khác Tin tức cùng chuyên mục Tin tức khác Tin tức cùng chuyên mục Tin tức khác Tin tức cùng chuyên mục Tin tức khác Tin tức cùng chuyên mục Tin tức khác Tin tức cùng chuyên mục Tin tức khác Tin tức cùng chuyên mục Tin tức khác Tin tức cùng chuyên mục Tin tức khác Tin tức cùng chuyên mục Tin tức khác Tin tức cùng chuyên mục Tin tức khác Tin tức cùng chuyên mục Tin tức khác Tin tức cùng chuyên mục Tin tức khác Tin tức cùng chuyên mục Tin tức khác Tin tức cùng chuyên mục Tin tức khác Tin tức cùng chuyên mục Tin tức khác Tin tức cùng chuyên mục Tin tức khác Tin tức cùng chuyên mục Tin tức khác Tin tức cùng chuyên mục Tin tức khác Tin tức cùng chuyên mục Tin tức khác Tin tức cùng chuyên mục Tin tức khác Tin tức cùng chuyên mục Tin tức khác Tin tức cùng chuyên mục Tin tức khác Tin tức cùng chuyên mục Tin tức khác Tin tức cùng chuyên mục Tin tức khác Tin tức cùng chuyên mục Tin tức khác Tin tức cùng chuyên mục Tin tức khác Tin tức cùng chuyên mục Tin tức khác Tin tức cùng chuyên mục Tin tức khác Tin tức cùng chuyên mục Tin tức khác Tin tức cùng chuyên mục Tin tức khác Tin tức cùng chuyên mục Tin tức khác Tin tức cùng chuyên mục Tin tức khác Tin tức cùng chuyên mục Tin tức khác Tin tức cùng chuyên mục Tin tức khác Tin tức cùng chuyên mục Tin tức khác Tin tức cùng chuyên mục Tin tức khác Tin tức cùng chuyên mục Tin tức khác Tin tức cùng chuyên mục Tin tức khác Tin tức cùng chuyên mục Tin tức khác Tin tức cùng chuyên mục Tin tức khác Tin tức cùng chuyên mục Tin tức khác Tin tức cùng chuyên mục Tin tức khác Tin tức cùng chuyên mục Tin tức khác Tin tức cùng chuyên mục Tin tức khác Tin tức cùng chuyên mục Tin tức khác Tin tức cùng chuyên mục Tin tức khác Tin tức cùng chuyên mục Tin tức khác Tin tức cùng chuyên mục Tin tức khác Tin tức cùng chuyên mục Tin tức khác Tin tức cùng chuyên mục Tin tức khác Tin tức cùng chuyên mục Tin tức khác Tin tức cùng chuyên mục Tin tức khác Tin tức cùng chuyên mục Tin tức khác Tin tức cùng chuyên mục Tin tức khác Tin tức cùng chuyên mục Tin tức khác Tin tức cùng chuyên mục Tin tức khác Tin tức cùng chuyên mục Tin tức khác Tin tức cùng chuyên mục Tin tức khác Tin tức cùng chuyên mục Tin tức khác Tin tức cùng chuyên mục Tin tức khác Tin tức cùng chuyên mục Tin tức khác Tin tức cùng chuyên mục Tin tức khác Tin tức cùng chuyên mục Tin tức khác Tin tức cùng chuyên mục Tin tức khác Tin tức cùng chuyên mục Tin tức khác Tin tức cùng chuyên mục Tin tức khác Tin tức cùng chuyên mục Tin tức khác Tin tức cùng chuyên mục Tin tức khác Tin tức cùng chuyên mục Tin tức khác Tin tức cùng chuyên mục Tin tức khác Tin tức cùng chuyên mục Tin tức khác Tin tức cùng chuyên mục Tin tức khác Tin tức cùng chuyên mục Tin tức khác Tin tức cùng chuyên mục Tin tức khác Tin tức cùng chuyên mục Tin tức khác Tin tức cùng chuyên mục Tin tức khác Tin tức cùng chuyên mục Tin tức khác Tin tức cùng chuyên mục Tin tức khác Tin tức cùng chuyên mục Tin tức khác Tin tức cùng chuyên mục Tin tức khác Tin tức cùng chuyên mục Tin tức khác Tin tức cùng chuyên mục Tin tức khác Tin tức cùng chuyên mục Tin tức khác Tin tức cùng chuyên mục Tin tức khác Tin tức cùng chuyên mục Tin tức khác Tin tức cùng chuyên mục Tin tức khác Tin tức cùng chuyên mục Tin tức khác Tin tức cùng chuyên mục Tin tức khác Tin tức cùng chuyên mục Tin tức khác Tin tức cùng chuyên mục Tin tức khác Tin tức cùng chuyên mục Tin tức khác Tin tức cùng chuyên mục Tin tức khác Tin tức cùng chuyên mục Tin tức khác Tin tức cùng chuyên mục Tin tức khác Tin tức cùng chuyên mục Tin tức khác Tin tức cùng chuyên mục Tin tức khác Tin tức cùng chuyên mục Tin tức khác Tin tức cùng chuyên mục Tin tức khác Tin tức cùng chuyên mục Tin tức khác Tin tức cùng chuyên mục Tin tức khác Tin tức cùng chuyên mục Tin tức khác Tin tức cùng chuyên mục Tin tức khác Tin tức cùng chuyên mục Tin tức khác Tin tức cùng chuyên mục Tin tức khác Tin tức cùng chuyên mục Tin tức khác Tin tức cùng chuyên mục Tin tức khác Tin tức cùng chuyên mục Tin tức khác Tin tức cùng chuyên mục Tin tức khác Tin tức cùng chuyên mục Tin tức khác Tin tức cùng chuyên mục Tin tức khác Tin tức cùng chuyên mục Tin tức khác Tin tức cùng chuyên mục Tin tức khác Tin tức cùng chuyên mục Tin tức khác Tin tức cùng chuyên mục Tin tức khác Tin tức cùng chuyên mục Tin tức khác Tin tức cùng chuyên mục Tin tức khác Tin tức cùng chuyên mục Tin tức khác Tin tức cùng chuyên mục Tin tức khác Tin tức cùng chuyên mục Tin tức khác Tin tức cùng chuyên mục Tin tức khác Tin tức cùng chuyên mục Tin tức khác Tin tức cùng chuyên mục Tin tức khác Tin tức cùng chuyên mục Tin tức khác Tin tức cùng chuyên mục Tin tức khác Tin tức cùng chuyên mục Tin tức khác Tin tức cùng chuyên mục Tin tức khác Tin tức cùng chuyên mục Tin tức khác Tin tức cùng chuyên mục Tin tức khác Tin tức cùng chuyên mục Tin tức khác Tin tức cùng chuyên mục Tin tức khác Tin tức cùng chuyên mục Tin tức khác Tin tức cùng chuyên mục Tin tức khác Tin tức cùng chuyên mục Tin tức khác Tin tức cùng chuyên mục Tin tức khác Tin tức cùng chuyên mục Tin tức khác Tin tức cùng chuyên mục Tin tức khác Tin tức cùng chuyên mục Tin tức khác Tin tức cùng chuyên mục Tin tức khác Tin tức cùng chuyên mục Tin tức khác Tin tức cùng chuyên mục Tin tức khác Tin tức cùng chuyên mục Tin tức khác Tin tức cùng chuyên mục Tin tức khác Tin tức cùng chuyên mục Tin tức khác Tin tức cùng chuyên mục Tin tức khác Tin tức cùng chuyên mục Tin tức khác Tin tức cùng chuyên mục Tin tức khác Tin tức cùng chuyên mục Tin tức khác Tin tức cùng chuyên mục Tin tức khác Tin tức cùng chuyên mục Tin tức khác Tin tức cùng chuyên mục Tin tức khác Tin tức cùng chuyên mục Tin tức khác Tin tức cùng chuyên mục Tin tức khác Tin tức cùng chuyên mục Tin tức khác Tin tức cùng chuyên mục Tin tức khác Tin tức cùng chuyên mục Tin tức khác Tin tức cùng chuyên mục Tin tức khác Tin tức cùng chuyên mục Tin tức khác Tin tức cùng chuyên mục Tin tức khác Tin tức cùng chuyên mục Tin tức khác Tin tức cùng chuyên mục Tin tức khác Tin tức cùng chuyên mục Tin tức khác Tin tức cùng chuyên mục Tin tức khác Tin tức cùng chuyên mục Tin tức khác Tin tức cùng chuyên mục Tin tức khác Tin tức cùng chuyên mục Tin tức khác Tin tức cùng chuyên mục Tin tức khác Tin tức cùng chuyên mục Tin tức khác Tin tức cùng chuyên mục Tin tức khác Tin tức cùng chuyên mục Tin tức khác Tin tức cùng chuyên mục Tin tức khác Tin tức cùng chuyên mục Tin tức khác Tin tức cùng chuyên mục Tin tức khác Tin tức cùng chuyên mục Tin tức khác Tin tức cùng chuyên mục Tin tức khác Tin tức cùng chuyên mục Tin tức khác Tin tức cùng chuyên mục Tin tức khác Tin tức cùng chuyên mục Tin tức khác Tin tức cùng chuyên mục Tin tức khác Tin tức cùng chuyên mục Tin tức khác Tin tức cùng chuyên mục Tin tức khác Tin tức cùng chuyên mục Tin tức khác Tin tức cùng chuyên mục Tin tức khác Tin tức cùng chuyên mục Tin tức khác Tin tức cùng chuyên mục Tin tức khác Tin tức cùng chuyên mục Tin tức khác Tin tức cùng chuyên mục Tin tức khác Tin tức cùng chuyên mục Tin tức khác Tin tức cùng chuyên mục Tin tức khác Tin tức cùng chuyên mục Tin tức khác Tin tức cùng chuyên mục Tin tức khác Tin tức cùng chuyên mục Tin tức khác Tin tức cùng chuyên mục Tin tức khác Tin tức cùng chuyên mục Tin tức khác Tin tức cùng chuyên mục Tin tức khác Tin tức cùng chuyên mục Tin tức khác Tin tức cùng chuyên mục Tin tức khác Tin tức cùng chuyên mục Tin tức khác Tin tức cùng chuyên mục Tin tức khác Tin tức cùng chuyên mục Tin tức khác Tin tức cùng chuyên mục Tin tức khác Tin tức cùng chuyên mục Tin tức khác Tin tức cùng chuyên mục Tin tức khác Tin tức cùng chuyên mục Tin tức khác Tin tức cùng chuyên mục Tin tức khác Tin tức cùng chuyên mục Tin tức khác Tin tức cùng chuyên mục Tin tức khác Tin tức cùng chuyên mục Tin tức khác Tin tức cùng chuyên mục Tin tức khác Tin tức cùng chuyên mục Tin tức khác Tin tức cùng chuyên mục Tin tức khác Tin tức cùng chuyên mục Tin tức khác Tin tức cùng chuyên mục Tin tức khác Tin tức cùng chuyên mục Tin tức khác Tin tức cùng chuyên mục Tin tức khác Tin tức cùng chuyên mục Tin tức khác Tin tức cùng chuyên mục Tin tức khác Tin tức cùng chuyên mục Tin tức khác Tin tức cùng chuyên mục Tin tức khác Tin tức cùng chuyên mục Tin tức khác Tin tức cùng chuyên mục Tin tức khác Tin tức cùng chuyên mục Tin tức khác Tin tức cùng chuyên mục Tin tức khác Tin tức cùng chuyên mục Tin tức khác Tin tức cùng chuyên mục Tin tức khác Tin tức cùng chuyên mục Tin tức khác Tin tức cùng chuyên mục Tin tức khác Tin tức cùng chuyên mục Tin tức khác Tin tức cùng chuyên mục Tin tức khác Tin tức cùng chuyên mục Tin tức khác Tin tức cùng chuyên mục Tin tức khác Tin tức cùng chuyên mục Tin tức khác Tin tức cùng chuyên mục Tin tức khác Tin tức cùng chuyên mục Tin tức khác Tin tức cùng chuyên mục Tin tức khác Tin tức cùng chuyên mục Tin tức khác Tin tức cùng chuyên mục Tin tức khác Tin tức cùng chuyên mục Tin tức khác Tin tức cùng chuyên mục Tin tức khác Tin tức cùng chuyên mục Tin tức khác Tin tức cùng chuyên mục Tin tức khác Tin tức cùng chuyên mục Tin tức khác Tin tức cùng chuyên mục Tin tức khác Tin tức cùng chuyên mục Tin tức khác Tin tức cùng chuyên mục Tin tức khác Tin tức cùng chuyên mục Tin tức khác Tin tức cùng chuyên mục Tin tức khác Tin tức cùng chuyên mục Tin tức khác Tin tức cùng chuyên mục Tin tức khác Tin tức cùng chuyên mục Tin tức khác Tin tức cùng chuyên mục Tin tức khác Tin tức cùng chuyên mục Tin tức khác Tin tức cùng chuyên mục Tin tức khác Tin tức cùng chuyên mục Tin tức khác Tin tức cùng chuyên mục Tin tức khác Tin tức cùng chuyên mục Tin tức khác Tin tức cùng chuyên mục Tin tức khác Tin tức cùng chuyên mục Tin tức khác Tin tức cùng chuyên mục Tin tức khác Tin tức cùng chuyên mục Tin tức khác Tin tức cùng chuyên mục Tin tức khác Tin tức cùng chuyên mục Tin tức khác Tin tức cùng chuyên mục Tin tức khác Tin tức cùng chuyên mục Tin tức khác Tin tức cùng chuyên mục Tin tức khác Tin tức cùng chuyên mục Tin tức khác Tin tức cùng chuyên mục Tin tức khác Tin tức cùng chuyên mục Tin tức khác Tin tức cùng chuyên mục Tin tức khác Tin tức cùng chuyên mục Tin tức khác Tin tức cùng chuyên mục Tin tức khác Tin tức cùng chuyên mục Tin tức khác Tin tức cùng chuyên mục Tin tức khác Tin tức cùng chuyên mục Tin tức khác Tin tức cùng chuyên mục Tin tức khác Tin tức cùng chuyên mục Tin tức khác Tin tức cùng chuyên mục Tin tức khác Tin tức cùng chuyên mục Tin tức khác Tin tức cùng chuyên mục Tin tức khác Tin tức cùng chuyên mục Tin tức khác Tin tức cùng chuyên mục Tin tức khác Tin tức cùng chuyên mục Tin tức khác Tin tức cùng chuyên mục Tin tức khác Tin tức cùng chuyên mục Tin tức khác Tin tức cùng chuyên mục Tin tức khác Tin tức cùng chuyên mục Tin tức khác Tin tức cùng chuyên mục Tin tức khác Tin tức cùng chuyên mục Tin tức khác Tin tức cùng chuyên mục Tin tức khác Tin tức cùng chuyên mục Tin tức khác Tin tức cùng chuyên mục Tin tức khác Tin tức cùng chuyên mục Tin tức khác Tin tức cùng chuyên mục Tin tức khác Tin tức cùng chuyên mục Tin tức khác Tin tức cùng chuyên mục Tin tức khác Tin tức cùng chuyên mục Tin tức khác Tin tức cùng chuyên mục Tin tức khác Tin tức cùng chuyên mục Tin tức khác Tin tức cùng chuyên mục Tin tức khác Tin tức cùng chuyên mục Tin tức khác Tin tức cùng chuyên mục Tin tức khác Tin tức cùng chuyên mục Tin tức khác Tin tức cùng chuyên mục Tin tức khác Tin tức cùng chuyên mục Tin tức khác Tin tức cùng chuyên mục Tin tức khác Tin tức cùng chuyên mục Tin tức khác Tin tức cùng chuyên mục Tin tức khác Tin tức cùng chuyên mục Tin tức khác Tin tức cùng chuyên mục Tin tức khác Tin tức cùng chuyên mục Tin tức khác Tin tức cùng chuyên mục Tin tức khác Tin tức cùng chuyên mục Tin tức khác Tin tức cùng chuyên mục Tin tức khác Tin tức cùng chuyên mục Tin tức khác Tin tức cùng chuyên mục Tin tức khác Tin tức cùng chuyên mục Tin tức khác Tin tức cùng chuyên mục Tin tức khác Tin tức cùng chuyên mục Tin tức khác Tin tức cùng chuyên mục Tin tức khác Tin tức cùng chuyên mục Tin tức khác Tin tức cùng chuyên mục Tin tức khác Tin tức cùng chuyên mục Tin tức khác Tin tức cùng chuyên mục Tin tức khác Tin tức cùng chuyên mục Tin tức khác Tin tức cùng chuyên mục Tin tức khác Tin tức cùng chuyên mục Tin tức khác Tin tức cùng chuyên mục Tin tức khác Tin tức cùng chuyên mục Tin tức khác Tin tức cùng chuyên mục Tin tức khác Tin tức cùng chuyên mục Tin tức khác Tin tức cùng chuyên mục Tin tức khác Tin tức cùng chuyên mục Tin tức khác Tin tức cùng chuyên mục Tin tức khác Tin tức cùng chuyên mục Tin tức khác Tin tức cùng chuyên mục Tin tức khác Tin tức cùng chuyên mục Tin tức khác Tin tức cùng chuyên mục Tin tức khác Tin tức cùng chuyên mục Tin tức khác Tin tức cùng chuyên mục Tin tức khác Tin tức cùng chuyên mục Tin tức khác Tin tức cùng chuyên mục Tin tức khác Tin tức cùng chuyên mục Tin tức khác Tin tức cùng chuyên mục Tin tức khác Tin tức cùng chuyên mục Tin tức khác Tin tức cùng chuyên mục Tin tức khác Tin tức cùng chuyên mục Tin tức khác Tin tức cùng chuyên mục Tin tức khác Tin tức cùng chuyên mục Tin tức khác Tin tức cùng chuyên mục Tin tức khác Tin tức cùng chuyên mục Tin tức khác Tin tức cùng chuyên mục Tin tức khác Tin tức cùng chuyên mục Tin tức khác Tin tức cùng chuyên mục Tin tức khác Tin tức cùng chuyên mục Tin tức khác Tin tức cùng chuyên mục Tin tức khác Tin tức cùng chuyên mục Tin tức khác Tin tức cùng chuyên mục Tin tức khác Tin tức cùng chuyên mục Tin tức khác Tin tức cùng chuyên mục Tin tức khác Tin tức cùng chuyên mục Tin tức khác Tin tức cùng chuyên mục Tin tức khác Tin tức cùng chuyên mục Tin tức khác Tin tức cùng chuyên mục Tin tức khác Tin tức cùng chuyên mục Tin tức khác Tin tức cùng chuyên mục Tin tức khác Tin tức cùng chuyên mục Tin tức khác Tin tức cùng chuyên mục Tin tức khác Tin tức cùng chuyên mục Tin tức khác Tin tức cùng chuyên mục Tin tức khác Tin tức cùng chuyên mục Tin tức khác Tin tức cùng chuyên mục Tin tức khác Tin tức cùng chuyên mục Tin tức khác Tin tức cùng chuyên mục Tin tức khác Tin tức cùng chuyên mục Tin tức khác Tin tức cùng chuyên mục Tin tức khác Tin tức cùng chuyên mục Tin tức khác Tin tức cùng chuyên mục Tin tức khác Tin tức cùng chuyên mục Tin tức khác Tin tức cùng chuyên mục Tin tức khác Tin tức cùng chuyên mục Tin tức khác Tin tức cùng chuyên mục Tin tức khác Tin tức cùng chuyên mục Tin tức khác Tin tức cùng chuyên mục Tin tức khác Tin tức cùng chuyên mục Tin tức khác Tin tức cùng chuyên mục Tin tức khác Tin tức cùng chuyên mục Tin tức khác Tin tức cùng chuyên mục Tin tức khác Tin tức cùng chuyên mục Tin tức khác Tin tức cùng chuyên mục Tin tức khác Tin tức cùng chuyên mục Tin tức khác Tin tức cùng chuyên mục Tin tức khác Tin tức cùng chuyên mục Tin tức khác Tin tức cùng chuyên mục Tin tức khác Tin tức cùng chuyên mục Tin tức khác Tin tức cùng chuyên mục Tin tức khác Tin tức cùng chuyên mục Tin tức khác Tin tức cùng chuyên mục Tin tức khác Tin tức cùng chuyên mục Tin tức khác Tin tức cùng chuyên mục Tin tức khác Tin tức cùng chuyên mục Tin tức khác Tin tức cùng chuyên mục Tin tức khác Tin tức cùng chuyên mục Tin tức khác Tin tức cùng chuyên mục Tin tức khác Tin tức cùng chuyên mục Tin tức khác Tin tức cùng chuyên mục Tin tức khác Tin tức cùng chuyên mục Tin tức khác Tin tức cùng chuyên mục Tin tức khác Tin tức cùng chuyên mục Tin tức khác Tin tức cùng chuyên mục Tin tức khác Tin tức cùng chuyên mục Tin tức khác Tin tức cùng chuyên mục Tin tức khác Tin tức cùng chuyên mục Tin tức khác Tin tức cùng chuyên mục Tin tức khác Tin tức cùng chuyên mục Tin tức khác Tin tức cùng chuyên mục Tin tức khác Tin tức cùng chuyên mục Tin tức khác Tin tức cùng chuyên mục Tin tức khác Tin tức cùng chuyên mục Tin tức khác Tin tức cùng chuyên mục Tin tức khác Tin tức cùng chuyên mục Tin tức khác Tin tức cùng chuyên mục Tin tức khác Tin tức cùng chuyên mục Tin tức khác Tin tức cùng chuyên mục Tin tức khác Tin tức cùng chuyên mục Tin tức khác Tin tức cùng chuyên mục Tin tức khác Tin tức cùng chuyên mục Tin tức khác Tin tức cùng chuyên mục Tin tức khác Tin tức cùng chuyên mục Tin tức khác Tin tức cùng chuyên mục Tin tức khác Tin tức cùng chuyên mục Tin tức khác Tin tức cùng chuyên mục Tin tức khác Tin tức cùng chuyên mục Tin tức khác Tin tức cùng chuyên mục Tin tức khác Tin tức cùng chuyên mục Tin tức khác Tin tức cùng chuyên mục Tin tức khác Tin tức cùng chuyên mục Tin tức khác Tin tức cùng chuyên mục Tin tức khác Tin tức cùng chuyên mục Tin tức khác Tin tức cùng chuyên mục Tin tức khác Tin tức cùng chuyên mục Tin tức khác Tin tức cùng chuyên mục Tin tức khác Tin tức cùng chuyên mục Tin tức khác Tin tức cùng chuyên mục Tin tức khác Tin tức cùng chuyên mục Tin tức khác Tin tức cùng chuyên mục Tin tức khác Tin tức cùng chuyên mục Tin tức khác Tin tức cùng chuyên mục Tin tức khác Tin tức cùng chuyên mục Tin tức khác Tin tức cùng chuyên mục Tin tức khác Tin tức cùng chuyên mục Tin tức khác Tin tức cùng chuyên mục Tin tức khác Tin tức cùng chuyên mục Tin tức khác Tin tức cùng chuyên mục Tin tức khác Tin tức cùng chuyên mục Tin tức khác Tin tức cùng chuyên mục Tin tức khác Tin tức cùng chuyên mục Tin tức khác Tin tức cùng chuyên mục Tin tức khác Tin tức cùng chuyên mục Tin tức khác Tin tức cùng chuyên mục Tin tức khác Tin tức cùng chuyên mục Tin tức khác Tin tức cùng chuyên mục Tin tức khác Tin tức cùng chuyên mục Tin tức khác Tin tức cùng chuyên mục Tin tức khác Tin tức cùng chuyên mục Tin tức khác Tin tức cùng chuyên mục Tin tức khác Tin tức cùng chuyên mục Tin tức khác Tin tức cùng chuyên mục Tin tức khác Tin tức cùng chuyên mục Tin tức khác Tin tức cùng chuyên mục Tin tức khác Tin tức cùng chuyên mục Tin tức khác Tin tức cùng chuyên mục Tin tức khác Tin tức cùng chuyên mục Tin tức khác Tin tức cùng chuyên mục Tin tức khác Tin tức cùng chuyên mục Tin tức khác Tin tức cùng chuyên mục Tin tức khác Tin tức cùng chuyên mục Tin tức khác Tin tức cùng chuyên mục Tin tức khác Tin tức cùng chuyên mục Tin tức khác Tin tức cùng chuyên mục Tin tức khác Tin tức cùng chuyên mục Tin tức khác Tin tức cùng chuyên mục Tin tức khác Tin tức cùng chuyên mục Tin tức khác Tin tức cùng chuyên mục Tin tức khác Tin tức cùng chuyên mục Tin tức khác Tin tức cùng chuyên mục Tin tức khác Tin tức cùng chuyên mục Tin tức khác Tin tức cùng chuyên mục Tin tức khác Tin tức cùng chuyên mục Tin tức khác Tin tức cùng chuyên mục Tin tức khác Tin tức cùng chuyên mục Tin tức khác Tin tức cùng chuyên mục Tin tức khác Tin tức cùng chuyên mục Tin tức khác Tin tức cùng chuyên mục Tin tức khác Tin tức cùng chuyên mục Tin tức khác Tin tức cùng chuyên mục Tin tức khác Tin tức cùng chuyên mục Tin tức khác Tin tức cùng chuyên mục Tin tức khác Tin tức cùng chuyên mục Tin tức khác Tin tức cùng chuyên mục Tin tức khác Tin tức cùng chuyên mục Tin tức khác Tin tức cùng chuyên mục Tin tức khác Tin tức cùng chuyên mục Tin tức khác Tin tức cùng chuyên mục Tin tức khác Tin tức cùng chuyên mục Tin tức khác Tin tức cùng chuyên mục Tin tức khác Tin tức cùng chuyên mục Tin tức khác Tin tức cùng chuyên mục Tin tức khác Tin tức cùng chuyên mục Tin tức khác Tin tức cùng chuyên mục Tin tức khác Tin tức cùng chuyên mục Tin tức khác Tin tức cùng chuyên mục Tin tức khác Tin tức cùng chuyên mục Tin tức khác Tin tức cùng chuyên mục Tin tức khác Tin tức cùng chuyên mục Tin tức khác Tin tức cùng chuyên mục Tin tức khác Tin tức cùng chuyên mục Tin tức khác Tin tức cùng chuyên mục Tin tức khác Tin tức cùng chuyên mục Tin tức khác Tin tức cùng chuyên mục Tin tức khác Tin tức cùng chuyên mục Tin tức khác Tin tức cùng chuyên mục Tin tức khác Tin tức cùng chuyên mục Tin tức khác Tin tức cùng chuyên mục Tin tức khác Tin tức cùng chuyên mục Tin tức khác Tin tức cùng chuyên mục Tin tức khác Tin tức cùng chuyên mục Tin tức khác Tin tức cùng chuyên mục Tin tức khác Tin tức cùng chuyên mục Tin tức khác Tin tức cùng chuyên mục Tin tức khác Tin tức cùng chuyên mục Tin tức khác Tin tức cùng chuyên mục Tin tức khác Tin tức cùng chuyên mục Tin tức khác Tin tức cùng chuyên mục Tin tức khác Tin tức cùng chuyên mục Tin tức khác Tin tức cùng chuyên mục Tin tức khác Tin tức cùng chuyên mục Tin tức khác Tin tức cùng chuyên mục Tin tức khác Tin tức cùng chuyên mục Tin tức khác Tin tức cùng chuyên mục Tin tức khác Tin tức cùng chuyên mục Tin tức khác Tin tức cùng chuyên mục Tin tức khác Tin tức cùng chuyên mục Tin tức khác Tin tức cùng chuyên mục Tin tức khác Tin tức cùng chuyên mục Tin tức khác Tin tức cùng chuyên mục Tin tức khác Tin tức cùng chuyên mục Tin tức khác Tin tức cùng chuyên mục Tin tức khác Tin tức cùng chuyên mục Tin tức khác Tin tức cùng chuyên mục Tin tức khác Tin tức cùng chuyên mục Tin tức khác Tin tức cùng chuyên mục Tin tức khác Tin tức cùng chuyên mục Tin tức khác Tin tức cùng chuyên mục Tin tức khác Tin tức cùng chuyên mục Tin tức khác Tin tức cùng chuyên mục Tin tức khác Tin tức cùng chuyên mục Tin tức khác Tin tức cùng chuyên mục Tin tức khác Tin tức cùng chuyên mục Tin tức khác Tin tức cùng chuyên mục Tin tức khác Tin tức cùng chuyên mục Tin tức khác Tin tức cùng chuyên mục Tin tức khác Tin tức cùng chuyên mục Tin tức khác Tin tức cùng chuyên mục Tin tức khác Tin tức cùng chuyên mục Tin tức khác Tin tức cùng chuyên mục Tin tức khác Tin tức cùng chuyên mục Tin tức khác Tin tức cùng chuyên mục Tin tức khác Tin tức cùng chuyên mục Tin tức khác Tin tức cùng chuyên mục Tin tức khác Tin tức cùng chuyên mục Tin tức khác Tin tức cùng chuyên mục Tin tức khác Tin tức cùng chuyên mục Tin tức khác Tin tức cùng chuyên mục Tin tức khác Tin tức cùng chuyên mục Tin tức khác Tin tức cùng chuyên mục Tin tức khác Tin tức cùng chuyên mục Tin tức khác Tin tức cùng chuyên mục Tin tức khác Tin tức cùng chuyên mục Tin tức khác Tin tức cùng chuyên mục Tin tức khác Tin tức cùng chuyên mục Tin tức khác Tin tức cùng chuyên mục Tin tức khác Tin tức cùng chuyên mục Tin tức khác Tin tức cùng chuyên mục Tin tức khác Tin tức cùng chuyên mục Tin tức khác Tin tức cùng chuyên mục Tin tức khác Tin tức cùng chuyên mục Tin tức khác Tin tức cùng chuyên mục Tin tức khác Tin tức cùng chuyên mục Tin tức khác Tin tức cùng chuyên mục Tin tức khác Tin tức cùng chuyên mục Tin tức khác Tin tức cùng chuyên mục Tin tức khác Tin tức cùng chuyên mục Tin tức khác Tin tức cùng chuyên mục Tin tức khác Tin tức cùng chuyên mục Tin tức khác Tin tức cùng chuyên mục Tin tức khác Tin tức cùng chuyên mục Tin tức khác Tin tức cùng chuyên mục Tin tức khác Tin tức cùng chuyên mục Tin tức khác Tin tức cùng chuyên mục Tin tức khác Tin tức cùng chuyên mục Tin tức khác Tin tức cùng chuyên mục Tin tức khác Tin tức cùng chuyên mục Tin tức khác Tin tức cùng chuyên mục Tin tức khác Tin tức cùng chuyên mục Tin tức khác Tin tức cùng chuyên mục Tin tức khác Tin tức cùng chuyên mục Tin tức khác Tin tức cùng chuyên mục Tin tức khác Tin tức cùng chuyên mục Tin tức khác Tin tức cùng chuyên mục Tin tức khác Tin tức cùng chuyên mục Tin tức khác Tin tức cùng chuyên mục Tin tức khác Tin tức cùng chuyên mục Tin tức khác Tin tức cùng chuyên mục Tin tức khác Tin tức cùng chuyên mục Tin tức khác Tin tức cùng chuyên mục Tin tức khác Tin tức cùng chuyên mục Tin tức khác Tin tức cùng chuyên mục Tin tức khác Tin tức cùng chuyên mục Tin tức khác Tin tức cùng chuyên mục Tin tức khác Tin tức cùng chuyên mục Tin tức khác Tin tức cùng chuyên mục Tin tức khác Tin tức cùng chuyên mục Tin tức khác Tin tức cùng chuyên mục Tin tức khác Tin tức cùng chuyên mục Tin tức khác Tin tức cùng chuyên mục Tin tức khác Tin tức cùng chuyên mục Tin tức khác Tin tức cùng chuyên mục Tin tức khác Tin tức cùng chuyên mục Tin tức khác Tin tức cùng chuyên mục Tin tức khác Tin tức cùng chuyên mục Tin tức khác Tin tức cùng chuyên mục Tin tức khác Tin tức cùng chuyên mục Tin tức khác Tin tức cùng chuyên mục Tin tức khác Tin tức cùng chuyên mục Tin tức khác Tin tức cùng chuyên mục Tin tức khác Tin tức cùng chuyên mục Tin tức khác Tin tức cùng chuyên mục Tin tức khác Tin tức cùng chuyên mục Tin tức khác Tin tức cùng chuyên mục Tin tức khác Tin tức cùng chuyên mục Tin tức khác Tin tức cùng chuyên mục Tin tức khác Tin tức cùng chuyên mục Tin tức khác Tin tức cùng chuyên mục Tin tức khác Tin tức cùng chuyên mục Tin tức khác Tin tức cùng chuyên mục Tin tức khác Tin tức cùng chuyên mục Tin tức khác Tin tức cùng chuyên mục Tin tức khác Tin tức cùng chuyên mục Tin tức khác Tin tức cùng chuyên mục Tin tức khác Tin tức cùng chuyên mục Tin tức khác Tin tức cùng chuyên mục Tin tức khác Tin tức cùng chuyên mục Tin tức khác Tin tức cùng chuyên mục Tin tức khác Tin tức cùng chuyên mục Tin tức khác Tin tức cùng chuyên mục Tin tức khác Tin tức cùng chuyên mục Tin tức khác Tin tức cùng chuyên mục Tin tức khác Tin tức cùng chuyên mục Tin tức khác Tin tức cùng chuyên mục Tin tức khác Tin tức cùng chuyên mục Tin tức khác Tin tức cùng chuyên mục Tin tức khác Tin tức cùng chuyên mục Tin tức khác Tin tức cùng chuyên mục Tin tức khác Tin tức cùng chuyên mục Tin tức khác Tin tức cùng chuyên mục Tin tức khác Tin tức cùng chuyên mục Tin tức khác Tin tức cùng chuyên mục Tin tức khác Tin tức cùng chuyên mục Tin tức khác Tin tức cùng chuyên mục Tin tức khác Tin tức cùng chuyên mục Tin tức khác Tin tức cùng chuyên mục Tin tức khác Tin tức cùng chuyên mục Tin tức khác Tin tức cùng chuyên mục Tin tức khác Tin tức cùng chuyên mục Tin tức khác Tin tức cùng chuyên mục Tin tức khác Tin tức cùng chuyên mục Tin tức khác Tin tức cùng chuyên mục Tin tức khác Tin tức cùng chuyên mục Tin tức khác Tin tức cùng chuyên mục Tin tức khác Tin tức cùng chuyên mục Tin tức khác Tin tức cùng chuyên mục Tin tức khác Tin tức cùng chuyên mục Tin tức khác Tin tức cùng chuyên mục Tin tức khác Tin tức cùng chuyên mục Tin tức khác Tin tức cùng chuyên mục Tin tức khác Tin tức cùng chuyên mục Tin tức khác Tin tức cùng chuyên mục Tin tức khác Tin tức cùng chuyên mục Tin tức khác Tin tức cùng chuyên mục Tin tức khác Tin tức cùng chuyên mục Tin tức khác Tin tức cùng chuyên mục Tin tức khác Tin tức cùng chuyên mục Tin tức khác Tin tức cùng chuyên mục Tin tức khác Tin tức cùng chuyên mục Tin tức khác Tin tức cùng chuyên mục Tin tức khác Tin tức cùng chuyên mục Tin tức khác Tin tức cùng chuyên mục Tin tức khác Tin tức cùng chuyên mục Tin tức khác Tin tức cùng chuyên mục Tin tức khác Tin tức cùng chuyên mục Tin tức khác Tin tức cùng chuyên mục Tin tức khác Tin tức cùng chuyên mục Tin tức khác Tin tức cùng chuyên mục Tin tức khác Tin tức cùng chuyên mục Tin tức khác Tin tức cùng chuyên mục Tin tức khác Tin tức cùng chuyên mục Tin tức khác Tin tức cùng chuyên mục Tin tức khác Tin tức cùng chuyên mục Tin tức khác Tin tức cùng chuyên mục Tin tức khác Tin tức cùng chuyên mục Tin tức khác Tin tức cùng chuyên mục Tin tức khác Tin tức cùng chuyên mục Tin tức khác Tin tức cùng chuyên mục Tin tức khác Tin tức cùng chuyên mục Tin tức khác Tin tức cùng chuyên mục Tin tức khác Tin tức cùng chuyên mục Tin tức khác Tin tức cùng chuyên mục Tin tức khác Tin tức cùng chuyên mục Tin tức khác Tin tức cùng chuyên mục Tin tức khác Tin tức cùng chuyên mục Tin tức khác Tin tức cùng chuyên mục Tin tức khác Tin tức cùng chuyên mục Tin tức khác Tin tức cùng chuyên mục Tin tức khác Tin tức cùng chuyên mục Tin tức khác Tin tức cùng chuyên mục Tin tức khác Tin tức cùng chuyên mục Tin tức khác Tin tức cùng chuyên mục Tin tức khác Tin tức cùng chuyên mục Tin tức khác Tin tức cùng chuyên mục Tin tức khác Tin tức cùng chuyên mục Tin tức khác Tin tức cùng chuyên mục Tin tức khác Tin tức cùng chuyên mục Tin tức khác Tin tức cùng chuyên mục Tin tức khác Tin tức cùng chuyên mục Tin tức khác Tin tức cùng chuyên mục Tin tức khác Tin tức cùng chuyên mục Tin tức khác Tin tức cùng chuyên mục Tin tức khác Tin tức cùng chuyên mục Tin tức khác Tin tức cùng chuyên mục Tin tức khác Tin tức cùng chuyên mục Tin tức khác Tin tức cùng chuyên mục Tin tức khác Tin tức cùng chuyên mục Tin tức khác Tin tức cùng chuyên mục Tin tức khác Tin tức cùng chuyên mục Tin tức khác Tin tức cùng chuyên mục Tin tức khác Tin tức cùng chuyên mục Tin tức khác Tin tức cùng chuyên mục Tin tức khác Tin tức cùng chuyên mục Tin tức khác Tin tức cùng chuyên mục Tin tức khác Tin tức cùng chuyên mục Tin tức khác Tin tức cùng chuyên mục Tin tức khác Tin tức cùng chuyên mục Tin tức khác Tin tức cùng chuyên mục Tin tức khác Tin tức cùng chuyên mục Tin tức khác Tin tức cùng chuyên mục Tin tức khác Tin tức cùng chuyên mục Tin tức khác Tin tức cùng chuyên mục Tin tức khác Tin tức cùng chuyên mục Tin tức khác Tin tức cùng chuyên mục Tin tức khác Tin tức cùng chuyên mục Tin tức khác Tin tức cùng chuyên mục Tin tức khác Tin tức cùng chuyên mục Tin tức khác Tin tức cùng chuyên mục Tin tức khác Tin tức cùng chuyên mục Tin tức khác Tin tức cùng chuyên mục Tin tức khác Tin tức cùng chuyên mục Tin tức khác Tin tức cùng chuyên mục Tin tức khác Tin tức cùng chuyên mục Tin tức khác Tin tức cùng chuyên mục Tin tức khác Tin tức cùng chuyên mục Tin tức khác Tin tức cùng chuyên mục Tin tức khác Tin tức cùng chuyên mục Tin tức khác Tin tức cùng chuyên mục Tin tức khác Tin tức cùng chuyên mục Tin tức khác Tin tức cùng chuyên mục Tin tức khác Tin tức cùng chuyên mục Tin tức khác Tin tức cùng chuyên mục Tin tức khác Tin tức cùng chuyên mục Tin tức khác Tin tức cùng chuyên mục Tin tức khác Tin tức cùng chuyên mục Tin tức khác Tin tức cùng chuyên mục Tin tức khác Tin tức cùng chuyên mục Tin tức khác Tin tức cùng chuyên mục Tin tức khác Tin tức cùng chuyên mục Tin tức khác Tin tức cùng chuyên mục Tin tức khác Tin tức cùng chuyên mục Tin tức khác Tin tức cùng chuyên mục Tin tức khác Tin tức cùng chuyên mục Tin tức khác Tin tức cùng chuyên mục Tin tức khác Tin tức cùng chuyên mục Tin tức khác Tin tức cùng chuyên mục Tin tức khác Tin tức cùng chuyên mục Tin tức khác Tin tức cùng chuyên mục Tin tức khác Tin tức cùng chuyên mục Tin tức khác Tin tức cùng chuyên mục Tin tức khác Tin tức cùng chuyên mục Tin tức khác Tin tức cùng chuyên mục Tin tức khác Tin tức cùng chuyên mục Tin tức khác Tin tức cùng chuyên mục Tin tức khác Tin tức cùng chuyên mục Tin tức khác Tin tức cùng chuyên mục Tin tức khác Tin tức cùng chuyên mục Tin tức khác Tin tức cùng chuyên mục Tin tức khác Tin tức cùng chuyên mục Tin tức khác Tin tức cùng chuyên mục Tin tức khác Tin tức cùng chuyên mục Tin tức khác Tin tức cùng chuyên mục Tin tức khác Tin tức cùng chuyên mục Tin tức khác Tin tức cùng chuyên mục Tin tức khác Tin tức cùng chuyên mục Tin tức khác Tin tức cùng chuyên mục Tin tức khác Tin tức cùng chuyên mục Tin tức khác Tin tức cùng chuyên mục Tin tức khác Tin tức cùng chuyên mục Tin tức khác Tin tức cùng chuyên mục Tin tức khác Tin tức cùng chuyên mục Tin tức khác Tin tức cùng chuyên mục Tin tức khác Tin tức cùng chuyên mục Tin tức khác Tin tức cùng chuyên mục Tin tức khác Tin tức cùng chuyên mục Tin tức khác Tin tức cùng chuyên mục Tin tức khác Tin tức cùng chuyên mục Tin tức khác Tin tức cùng chuyên mục Tin tức khác Tin tức cùng chuyên mục Tin tức khác Tin tức cùng chuyên mục Tin tức khác Tin tức cùng chuyên mục Tin tức khác Tin tức cùng chuyên mục Tin tức khác Tin tức cùng chuyên mục Tin tức khác Tin tức cùng chuyên mục Tin tức khác Tin tức cùng chuyên mục Tin tức khác Tin tức cùng chuyên mục Tin tức khác Tin tức cùng chuyên mục Tin tức khác Tin tức cùng chuyên mục Tin tức khác Tin tức cùng chuyên mục Tin tức khác Tin tức cùng chuyên mục Tin tức khác Tin tức cùng chuyên mục Tin tức khác Tin tức cùng chuyên mục Tin tức khác Tin tức cùng chuyên mục Tin tức khác Tin tức cùng chuyên mục Tin tức khác Tin tức cùng chuyên mục Tin tức khác Tin tức cùng chuyên mục Tin tức khác Tin tức cùng chuyên mục Tin tức khác Tin tức cùng chuyên mục Tin tức khác Tin tức cùng chuyên mục Tin tức khác Tin tức cùng chuyên mục Tin tức khác Tin tức cùng chuyên mục Tin tức khác Tin tức cùng chuyên mục Tin tức khác Tin tức cùng chuyên mục Tin tức khác Tin tức cùng chuyên mục Tin tức khác Tin tức cùng chuyên mục Tin tức khác Tin tức cùng chuyên mục Tin tức khác Tin tức cùng chuyên mục Tin tức khác Tin tức cùng chuyên mục Tin tức khác Tin tức cùng chuyên mục Tin tức khác Tin tức cùng chuyên mục Tin tức khác Tin tức cùng chuyên mục Tin tức khác Tin tức cùng chuyên mục Tin tức khác Tin tức cùng chuyên mục Tin tức khác Tin tức cùng chuyên mục Tin tức khác Tin tức cùng chuyên mục Tin tức khác Tin tức cùng chuyên mục Tin tức khác Tin tức cùng chuyên mục Tin tức khác Tin tức cùng chuyên mục Tin tức khác Tin tức cùng chuyên mục Tin tức khác Tin tức cùng chuyên mục Tin tức khác Tin tức cùng chuyên mục Tin tức khác Tin tức cùng chuyên mục Tin tức khác Tin tức cùng chuyên mục Tin tức khác Tin tức cùng chuyên mục Tin tức khác Tin tức cùng chuyên mục Tin tức khác Tin tức cùng chuyên mục Tin tức khác Tin tức cùng chuyên mục Tin tức khác Tin tức cùng chuyên mục Tin tức khác Tin tức cùng chuyên mục Tin tức khác Tin tức cùng chuyên mục Tin tức khác Tin tức cùng chuyên mục Tin tức khác Tin tức cùng chuyên mục Tin tức khác Tin tức cùng chuyên mục Tin tức khác Tin tức cùng chuyên mục Tin tức khác Tin tức cùng chuyên mục Tin tức khác Tin tức cùng chuyên mục Tin tức khác Tin tức cùng chuyên mục Tin tức khác Tin tức cùng chuyên mục Tin tức khác Tin tức cùng chuyên mục Tin tức khác Tin tức cùng chuyên mục Tin tức khác Tin tức cùng chuyên mục Tin tức khác Tin tức cùng chuyên mục Tin tức khác Tin tức cùng chuyên mục Tin tức khác Tin tức cùng chuyên mục Tin tức khác Tin tức cùng chuyên mục Tin tức khác Tin tức cùng chuyên mục Tin tức khác Tin tức cùng chuyên mục Tin tức khác Tin tức cùng chuyên mục Tin tức khác Tin tức cùng chuyên mục Tin tức khác Tin tức cùng chuyên mục Tin tức khác Tin tức cùng chuyên mục Tin tức khác Tin tức cùng chuyên mục Tin tức khác Tin tức cùng chuyên mục Tin tức khác Tin tức cùng chuyên mục Tin tức khác Tin tức cùng chuyên mục Tin tức khác Tin tức cùng chuyên mục Tin tức khác Tin tức cùng chuyên mục Tin tức khác Tin tức cùng chuyên mục Tin tức khác Tin tức cùng chuyên mục Tin tức khác Tin tức cùng chuyên mục Tin tức khác Tin tức cùng chuyên mục Tin tức khác Tin tức cùng chuyên mục Tin tức khác Tin tức cùng chuyên mục Tin tức khác Tin tức cùng chuyên mục Tin tức khác Tin tức cùng chuyên mục Tin tức khác Tin tức cùng chuyên mục Tin tức khác Tin tức cùng chuyên mục Tin tức khác Tin tức cùng chuyên mục Tin tức khác Tin tức cùng chuyên mục Tin tức khác Tin tức cùng chuyên mục Tin tức khác Tin tức cùng chuyên mục Tin tức khác Tin tức cùng chuyên mục Tin tức khác Tin tức cùng chuyên mục Tin tức khác Tin tức cùng chuyên mục Tin tức khác Tin tức cùng chuyên mục Tin tức khác Tin tức cùng chuyên mục Tin tức khác Tin tức cùng chuyên mục Tin tức khác Tin tức cùng chuyên mục Tin tức khác Tin tức cùng chuyên mục Tin tức khác Tin tức cùng chuyên mục Tin tức khác Tin tức cùng chuyên mục Tin tức khác Tin tức cùng chuyên mục Tin tức khác Tin tức cùng chuyên mục Tin tức khác Tin tức cùng chuyên mục Tin tức khác Tin tức cùng chuyên mục Tin tức khác Tin tức cùng chuyên mục Tin tức khác Tin tức cùng chuyên mục Tin tức khác Tin tức cùng chuyên mục Tin tức khác Tin tức cùng chuyên mục Tin tức khác Tin tức cùng chuyên mục Tin tức khác Tin tức cùng chuyên mục Tin tức khác Tin tức cùng chuyên mục Tin tức khác Tin tức cùng chuyên mục Tin tức khác Tin tức cùng chuyên mục Tin tức khác Tin tức cùng chuyên mục Tin tức khác Tin tức cùng chuyên mục Tin tức khác Tin tức cùng chuyên mục Tin tức khác Tin tức cùng chuyên mục Tin tức khác Tin tức cùng chuyên mục Tin tức khác Tin tức cùng chuyên mục Tin tức khác Tin tức cùng chuyên mục Tin tức khác Tin tức cùng chuyên mục Tin tức khác Tin tức cùng chuyên mục Tin tức khác Tin tức cùng chuyên mục Tin tức khác Tin tức cùng chuyên mục Tin tức khác Tin tức cùng chuyên mục Tin tức khác Tin tức cùng chuyên mục Tin tức khác Tin tức cùng chuyên mục Tin tức khác Tin tức cùng chuyên mục Tin tức khác Tin tức cùng chuyên mục Tin tức khác Tin tức cùng chuyên mục Tin tức khác Tin tức cùng chuyên mục Tin tức khác Tin tức cùng chuyên mục Tin tức khác Tin tức cùng chuyên mục Tin tức khác Tin tức cùng chuyên mục Tin tức khác Tin tức cùng chuyên mục Tin tức khác Tin tức cùng chuyên mục Tin tức khác Tin tức cùng chuyên mục Tin tức khác Tin tức cùng chuyên mục Tin tức khác Tin tức cùng chuyên mục Tin tức khác Tin tức cùng chuyên mục Tin tức khác Tin tức cùng chuyên mục Tin tức khác Tin tức cùng chuyên mục Tin tức khác Tin tức cùng chuyên mục Tin tức khác Tin tức cùng chuyên mục Tin tức khác Tin tức cùng chuyên mục Tin tức khác Tin tức cùng chuyên mục Tin tức khác Tin tức cùng chuyên mục Tin tức khác Tin tức cùng chuyên mục Tin tức khác Tin tức cùng chuyên mục Tin tức khác Tin tức cùng chuyên mục Tin tức khác Tin tức cùng chuyên mục Tin tức khác Tin tức cùng chuyên mục Tin tức khác Tin tức cùng chuyên mục Tin tức khác Tin tức cùng chuyên mục Tin tức khác Tin tức cùng chuyên mục Tin tức khác Tin tức cùng chuyên mục Tin tức khác Tin tức cùng chuyên mục Tin tức khác Tin tức cùng chuyên mục Tin tức khác Tin tức cùng chuyên mục Tin tức khác Tin tức cùng chuyên mục Tin tức khác Tin tức cùng chuyên mục Tin tức khác Tin tức cùng chuyên mục Tin tức khác Tin tức cùng chuyên mục Tin tức khác Tin tức cùng chuyên mục Tin tức khác Tin tức cùng chuyên mục Tin tức khác Tin tức cùng chuyên mục Tin tức khác Tin tức cùng chuyên mục Tin tức khác Tin tức cùng chuyên mục Tin tức khác Tin tức cùng chuyên mục Tin tức khác Tin tức cùng chuyên mục Tin tức khác Tin tức cùng chuyên mục Tin tức khác Tin tức cùng chuyên mục Tin tức khác Tin tức cùng chuyên mục Tin tức khác Tin tức cùng chuyên mục Tin tức khác Tin tức cùng chuyên mục Tin tức khác Tin tức cùng chuyên mục Tin tức khác Tin tức cùng chuyên mục Tin tức khác Tin tức cùng chuyên mục Tin tức khác Tin tức cùng chuyên mục Tin tức khác Tin tức cùng chuyên mục Tin tức khác Tin tức cùng chuyên mục Tin tức khác Tin tức cùng chuyên mục Tin tức khác Tin tức cùng chuyên mục Tin tức khác Tin tức cùng chuyên mục Tin tức khác Tin tức cùng chuyên mục Tin tức khác Tin tức cùng chuyên mục Tin tức khác Tin tức cùng chuyên mục Tin tức khác Tin tức cùng chuyên mục Tin tức khác Tin tức cùng chuyên mục Tin tức khác Tin tức cùng chuyên mục Tin tức khác Tin tức cùng chuyên mục Tin tức khác Tin tức cùng chuyên mục Tin tức khác Tin tức cùng chuyên mục Tin tức khác Tin tức cùng chuyên mục Tin tức khác Tin tức cùng chuyên mục Tin tức khác Tin tức cùng chuyên mục Tin tức khác Tin tức cùng chuyên mục Tin tức khác Tin tức cùng chuyên mục Tin tức khác Tin tức cùng chuyên mục Tin tức khác Tin tức cùng chuyên mục Tin tức khác Tin tức cùng chuyên mục Tin tức khác Tin tức cùng chuyên mục Tin tức khác Tin tức cùng chuyên mục Tin tức khác Tin tức cùng chuyên mục Tin tức khác Tin tức cùng chuyên mục Tin tức khác Tin tức cùng chuyên mục Tin tức khác Tin tức cùng chuyên mục Tin tức khác Tin tức cùng chuyên mục Tin tức khác Tin tức cùng chuyên mục Tin tức khác Tin tức cùng chuyên mục Tin tức khác Tin tức cùng chuyên mục Tin tức khác Tin tức cùng chuyên mục Tin tức khác Tin tức cùng chuyên mục Tin tức khác Tin tức cùng chuyên mục Tin tức khác Tin tức cùng chuyên mục Tin tức khác Tin tức cùng chuyên mục Tin tức khác Tin tức cùng chuyên mục Tin tức khác Tin tức cùng chuyên mục Tin tức khác Tin tức cùng chuyên mục Tin tức khác Tin tức cùng chuyên mục Tin tức khác Tin tức cùng chuyên mục Tin tức khác Tin tức cùng chuyên mục Tin tức khác Tin tức cùng chuyên mục Tin tức khác Tin tức cùng chuyên mục Tin tức khác Tin tức cùng chuyên mục Tin tức khác Tin tức cùng chuyên mục Tin tức khác Tin tức cùng chuyên mục Tin tức khác Tin tức cùng chuyên mục Tin tức khác Tin tức cùng chuyên mục Tin tức khác Tin tức cùng chuyên mục Tin tức khác Tin tức cùng chuyên mục Tin tức khác Tin tức cùng chuyên mục Tin tức khác Tin tức cùng chuyên mục Tin tức khác Tin tức cùng chuyên mục Tin tức khác Tin tức cùng chuyên mục Tin tức khác Tin tức cùng chuyên mục Tin tức khác Tin tức cùng chuyên mục Tin tức khác Tin tức cùng chuyên mục Tin tức khác Tin tức cùng chuyên mục Tin tức khác Tin tức cùng chuyên mục Tin tức khác Tin tức cùng chuyên mục Tin tức khác Tin tức cùng chuyên mục Tin tức khác Tin tức cùng chuyên mục Tin tức khác Tin tức cùng chuyên mục Tin tức khác Tin tức cùng chuyên mục Tin tức khác Tin tức cùng chuyên mục Tin tức khác Tin tức cùng chuyên mục Tin tức khác Tin tức cùng chuyên mục Tin tức khác Tin tức cùng chuyên mục Tin tức khác Tin tức cùng chuyên mục Tin tức khác Tin tức cùng chuyên mục Tin tức khác Tin tức cùng chuyên mục Tin tức khác Tin tức cùng chuyên mục Tin tức khác Tin tức cùng chuyên mục Tin tức khác Tin tức cùng chuyên mục Tin tức khác Tin tức cùng chuyên mục Tin tức khác Tin tức cùng chuyên mục Tin tức khác Tin tức cùng chuyên mục Tin tức khác Tin tức cùng chuyên mục Tin tức khác Tin tức cùng chuyên mục Tin tức khác Tin tức cùng chuyên mục Tin tức khác Tin tức cùng chuyên mục Tin tức khác Tin tức cùng chuyên mục Tin tức khác Tin tức cùng chuyên mục Tin tức khác Tin tức cùng chuyên mục Tin tức khác Tin tức cùng chuyên mục Tin tức khác Tin tức cùng chuyên mục Tin tức khác Tin tức cùng chuyên mục Tin tức khác Tin tức cùng chuyên mục Tin tức khác Tin tức cùng chuyên mục Tin tức khác Tin tức cùng chuyên mục Tin tức khác Tin tức cùng chuyên mục Tin tức khác Tin tức cùng chuyên mục Tin tức khác Tin tức cùng chuyên mục Tin tức khác Tin tức cùng chuyên mục Tin tức khác Tin tức cùng chuyên mục Tin tức khác Tin tức cùng chuyên mục Tin tức khác Tin tức cùng chuyên mục Tin tức khác Tin tức cùng chuyên mục Tin tức khác Tin tức cùng chuyên mục Tin tức khác Tin tức cùng chuyên mục Tin tức khác Tin tức cùng chuyên mục Tin tức khác Tin tức cùng chuyên mục Tin tức khác Tin tức cùng chuyên mục Tin tức khác Tin tức cùng chuyên mục Tin tức khác Tin tức cùng chuyên mục Tin tức khác Tin tức cùng chuyên mục Tin tức khác Tin tức cùng chuyên mục Tin tức khác Tin tức cùng chuyên mục Tin tức khác Tin tức cùng chuyên mục Tin tức khác Tin tức cùng chuyên mục Tin tức khác Tin tức cùng chuyên mục Tin tức khác Tin tức cùng chuyên mục Tin tức khác Tin tức cùng chuyên mục Tin tức khác Tin tức cùng chuyên mục Tin tức khác Tin tức cùng chuyên mục Tin tức khác Tin tức cùng chuyên mục Tin tức khác Tin tức cùng chuyên mục Tin tức khác Tin tức cùng chuyên mục Tin tức khác Tin tức cùng chuyên mục Tin tức khác Tin tức cùng chuyên mục Tin tức khác Tin tức cùng chuyên mục Tin tức khác Tin tức cùng chuyên mục Tin tức khác Tin tức cùng chuyên mục Tin tức khác Tin tức cùng chuyên mục Tin tức khác Tin tức cùng chuyên mục Tin tức khác Tin tức cùng chuyên mục Tin tức khác Tin tức cùng chuyên mục Tin tức khác Tin tức cùng chuyên mục Tin tức khác Tin tức cùng chuyên mục Tin tức khác Tin tức cùng chuyên mục Tin tức khác Tin tức cùng chuyên mục Tin tức khác Tin tức cùng chuyên mục Tin tức khác Tin tức cùng chuyên mục Tin tức khác Tin tức cùng chuyên mục Tin tức khác Tin tức cùng chuyên mục Tin tức khác Tin tức cùng chuyên mục Tin tức khác Tin tức cùng chuyên mục Tin tức khác Tin tức cùng chuyên mục Tin tức khác Tin tức cùng chuyên mục Tin tức khác Tin tức cùng chuyên mục Tin tức khác Tin tức cùng chuyên mục Tin tức khác Tin tức cùng chuyên mục Tin tức khác Tin tức cùng chuyên mục Tin tức khác Tin tức cùng chuyên mục Tin tức khác Tin tức cùng chuyên mục Tin tức khác Tin tức cùng chuyên mục Tin tức khác Tin tức cùng chuyên mục Tin tức khác Tin tức cùng chuyên mục Tin tức khác Tin tức cùng chuyên mục Tin tức khác Tin tức cùng chuyên mục Tin tức khác Tin tức cùng chuyên mục Tin tức khác Tin tức cùng chuyên mục Tin tức khác Tin tức cùng chuyên mục Tin tức khác Tin tức cùng chuyên mục Tin tức khác Tin tức cùng chuyên mục Tin tức khác Tin tức cùng chuyên mục Tin tức khác Tin tức cùng chuyên mục Tin tức khác Tin tức cùng chuyên mục Tin tức khác Tin tức cùng chuyên mục Tin tức khác Tin tức cùng chuyên mục Tin tức khác Tin tức cùng chuyên mục Tin tức khác Tin tức cùng chuyên mục Tin tức khác Tin tức cùng chuyên mục Tin tức khác Tin tức cùng chuyên mục Tin tức khác Tin tức cùng chuyên mục Tin tức khác Tin tức cùng chuyên mục Tin tức khác Tin tức cùng chuyên mục Tin tức khác Tin tức cùng chuyên mục Tin tức khác Tin tức cùng chuyên mục Tin tức khác Tin tức cùng chuyên mục Tin tức khác Tin tức cùng chuyên mục Tin tức khác Tin tức cùng chuyên mục Tin tức khác Tin tức cùng chuyên mục Tin tức khác Tin tức cùng chuyên mục Tin tức khác Tin tức cùng chuyên mục Tin tức khác Tin tức cùng chuyên mục Tin tức khác Tin tức cùng chuyên mục Tin tức khác Tin tức cùng chuyên mục Tin tức khác Tin tức cùng chuyên mục Tin tức khác Tin tức cùng chuyên mục Tin tức khác Tin tức cùng chuyên mục Tin tức khác Tin tức cùng chuyên mục Tin tức khác Tin tức cùng chuyên mục Tin tức khác Tin tức cùng chuyên mục Tin tức khác Tin tức cùng chuyên mục Tin tức khác Tin tức cùng chuyên mục Tin tức khác Tin tức cùng chuyên mục Tin tức khác Tin tức cùng chuyên mục Tin tức khác Tin tức cùng chuyên mục Tin tức khác Tin tức cùng chuyên mục Tin tức khác Tin tức cùng chuyên mục Tin tức khác Tin tức cùng chuyên mục Tin tức khác Tin tức cùng chuyên mục Tin tức khác Tin tức cùng chuyên mục Tin tức khác Tin tức cùng chuyên mục Tin tức khác Tin tức cùng chuyên mục Tin tức khác Tin tức cùng chuyên mục Tin tức khác Tin tức cùng chuyên mục Tin tức khác Tin tức cùng chuyên mục Tin tức khác Tin tức cùng chuyên mục Tin tức khác Tin tức cùng chuyên mục Tin tức khác Tin tức cùng chuyên mục Tin tức khác Tin tức cùng chuyên mục Tin tức khác Tin tức cùng chuyên mục Tin tức khác Tin tức cùng chuyên mục Tin tức khác Tin tức cùng chuyên mục Tin tức khác Tin tức cùng chuyên mục Tin tức khác Tin tức cùng chuyên mục Tin tức khác Tin tức cùng chuyên mục Tin tức khác Tin tức cùng chuyên mục Tin tức khác Tin tức cùng chuyên mục Tin tức khác Tin tức cùng chuyên mục Tin tức khác Tin tức cùng chuyên mục Tin tức khác Tin tức cùng chuyên mục Tin tức khác Tin tức cùng chuyên mục Tin tức khác Tin tức cùng chuyên mục Tin tức khác Tin tức cùng chuyên mục Tin tức khác Tin tức cùng chuyên mục Tin tức khác Tin tức cùng chuyên mục Tin tức khác Tin tức cùng chuyên mục Tin tức khác Tin tức cùng chuyên mục Tin tức khác Tin tức cùng chuyên mục Tin tức khác Tin tức cùng chuyên mục Tin tức khác Tin tức cùng chuyên mục Tin tức khác Tin tức cùng chuyên mục Tin tức khác Tin tức cùng chuyên mục Tin tức khác Tin tức cùng chuyên mục Tin tức khác Tin tức cùng chuyên mục Tin tức khác Tin tức cùng chuyên mục Tin tức khác Tin tức cùng chuyên mục Tin tức khác Tin tức cùng chuyên mục Tin tức khác Tin tức cùng chuyên mục Tin tức khác Tin tức cùng chuyên mục Tin tức khác Tin tức cùng chuyên mục Tin tức khác Tin tức cùng chuyên mục Tin tức khác Tin tức cùng chuyên mục Tin tức khác Tin tức cùng chuyên mục Tin tức khác Tin tức cùng chuyên mục Tin tức khác Tin tức cùng chuyên mục Tin tức khác Tin tức cùng chuyên mục Tin tức khác Tin tức cùng chuyên mục Tin tức khác Tin tức cùng chuyên mục Tin tức khác Tin tức cùng chuyên mục Tin tức khác Tin tức cùng chuyên mục Tin tức khác Tin tức cùng chuyên mục Tin tức khác Tin tức cùng chuyên mục Tin tức khác Tin tức cùng chuyên mục Tin tức khác Tin tức cùng chuyên mục Tin tức khác Tin tức cùng chuyên mục Tin tức khác Tin tức cùng chuyên mục Tin tức khác Tin tức cùng chuyên mục Tin tức khác Tin tức cùng chuyên mục Tin tức khác Tin tức cùng chuyên mục Tin tức khác Tin tức cùng chuyên mục Tin tức khác Tin tức cùng chuyên mục Tin tức khác Tin tức cùng chuyên mục Tin tức khác Tin tức cùng chuyên mục Tin tức khác Tin tức cùng chuyên mục Tin tức khác Tin tức cùng chuyên mục Tin tức khác Tin tức cùng chuyên mục Tin tức khác Tin tức cùng chuyên mục Tin tức khác Tin tức cùng chuyên mục Tin tức khác Tin tức cùng chuyên mục Tin tức khác Tin tức cùng chuyên mục Tin tức khác Tin tức cùng chuyên mục Tin tức khác Tin tức cùng chuyên mục Tin tức khác Tin tức cùng chuyên mục Tin tức khác Tin tức cùng chuyên mục Tin tức khác Tin tức cùng chuyên mục Tin tức khác Tin tức cùng chuyên mục Tin tức khác Tin tức cùng chuyên mục Tin tức khác Tin tức cùng chuyên mục Tin tức khác Tin tức cùng chuyên mục Tin tức khác Tin tức cùng chuyên mục Tin tức khác Tin tức cùng chuyên mục Tin tức khác Tin tức cùng chuyên mục Tin tức khác Tin tức cùng chuyên mục Tin tức khác Tin tức cùng chuyên mục Tin tức khác Tin tức cùng chuyên mục Tin tức khác Tin tức cùng chuyên mục Tin tức khác Tin tức cùng chuyên mục Tin tức khác Tin tức cùng chuyên mục Tin tức khác Tin tức cùng chuyên mục Tin tức khác Tin tức cùng chuyên mục Tin tức khác Tin tức cùng chuyên mục Tin tức khác Tin tức cùng chuyên mục Tin tức khác Tin tức cùng chuyên mục Tin tức khác Tin tức cùng chuyên mục Tin tức khác Tin tức cùng chuyên mục Tin tức khác Tin tức cùng chuyên mục Tin tức khác Tin tức cùng chuyên mục Tin tức khác Tin tức cùng chuyên mục Tin tức khác Tin tức cùng chuyên mục Tin tức khác Tin tức cùng chuyên mục Tin tức khác Tin tức cùng chuyên mục Tin tức khác Tin tức cùng chuyên mục Tin tức khác Tin tức cùng chuyên mục Tin tức khác Tin tức cùng chuyên mục Tin tức khác Tin tức cùng chuyên mục Tin tức khác Tin tức cùng chuyên mục Tin tức khác Tin tức cùng chuyên mục Tin tức khác Tin tức cùng chuyên mục Tin tức khác Tin tức cùng chuyên mục Tin tức khác Tin tức cùng chuyên mục Tin tức khác Tin tức cùng chuyên mục Tin tức khác Tin tức cùng chuyên mục Tin tức khác Tin tức cùng chuyên mục Tin tức khác Tin tức cùng chuyên mục Tin tức khác Tin tức cùng chuyên mục Tin tức khác Tin tức cùng chuyên mục Tin tức khác Tin tức cùng chuyên mục Tin tức khác Tin tức cùng chuyên mục Tin tức khác Tin tức cùng chuyên mục Tin tức khác Tin tức cùng chuyên mục Tin tức khác Tin tức cùng chuyên mục Tin tức khác Tin tức cùng chuyên mục Tin tức khác Tin tức cùng chuyên mục Tin tức khác Tin tức cùng chuyên mục Tin tức khác Tin tức cùng chuyên mục Tin tức khác Tin tức cùng chuyên mục Tin tức khác Tin tức cùng chuyên mục Tin tức khác Tin tức cùng chuyên mục Tin tức khác Tin tức cùng chuyên mục Tin tức khác Tin tức cùng chuyên mục Tin tức khác Tin tức cùng chuyên mục Tin tức khác Tin tức cùng chuyên mục Tin tức khác Tin tức cùng chuyên mục Tin tức khác Tin tức cùng chuyên mục Tin tức khác Tin tức cùng chuyên mục Tin tức khác Tin tức cùng chuyên mục Tin tức khác Tin tức cùng chuyên mục Tin tức khác Tin tức cùng chuyên mục Tin tức khác Tin tức cùng chuyên mục Tin tức khác Tin tức cùng chuyên mục Tin tức khác Tin tức cùng chuyên mục Tin tức khác Tin tức cùng chuyên mục Tin tức khác Tin tức cùng chuyên mục Tin tức khác Tin tức cùng chuyên mục Tin tức khác Tin tức cùng chuyên mục Tin tức khác Tin tức cùng chuyên mục Tin tức khác Tin tức cùng chuyên mục Tin tức khác Tin tức cùng chuyên mục Tin tức khác Tin tức cùng chuyên mục Tin tức khác Tin tức cùng chuyên mục Tin tức khác Tin tức cùng chuyên mục Tin tức khác Tin tức cùng chuyên mục Tin tức khác Tin tức cùng chuyên mục Tin tức khác Tin tức cùng chuyên mục Tin tức khác Tin tức cùng chuyên mục Tin tức khác Tin tức cùng chuyên mục Tin tức khác Tin tức cùng chuyên mục Tin tức khác Tin tức cùng chuyên mục Tin tức khác Tin tức cùng chuyên mục Tin tức khác Tin tức cùng chuyên mục Tin tức khác Tin tức cùng chuyên mục Tin tức khác Tin tức cùng chuyên mục Tin tức khác Tin tức cùng chuyên mục Tin tức khác Tin tức cùng chuyên mục Tin tức khác Tin tức cùng chuyên mục Tin tức khác Tin tức cùng chuyên mục Tin tức khác Tin tức cùng chuyên mục Tin tức khác Tin tức cùng chuyên mục Tin tức khác Tin tức cùng chuyên mục Tin tức khác Tin tức cùng chuyên mục Tin tức khác Tin tức cùng chuyên mục Tin tức khác Tin tức cùng chuyên mục Tin tức khác Tin tức cùng chuyên mục Tin tức khác Tin tức cùng chuyên mục Tin tức khác Tin tức cùng chuyên mục Tin tức khác Tin tức cùng chuyên mục Tin tức khác Tin tức cùng chuyên mục Tin tức khác Tin tức cùng chuyên mục Tin tức khác Tin tức cùng chuyên mục Tin tức khác Tin tức cùng chuyên mục Tin tức khác Tin tức cùng chuyên mục Tin tức khác Tin tức cùng chuyên mục Tin tức khác Tin tức cùng chuyên mục Tin tức khác Tin tức cùng chuyên mục Tin tức khác Tin tức cùng chuyên mục Tin tức khác Tin tức cùng chuyên mục Tin tức khác Tin tức cùng chuyên mục Tin tức khác Tin tức cùng chuyên mục Tin tức khác Tin tức cùng chuyên mục Tin tức khác Tin tức cùng chuyên mục Tin tức khác Tin tức cùng chuyên mục Tin tức khác Tin tức cùng chuyên mục Tin tức khác Tin tức cùng chuyên mục Tin tức khác Tin tức cùng chuyên mục Tin tức khác Tin tức cùng chuyên mục Tin tức khác Tin tức cùng chuyên mục Tin tức khác Tin tức cùng chuyên mục Tin tức khác Tin tức cùng chuyên mục Tin tức khác Tin tức cùng chuyên mục Tin tức khác Tin tức cùng chuyên mục Tin tức khác Tin tức cùng chuyên mục Tin tức khác Tin tức cùng chuyên mục Tin tức khác Tin tức cùng chuyên mục Tin tức khác Tin tức cùng chuyên mục Tin tức khác Tin tức cùng chuyên mục Tin tức khác Tin tức cùng chuyên mục Tin tức khác Tin tức cùng chuyên mục Tin tức khác Tin tức cùng chuyên mục Tin tức khác Tin tức cùng chuyên mục Tin tức khác Tin tức cùng chuyên mục Tin tức khác Tin tức cùng chuyên mục Tin tức khác Tin tức cùng chuyên mục Tin tức khác Tin tức cùng chuyên mục Tin tức khác Tin tức cùng chuyên mục Tin tức khác Tin tức cùng chuyên mục Tin tức khác Tin tức cùng chuyên mục Tin tức khác Tin tức cùng chuyên mục Tin tức khác Tin tức cùng chuyên mục Tin tức khác Tin tức cùng chuyên mục Tin tức khác Tin tức cùng chuyên mục Tin tức khác Tin tức cùng chuyên mục Tin tức khác Tin tức cùng chuyên mục Tin tức khác Tin tức cùng chuyên mục Tin tức khác Tin tức cùng chuyên mục Tin tức khác Tin tức cùng chuyên mục Tin tức khác Tin tức cùng chuyên mục Tin tức khác Tin tức cùng chuyên mục Tin tức khác Tin tức cùng chuyên mục Tin tức khác Tin tức cùng chuyên mục Tin tức khác Tin tức cùng chuyên mục Tin tức khác Tin tức cùng chuyên mục Tin tức khác Tin tức cùng chuyên mục Tin tức khác Tin tức cùng chuyên mục Tin tức khác Tin tức cùng chuyên mục Tin tức khác Tin tức cùng chuyên mục Tin tức khác Tin tức cùng chuyên mục Tin tức khác Tin tức cùng chuyên mục Tin tức khác Tin tức cùng chuyên mục Tin tức khác Tin tức cùng chuyên mục Tin tức khác Tin tức cùng chuyên mục Tin tức khác Tin tức cùng chuyên mục Tin tức khác Tin tức cùng chuyên mục Tin tức khác Tin tức cùng chuyên mục Tin tức khác Tin tức cùng chuyên mục Tin tức khác Tin tức cùng chuyên mục Tin tức khác Tin tức cùng chuyên mục Tin tức khác Tin tức cùng chuyên mục Tin tức khác Tin tức cùng chuyên mục Tin tức khác Tin tức cùng chuyên mục Tin tức khác Tin tức cùng chuyên mục Tin tức khác Tin tức cùng chuyên mục Tin tức khác Tin tức cùng chuyên mục Tin tức khác Tin tức cùng chuyên mục Tin tức khác Tin tức cùng chuyên mục Tin tức khác Tin tức cùng chuyên mục Tin tức khác Tin tức cùng chuyên mục Tin tức khác Tin tức cùng chuyên mục Tin tức khác Tin tức cùng chuyên mục Tin tức khác Tin tức cùng chuyên mục Tin tức khác Tin tức cùng chuyên mục Tin tức khác Tin tức cùng chuyên mục Tin tức khác Tin tức cùng chuyên mục Tin tức khác Tin tức cùng chuyên mục Tin tức khác Tin tức cùng chuyên mục Tin tức khác Tin tức cùng chuyên mục Tin tức khác Tin tức cùng chuyên mục Tin tức khác Tin tức cùng chuyên mục Tin tức khác Tin tức cùng chuyên mục Tin tức khác Tin tức cùng chuyên mục Tin tức khác Tin tức cùng chuyên mục Tin tức khác Tin tức cùng chuyên mục Tin tức khác Tin tức cùng chuyên mục Tin tức khác Tin tức cùng chuyên mục Tin tức khác Tin tức cùng chuyên mục Tin tức khác Tin tức cùng chuyên mục Tin tức khác Tin tức cùng chuyên mục Tin tức khác Tin tức cùng chuyên mục Tin tức khác Tin tức cùng chuyên mục Tin tức khác Tin tức cùng chuyên mục Tin tức khác Tin tức cùng chuyên mục Tin tức khác Tin tức cùng chuyên mục Tin tức khác Tin tức cùng chuyên mục Tin tức khác Tin tức cùng chuyên mục Tin tức khác Tin tức cùng chuyên mục Tin tức khác Tin tức cùng chuyên mục Tin tức khác Tin tức cùng chuyên mục Tin tức khác Tin tức cùng chuyên mục Tin tức khác Tin tức cùng chuyên mục Tin tức khác Tin tức cùng chuyên mục Tin tức khác Tin tức cùng chuyên mục Tin tức khác Tin tức cùng chuyên mục Tin tức khác Tin tức cùng chuyên mục Tin tức khác Tin tức cùng chuyên mục Tin tức khác Tin tức cùng chuyên mục Tin tức khác Tin tức cùng chuyên mục Tin tức khác Tin tức cùng chuyên mục Tin tức khác Tin tức cùng chuyên mục Tin tức khác Tin tức cùng chuyên mục Tin tức khác Tin tức cùng chuyên mục Tin tức khác Tin tức cùng chuyên mục Tin tức khác Tin tức cùng chuyên mục Tin tức khác Tin tức cùng chuyên mục Tin tức khác Tin tức cùng chuyên mục Tin tức khác Tin tức cùng chuyên mục Tin tức khác Tin tức cùng chuyên mục Tin tức khác Tin tức cùng chuyên mục Tin tức khác Tin tức cùng chuyên mục Tin tức khác Tin tức cùng chuyên mục Tin tức khác Tin tức cùng chuyên mục Tin tức khác Tin tức cùng chuyên mục Tin tức khác Tin tức cùng chuyên mục Tin tức khác Tin tức cùng chuyên mục Tin tức khác Tin tức cùng chuyên mục Tin tức khác Tin tức cùng chuyên mục Tin tức khác Tin tức cùng chuyên mục Tin tức khác Tin tức cùng chuyên mục Tin tức khác Tin tức cùng chuyên mục Tin tức khác Tin tức cùng chuyên mục Tin tức khác Tin tức cùng chuyên mục Tin tức khác Tin tức cùng chuyên mục Tin tức khác Tin tức cùng chuyên mục Tin tức khác Tin tức cùng chuyên mục Tin tức khác Tin tức cùng chuyên mục Tin tức khác Tin tức cùng chuyên mục Tin tức khác Tin tức cùng chuyên mục Tin tức khác Tin tức cùng chuyên mục Tin tức khác Tin tức cùng chuyên mục Tin tức khác Tin tức cùng chuyên mục Tin tức khác Tin tức cùng chuyên mục Tin tức khác Tin tức cùng chuyên mục Tin tức khác Tin tức cùng chuyên mục Tin tức khác Tin tức cùng chuyên mục Tin tức khác Tin tức cùng chuyên mục Tin tức khác Tin tức cùng chuyên mục Tin tức khác Tin tức cùng chuyên mục Tin tức khác Tin tức cùng chuyên mục Tin tức khác Tin tức cùng chuyên mục Tin tức khác Tin tức cùng chuyên mục Tin tức khác Tin tức cùng chuyên mục Tin tức khác Tin tức cùng chuyên mục Tin tức khác Tin tức cùng chuyên mục Tin tức khác Tin tức cùng chuyên mục Tin tức khác Tin tức cùng chuyên mục Tin tức khác Tin tức cùng chuyên mục Tin tức khác Tin tức cùng chuyên mục Tin tức khác Tin tức cùng chuyên mục Tin tức khác Tin tức cùng chuyên mục Tin tức khác Tin tức cùng chuyên mục Tin tức khác Tin tức cùng chuyên mục Tin tức khác Tin tức cùng chuyên mục Tin tức khác Tin tức cùng chuyên mục Tin tức khác Tin tức cùng chuyên mục Tin tức khác Tin tức cùng chuyên mục Tin tức khác Tin tức cùng chuyên mục Tin tức khác Tin tức cùng chuyên mục Tin tức khác Tin tức cùng chuyên mục Tin tức khác Tin tức cùng chuyên mục Tin tức khác Tin tức cùng chuyên mục Tin tức khác Tin tức cùng chuyên mục Tin tức khác Tin tức cùng chuyên mục Tin tức khác Tin tức cùng chuyên mục Tin tức khác Tin tức cùng chuyên mục Tin tức khác Tin tức cùng chuyên mục Tin tức khác Tin tức cùng chuyên mục Tin tức khác Tin tức cùng chuyên mục Tin tức khác Tin tức cùng chuyên mục Tin tức khác Tin tức cùng chuyên mục Tin tức khác Tin tức cùng chuyên mục Tin tức khác Tin tức cùng chuyên mục Tin tức khác Tin tức cùng chuyên mục Tin tức khác Tin tức cùng chuyên mục Tin tức khác Tin tức cùng chuyên mục Tin tức khác Tin tức cùng chuyên mục Tin tức khác Tin tức cùng chuyên mục Tin tức khác Tin tức cùng chuyên mục Tin tức khác Tin tức cùng chuyên mục Tin tức khác Tin tức cùng chuyên mục Tin tức khác Tin tức cùng chuyên mục Tin tức khác Tin tức cùng chuyên mục Tin tức khác Tin tức cùng chuyên mục Tin tức khác Tin tức cùng chuyên mục Tin tức khác Tin tức cùng chuyên mục Tin tức khác Tin tức cùng chuyên mục Tin tức khác Tin tức cùng chuyên mục Tin tức khác Tin tức cùng chuyên mục Tin tức khác Tin tức cùng chuyên mục Tin tức khác Tin tức cùng chuyên mục Tin tức khác Tin tức cùng chuyên mục Tin tức khác Tin tức cùng chuyên mục Tin tức khác Tin tức cùng chuyên mục Tin tức khác Tin tức cùng chuyên mục Tin tức khác Tin tức cùng chuyên mục Tin tức khác Tin tức cùng chuyên mục Tin tức khác Tin tức cùng chuyên mục Tin tức khác Tin tức cùng chuyên mục Tin tức khác Tin tức cùng chuyên mục Tin tức khác Tin tức cùng chuyên mục Tin tức khác Tin tức cùng chuyên mục Tin tức khác Tin tức cùng chuyên mục Tin tức khác Tin tức cùng chuyên mục Tin tức khác Tin tức cùng chuyên mục Tin tức khác Tin tức cùng chuyên mục Tin tức khác Tin tức cùng chuyên mục Tin tức khác Tin tức cùng chuyên mục Tin tức khác Tin tức cùng chuyên mục Tin tức khác Tin tức cùng chuyên mục Tin tức khác Tin tức cùng chuyên mục Tin tức khác Tin tức cùng chuyên mục Tin tức khác Tin tức cùng chuyên mục Tin tức khác Tin tức cùng chuyên mục Tin tức khác Tin tức cùng chuyên mục Tin tức khác Tin tức cùng chuyên mục Tin tức khác Tin tức cùng chuyên mục Tin tức khác Tin tức cùng chuyên mục Tin tức khác Tin tức cùng chuyên mục Tin tức khác Tin tức cùng chuyên mục Tin tức khác Tin tức cùng chuyên mục Tin tức khác Tin tức cùng chuyên mục Tin tức khác Tin tức cùng chuyên mục Tin tức khác Tin tức cùng chuyên mục Tin tức khác Tin tức cùng chuyên mục Tin tức khác Tin tức cùng chuyên mục Tin tức khác Tin tức cùng chuyên mục Tin tức khác Tin tức cùng chuyên mục Tin tức khác Tin tức cùng chuyên mục Tin tức khác Tin tức cùng chuyên mục Tin tức khác Tin tức cùng chuyên mục Tin tức khác Tin tức cùng chuyên mục Tin tức khác Tin tức cùng chuyên mục Tin tức khác Tin tức cùng chuyên mục Tin tức khác Tin tức cùng chuyên mục Tin tức khác Tin tức cùng chuyên mục Tin tức khác Tin tức cùng chuyên mục Tin tức khác Tin tức cùng chuyên mục Tin tức khác Tin tức cùng chuyên mục Tin tức khác Tin tức cùng chuyên mục Tin tức khác Tin tức cùng chuyên mục Tin tức khác Tin tức cùng chuyên mục Tin tức khác Tin tức cùng chuyên mục Tin tức khác Tin tức cùng chuyên mục Tin tức khác Tin tức cùng chuyên mục Tin tức khác Tin tức cùng chuyên mục Tin tức khác Tin tức cùng chuyên mục Tin tức khác Tin tức cùng chuyên mục Tin tức khác Tin tức cùng chuyên mục Tin tức khác Tin tức cùng chuyên mục Tin tức khác Tin tức cùng chuyên mục Tin tức khác Tin tức cùng chuyên mục Tin tức khác Tin tức cùng chuyên mục Tin tức khác Tin tức cùng chuyên mục Tin tức khác Tin tức cùng chuyên mục Tin tức khác Tin tức cùng chuyên mục Tin tức khác Tin tức cùng chuyên mục Tin tức khác Tin tức cùng chuyên mục Tin tức khác Tin tức cùng chuyên mục Tin tức khác Tin tức cùng chuyên mục Tin tức khác Tin tức cùng chuyên mục Tin tức khác Tin tức cùng chuyên mục Tin tức khác Tin tức cùng chuyên mục Tin tức khác Tin tức cùng chuyên mục Tin tức khác Tin tức cùng chuyên mục Tin tức khác Tin tức cùng chuyên mục Tin tức khác Tin tức cùng chuyên mục Tin tức khác Tin tức cùng chuyên mục Tin tức khác Tin tức cùng chuyên mục Tin tức khác Tin tức cùng chuyên mục Tin tức khác Tin tức cùng chuyên mục Tin tức khác Tin tức cùng chuyên mục Tin tức khác Tin tức cùng chuyên mục Tin tức khác Tin tức cùng chuyên mục Tin tức khác Tin tức cùng chuyên mục Tin tức khác Tin tức cùng chuyên mục Tin tức khác Tin tức cùng chuyên mục Tin tức khác Tin tức cùng chuyên mục Tin tức khác Tin tức cùng chuyên mục Tin tức khác Tin tức cùng chuyên mục Tin tức khác Tin tức cùng chuyên mục Tin tức khác Tin tức cùng chuyên mục Tin tức khác Tin tức cùng chuyên mục Tin tức khác Tin tức cùng chuyên mục Tin tức khác Tin tức cùng chuyên mục Tin tức khác Tin tức cùng chuyên mục Tin tức khác Tin tức cùng chuyên mục Tin tức khác Tin tức cùng chuyên mục Tin tức khác Tin tức cùng chuyên mục Tin tức khác Tin tức cùng chuyên mục Tin tức khác Tin tức cùng chuyên mục Tin tức khác Tin tức cùng chuyên mục Tin tức khác Tin tức cùng chuyên mục Tin tức khác Tin tức cùng chuyên mục Tin tức khác Tin tức cùng chuyên mục Tin tức khác Tin tức cùng chuyên mục Tin tức khác Tin tức cùng chuyên mục Tin tức khác Tin tức cùng chuyên mục Tin tức khác Tin tức cùng chuyên mục Tin tức khác Tin tức cùng chuyên mục Tin tức khác Tin tức cùng chuyên mục Tin tức khác Tin tức cùng chuyên mục Tin tức khác Tin tức cùng chuyên mục Tin tức khác Tin tức cùng chuyên mục Tin tức khác Tin tức cùng chuyên mục Tin tức khác Tin tức cùng chuyên mục Tin tức khác Tin tức cùng chuyên mục Tin tức khác Tin tức cùng chuyên mục Tin tức khác Tin tức cùng chuyên mục Tin tức khác Tin tức cùng chuyên mục Tin tức khác Tin tức cùng chuyên mục Tin tức khác Tin tức cùng chuyên mục Tin tức khác Tin tức cùng chuyên mục Tin tức khác Tin tức cùng chuyên mục Tin tức khác Tin tức cùng chuyên mục Tin tức khác Tin tức cùng chuyên mục Tin tức khác Tin tức cùng chuyên mục Tin tức khác Tin tức cùng chuyên mục Tin tức khác Tin tức cùng chuyên mục Tin tức khác Tin tức cùng chuyên mục Tin tức khác Tin tức cùng chuyên mục Tin tức khác Tin tức cùng chuyên mục Tin tức khác Tin tức cùng chuyên mục Tin tức khác Tin tức cùng chuyên mục Tin tức khác Tin tức cùng chuyên mục Tin tức khác Tin tức cùng chuyên mục Tin tức khác Tin tức cùng chuyên mục Tin tức khác Tin tức cùng chuyên mục Tin tức khác Tin tức cùng chuyên mục Tin tức khác Tin tức cùng chuyên mục Tin tức khác Tin tức cùng chuyên mục Tin tức khác Tin tức cùng chuyên mục Tin tức khác Tin tức cùng chuyên mục Tin tức khác Tin tức cùng chuyên mục Tin tức khác Tin tức cùng chuyên mục Tin tức khác Tin tức cùng chuyên mục Tin tức khác Tin tức cùng chuyên mục Tin tức khác Tin tức cùng chuyên mục Tin tức khác Tin tức cùng chuyên mục Tin tức khác Tin tức cùng chuyên mục Tin tức khác Tin tức cùng chuyên mục Tin tức khác Tin tức cùng chuyên mục Tin tức khác Tin tức cùng chuyên mục Tin tức khác Tin tức cùng chuyên mục Tin tức khác Tin tức cùng chuyên mục Tin tức khác Tin tức cùng chuyên mục Tin tức khác Tin tức cùng chuyên mục Tin tức khác Tin tức cùng chuyên mục Tin tức khác Tin tức cùng chuyên mục Tin tức khác Tin tức cùng chuyên mục Tin tức khác Tin tức cùng chuyên mục Tin tức khác Tin tức cùng chuyên mục Tin tức khác Tin tức cùng chuyên mục Tin tức khác Tin tức cùng chuyên mục Tin tức khác Tin tức cùng chuyên mục Tin tức khác Tin tức cùng chuyên mục Tin tức khác Tin tức cùng chuyên mục Tin tức khác Tin tức cùng chuyên mục Tin tức khác Tin tức cùng chuyên mục Tin tức khác Tin tức cùng chuyên mục Tin tức khác Tin tức cùng chuyên mục Tin tức khác Tin tức cùng chuyên mục Tin tức khác Tin tức cùng chuyên mục Tin tức khác Tin tức cùng chuyên mục Tin tức khác Tin tức cùng chuyên mục Tin tức khác Tin tức cùng chuyên mục Tin tức khác Tin tức cùng chuyên mục Tin tức khác Tin tức cùng chuyên mục Tin tức khác Tin tức cùng chuyên mục Tin tức khác Tin tức cùng chuyên mục Tin tức khác Tin tức cùng chuyên mục Tin tức khác Tin tức cùng chuyên mục Tin tức khác Tin tức cùng chuyên mục Tin tức khác Tin tức cùng chuyên mục Tin tức khác Tin tức cùng chuyên mục Tin tức khác Tin tức cùng chuyên mục Tin tức khác Tin tức cùng chuyên mục Tin tức khác Tin tức cùng chuyên mục Tin tức khác Tin tức cùng chuyên mục Tin tức khác Tin tức cùng chuyên mục Tin tức khác Tin tức cùng chuyên mục Tin tức khác Tin tức cùng chuyên mục Tin tức khác Tin tức cùng chuyên mục Tin tức khác Tin tức cùng chuyên mục Tin tức khác Tin tức cùng chuyên mục Tin tức khác Tin tức cùng chuyên mục Tin tức khác Tin tức cùng chuyên mục Tin tức khác Tin tức cùng chuyên mục Tin tức khác Tin tức cùng chuyên mục Tin tức khác Tin tức cùng chuyên mục Tin tức khác Tin tức cùng chuyên mục Tin tức khác Tin tức cùng chuyên mục Tin tức khác Tin tức cùng chuyên mục Tin tức khác Tin tức cùng chuyên mục Tin tức khác Tin tức cùng chuyên mục Tin tức khác Tin tức cùng chuyên mục Tin tức khác Tin tức cùng chuyên mục Tin tức khác Tin tức cùng chuyên mục Tin tức khác Tin tức cùng chuyên mục Tin tức khác Tin tức cùng chuyên mục Tin tức khác Tin tức cùng chuyên mục Tin tức khác Tin tức cùng chuyên mục Tin tức khác Tin tức cùng chuyên mục Tin tức khác Tin tức cùng chuyên mục Tin tức khác Tin tức cùng chuyên mục Tin tức khác Tin tức cùng chuyên mục Tin tức khác Tin tức cùng chuyên mục Tin tức khác Tin tức cùng chuyên mục Tin tức khác Tin tức cùng chuyên mục Tin tức khác Tin tức cùng chuyên mục Tin tức khác Tin tức cùng chuyên mục Tin tức khác Tin tức cùng chuyên mục Tin tức khác Tin tức cùng chuyên mục Tin tức khác Tin tức cùng chuyên mục Tin tức khác Tin tức cùng chuyên mục Tin tức khác Tin tức cùng chuyên mục Tin tức khác Tin tức cùng chuyên mục Tin tức khác Tin tức cùng chuyên mục Tin tức khác Tin tức cùng chuyên mục Tin tức khác Tin tức cùng chuyên mục Tin tức khác Tin tức cùng chuyên mục Tin tức khác Tin tức cùng chuyên mục Tin tức khác Tin tức cùng chuyên mục Tin tức khác Tin tức cùng chuyên mục Tin tức khác Tin tức cùng chuyên mục Tin tức khác Tin tức cùng chuyên mục Tin tức khác Tin tức cùng chuyên mục Tin tức khác Tin tức cùng chuyên mục Tin tức khác Tin tức cùng chuyên mục Tin tức khác Tin tức cùng chuyên mục Tin tức khác Tin tức cùng chuyên mục Tin tức khác Tin tức cùng chuyên mục Tin tức khác Tin tức cùng chuyên mục Tin tức khác Tin tức cùng chuyên mục Tin tức khác Tin tức cùng chuyên mục Tin tức khác Tin tức cùng chuyên mục Tin tức khác Tin tức cùng chuyên mục Tin tức khác Tin tức cùng chuyên mục Tin tức khác Tin tức cùng chuyên mục Tin tức khác Tin tức cùng chuyên mục Tin tức khác Tin tức cùng chuyên mục Tin tức khác Tin tức cùng chuyên mục Tin tức khác Tin tức cùng chuyên mục Tin tức khác Tin tức cùng chuyên mục Tin tức khác Tin tức cùng chuyên mục Tin tức khác Tin tức cùng chuyên mục Tin tức khác Tin tức cùng chuyên mục Tin tức khác Tin tức cùng chuyên mục Tin tức khác Tin tức cùng chuyên mục Tin tức khác Tin tức cùng chuyên mục Tin tức khác Tin tức cùng chuyên mục Tin tức khác Tin tức cùng chuyên mục Tin tức khác Tin tức cùng chuyên mục Tin tức khác Tin tức cùng chuyên mục Tin tức khác Tin tức cùng chuyên mục Tin tức khác Tin tức cùng chuyên mục Tin tức khác Tin tức cùng chuyên mục Tin tức khác Tin tức cùng chuyên mục Tin tức khác Tin tức cùng chuyên mục Tin tức khác Tin tức cùng chuyên mục Tin tức khác Tin tức cùng chuyên mục Tin tức khác Tin tức cùng chuyên mục Tin tức khác Tin tức cùng chuyên mục Tin tức khác Tin tức cùng chuyên mục Tin tức khác Tin tức cùng chuyên mục Tin tức khác Tin tức cùng chuyên mục Tin tức khác Tin tức cùng chuyên mục Tin tức khác Tin tức cùng chuyên mục Tin tức khác Tin tức cùng chuyên mục Tin tức khác Tin tức cùng chuyên mục Tin tức khác Tin tức cùng chuyên mục Tin tức khác Tin tức cùng chuyên mục Tin tức khác Tin tức cùng chuyên mục Tin tức khác Tin tức cùng chuyên mục Tin tức khác Tin tức cùng chuyên mục Tin tức khác Tin tức cùng chuyên mục Tin tức khác Tin tức cùng chuyên mục Tin tức khác Tin tức cùng chuyên mục Tin tức khác Tin tức cùng chuyên mục Tin tức khác Tin tức cùng chuyên mục Tin tức khác Tin tức cùng chuyên mục Tin tức khác Tin tức cùng chuyên mục Tin tức khác Tin tức cùng chuyên mục Tin tức khác Tin tức cùng chuyên mục Tin tức khác Tin tức cùng chuyên mục Tin tức khác Tin tức cùng chuyên mục Tin tức khác Tin tức cùng chuyên mục Tin tức khác Tin tức cùng chuyên mục Tin tức khác Tin tức cùng chuyên mục Tin tức khác Tin tức cùng chuyên mục Tin tức khác Tin tức cùng chuyên mục Tin tức khác Tin tức cùng chuyên mục Tin tức khác Tin tức cùng chuyên mục Tin tức khác Tin tức cùng chuyên mục Tin tức khác Tin tức cùng chuyên mục Tin tức khác Tin tức cùng chuyên mục Tin tức khác Tin tức cùng chuyên mục Tin tức khác Tin tức cùng chuyên mục Tin tức khác Tin tức cùng chuyên mục Tin tức khác Tin tức cùng chuyên mục Tin tức khác Tin tức cùng chuyên mục Tin tức khác Tin tức cùng chuyên mục Tin tức khác Tin tức cùng chuyên mục Tin tức khác Tin tức cùng chuyên mục Tin tức khác Tin tức cùng chuyên mục Tin tức khác Tin tức cùng chuyên mục Tin tức khác Tin tức cùng chuyên mục Tin tức khác Tin tức cùng chuyên mục Tin tức khác Tin tức cùng chuyên mục Tin tức khác Tin tức cùng chuyên mục Tin tức khác Tin tức cùng chuyên mục Tin tức khác Tin tức cùng chuyên mục Tin tức khác Tin tức cùng chuyên mục Tin tức khác Tin tức cùng chuyên mục Tin tức khác Tin tức cùng chuyên mục Tin tức khác Tin tức cùng chuyên mục Tin tức khác Tin tức cùng chuyên mục Tin tức khác Tin tức cùng chuyên mục Tin tức khác Tin tức cùng chuyên mục Tin tức khác Tin tức cùng chuyên mục Tin tức khác Tin tức cùng chuyên mục Tin tức khác Tin tức cùng chuyên mục Tin tức khác Tin tức cùng chuyên mục Tin tức khác Tin tức cùng chuyên mục Tin tức khác Tin tức cùng chuyên mục Tin tức khác Tin tức cùng chuyên mục Tin tức khác Tin tức cùng chuyên mục Tin tức khác Tin tức cùng chuyên mục Tin tức khác Tin tức cùng chuyên mục Tin tức khác Tin tức cùng chuyên mục Tin tức khác Tin tức cùng chuyên mục Tin tức khác Tin tức cùng chuyên mục Tin tức khác Tin tức cùng chuyên mục Tin tức khác Tin tức cùng chuyên mục Tin tức khác Tin tức cùng chuyên mục Tin tức khác Tin tức cùng chuyên mục Tin tức khác Tin tức cùng chuyên mục Tin tức khác Tin tức cùng chuyên mục Tin tức khác Tin tức cùng chuyên mục Tin tức khác Tin tức cùng chuyên mục Tin tức khác Tin tức cùng chuyên mục Tin tức khác Tin tức cùng chuyên mục Tin tức khác Tin tức cùng chuyên mục Tin tức khác Tin tức cùng chuyên mục Tin tức khác Tin tức cùng chuyên mục Tin tức khác Tin tức cùng chuyên mục Tin tức khác Tin tức cùng chuyên mục Tin tức khác Tin tức cùng chuyên mục Tin tức khác Tin tức cùng chuyên mục Tin tức khác Tin tức cùng chuyên mục Tin tức khác Tin tức cùng chuyên mục Tin tức khác Tin tức cùng chuyên mục Tin tức khác Tin tức cùng chuyên mục Tin tức khác Tin tức cùng chuyên mục Tin tức khác Tin tức cùng chuyên mục Tin tức khác Tin tức cùng chuyên mục Tin tức khác Tin tức cùng chuyên mục Tin tức khác Tin tức cùng chuyên mục Tin tức khác Tin tức cùng chuyên mục Tin tức khác Tin tức cùng chuyên mục Tin tức khác Tin tức cùng chuyên mục Tin tức khác Tin tức cùng chuyên mục Tin tức khác Tin tức cùng chuyên mục Tin tức khác Tin tức cùng chuyên mục Tin tức khác Tin tức cùng chuyên mục Tin tức khác Tin tức cùng chuyên mục Tin tức khác Tin tức cùng chuyên mục Tin tức khác Tin tức cùng chuyên mục Tin tức khác Tin tức cùng chuyên mục Tin tức khác Tin tức cùng chuyên mục Tin tức khác Tin tức cùng chuyên mục Tin tức khác Tin tức cùng chuyên mục Tin tức khác Tin tức cùng chuyên mục Tin tức khác Tin tức cùng chuyên mục Tin tức khác Tin tức cùng chuyên mục Tin tức khác Tin tức cùng chuyên mục Tin tức khác Tin tức cùng chuyên mục Tin tức khác Tin tức cùng chuyên mục Tin tức khác Tin tức cùng chuyên mục Tin tức khác Tin tức cùng chuyên mục Tin tức khác Tin tức cùng chuyên mục Tin tức khác Tin tức cùng chuyên mục Tin tức khác Tin tức cùng chuyên mục Tin tức khác Tin tức cùng chuyên mục Tin tức khác Tin tức cùng chuyên mục Tin tức khác Tin tức cùng chuyên mục Tin tức khác Tin tức cùng chuyên mục Tin tức khác Tin tức cùng chuyên mục Tin tức khác Tin tức cùng chuyên mục Tin tức khác Tin tức cùng chuyên mục Tin tức khác Tin tức cùng chuyên mục Tin tức khác Tin tức cùng chuyên mục Tin tức khác Tin tức cùng chuyên mục Tin tức khác Tin tức cùng chuyên mục Tin tức khác Tin tức cùng chuyên mục Tin tức khác Tin tức cùng chuyên mục Tin tức khác Tin tức cùng chuyên mục Tin tức khác Tin tức cùng chuyên mục Tin tức khác Tin tức cùng chuyên mục Tin tức khác Tin tức cùng chuyên mục Tin tức khác Tin tức cùng chuyên mục Tin tức khác Tin tức cùng chuyên mục Tin tức khác Tin tức cùng chuyên mục Tin tức khác Tin tức cùng chuyên mục Tin tức khác Tin tức cùng chuyên mục Tin tức khác Tin tức cùng chuyên mục Tin tức khác Tin tức cùng chuyên mục Tin tức khác Tin tức cùng chuyên mục Tin tức khác Tin tức cùng chuyên mục Tin tức khác Tin tức cùng chuyên mục Tin tức khác Tin tức cùng chuyên mục Tin tức khác Tin tức cùng chuyên mục Tin tức khác Tin tức cùng chuyên mục Tin tức khác Tin tức cùng chuyên mục Tin tức khác Tin tức cùng chuyên mục Tin tức khác Tin tức cùng chuyên mục Tin tức khác Tin tức cùng chuyên mục Tin tức khác Tin tức cùng chuyên mục Tin tức khác Tin tức cùng chuyên mục Tin tức khác Tin tức cùng chuyên mục Tin tức khác Tin tức cùng chuyên mục Tin tức khác Tin tức cùng chuyên mục Tin tức khác Tin tức cùng chuyên mục Tin tức khác Tin tức cùng chuyên mục Tin tức khác Tin tức cùng chuyên mục Tin tức khác Tin tức cùng chuyên mục Tin tức khác Tin tức cùng chuyên mục Tin tức khác Tin tức cùng chuyên mục Tin tức khác Tin tức cùng chuyên mục Tin tức khác Tin tức cùng chuyên mục Tin tức khác Tin tức cùng chuyên mục Tin tức khác Tin tức cùng chuyên mục Tin tức khác Tin tức cùng chuyên mục Tin tức khác Tin tức cùng chuyên mục Tin tức khác Tin tức cùng chuyên mục Tin tức khác Tin tức cùng chuyên mục Tin tức khác Tin tức cùng chuyên mục Tin tức khác Tin tức cùng chuyên mục Tin tức khác Tin tức cùng chuyên mục Tin tức khác Tin tức cùng chuyên mục Tin tức khác Tin tức cùng chuyên mục Tin tức khác Tin tức cùng chuyên mục Tin tức khác Tin tức cùng chuyên mục Tin tức khác Tin tức cùng chuyên mục Tin tức khác Tin tức cùng chuyên mục Tin tức khác Tin tức cùng chuyên mục Tin tức khác Tin tức cùng chuyên mục Tin tức khác Tin tức cùng chuyên mục Tin tức khác Tin tức cùng chuyên mục Tin tức khác Tin tức cùng chuyên mục Tin tức khác Tin tức cùng chuyên mục Tin tức khác Tin tức cùng chuyên mục Tin tức khác Tin tức cùng chuyên mục Tin tức khác Tin tức cùng chuyên mục Tin tức khác Tin tức cùng chuyên mục Tin tức khác Tin tức cùng chuyên mục Tin tức khác Tin tức cùng chuyên mục Tin tức khác Tin tức cùng chuyên mục Tin tức khác Tin tức cùng chuyên mục Tin tức khác Tin tức cùng chuyên mục Tin tức khác Tin tức cùng chuyên mục Tin tức khác Tin tức cùng chuyên mục Tin tức khác Tin tức cùng chuyên mục Tin tức khác Tin tức cùng chuyên mục Tin tức khác Tin tức cùng chuyên mục Tin tức khác Tin tức cùng chuyên mục Tin tức khác Tin tức cùng chuyên mục Tin tức khác Tin tức cùng chuyên mục Tin tức khác Tin tức cùng chuyên mục Tin tức khác Tin tức cùng chuyên mục Tin tức khác Tin tức cùng chuyên mục Tin tức khác Tin tức cùng chuyên mục Tin tức khác Tin tức cùng chuyên mục Tin tức khác Tin tức cùng chuyên mục Tin tức khác Tin tức cùng chuyên mục Tin tức khác Tin tức cùng chuyên mục Tin tức khác Tin tức cùng chuyên mục Tin tức khác Tin tức cùng chuyên mục Tin tức khác Tin tức cùng chuyên mục Tin tức khác Tin tức cùng chuyên mục Tin tức khác Tin tức cùng chuyên mục Tin tức khác Tin tức cùng chuyên mục Tin tức khác Tin tức cùng chuyên mục Tin tức khác Tin tức cùng chuyên mục Tin tức khác Tin tức cùng chuyên mục Tin tức khác Tin tức cùng chuyên mục Tin tức khác Tin tức cùng chuyên mục Tin tức khác Tin tức cùng chuyên mục Tin tức khác Tin tức cùng chuyên mục Tin tức khác Tin tức cùng chuyên mục Tin tức khác Tin tức cùng chuyên mục Tin tức khác Tin tức cùng chuyên mục Tin tức khác Tin tức cùng chuyên mục Tin tức khác Tin tức cùng chuyên mục Tin tức khác Tin tức cùng chuyên mục Tin tức khác Tin tức cùng chuyên mục Tin tức khác Tin tức cùng chuyên mục Tin tức khác Tin tức cùng chuyên mục Tin tức khác Tin tức cùng chuyên mục Tin tức khác Tin tức cùng chuyên mục Tin tức khác Tin tức cùng chuyên mục Tin tức khác Tin tức cùng chuyên mục Tin tức khác Tin tức cùng chuyên mục Tin tức khác Tin tức cùng chuyên mục Tin tức khác Tin tức cùng chuyên mục Tin tức khác Tin tức cùng chuyên mục Tin tức khác Tin tức cùng chuyên mục Tin tức khác Tin tức cùng chuyên mục Tin tức khác Tin tức cùng chuyên mục Tin tức khác Tin tức cùng chuyên mục Tin tức khác Tin tức cùng chuyên mục Tin tức khác Tin tức cùng chuyên mục Tin tức khác Tin tức cùng chuyên mục Tin tức khác Tin tức cùng chuyên mục Tin tức khác Tin tức cùng chuyên mục Tin tức khác Tin tức cùng chuyên mục Tin tức khác Tin tức cùng chuyên mục Tin tức khác Tin tức cùng chuyên mục Tin tức khác Tin tức cùng chuyên mục Tin tức khác Tin tức cùng chuyên mục Tin tức khác Tin tức cùng chuyên mục Tin tức khác Tin tức cùng chuyên mục Tin tức khác Tin tức cùng chuyên mục Tin tức khác Tin tức cùng chuyên mục Tin tức khác Tin tức cùng chuyên mục Tin tức khác Tin tức cùng chuyên mục Tin tức khác Tin tức cùng chuyên mục Tin tức khác Tin tức cùng chuyên mục Tin tức khác Tin tức cùng chuyên mục Tin tức khác Tin tức cùng chuyên mục Tin tức khác Tin tức cùng chuyên mục Tin tức khác Tin tức cùng chuyên mục Tin tức khác Tin tức cùng chuyên mục Tin tức khác Tin tức cùng chuyên mục Tin tức khác Tin tức cùng chuyên mục Tin tức khác Tin tức cùng chuyên mục Tin tức khác Tin tức cùng chuyên mục Tin tức khác Tin tức cùng chuyên mục Tin tức khác Tin tức cùng chuyên mục Tin tức khác Tin tức cùng chuyên mục Tin tức khác Tin tức cùng chuyên mục Tin tức khác Tin tức cùng chuyên mục Tin tức khác Tin tức cùng chuyên mục Tin tức khác Tin tức cùng chuyên mục Tin tức khác Tin tức cùng chuyên mục Tin tức khác Tin tức cùng chuyên mục Tin tức khác Tin tức cùng chuyên mục Tin tức khác Tin tức cùng chuyên mục Tin tức khác Tin tức cùng chuyên mục Tin tức khác Tin tức cùng chuyên mục Tin tức khác Tin tức cùng chuyên mục Tin tức khác Tin tức cùng chuyên mục Tin tức khác Tin tức cùng chuyên mục Tin tức khác Tin tức cùng chuyên mục Tin tức khác Tin tức cùng chuyên mục Tin tức khác Tin tức cùng chuyên mục Tin tức khác Tin tức cùng chuyên mục Tin tức khác Tin tức cùng chuyên mục Tin tức khác Tin tức cùng chuyên mục Tin tức khác Tin tức cùng chuyên mục Tin tức khác Tin tức cùng chuyên mục Tin tức khác Tin tức cùng chuyên mục Tin tức khác Tin tức cùng chuyên mục Tin tức khác Tin tức cùng chuyên mục Tin tức khác Tin tức cùng chuyên mục Tin tức khác Tin tức cùng chuyên mục Tin tức khác Tin tức cùng chuyên mục Tin tức khác Tin tức cùng chuyên mục Tin tức khác Tin tức cùng chuyên mục Tin tức khác Tin tức cùng chuyên mục Tin tức khác Tin tức cùng chuyên mục Tin tức khác Tin tức cùng chuyên mục Tin tức khác Tin tức cùng chuyên mục Tin tức khác Tin tức cùng chuyên mục Tin tức khác Tin tức cùng chuyên mục Tin tức khác Tin tức cùng chuyên mục Tin tức khác Tin tức cùng chuyên mục Tin tức khác Tin tức cùng chuyên mục Tin tức khác Tin tức cùng chuyên mục Tin tức khác Tin tức cùng chuyên mục Tin tức khác Tin tức cùng chuyên mục Tin tức khác Tin tức cùng chuyên mục Tin tức khác Tin tức cùng chuyên mục Tin tức khác Tin tức cùng chuyên mục Tin tức khác Tin tức cùng chuyên mục Tin tức khác Tin tức cùng chuyên mục Tin tức khác Tin tức cùng chuyên mục Tin tức khác Tin tức cùng chuyên mục Tin tức khác Tin tức cùng chuyên mục Tin tức khác Tin tức cùng chuyên mục Tin tức khác Tin tức cùng chuyên mục Tin tức khác Tin tức cùng chuyên mục Tin tức khác Tin tức cùng chuyên mục Tin tức khác Tin tức cùng chuyên mục Tin tức khác Tin tức cùng chuyên mục Tin tức khác Tin tức cùng chuyên mục Tin tức khác Tin tức cùng chuyên mục Tin tức khác Tin tức cùng chuyên mục Tin tức khác Tin tức cùng chuyên mục Tin tức khác Tin tức cùng chuyên mục Tin tức khác Tin tức cùng chuyên mục Tin tức khác Tin tức cùng chuyên mục Tin tức khác Tin tức cùng chuyên mục Tin tức khác Tin tức cùng chuyên mục Tin tức khác Tin tức cùng chuyên mục Tin tức khác Tin tức cùng chuyên mục Tin tức khác Tin tức cùng chuyên mục Tin tức khác Tin tức cùng chuyên mục Tin tức khác Tin tức cùng chuyên mục Tin tức khác Tin tức cùng chuyên mục Tin tức khác Tin tức cùng chuyên mục Tin tức khác Tin tức cùng chuyên mục Tin tức khác Tin tức cùng chuyên mục Tin tức khác Tin tức cùng chuyên mục Tin tức khác Tin tức cùng chuyên mục Tin tức khác Tin tức cùng chuyên mục Tin tức khác Tin tức cùng chuyên mục Tin tức khác Tin tức cùng chuyên mục Tin tức khác Tin tức cùng chuyên mục Tin tức khác Tin tức cùng chuyên mục Tin tức khác Tin tức cùng chuyên mục Tin tức khác Tin tức cùng chuyên mục Tin tức khác Tin tức cùng chuyên mục Tin tức khác Tin tức cùng chuyên mục Tin tức khác Tin tức cùng chuyên mục Tin tức khác Tin tức cùng chuyên mục Tin tức khác Tin tức cùng chuyên mục Tin tức khác Tin tức cùng chuyên mục Tin tức khác Tin tức cùng chuyên mục Tin tức khác Tin tức cùng chuyên mục Tin tức khác Tin tức cùng chuyên mục Tin tức khác Tin tức cùng chuyên mục Tin tức khác Tin tức cùng chuyên mục Tin tức khác Tin tức cùng chuyên mục Tin tức khác Tin tức cùng chuyên mục Tin tức khác Tin tức cùng chuyên mục Tin tức khác Tin tức cùng chuyên mục Tin tức khác Tin tức cùng chuyên mục Tin tức khác Tin tức cùng chuyên mục Tin tức khác Tin tức cùng chuyên mục Tin tức khác Tin tức cùng chuyên mục Tin tức khác Tin tức cùng chuyên mục Tin tức khác Tin tức cùng chuyên mục Tin tức khác Tin tức cùng chuyên mục Tin tức khác Tin tức cùng chuyên mục Tin tức khác Tin tức cùng chuyên mục Tin tức khác Tin tức cùng chuyên mục Tin tức khác Tin tức cùng chuyên mục Tin tức khác Tin tức cùng chuyên mục Tin tức khác Tin tức cùng chuyên mục Tin tức khác Tin tức cùng chuyên mục Tin tức khác Tin tức cùng chuyên mục Tin tức khác Tin tức cùng chuyên mục Tin tức khác Tin tức cùng chuyên mục Tin tức khác Tin tức cùng chuyên mục Tin tức khác Tin tức cùng chuyên mục Tin tức khác Tin tức cùng chuyên mục Tin tức khác Tin tức cùng chuyên mục Tin tức khác Tin tức cùng chuyên mục Tin tức khác Tin tức cùng chuyên mục Tin tức khác Tin tức cùng chuyên mục Tin tức khác Tin tức cùng chuyên mục Tin tức khác Tin tức cùng chuyên mục Tin tức khác Tin tức cùng chuyên mục Tin tức khác Tin tức cùng chuyên mục Tin tức khác Tin tức cùng chuyên mục Tin tức khác Tin tức cùng chuyên mục Tin tức khác Tin tức cùng chuyên mục Tin tức khác Tin tức cùng chuyên mục Tin tức khác Tin tức cùng chuyên mục Tin tức khác Tin tức cùng chuyên mục Tin tức khác Tin tức cùng chuyên mục Tin tức khác Tin tức cùng chuyên mục Tin tức khác Tin tức cùng chuyên mục Tin tức khác Tin tức cùng chuyên mục Tin tức khác Tin tức cùng chuyên mục Tin tức khác Tin tức cùng chuyên mục Tin tức khác Tin tức cùng chuyên mục Tin tức khác Tin tức cùng chuyên mục Tin tức khác Tin tức cùng chuyên mục Tin tức khác Tin tức cùng chuyên mục Tin tức khác Tin tức cùng chuyên mục Tin tức khác Tin tức cùng chuyên mục Tin tức khác Tin tức cùng chuyên mục Tin tức khác Tin tức cùng chuyên mục Tin tức khác Tin tức cùng chuyên mục Tin tức khác Tin tức cùng chuyên mục Tin tức khác Tin tức cùng chuyên mục Tin tức khác Tin tức cùng chuyên mục Tin tức khác Tin tức cùng chuyên mục Tin tức khác Tin tức cùng chuyên mục Tin tức khác Tin tức cùng chuyên mục Tin tức khác Tin tức cùng chuyên mục Tin tức khác Tin tức cùng chuyên mục Tin tức khác Tin tức cùng chuyên mục Tin tức khác Tin tức cùng chuyên mục Tin tức khác Tin tức cùng chuyên mục Tin tức khác Tin tức cùng chuyên mục Tin tức khác Tin tức cùng chuyên mục Tin tức khác Tin tức cùng chuyên mục Tin tức khác Tin tức cùng chuyên mục Tin tức khác Tin tức cùng chuyên mục Tin tức khác Tin tức cùng chuyên mục Tin tức khác Tin tức cùng chuyên mục Tin tức khác Tin tức cùng chuyên mục Tin tức khác Tin tức cùng chuyên mục Tin tức khác Tin tức cùng chuyên mục Tin tức khác Tin tức cùng chuyên mục Tin tức khác Tin tức cùng chuyên mục Tin tức khác Tin tức cùng chuyên mục Tin tức khác Tin tức cùng chuyên mục Tin tức khác Tin tức cùng chuyên mục Tin tức khác Tin tức cùng chuyên mục Tin tức khác Tin tức cùng chuyên mục Tin tức khác Tin tức cùng chuyên mục Tin tức khác Tin tức cùng chuyên mục Tin tức khác Tin tức cùng chuyên mục Tin tức khác Tin tức cùng chuyên mục Tin tức khác Tin tức cùng chuyên mục Tin tức khác Tin tức cùng chuyên mục Tin tức khác Tin tức cùng chuyên mục Tin tức khác Tin tức cùng chuyên mục Tin tức khác Tin tức cùng chuyên mục Tin tức khác Tin tức cùng chuyên mục Tin tức khác Tin tức cùng chuyên mục Tin tức khác Tin tức cùng chuyên mục Tin tức khác Tin tức cùng chuyên mục Tin tức khác Tin tức cùng chuyên mục Tin tức khác Tin tức cùng chuyên mục Tin tức khác Tin tức cùng chuyên mục Tin tức khác Tin tức cùng chuyên mục Tin tức khác Tin tức cùng chuyên mục Tin tức khác Tin tức cùng chuyên mục Tin tức khác Tin tức cùng chuyên mục Tin tức khác Tin tức cùng chuyên mục Tin tức khác Tin tức cùng chuyên mục Tin tức khác Tin tức cùng chuyên mục Tin tức khác Tin tức cùng chuyên mục Tin tức khác Tin tức cùng chuyên mục Tin tức khác Tin tức cùng chuyên mục Tin tức khác Tin tức cùng chuyên mục Tin tức khác Tin tức cùng chuyên mục Tin tức khác Tin tức cùng chuyên mục Tin tức khác Tin tức cùng chuyên mục Tin tức khác Tin tức cùng chuyên mục Tin tức khác Tin tức cùng chuyên mục Tin tức khác Tin tức cùng chuyên mục Tin tức khác Tin tức cùng chuyên mục Tin tức khác Tin tức cùng chuyên mục Tin tức khác Tin tức cùng chuyên mục Tin tức khác Tin tức cùng chuyên mục Tin tức khác Tin tức cùng chuyên mục Tin tức khác Tin tức cùng chuyên mục Tin tức khác Tin tức cùng chuyên mục Tin tức khác Tin tức cùng chuyên mục Tin tức khác Tin tức cùng chuyên mục Tin tức khác Tin tức cùng chuyên mục Tin tức khác Tin tức cùng chuyên mục Tin tức khác Tin tức cùng chuyên mục Tin tức khác Tin tức cùng chuyên mục Tin tức khác Tin tức cùng chuyên mục Tin tức khác Tin tức cùng chuyên mục Tin tức khác Tin tức cùng chuyên mục Tin tức khác Tin tức cùng chuyên mục Tin tức khác Tin tức cùng chuyên mục Tin tức khác Tin tức cùng chuyên mục Tin tức khác Tin tức cùng chuyên mục Tin tức khác Tin tức cùng chuyên mục Tin tức khác Tin tức cùng chuyên mục Tin tức khác Tin tức cùng chuyên mục Tin tức khác Tin tức cùng chuyên mục Tin tức khác Tin tức cùng chuyên mục Tin tức khác Tin tức cùng chuyên mục Tin tức khác Tin tức cùng chuyên mục Tin tức khác Tin tức cùng chuyên mục Tin tức khác Tin tức cùng chuyên mục Tin tức khác Tin tức cùng chuyên mục Tin tức khác Tin tức cùng chuyên mục Tin tức khác Tin tức cùng chuyên mục Tin tức khác Tin tức cùng chuyên mục Tin tức khác Tin tức cùng chuyên mục Tin tức khác Tin tức cùng chuyên mục Tin tức khác Tin tức cùng chuyên mục Tin tức khác Tin tức cùng chuyên mục Tin tức khác Tin tức cùng chuyên mục Tin tức khác Tin tức cùng chuyên mục Tin tức khác Tin tức cùng chuyên mục Tin tức khác Tin tức cùng chuyên mục Tin tức khác Tin tức cùng chuyên mục Tin tức khác Tin tức cùng chuyên mục Tin tức khác Tin tức cùng chuyên mục Tin tức khác Tin tức cùng chuyên mục Tin tức khác Tin tức cùng chuyên mục Tin tức khác Tin tức cùng chuyên mục Tin tức khác Tin tức cùng chuyên mục Tin tức khác Tin tức cùng chuyên mục Tin tức khác Tin tức cùng chuyên mục Tin tức khác Tin tức cùng chuyên mục Tin tức khác Tin tức cùng chuyên mục Tin tức khác Tin tức cùng chuyên mục Tin tức khác Tin tức cùng chuyên mục Tin tức khác Tin tức cùng chuyên mục Tin tức khác Tin tức cùng chuyên mục Tin tức khác Tin tức cùng chuyên mục Tin tức khác Tin tức cùng chuyên mục Tin tức khác Tin tức cùng chuyên mục Tin tức khác Tin tức cùng chuyên mục Tin tức khác Tin tức cùng chuyên mục Tin tức khác Tin tức cùng chuyên mục Tin tức khác Tin tức cùng chuyên mục Tin tức khác Tin tức cùng chuyên mục Tin tức khác Tin tức cùng chuyên mục Tin tức khác Tin tức cùng chuyên mục Tin tức khác Tin tức cùng chuyên mục Tin tức khác Tin tức cùng chuyên mục Tin tức khác Tin tức cùng chuyên mục Tin tức khác Tin tức cùng chuyên mục Tin tức khác Tin tức cùng chuyên mục Tin tức khác Tin tức cùng chuyên mục Tin tức khác Tin tức cùng chuyên mục Tin tức khác Tin tức cùng chuyên mục Tin tức khác Tin tức cùng chuyên mục Tin tức khác Tin tức cùng chuyên mục Tin tức khác Tin tức cùng chuyên mục Tin tức khác Tin tức cùng chuyên mục Tin tức khác Tin tức cùng chuyên mục Tin tức khác Tin tức cùng chuyên mục Tin tức khác Tin tức cùng chuyên mục Tin tức khác Tin tức cùng chuyên mục Tin tức khác Tin tức cùng chuyên mục Tin tức khác Tin tức cùng chuyên mục Tin tức khác Tin tức cùng chuyên mục Tin tức khác Tin tức cùng chuyên mục Tin tức khác Tin tức cùng chuyên mục Tin tức khác Tin tức cùng chuyên mục Tin tức khác Tin tức cùng chuyên mục Tin tức khác Tin tức cùng chuyên mục Tin tức khác Tin tức cùng chuyên mục Tin tức khác Tin tức cùng chuyên mục Tin tức khác Tin tức cùng chuyên mục Tin tức khác Tin tức cùng chuyên mục Tin tức khác Tin tức cùng chuyên mục Tin tức khác Tin tức cùng chuyên mục Tin tức khác Tin tức cùng chuyên mục Tin tức khác Tin tức cùng chuyên mục Tin tức khác Tin tức cùng chuyên mục Tin tức khác Tin tức cùng chuyên mục Tin tức khác Tin tức cùng chuyên mục Tin tức khác Tin tức cùng chuyên mục Tin tức khác Tin tức cùng chuyên mục Tin tức khác Tin tức cùng chuyên mục Tin tức khác Tin tức cùng chuyên mục Tin tức khác Tin tức cùng chuyên mục Tin tức khác Tin tức cùng chuyên mục Tin tức khác Tin tức cùng chuyên mục Tin tức khác Tin tức cùng chuyên mục Tin tức khác Tin tức cùng chuyên mục Tin tức khác Tin tức cùng chuyên mục Tin tức khác Tin tức cùng chuyên mục Tin tức khác Tin tức cùng chuyên mục Tin tức khác Tin tức cùng chuyên mục Tin tức khác Tin tức cùng chuyên mục Tin tức khác Tin tức cùng chuyên mục Tin tức khác Tin tức cùng chuyên mục Tin tức khác Tin tức cùng chuyên mục Tin tức khác Tin tức cùng chuyên mục Tin tức khác Tin tức cùng chuyên mục Tin tức khác Tin tức cùng chuyên mục Tin tức khác Tin tức cùng chuyên mục Tin tức khác Tin tức cùng chuyên mục Tin tức khác Tin tức cùng chuyên mục Tin tức khác Tin tức cùng chuyên mục Tin tức khác Tin tức cùng chuyên mục Tin tức khác Tin tức cùng chuyên mục Tin tức khác Tin tức cùng chuyên mục Tin tức khác Tin tức cùng chuyên mục Tin tức khác Tin tức cùng chuyên mục Tin tức khác Tin tức cùng chuyên mục Tin tức khác Tin tức cùng chuyên mục Tin tức khác Tin tức cùng chuyên mục Tin tức khác Tin tức cùng chuyên mục Tin tức khác Tin tức cùng chuyên mục Tin tức khác Tin tức cùng chuyên mục Tin tức khác Tin tức cùng chuyên mục Tin tức khác Tin tức cùng chuyên mục Tin tức khác Tin tức cùng chuyên mục Tin tức khác Tin tức cùng chuyên mục Tin tức khác Tin tức cùng chuyên mục Tin tức khác Tin tức cùng chuyên mục Tin tức khác Tin tức cùng chuyên mục Tin tức khác Tin tức cùng chuyên mục Tin tức khác Tin tức cùng chuyên mục Tin tức khác Tin tức cùng chuyên mục Tin tức khác Tin tức cùng chuyên mục Tin tức khác Tin tức cùng chuyên mục Tin tức khác Tin tức cùng chuyên mục Tin tức khác Tin tức cùng chuyên mục Tin tức khác Tin tức cùng chuyên mục Tin tức khác Tin tức cùng chuyên mục Tin tức khác Tin tức cùng chuyên mục Tin tức khác Tin tức cùng chuyên mục Tin tức khác Tin tức cùng chuyên mục Tin tức khác Tin tức cùng chuyên mục Tin tức khác Tin tức cùng chuyên mục Tin tức khác Tin tức cùng chuyên mục Tin tức khác Tin tức cùng chuyên mục Tin tức khác Tin tức cùng chuyên mục Tin tức khác Tin tức cùng chuyên mục Tin tức khác Tin tức cùng chuyên mục Tin tức khác Tin tức cùng chuyên mục Tin tức khác Tin tức cùng chuyên mục Tin tức khác Tin tức cùng chuyên mục Tin tức khác Tin tức cùng chuyên mục Tin tức khác Tin tức cùng chuyên mục Tin tức khác Tin tức cùng chuyên mục Tin tức khác Tin tức cùng chuyên mục Tin tức khác Tin tức cùng chuyên mục Tin tức khác Tin tức cùng chuyên mục Tin tức khác Tin tức cùng chuyên mục Tin tức khác Tin tức cùng chuyên mục Tin tức khác Tin tức cùng chuyên mục Tin tức khác Tin tức cùng chuyên mục Tin tức khác Tin tức cùng chuyên mục Tin tức khác Tin tức cùng chuyên mục Tin tức khác Tin tức cùng chuyên mục Tin tức khác Tin tức cùng chuyên mục Tin tức khác Tin tức cùng chuyên mục Tin tức khác Tin tức cùng chuyên mục Tin tức khác Tin tức cùng chuyên mục Tin tức khác Tin tức cùng chuyên mục Tin tức khác Tin tức cùng chuyên mục Tin tức khác Tin tức cùng chuyên mục Tin tức khác Tin tức cùng chuyên mục Tin tức khác Tin tức cùng chuyên mục Tin tức khác Tin tức cùng chuyên mục Tin tức khác Tin tức cùng chuyên mục Tin tức khác Tin tức cùng chuyên mục Tin tức khác Tin tức cùng chuyên mục Tin tức khác Tin tức cùng chuyên mục Tin tức khác Tin tức cùng chuyên mục Tin tức khác Tin tức cùng chuyên mục Tin tức khác Tin tức cùng chuyên mục Tin tức khác Tin tức cùng chuyên mục Tin tức khác Tin tức cùng chuyên mục Tin tức khác Tin tức cùng chuyên mục Tin tức khác Tin tức cùng chuyên mục Tin tức khác Tin tức cùng chuyên mục Tin tức khác Tin tức cùng chuyên mục Tin tức khác Tin tức cùng chuyên mục Tin tức khác Tin tức cùng chuyên mục Tin tức khác Tin tức cùng chuyên mục Tin tức khác Tin tức cùng chuyên mục Tin tức khác Tin tức cùng chuyên mục Tin tức khác Tin tức cùng chuyên mục Tin tức khác Tin tức cùng chuyên mục Tin tức khác Tin tức cùng chuyên mục Tin tức khác Tin tức cùng chuyên mục Tin tức khác Tin tức cùng chuyên mục Tin tức khác Tin tức cùng chuyên mục Tin tức khác Tin tức cùng chuyên mục Tin tức khác Tin tức cùng chuyên mục Tin tức khác Tin tức cùng chuyên mục Tin tức khác Tin tức cùng chuyên mục Tin tức khác Tin tức cùng chuyên mục Tin tức khác Tin tức cùng chuyên mục Tin tức khác Tin tức cùng chuyên mục Tin tức khác Tin tức cùng chuyên mục Tin tức khác Tin tức cùng chuyên mục Tin tức khác Tin tức cùng chuyên mục Tin tức khác Tin tức cùng chuyên mục Tin tức khác Tin tức cùng chuyên mục Tin tức khác Tin tức cùng chuyên mục Tin tức khác Tin tức cùng chuyên mục Tin tức khác Tin tức cùng chuyên mục Tin tức khác Tin tức cùng chuyên mục Tin tức khác Tin tức cùng chuyên mục Tin tức khác Tin tức cùng chuyên mục Tin tức khác Tin tức cùng chuyên mục Tin tức khác Tin tức cùng chuyên mục Tin tức khác Tin tức cùng chuyên mục Tin tức khác Tin tức cùng chuyên mục Tin tức khác Tin tức cùng chuyên mục Tin tức khác Tin tức cùng chuyên mục Tin tức khác Tin tức cùng chuyên mục Tin tức khác Tin tức cùng chuyên mục Tin tức khác Tin tức cùng chuyên mục Tin tức khác Tin tức cùng chuyên mục Tin tức khác Tin tức cùng chuyên mục Tin tức khác Tin tức cùng chuyên mục Tin tức khác Tin tức cùng chuyên mục Tin tức khác Tin tức cùng chuyên mục Tin tức khác Tin tức cùng chuyên mục Tin tức khác Tin tức cùng chuyên mục Tin tức khác Tin tức cùng chuyên mục Tin tức khác Tin tức cùng chuyên mục Tin tức khác Tin tức cùng chuyên mục Tin tức khác Tin tức cùng chuyên mục Tin tức khác Tin tức cùng chuyên mục Tin tức khác Tin tức cùng chuyên mục Tin tức khác Tin tức cùng chuyên mục Tin tức khác Tin tức cùng chuyên mục Tin tức khác Tin tức cùng chuyên mục Tin tức khác Tin tức cùng chuyên mục Tin tức khác Tin tức cùng chuyên mục Tin tức khác Tin tức cùng chuyên mục Tin tức khác Tin tức cùng chuyên mục Tin tức khác Tin tức cùng chuyên mục Tin tức khác Tin tức cùng chuyên mục Tin tức khác Tin tức cùng chuyên mục Tin tức khác Tin tức cùng chuyên mục Tin tức khác Tin tức cùng chuyên mục Tin tức khác Tin tức cùng chuyên mục Tin tức khác Tin tức cùng chuyên mục Tin tức khác Tin tức cùng chuyên mục Tin tức khác Tin tức cùng chuyên mục Tin tức khác Tin tức cùng chuyên mục Tin tức khác Tin tức cùng chuyên mục Tin tức khác Tin tức cùng chuyên mục Tin tức khác Tin tức cùng chuyên mục Tin tức khác Tin tức cùng chuyên mục Tin tức khác Tin tức cùng chuyên mục Tin tức khác Tin tức cùng chuyên mục Tin tức khác Tin tức cùng chuyên mục Tin tức khác Tin tức cùng chuyên mục Tin tức khác Tin tức cùng chuyên mục Tin tức khác Tin tức cùng chuyên mục Tin tức khác Tin tức cùng chuyên mục Tin tức khác Tin tức cùng chuyên mục Tin tức khác Tin tức cùng chuyên mục Tin tức khác Tin tức cùng chuyên mục Tin tức khác Tin tức cùng chuyên mục Tin tức khác Tin tức cùng chuyên mục Tin tức khác Tin tức cùng chuyên mục Tin tức khác Tin tức cùng chuyên mục Tin tức khác Tin tức cùng chuyên mục Tin tức khác Tin tức cùng chuyên mục Tin tức khác Tin tức cùng chuyên mục Tin tức khác Tin tức cùng chuyên mục Tin tức khác Tin tức cùng chuyên mục Tin tức khác Tin tức cùng chuyên mục Tin tức khác Tin tức cùng chuyên mục Tin tức khác Tin tức cùng chuyên mục Tin tức khác Tin tức cùng chuyên mục Tin tức khác Tin tức cùng chuyên mục Tin tức khác Tin tức cùng chuyên mục Tin tức khác Tin tức cùng chuyên mục Tin tức khác Tin tức cùng chuyên mục Tin tức khác Tin tức cùng chuyên mục Tin tức khác Tin tức cùng chuyên mục Tin tức khác Tin tức cùng chuyên mục Tin tức khác Tin tức cùng chuyên mục Tin tức khác Tin tức cùng chuyên mục Tin tức khác Tin tức cùng chuyên mục Tin tức khác Tin tức cùng chuyên mục Tin tức khác Tin tức cùng chuyên mục Tin tức khác Tin tức cùng chuyên mục Tin tức khác Tin tức cùng chuyên mục Tin tức khác Tin tức cùng chuyên mục Tin tức khác Tin tức cùng chuyên mục Tin tức khác Tin tức cùng chuyên mục Tin tức khác Tin tức cùng chuyên mục Tin tức khác Tin tức cùng chuyên mục Tin tức khác Tin tức cùng chuyên mục Tin tức khác Tin tức cùng chuyên mục Tin tức khác Tin tức cùng chuyên mục Tin tức khác Tin tức cùng chuyên mục Tin tức khác Tin tức cùng chuyên mục Tin tức khác Tin tức cùng chuyên mục Tin tức khác Tin tức cùng chuyên mục Tin tức khác Tin tức cùng chuyên mục Tin tức khác Tin tức cùng chuyên mục Tin tức khác Tin tức cùng chuyên mục Tin tức khác Tin tức cùng chuyên mục Tin tức khác Tin tức cùng chuyên mục Tin tức khác Tin tức cùng chuyên mục Tin tức khác Tin tức cùng chuyên mục Tin tức khác Tin tức cùng chuyên mục Tin tức khác Tin tức cùng chuyên mục Tin tức khác Tin tức cùng chuyên mục Tin tức khác Tin tức cùng chuyên mục Tin tức khác Tin tức cùng chuyên mục Tin tức khác Tin tức cùng chuyên mục Tin tức khác Tin tức cùng chuyên mục Tin tức khác Tin tức cùng chuyên mục Tin tức khác Tin tức cùng chuyên mục Tin tức khác Tin tức cùng chuyên mục Tin tức khác Tin tức cùng chuyên mục Tin tức khác Tin tức cùng chuyên mục Tin tức khác Tin tức cùng chuyên mục Tin tức khác Tin tức cùng chuyên mục Tin tức khác Tin tức cùng chuyên mục Tin tức khác Tin tức cùng chuyên mục Tin tức khác Tin tức cùng chuyên mục Tin tức khác Tin tức cùng chuyên mục Tin tức khác Tin tức cùng chuyên mục Tin tức khác Tin tức cùng chuyên mục Tin tức khác Tin tức cùng chuyên mục Tin tức khác Tin tức cùng chuyên mục Tin tức khác Tin tức cùng chuyên mục Tin tức khác Tin tức cùng chuyên mục Tin tức khác Tin tức cùng chuyên mục Tin tức khác Tin tức cùng chuyên mục Tin tức khác Tin tức cùng chuyên mục Tin tức khác Tin tức cùng chuyên mục Tin tức khác Tin tức cùng chuyên mục Tin tức khác Tin tức cùng chuyên mục Tin tức khác Tin tức cùng chuyên mục Tin tức khác Tin tức cùng chuyên mục Tin tức khác Tin tức cùng chuyên mục Tin tức khác Tin tức cùng chuyên mục Tin tức khác Tin tức cùng chuyên mục Tin tức khác Tin tức cùng chuyên mục Tin tức khác Tin tức cùng chuyên mục Tin tức khác Tin tức cùng chuyên mục Tin tức khác Tin tức cùng chuyên mục Tin tức khác Tin tức cùng chuyên mục Tin tức khác Tin tức cùng chuyên mục Tin tức khác Tin tức cùng chuyên mục Tin tức khác Tin tức cùng chuyên mục Tin tức khác Tin tức cùng chuyên mục Tin tức khác Tin tức cùng chuyên mục Tin tức khác Tin tức cùng chuyên mục Tin tức khác Tin tức cùng chuyên mục Tin tức khác Tin tức cùng chuyên mục Tin tức khác Tin tức cùng chuyên mục Tin tức khác Tin tức cùng chuyên mục Tin tức khác Tin tức cùng chuyên mục Tin tức khác Tin tức cùng chuyên mục Tin tức khác Tin tức cùng chuyên mục Tin tức khác Tin tức cùng chuyên mục Tin tức khác Tin tức cùng chuyên mục Tin tức khác Tin tức cùng chuyên mục Tin tức khác Tin tức cùng chuyên mục Tin tức khác Tin tức cùng chuyên mục Tin tức khác Tin tức cùng chuyên mục Tin tức khác Tin tức cùng chuyên mục Tin tức khác Tin tức cùng chuyên mục Tin tức khác Tin tức cùng chuyên mục Tin tức khác Tin tức cùng chuyên mục Tin tức khác Tin tức cùng chuyên mục Tin tức khác Tin tức cùng chuyên mục Tin tức khác Tin tức cùng chuyên mục Tin tức khác Tin tức cùng chuyên mục Tin tức khác Tin tức cùng chuyên mục Tin tức khác Tin tức cùng chuyên mục Tin tức khác Tin tức cùng chuyên mục Tin tức khác Tin tức cùng chuyên mục Tin tức khác Tin tức cùng chuyên mục Tin tức khác Tin tức cùng chuyên mục Tin tức khác Tin tức cùng chuyên mục Tin tức khác Tin tức cùng chuyên mục Tin tức khác Tin tức cùng chuyên mục Tin tức khác Tin tức cùng chuyên mục Tin tức khác Tin tức cùng chuyên mục Tin tức khác Tin tức cùng chuyên mục Tin tức khác Tin tức cùng chuyên mục Tin tức khác Tin tức cùng chuyên mục Tin tức khác Tin tức cùng chuyên mục Tin tức khác Tin tức cùng chuyên mục Tin tức khác Tin tức cùng chuyên mục Tin tức khác Tin tức cùng chuyên mục Tin tức khác Tin tức cùng chuyên mục Tin tức khác Tin tức cùng chuyên mục Tin tức khác Tin tức cùng chuyên mục Tin tức khác Tin tức cùng chuyên mục Tin tức khác Tin tức cùng chuyên mục Tin tức khác Tin tức cùng chuyên mục Tin tức khác Tin tức cùng chuyên mục Tin tức khác Tin tức cùng chuyên mục Tin tức khác Tin tức cùng chuyên mục Tin tức khác Tin tức cùng chuyên mục Tin tức khác Tin tức cùng chuyên mục Tin tức khác Tin tức cùng chuyên mục Tin tức khác Tin tức cùng chuyên mục Tin tức khác Tin tức cùng chuyên mục Tin tức khác Tin tức cùng chuyên mục Tin tức khác Tin tức cùng chuyên mục Tin tức khác Tin tức cùng chuyên mục Tin tức khác Tin tức cùng chuyên mục Tin tức khác Tin tức cùng chuyên mục Tin tức khác Tin tức cùng chuyên mục Tin tức khác Tin tức cùng chuyên mục Tin tức khác Tin tức cùng chuyên mục Tin tức khác Tin tức cùng chuyên mục Tin tức khác Tin tức cùng chuyên mục Tin tức khác Tin tức cùng chuyên mục Tin tức khác Tin tức cùng chuyên mục Tin tức khác Tin tức cùng chuyên mục Tin tức khác Tin tức cùng chuyên mục Tin tức khác Tin tức cùng chuyên mục Tin tức khác Tin tức cùng chuyên mục Tin tức khác Tin tức cùng chuyên mục Tin tức khác Tin tức cùng chuyên mục Tin tức khác Tin tức cùng chuyên mục Tin tức khác Tin tức cùng chuyên mục Tin tức khác Tin tức cùng chuyên mục Tin tức khác Tin tức cùng chuyên mục Tin tức khác Tin tức cùng chuyên mục Tin tức khác Tin tức cùng chuyên mục Tin tức khác Tin tức cùng chuyên mục Tin tức khác Tin tức cùng chuyên mục Tin tức khác Tin tức cùng chuyên mục Tin tức khác Tin tức cùng chuyên mục Tin tức khác Tin tức cùng chuyên mục Tin tức khác Tin tức cùng chuyên mục Tin tức khác Tin tức cùng chuyên mục Tin tức khác Tin tức cùng chuyên mục Tin tức khác Tin tức cùng chuyên mục Tin tức khác Tin tức cùng chuyên mục Tin tức khác Tin tức cùng chuyên mục Tin tức khác Tin tức cùng chuyên mục Tin tức khác Tin tức cùng chuyên mục Tin tức khác Tin tức cùng chuyên mục Tin tức khác Tin tức cùng chuyên mục Tin tức khác Tin tức cùng chuyên mục Tin tức khác Tin tức cùng chuyên mục Tin tức khác Tin tức cùng chuyên mục Tin tức khác Tin tức cùng chuyên mục Tin tức khác Tin tức cùng chuyên mục Tin tức khác Tin tức cùng chuyên mục Tin tức khác Tin tức cùng chuyên mục Tin tức khác Tin tức cùng chuyên mục Tin tức khác Tin tức cùng chuyên mục Tin tức khác Tin tức cùng chuyên mục Tin tức khác Tin tức cùng chuyên mục Tin tức khác Tin tức cùng chuyên mục Tin tức khác Tin tức cùng chuyên mục Tin tức khác Tin tức cùng chuyên mục Tin tức khác Tin tức cùng chuyên mục Tin tức khác Tin tức cùng chuyên mục Tin tức khác Tin tức cùng chuyên mục Tin tức khác Tin tức cùng chuyên mục Tin tức khác Tin tức cùng chuyên mục Tin tức khác Tin tức cùng chuyên mục Tin tức khác Tin tức cùng chuyên mục Tin tức khác Tin tức cùng chuyên mục Tin tức khác Tin tức cùng chuyên mục Tin tức khác Tin tức cùng chuyên mục Tin tức khác Tin tức cùng chuyên mục Tin tức khác Tin tức cùng chuyên mục Tin tức khác Tin tức cùng chuyên mục Tin tức khác Tin tức cùng chuyên mục Tin tức khác Tin tức cùng chuyên mục Tin tức khác Tin tức cùng chuyên mục Tin tức khác Tin tức cùng chuyên mục Tin tức khác Tin tức cùng chuyên mục Tin tức khác Tin tức cùng chuyên mục Tin tức khác Tin tức cùng chuyên mục Tin tức khác Tin tức cùng chuyên mục Tin tức khác Tin tức cùng chuyên mục Tin tức khác Tin tức cùng chuyên mục Tin tức khác Tin tức cùng chuyên mục Tin tức khác Tin tức cùng chuyên mục Tin tức khác Tin tức cùng chuyên mục Tin tức khác Tin tức cùng chuyên mục Tin tức khác Tin tức cùng chuyên mục Tin tức khác Tin tức cùng chuyên mục Tin tức khác Tin tức cùng chuyên mục Tin tức khác Tin tức cùng chuyên mục Tin tức khác Tin tức cùng chuyên mục Tin tức khác Tin tức cùng chuyên mục Tin tức khác Tin tức cùng chuyên mục Tin tức khác Tin tức cùng chuyên mục Tin tức khác Tin tức cùng chuyên mục Tin tức khác Tin tức cùng chuyên mục Tin tức khác Tin tức cùng chuyên mục Tin tức khác Tin tức cùng chuyên mục Tin tức khác Tin tức cùng chuyên mục Tin tức khác Tin tức cùng chuyên mục Tin tức khác Tin tức cùng chuyên mục Tin tức khác Tin tức cùng chuyên mục Tin tức khác Tin tức cùng chuyên mục Tin tức khác Tin tức cùng chuyên mục Tin tức khác Tin tức cùng chuyên mục Tin tức khác Tin tức cùng chuyên mục Tin tức khác Tin tức cùng chuyên mục Tin tức khác Tin tức cùng chuyên mục Tin tức khác Tin tức cùng chuyên mục Tin tức khác Tin tức cùng chuyên mục Tin tức khác Tin tức cùng chuyên mục Tin tức khác Tin tức cùng chuyên mục Tin tức khác Tin tức cùng chuyên mục Tin tức khác Tin tức cùng chuyên mục Tin tức khác Tin tức cùng chuyên mục Tin tức khác Tin tức cùng chuyên mục Tin tức khác Tin tức cùng chuyên mục Tin tức khác Tin tức cùng chuyên mục Tin tức khác Tin tức cùng chuyên mục Tin tức khác Tin tức cùng chuyên mục Tin tức khác Tin tức cùng chuyên mục Tin tức khác Tin tức cùng chuyên mục Tin tức khác Tin tức cùng chuyên mục Tin tức khác Tin tức cùng chuyên mục Tin tức khác Tin tức cùng chuyên mục Tin tức khác Tin tức cùng chuyên mục Tin tức khác Tin tức cùng chuyên mục Tin tức khác Tin tức cùng chuyên mục Tin tức khác Tin tức cùng chuyên mục Tin tức khác Tin tức cùng chuyên mục Tin tức khác Tin tức cùng chuyên mục Tin tức khác Tin tức cùng chuyên mục Tin tức khác Tin tức cùng chuyên mục Tin tức khác Tin tức cùng chuyên mục Tin tức khác Tin tức cùng chuyên mục Tin tức khác Tin tức cùng chuyên mục Tin tức khác Tin tức cùng chuyên mục Tin tức khác Tin tức cùng chuyên mục Tin tức khác Tin tức cùng chuyên mục Tin tức khác Tin tức cùng chuyên mục Tin tức khác Tin tức cùng chuyên mục Tin tức khác Tin tức cùng chuyên mục Tin tức khác Tin tức cùng chuyên mục Tin tức khác Tin tức cùng chuyên mục Tin tức khác Tin tức cùng chuyên mục Tin tức khác Tin tức cùng chuyên mục Tin tức khác Tin tức cùng chuyên mục Tin tức khác Tin tức cùng chuyên mục Tin tức khác Tin tức cùng chuyên mục Tin tức khác Tin tức cùng chuyên mục Tin tức khác Tin tức cùng chuyên mục Tin tức khác Tin tức cùng chuyên mục Tin tức khác Tin tức cùng chuyên mục Tin tức khác Tin tức cùng chuyên mục Tin tức khác Tin tức cùng chuyên mục Tin tức khác Tin tức cùng chuyên mục Tin tức khác Tin tức cùng chuyên mục Tin tức khác Tin tức cùng chuyên mục Tin tức khác Tin tức cùng chuyên mục Tin tức khác Tin tức cùng chuyên mục Tin tức khác Tin tức cùng chuyên mục Tin tức khác Tin tức cùng chuyên mục Tin tức khác Tin tức cùng chuyên mục Tin tức khác Tin tức cùng chuyên mục Tin tức khác Tin tức cùng chuyên mục Tin tức khác Tin tức cùng chuyên mục Tin tức khác Tin tức cùng chuyên mục Tin tức khác Tin tức cùng chuyên mục Tin tức khác Tin tức cùng chuyên mục Tin tức khác Tin tức cùng chuyên mục Tin tức khác Tin tức cùng chuyên mục Tin tức khác Tin tức cùng chuyên mục Tin tức khác Tin tức cùng chuyên mục Tin tức khác Tin tức cùng chuyên mục Tin tức khác Tin tức cùng chuyên mục Tin tức khác Tin tức cùng chuyên mục Tin tức khác Tin tức cùng chuyên mục Tin tức khác Tin tức cùng chuyên mục Tin tức khác Tin tức cùng chuyên mục Tin tức khác Tin tức cùng chuyên mục Tin tức khác Tin tức cùng chuyên mục Tin tức khác Tin tức cùng chuyên mục Tin tức khác Tin tức cùng chuyên mục Tin tức khác Tin tức cùng chuyên mục Tin tức khác Tin tức cùng chuyên mục Tin tức khác Tin tức cùng chuyên mục Tin tức khác Tin tức cùng chuyên mục Tin tức khác Tin tức cùng chuyên mục Tin tức khác Tin tức cùng chuyên mục Tin tức khác Tin tức cùng chuyên mục Tin tức khác Tin tức cùng chuyên mục Tin tức khác Tin tức cùng chuyên mục Tin tức khác Tin tức cùng chuyên mục Tin tức khác Tin tức cùng chuyên mục Tin tức khác Tin tức cùng chuyên mục Tin tức khác Tin tức cùng chuyên mục Tin tức khác Tin tức cùng chuyên mục Tin tức khác Tin tức cùng chuyên mục Tin tức khác Tin tức cùng chuyên mục Tin tức khác Tin tức cùng chuyên mục Tin tức khác Tin tức cùng chuyên mục Tin tức khác Tin tức cùng chuyên mục Tin tức khác Tin tức cùng chuyên mục Tin tức khác Tin tức cùng chuyên mục Tin tức khác Tin tức cùng chuyên mục Tin tức khác Tin tức cùng chuyên mục Tin tức khác Tin tức cùng chuyên mục Tin tức khác Tin tức cùng chuyên mục Tin tức khác Tin tức cùng chuyên mục Tin tức khác Tin tức cùng chuyên mục Tin tức khác Tin tức cùng chuyên mục Tin tức khác Tin tức cùng chuyên mục Tin tức khác Tin tức cùng chuyên mục Tin tức khác Tin tức cùng chuyên mục Tin tức khác Tin tức cùng chuyên mục Tin tức khác Tin tức cùng chuyên mục Tin tức khác Tin tức cùng chuyên mục Tin tức khác Tin tức cùng chuyên mục Tin tức khác Tin tức cùng chuyên mục Tin tức khác Tin tức cùng chuyên mục Tin tức khác Tin tức cùng chuyên mục Tin tức khác Tin tức cùng chuyên mục Tin tức khác Tin tức cùng chuyên mục Tin tức khác Tin tức cùng chuyên mục Tin tức khác Tin tức cùng chuyên mục Tin tức khác Tin tức cùng chuyên mục Tin tức khác Tin tức cùng chuyên mục Tin tức khác Tin tức cùng chuyên mục Tin tức khác Tin tức cùng chuyên mục Tin tức khác Tin tức cùng chuyên mục Tin tức khác Tin tức cùng chuyên mục Tin tức khác Tin tức cùng chuyên mục Tin tức khác Tin tức cùng chuyên mục Tin tức khác Tin tức cùng chuyên mục Tin tức khác Tin tức cùng chuyên mục Tin tức khác Tin tức cùng chuyên mục Tin tức khác Tin tức cùng chuyên mục Tin tức khác Tin tức cùng chuyên mục Tin tức khác Tin tức cùng chuyên mục Tin tức khác Tin tức cùng chuyên mục Tin tức khác Tin tức cùng chuyên mục Tin tức khác Tin tức cùng chuyên mục Tin tức khác Tin tức cùng chuyên mục Tin tức khác Tin tức cùng chuyên mục Tin tức khác Tin tức cùng chuyên mục Tin tức khác Tin tức cùng chuyên mục Tin tức khác Tin tức cùng chuyên mục Tin tức khác Tin tức cùng chuyên mục Tin tức khác Tin tức cùng chuyên mục Tin tức khác Tin tức cùng chuyên mục Tin tức khác Tin tức cùng chuyên mục Tin tức khác Tin tức cùng chuyên mục Tin tức khác Tin tức cùng chuyên mục Tin tức khác Tin tức cùng chuyên mục Tin tức khác Tin tức cùng chuyên mục Tin tức khác Tin tức cùng chuyên mục Tin tức khác Tin tức cùng chuyên mục Tin tức khác Tin tức cùng chuyên mục Tin tức khác Tin tức cùng chuyên mục Tin tức khác Tin tức cùng chuyên mục Tin tức khác Tin tức cùng chuyên mục Tin tức khác Tin tức cùng chuyên mục Tin tức khác Tin tức cùng chuyên mục Tin tức khác Tin tức cùng chuyên mục Tin tức khác Tin tức cùng chuyên mục Tin tức khác Tin tức cùng chuyên mục Tin tức khác Tin tức cùng chuyên mục Tin tức khác Tin tức cùng chuyên mục Tin tức khác Tin tức cùng chuyên mục Tin tức khác Tin tức cùng chuyên mục Tin tức khác Tin tức cùng chuyên mục Tin tức khác Tin tức cùng chuyên mục Tin tức khác Tin tức cùng chuyên mục Tin tức khác Tin tức cùng chuyên mục Tin tức khác Tin tức cùng chuyên mục Tin tức khác Tin tức cùng chuyên mục Tin tức khác Tin tức cùng chuyên mục Tin tức khác Tin tức cùng chuyên mục Tin tức khác Tin tức cùng chuyên mục Tin tức khác Tin tức cùng chuyên mục Tin tức khác Tin tức cùng chuyên mục Tin tức khác Tin tức cùng chuyên mục Tin tức khác Tin tức cùng chuyên mục Tin tức khác Tin tức cùng chuyên mục Tin tức khác Tin tức cùng chuyên mục Tin tức khác Tin tức cùng chuyên mục Tin tức khác Tin tức cùng chuyên mục Tin tức khác Tin tức cùng chuyên mục Tin tức khác Tin tức cùng chuyên mục Tin tức khác Tin tức cùng chuyên mục Tin tức khác Tin tức cùng chuyên mục Tin tức khác Tin tức cùng chuyên mục Tin tức khác Tin tức cùng chuyên mục Tin tức khác Tin tức cùng chuyên mục Tin tức khác Tin tức cùng chuyên mục Tin tức khác Tin tức cùng chuyên mục Tin tức khác Tin tức cùng chuyên mục Tin tức khác Tin tức cùng chuyên mục Tin tức khác Tin tức cùng chuyên mục Tin tức khác Tin tức cùng chuyên mục Tin tức khác Tin tức cùng chuyên mục Tin tức khác Tin tức cùng chuyên mục Tin tức khác Tin tức cùng chuyên mục Tin tức khác Tin tức cùng chuyên mục Tin tức khác Tin tức cùng chuyên mục Tin tức khác Tin tức cùng chuyên mục Tin tức khác Tin tức cùng chuyên mục Tin tức khác Tin tức cùng chuyên mục Tin tức khác Tin tức cùng chuyên mục Tin tức khác Tin tức cùng chuyên mục Tin tức khác Tin tức cùng chuyên mục Tin tức khác Tin tức cùng chuyên mục Tin tức khác Tin tức cùng chuyên mục Tin tức khác Tin tức cùng chuyên mục Tin tức khác Tin tức cùng chuyên mục Tin tức khác Tin tức cùng chuyên mục Tin tức khác Tin tức cùng chuyên mục Tin tức khác Tin tức cùng chuyên mục Tin tức khác Tin tức cùng chuyên mục Tin tức khác Tin tức cùng chuyên mục Tin tức khác Tin tức cùng chuyên mục Tin tức khác Tin tức cùng chuyên mục Tin tức khác Tin tức cùng chuyên mục Tin tức khác Tin tức cùng chuyên mục Tin tức khác Tin tức cùng chuyên mục Tin tức khác Tin tức cùng chuyên mục Tin tức khác Tin tức cùng chuyên mục Tin tức khác Tin tức cùng chuyên mục Tin tức khác Tin tức cùng chuyên mục Tin tức khác Tin tức cùng chuyên mục Tin tức khác Tin tức cùng chuyên mục Tin tức khác Tin tức cùng chuyên mục Tin tức khác Tin tức cùng chuyên mục Tin tức khác Tin tức cùng chuyên mục Tin tức khác Tin tức cùng chuyên mục Tin tức khác Tin tức cùng chuyên mục Tin tức khác Tin tức cùng chuyên mục Tin tức khác Tin tức cùng chuyên mục Tin tức khác Tin tức cùng chuyên mục Tin tức khác Tin tức cùng chuyên mục Tin tức khác Tin tức cùng chuyên mục Tin tức khác Tin tức cùng chuyên mục Tin tức khác Tin tức cùng chuyên mục Tin tức khác Tin tức cùng chuyên mục Tin tức khác Tin tức cùng chuyên mục Tin tức khác Tin tức cùng chuyên mục Tin tức khác Tin tức cùng chuyên mục Tin tức khác Tin tức cùng chuyên mục Tin tức khác Tin tức cùng chuyên mục Tin tức khác Tin tức cùng chuyên mục Tin tức khác Tin tức cùng chuyên mục Tin tức khác Tin tức cùng chuyên mục Tin tức khác Tin tức cùng chuyên mục Tin tức khác Tin tức cùng chuyên mục Tin tức khác Tin tức cùng chuyên mục Tin tức khác Tin tức cùng chuyên mục Tin tức khác Tin tức cùng chuyên mục Tin tức khác Tin tức cùng chuyên mục Tin tức khác Tin tức cùng chuyên mục Tin tức khác Tin tức cùng chuyên mục Tin tức khác Tin tức cùng chuyên mục Tin tức khác Tin tức cùng chuyên mục Tin tức khác Tin tức cùng chuyên mục Tin tức khác Tin tức cùng chuyên mục Tin tức khác Tin tức cùng chuyên mục Tin tức khác Tin tức cùng chuyên mục Tin tức khác Tin tức cùng chuyên mục Tin tức khác Tin tức cùng chuyên mục Tin tức khác Tin tức cùng chuyên mục Tin tức khác Tin tức cùng chuyên mục Tin tức khác Tin tức cùng chuyên mục Tin tức khác Tin tức cùng chuyên mục Tin tức khác Tin tức cùng chuyên mục Tin tức khác Tin tức cùng chuyên mục Tin tức khác Tin tức cùng chuyên mục Tin tức khác Tin tức cùng chuyên mục Tin tức khác Tin tức cùng chuyên mục Tin tức khác Tin tức cùng chuyên mục Tin tức khác Tin tức cùng chuyên mục Tin tức khác Tin tức cùng chuyên mục Tin tức khác Tin tức cùng chuyên mục Tin tức khác Tin tức cùng chuyên mục Tin tức khác Tin tức cùng chuyên mục Tin tức khác Tin tức cùng chuyên mục Tin tức khác Tin tức cùng chuyên mục Tin tức khác Tin tức cùng chuyên mục Tin tức khác Tin tức cùng chuyên mục Tin tức khác Tin tức cùng chuyên mục Tin tức khác Tin tức cùng chuyên mục Tin tức khác Tin tức cùng chuyên mục Tin tức khác Tin tức cùng chuyên mục Tin tức khác Tin tức cùng chuyên mục Tin tức khác Tin tức cùng chuyên mục Tin tức khác Tin tức cùng chuyên mục Tin tức khác Tin tức cùng chuyên mục Tin tức khác Tin tức cùng chuyên mục Tin tức khác Tin tức cùng chuyên mục Tin tức khác Tin tức cùng chuyên mục Tin tức khác Tin tức cùng chuyên mục Tin tức khác Tin tức cùng chuyên mục Tin tức khác Tin tức cùng chuyên mục Tin tức khác Tin tức cùng chuyên mục Tin tức khác Tin tức cùng chuyên mục Tin tức khác Tin tức cùng chuyên mục Tin tức khác Tin tức cùng chuyên mục Tin tức khác Tin tức cùng chuyên mục Tin tức khác Tin tức cùng chuyên mục Tin tức khác Tin tức cùng chuyên mục Tin tức khác Tin tức cùng chuyên mục Tin tức khác Tin tức cùng chuyên mục Tin tức khác Tin tức cùng chuyên mục Tin tức khác Tin tức cùng chuyên mục Tin tức khác Tin tức cùng chuyên mục Tin tức khác Tin tức cùng chuyên mục Tin tức khác Tin tức cùng chuyên mục Tin tức khác Tin tức cùng chuyên mục Tin tức khác Tin tức cùng chuyên mục Tin tức khác Tin tức cùng chuyên mục Tin tức khác Tin tức cùng chuyên mục Tin tức khác Tin tức cùng chuyên mục Tin tức khác Tin tức cùng chuyên mục Tin tức khác Tin tức cùng chuyên mục Tin tức khác Tin tức cùng chuyên mục Tin tức khác Tin tức cùng chuyên mục Tin tức khác Tin tức cùng chuyên mục Tin tức khác Tin tức cùng chuyên mục Tin tức khác Tin tức cùng chuyên mục Tin tức khác Tin tức cùng chuyên mục Tin tức khác Tin tức cùng chuyên mục Tin tức khác Tin tức cùng chuyên mục Tin tức khác Tin tức cùng chuyên mục Tin tức khác Tin tức cùng chuyên mục Tin tức khác Tin tức cùng chuyên mục Tin tức khác Tin tức cùng chuyên mục Tin tức khác Tin tức cùng chuyên mục Tin tức khác Tin tức cùng chuyên mục Tin tức khác Tin tức cùng chuyên mục Tin tức khác Tin tức cùng chuyên mục Tin tức khác Tin tức cùng chuyên mục Tin tức khác Tin tức cùng chuyên mục Tin tức khác Tin tức cùng chuyên mục Tin tức khác Tin tức cùng chuyên mục Tin tức khác Tin tức cùng chuyên mục Tin tức khác Tin tức cùng chuyên mục Tin tức khác Tin tức cùng chuyên mục Tin tức khác Tin tức cùng chuyên mục Tin tức khác Tin tức cùng chuyên mục Tin tức khác Tin tức cùng chuyên mục Tin tức khác Tin tức cùng chuyên mục Tin tức khác Tin tức cùng chuyên mục Tin tức khác Tin tức cùng chuyên mục Tin tức khác Tin tức cùng chuyên mục Tin tức khác Tin tức cùng chuyên mục Tin tức khác Tin tức cùng chuyên mục Tin tức khác Tin tức cùng chuyên mục Tin tức khác Tin tức cùng chuyên mục Tin tức khác Tin tức cùng chuyên mục Tin tức khác Tin tức cùng chuyên mục Tin tức khác Tin tức cùng chuyên mục Tin tức khác Tin tức cùng chuyên mục Tin tức khác Tin tức cùng chuyên mục Tin tức khác Tin tức cùng chuyên mục Tin tức khác Tin tức cùng chuyên mục Tin tức khác Tin tức cùng chuyên mục Tin tức khác Tin tức cùng chuyên mục Tin tức khác Tin tức cùng chuyên mục Tin tức khác Tin tức cùng chuyên mục Tin tức khác Tin tức cùng chuyên mục Tin tức khác Tin tức cùng chuyên mục Tin tức khác Tin tức cùng chuyên mục Tin tức khác Tin tức cùng chuyên mục Tin tức khác Tin tức cùng chuyên mục Tin tức khác Tin tức cùng chuyên mục Tin tức khác Tin tức cùng chuyên mục Tin tức khác Tin tức cùng chuyên mục Tin tức khác Tin tức cùng chuyên mục Tin tức khác Tin tức cùng chuyên mục Tin tức khác Tin tức cùng chuyên mục Tin tức khác Tin tức cùng chuyên mục Tin tức khác Tin tức cùng chuyên mục Tin tức khác Tin tức cùng chuyên mục Tin tức khác Tin tức cùng chuyên mục Tin tức khác Tin tức cùng chuyên mục Tin tức khác Tin tức cùng chuyên mục Tin tức khác Tin tức cùng chuyên mục Tin tức khác Tin tức cùng chuyên mục Tin tức khác Tin tức cùng chuyên mục Tin tức khác Tin tức cùng chuyên mục Tin tức khác Tin tức cùng chuyên mục Tin tức khác Tin tức cùng chuyên mục Tin tức khác Tin tức cùng chuyên mục Tin tức khác Tin tức cùng chuyên mục Tin tức khác Tin tức cùng chuyên mục Tin tức khác Tin tức cùng chuyên mục Tin tức khác Tin tức cùng chuyên mục Tin tức khác Tin tức cùng chuyên mục Tin tức khác Tin tức cùng chuyên mục Tin tức khác Tin tức cùng chuyên mục Tin tức khác Tin tức cùng chuyên mục Tin tức khác Tin tức cùng chuyên mục Tin tức khác Tin tức cùng chuyên mục Tin tức khác Tin tức cùng chuyên mục Tin tức khác Tin tức cùng chuyên mục Tin tức khác Tin tức cùng chuyên mục Tin tức khác Tin tức cùng chuyên mục Tin tức khác Tin tức cùng chuyên mục Tin tức khác Tin tức cùng chuyên mục Tin tức khác Tin tức cùng chuyên mục Tin tức khác Tin tức cùng chuyên mục Tin tức khác Tin tức cùng chuyên mục Tin tức khác Tin tức cùng chuyên mục Tin tức khác Tin tức cùng chuyên mục Tin tức khác Tin tức cùng chuyên mục Tin tức khác Tin tức cùng chuyên mục Tin tức khác Tin tức cùng chuyên mục Tin tức khác Tin tức cùng chuyên mục Tin tức khác Tin tức cùng chuyên mục Tin tức khác Tin tức cùng chuyên mục Tin tức khác Tin tức cùng chuyên mục Tin tức khác Tin tức cùng chuyên mục Tin tức khác Tin tức cùng chuyên mục Tin tức khác Tin tức cùng chuyên mục Tin tức khác Tin tức cùng chuyên mục Tin tức khác Tin tức cùng chuyên mục Tin tức khác Tin tức cùng chuyên mục Tin tức khác Tin tức cùng chuyên mục Tin tức khác Tin tức cùng chuyên mục Tin tức khác Tin tức cùng chuyên mục Tin tức khác Tin tức cùng chuyên mục Tin tức khác Tin tức cùng chuyên mục Tin tức khác Tin tức cùng chuyên mục Tin tức khác Tin tức cùng chuyên mục Tin tức khác Tin tức cùng chuyên mục Tin tức khác Tin tức cùng chuyên mục Tin tức khác Tin tức cùng chuyên mục Tin tức khác Tin tức cùng chuyên mục Tin tức khác Tin tức cùng chuyên mục Tin tức khác Tin tức cùng chuyên mục Tin tức khác Tin tức cùng chuyên mục Tin tức khác Tin tức cùng chuyên mục Tin tức khác Tin tức cùng chuyên mục Tin tức khác Tin tức cùng chuyên mục Tin tức khác Tin tức cùng chuyên mục Tin tức khác Tin tức cùng chuyên mục Tin tức khác Tin tức cùng chuyên mục Tin tức khác Tin tức cùng chuyên mục Tin tức khác Tin tức cùng chuyên mục Tin tức khác Tin tức cùng chuyên mục Tin tức khác Tin tức cùng chuyên mục Tin tức khác Tin tức cùng chuyên mục Tin tức khác Tin tức cùng chuyên mục Tin tức khác Tin tức cùng chuyên mục Tin tức khác Tin tức cùng chuyên mục Tin tức khác Tin tức cùng chuyên mục Tin tức khác Tin tức cùng chuyên mục Tin tức khác Tin tức cùng chuyên mục Tin tức khác Tin tức cùng chuyên mục Tin tức khác Tin tức cùng chuyên mục Tin tức khác Tin tức cùng chuyên mục Tin tức khác Tin tức cùng chuyên mục Tin tức khác Tin tức cùng chuyên mục Tin tức khác Tin tức cùng chuyên mục Tin tức khác Tin tức cùng chuyên mục Tin tức khác Tin tức cùng chuyên mục Tin tức khác Tin tức cùng chuyên mục Tin tức khác Tin tức cùng chuyên mục Tin tức khác Tin tức cùng chuyên mục Tin tức khác Tin tức cùng chuyên mục Tin tức khác Tin tức cùng chuyên mục Tin tức khác Tin tức cùng chuyên mục Tin tức khác Tin tức cùng chuyên mục Tin tức khác Tin tức cùng chuyên mục Tin tức khác Tin tức cùng chuyên mục Tin tức khác Tin tức cùng chuyên mục Tin tức khác Tin tức cùng chuyên mục Tin tức khác Tin tức cùng chuyên mục Tin tức khác Tin tức cùng chuyên mục Tin tức khác Tin tức cùng chuyên mục Tin tức khác Tin tức cùng chuyên mục Tin tức khác Tin tức cùng chuyên mục Tin tức khác Tin tức cùng chuyên mục Tin tức khác Tin tức cùng chuyên mục Tin tức khác Tin tức cùng chuyên mục Tin tức khác Tin tức cùng chuyên mục Tin tức khác Tin tức cùng chuyên mục Tin tức khác Tin tức cùng chuyên mục Tin tức khác Tin tức cùng chuyên mục Tin tức khác Tin tức cùng chuyên mục Tin tức khác Tin tức cùng chuyên mục Tin tức khác Tin tức cùng chuyên mục Tin tức khác Tin tức cùng chuyên mục Tin tức khác Tin tức cùng chuyên mục Tin tức khác Tin tức cùng chuyên mục Tin tức khác Tin tức cùng chuyên mục Tin tức khác Tin tức cùng chuyên mục Tin tức khác Tin tức cùng chuyên mục Tin tức khác Tin tức cùng chuyên mục Tin tức khác Tin tức cùng chuyên mục Tin tức khác Tin tức cùng chuyên mục Tin tức khác Tin tức cùng chuyên mục Tin tức khác Tin tức cùng chuyên mục Tin tức khác Tin tức cùng chuyên mục Tin tức khác Tin tức cùng chuyên mục Tin tức khác Tin tức cùng chuyên mục Tin tức khác Tin tức cùng chuyên mục Tin tức khác Tin tức cùng chuyên mục Tin tức khác Tin tức cùng chuyên mục Tin tức khác Tin tức cùng chuyên mục Tin tức khác Tin tức cùng chuyên mục Tin tức khác Tin tức cùng chuyên mục Tin tức khác Tin tức cùng chuyên mục Tin tức khác Tin tức cùng chuyên mục Tin tức khác Tin tức cùng chuyên mục Tin tức khác Tin tức cùng chuyên mục Tin tức khác Tin tức cùng chuyên mục Tin tức khác Tin tức cùng chuyên mục Tin tức khác Tin tức cùng chuyên mục Tin tức khác Tin tức cùng chuyên mục Tin tức khác Tin tức cùng chuyên mục Tin tức khác Tin tức cùng chuyên mục Tin tức khác Tin tức cùng chuyên mục Tin tức khác Tin tức cùng chuyên mục Tin tức khác Tin tức cùng chuyên mục Tin tức khác Tin tức cùng chuyên mục Tin tức khác Tin tức cùng chuyên mục Tin tức khác Tin tức cùng chuyên mục Tin tức khác Tin tức cùng chuyên mục Tin tức khác Tin tức cùng chuyên mục Tin tức khác Tin tức cùng chuyên mục Tin tức khác Tin tức cùng chuyên mục Tin tức khác Tin tức cùng chuyên mục Tin tức khác Tin tức cùng chuyên mục Tin tức khác Tin tức cùng chuyên mục Tin tức khác Tin tức cùng chuyên mục Tin tức khác Tin tức cùng chuyên mục Tin tức khác Tin tức cùng chuyên mục Tin tức khác Tin tức cùng chuyên mục Tin tức khác Tin tức cùng chuyên mục Tin tức khác Tin tức cùng chuyên mục Tin tức khác Tin tức cùng chuyên mục Tin tức khác Tin tức cùng chuyên mục Tin tức khác Tin tức cùng chuyên mục Tin tức khác Tin tức cùng chuyên mục Tin tức khác Tin tức cùng chuyên mục Tin tức khác Tin tức cùng chuyên mục Tin tức khác Tin tức cùng chuyên mục Tin tức khác Tin tức cùng chuyên mục Tin tức khác Tin tức cùng chuyên mục Tin tức khác Tin tức cùng chuyên mục Tin tức khác Tin tức cùng chuyên mục Tin tức khác Tin tức cùng chuyên mục Tin tức khác Tin tức cùng chuyên mục Tin tức khác Tin tức cùng chuyên mục Tin tức khác Tin tức cùng chuyên mục Tin tức khác Tin tức cùng chuyên mục Tin tức khác Tin tức cùng chuyên mục Tin tức khác Tin tức cùng chuyên mục Tin tức khác Tin tức cùng chuyên mục Tin tức khác Tin tức cùng chuyên mục Tin tức khác Tin tức cùng chuyên mục Tin tức khác Tin tức cùng chuyên mục Tin tức khác Tin tức cùng chuyên mục Tin tức khác Tin tức cùng chuyên mục Tin tức khác Tin tức cùng chuyên mục Tin tức khác Tin tức cùng chuyên mục Tin tức khác Tin tức cùng chuyên mục Tin tức khác Tin tức cùng chuyên mục Tin tức khác Tin tức cùng chuyên mục Tin tức khác Tin tức cùng chuyên mục Tin tức khác Tin tức cùng chuyên mục Tin tức khác Tin tức cùng chuyên mục Tin tức khác Tin tức cùng chuyên mục Tin tức khác Tin tức cùng chuyên mục Tin tức khác Tin tức cùng chuyên mục Tin tức khác Tin tức cùng chuyên mục Tin tức khác Tin tức cùng chuyên mục Tin tức khác Tin tức cùng chuyên mục Tin tức khác Tin tức cùng chuyên mục Tin tức khác Tin tức cùng chuyên mục Tin tức khác Tin tức cùng chuyên mục Tin tức khác Tin tức cùng chuyên mục Tin tức khác Tin tức cùng chuyên mục Tin tức khác Tin tức cùng chuyên mục Tin tức khác Tin tức cùng chuyên mục Tin tức khác Tin tức cùng chuyên mục Tin tức khác Tin tức cùng chuyên mục Tin tức khác Tin tức cùng chuyên mục Tin tức khác Tin tức cùng chuyên mục Tin tức khác Tin tức cùng chuyên mục Tin tức khác Tin tức cùng chuyên mục Tin tức khác Tin tức cùng chuyên mục Tin tức khác Tin tức cùng chuyên mục Tin tức khác Tin tức cùng chuyên mục Tin tức khác Tin tức cùng chuyên mục Tin tức khác Tin tức cùng chuyên mục Tin tức khác Tin tức cùng chuyên mục Tin tức khác Tin tức cùng chuyên mục Tin tức khác Tin tức cùng chuyên mục Tin tức khác Tin tức cùng chuyên mục Tin tức khác Tin tức cùng chuyên mục Tin tức khác Tin tức cùng chuyên mục Tin tức khác Tin tức cùng chuyên mục Tin tức khác Tin tức cùng chuyên mục Tin tức khác Tin tức cùng chuyên mục Tin tức khác Tin tức cùng chuyên mục Tin tức khác Tin tức cùng chuyên mục Tin tức khác Tin tức cùng chuyên mục Tin tức khác Tin tức cùng chuyên mục Tin tức khác Tin tức cùng chuyên mục Tin tức khác Tin tức cùng chuyên mục Tin tức khác Tin tức cùng chuyên mục Tin tức khác Tin tức cùng chuyên mục Tin tức khác Tin tức cùng chuyên mục Tin tức khác Tin tức cùng chuyên mục Tin tức khác Tin tức cùng chuyên mục Tin tức khác Tin tức cùng chuyên mục Tin tức khác Tin tức cùng chuyên mục Tin tức khác Tin tức cùng chuyên mục Tin tức khác Tin tức cùng chuyên mục Tin tức khác Tin tức cùng chuyên mục Tin tức khác Tin tức cùng chuyên mục Tin tức khác Tin tức cùng chuyên mục Tin tức khác Tin tức cùng chuyên mục Tin tức khác Tin tức cùng chuyên mục Tin tức khác Tin tức cùng chuyên mục Tin tức khác Tin tức cùng chuyên mục Tin tức khác Tin tức cùng chuyên mục Tin tức khác Tin tức cùng chuyên mục Tin tức khác Tin tức cùng chuyên mục Tin tức khác Tin tức cùng chuyên mục Tin tức khác Tin tức cùng chuyên mục Tin tức khác Tin tức cùng chuyên mục Tin tức khác Tin tức cùng chuyên mục Tin tức khác Tin tức cùng chuyên mục Tin tức khác Tin tức cùng chuyên mục Tin tức khác Tin tức cùng chuyên mục Tin tức khác Tin tức cùng chuyên mục Tin tức khác Tin tức cùng chuyên mục Tin tức khác Tin tức cùng chuyên mục Tin tức khác Tin tức cùng chuyên mục Tin tức khác Tin tức cùng chuyên mục Tin tức khác Tin tức cùng chuyên mục Tin tức khác Tin tức cùng chuyên mục Tin tức khác Tin tức cùng chuyên mục Tin tức khác Tin tức cùng chuyên mục Tin tức khác Tin tức cùng chuyên mục Tin tức khác Tin tức cùng chuyên mục Tin tức khác Tin tức cùng chuyên mục Tin tức khác Tin tức cùng chuyên mục Tin tức khác Tin tức cùng chuyên mục Tin tức khác Tin tức cùng chuyên mục Tin tức khác Tin tức cùng chuyên mục Tin tức khác Tin tức cùng chuyên mục Tin tức khác Tin tức cùng chuyên mục Tin tức khác Tin tức cùng chuyên mục Tin tức khác Tin tức cùng chuyên mục Tin tức khác Tin tức cùng chuyên mục Tin tức khác Tin tức cùng chuyên mục Tin tức khác Tin tức cùng chuyên mục Tin tức khác Tin tức cùng chuyên mục Tin tức khác Tin tức cùng chuyên mục Tin tức khác Tin tức cùng chuyên mục Tin tức khác Tin tức cùng chuyên mục Tin tức khác Tin tức cùng chuyên mục Tin tức khác Tin tức cùng chuyên mục Tin tức khác Tin tức cùng chuyên mục Tin tức khác Tin tức cùng chuyên mục Tin tức khác Tin tức cùng chuyên mục Tin tức khác Tin tức cùng chuyên mục Tin tức khác Tin tức cùng chuyên mục Tin tức khác Tin tức cùng chuyên mục Tin tức khác Tin tức cùng chuyên mục Tin tức khác Tin tức cùng chuyên mục Tin tức khác Tin tức cùng chuyên mục Tin tức khác Tin tức cùng chuyên mục Tin tức khác Tin tức cùng chuyên mục Tin tức khác Tin tức cùng chuyên mục Tin tức khác Tin tức cùng chuyên mục Tin tức khác Tin tức cùng chuyên mục Tin tức khác Tin tức cùng chuyên mục Tin tức khác Tin tức cùng chuyên mục Tin tức khác Tin tức cùng chuyên mục Tin tức khác Tin tức cùng chuyên mục Tin tức khác Tin tức cùng chuyên mục Tin tức khác Tin tức cùng chuyên mục Tin tức khác Tin tức cùng chuyên mục Tin tức khác Tin tức cùng chuyên mục Tin tức khác Tin tức cùng chuyên mục Tin tức khác Tin tức cùng chuyên mục Tin tức khác Tin tức cùng chuyên mục Tin tức khác Tin tức cùng chuyên mục Tin tức khác Tin tức cùng chuyên mục Tin tức khác Tin tức cùng chuyên mục Tin tức khác Tin tức cùng chuyên mục Tin tức khác Tin tức cùng chuyên mục Tin tức khác Tin tức cùng chuyên mục Tin tức khác Tin tức cùng chuyên mục Tin tức khác Tin tức cùng chuyên mục Tin tức khác Tin tức cùng chuyên mục Tin tức khác Tin tức cùng chuyên mục Tin tức khác Tin tức cùng chuyên mục Tin tức khác Tin tức cùng chuyên mục Tin tức khác Tin tức cùng chuyên mục Tin tức khác Tin tức cùng chuyên mục Tin tức khác Tin tức cùng chuyên mục Tin tức khác Tin tức cùng chuyên mục Tin tức khác Tin tức cùng chuyên mục Tin tức khác Tin tức cùng chuyên mục Tin tức khác Tin tức cùng chuyên mục Tin tức khác Tin tức cùng chuyên mục Tin tức khác Tin tức cùng chuyên mục Tin tức khác Tin tức cùng chuyên mục Tin tức khác Tin tức cùng chuyên mục Tin tức khác Tin tức cùng chuyên mục Tin tức khác Tin tức cùng chuyên mục Tin tức khác Tin tức cùng chuyên mục Tin tức khác Tin tức cùng chuyên mục Tin tức khác Tin tức cùng chuyên mục Tin tức khác Tin tức cùng chuyên mục Tin tức khác Tin tức cùng chuyên mục Tin tức khác Tin tức cùng chuyên mục Tin tức khác Tin tức cùng chuyên mục Tin tức khác Tin tức cùng chuyên mục Tin tức khác Tin tức cùng chuyên mục Tin tức khác Tin tức cùng chuyên mục Tin tức khác Tin tức cùng chuyên mục Tin tức khác Tin tức cùng chuyên mục Tin tức khác Tin tức cùng chuyên mục Tin tức khác Tin tức cùng chuyên mục Tin tức khác Tin tức cùng chuyên mục Tin tức khác Tin tức cùng chuyên mục Tin tức khác Tin tức cùng chuyên mục Tin tức khác Tin tức cùng chuyên mục Tin tức khác Tin tức cùng chuyên mục Tin tức khác Tin tức cùng chuyên mục Tin tức khác Tin tức cùng chuyên mục Tin tức khác Tin tức cùng chuyên mục Tin tức khác Tin tức cùng chuyên mục Tin tức khác Tin tức cùng chuyên mục Tin tức khác Tin tức cùng chuyên mục Tin tức khác Tin tức cùng chuyên mục Tin tức khác Tin tức cùng chuyên mục Tin tức khác Tin tức cùng chuyên mục Tin tức khác Tin tức cùng chuyên mục Tin tức khác Tin tức cùng chuyên mục Tin tức khác Tin tức cùng chuyên mục Tin tức khác Tin tức cùng chuyên mục Tin tức khác Tin tức cùng chuyên mục Tin tức khác Tin tức cùng chuyên mục Tin tức khác Tin tức cùng chuyên mục Tin tức khác Tin tức cùng chuyên mục Tin tức khác Tin tức cùng chuyên mục Tin tức khác Tin tức cùng chuyên mục Tin tức khác Tin tức cùng chuyên mục Tin tức khác Tin tức cùng chuyên mục Tin tức khác Tin tức cùng chuyên mục Tin tức khác Tin tức cùng chuyên mục Tin tức khác Tin tức cùng chuyên mục Tin tức khác Tin tức cùng chuyên mục Tin tức khác Tin tức cùng chuyên mục Tin tức khác Tin tức cùng chuyên mục Tin tức khác Tin tức cùng chuyên mục Tin tức khác Tin tức cùng chuyên mục Tin tức khác Tin tức cùng chuyên mục Tin tức khác Tin tức cùng chuyên mục Tin tức khác Tin tức cùng chuyên mục Tin tức khác Tin tức cùng chuyên mục Tin tức khác Tin tức cùng chuyên mục Tin tức khác Tin tức cùng chuyên mục Tin tức khác Tin tức cùng chuyên mục Tin tức khác Tin tức cùng chuyên mục Tin tức khác Tin tức cùng chuyên mục Tin tức khác Tin tức cùng chuyên mục Tin tức khác Tin tức cùng chuyên mục Tin tức khác Tin tức cùng chuyên mục Tin tức khác Tin tức cùng chuyên mục Tin tức khác Tin tức cùng chuyên mục Tin tức khác Tin tức cùng chuyên mục Tin tức khác Tin tức cùng chuyên mục Tin tức khác Tin tức cùng chuyên mục Tin tức khác Tin tức cùng chuyên mục Tin tức khác Tin tức cùng chuyên mục Tin tức khác Tin tức cùng chuyên mục Tin tức khác Tin tức cùng chuyên mục Tin tức khác Tin tức cùng chuyên mục Tin tức khác Tin tức cùng chuyên mục Tin tức khác Tin tức cùng chuyên mục Tin tức khác Tin tức cùng chuyên mục Tin tức khác Tin tức cùng chuyên mục Tin tức khác Tin tức cùng chuyên mục Tin tức khác Tin tức cùng chuyên mục Tin tức khác Tin tức cùng chuyên mục Tin tức khác Tin tức cùng chuyên mục Tin tức khác Tin tức cùng chuyên mục Tin tức khác Tin tức cùng chuyên mục Tin tức khác Tin tức cùng chuyên mục Tin tức khác Tin tức cùng chuyên mục Tin tức khác Tin tức cùng chuyên mục Tin tức khác Tin tức cùng chuyên mục Tin tức khác Tin tức cùng chuyên mục Tin tức khác Tin tức cùng chuyên mục Tin tức khác Tin tức cùng chuyên mục Tin tức khác Tin tức cùng chuyên mục Tin tức khác Tin tức cùng chuyên mục Tin tức khác Tin tức cùng chuyên mục Tin tức khác Tin tức cùng chuyên mục Tin tức khác Tin tức cùng chuyên mục Tin tức khác Tin tức cùng chuyên mục Tin tức khác Tin tức cùng chuyên mục Tin tức khác Tin tức cùng chuyên mục Tin tức khác Tin tức cùng chuyên mục Tin tức khác Tin tức cùng chuyên mục Tin tức khác Tin tức cùng chuyên mục Tin tức khác Tin tức cùng chuyên mục Tin tức khác Tin tức cùng chuyên mục Tin tức khác Tin tức cùng chuyên mục Tin tức khác Tin tức cùng chuyên mục Tin tức khác Tin tức cùng chuyên mục Tin tức khác Tin tức cùng chuyên mục Tin tức khác Tin tức cùng chuyên mục Tin tức khác Tin tức cùng chuyên mục Tin tức khác Tin tức cùng chuyên mục Tin tức khác Tin tức cùng chuyên mục Tin tức khác Tin tức cùng chuyên mục Tin tức khác Tin tức cùng chuyên mục Tin tức khác Tin tức cùng chuyên mục Tin tức khác Tin tức cùng chuyên mục Tin tức khác Tin tức cùng chuyên mục Tin tức khác Tin tức cùng chuyên mục Tin tức khác Tin tức cùng chuyên mục Tin tức khác Tin tức cùng chuyên mục Tin tức khác Tin tức cùng chuyên mục Tin tức khác Tin tức cùng chuyên mục Tin tức khác Tin tức cùng chuyên mục Tin tức khác Tin tức cùng chuyên mục Tin tức khác Tin tức cùng chuyên mục Tin tức khác Tin tức cùng chuyên mục Tin tức khác Tin tức cùng chuyên mục Tin tức khác Tin tức cùng chuyên mục Tin tức khác Tin tức cùng chuyên mục Tin tức khác Tin tức cùng chuyên mục Tin tức khác Tin tức cùng chuyên mục Tin tức khác Tin tức cùng chuyên mục Tin tức khác Tin tức cùng chuyên mục Tin tức khác Tin tức cùng chuyên mục Tin tức khác Tin tức cùng chuyên mục Tin tức khác Tin tức cùng chuyên mục Tin tức khác Tin tức cùng chuyên mục Tin tức khác Tin tức cùng chuyên mục Tin tức khác Tin tức cùng chuyên mục Tin tức khác Tin tức cùng chuyên mục Tin tức khác Tin tức cùng chuyên mục Tin tức khác Tin tức cùng chuyên mục Tin tức khác Tin tức cùng chuyên mục Tin tức khác Tin tức cùng chuyên mục Tin tức khác Tin tức cùng chuyên mục Tin tức khác Tin tức cùng chuyên mục Tin tức khác Tin tức cùng chuyên mục Tin tức khác Tin tức cùng chuyên mục Tin tức khác Tin tức cùng chuyên mục Tin tức khác Tin tức cùng chuyên mục Tin tức khác Tin tức cùng chuyên mục Tin tức khác Tin tức cùng chuyên mục Tin tức khác Tin tức cùng chuyên mục Tin tức khác Tin tức cùng chuyên mục Tin tức khác Tin tức cùng chuyên mục Tin tức khác Tin tức cùng chuyên mục Tin tức khác Tin tức cùng chuyên mục Tin tức khác Tin tức cùng chuyên mục Tin tức khác Tin tức cùng chuyên mục Tin tức khác Tin tức cùng chuyên mục Tin tức khác Tin tức cùng chuyên mục Tin tức khác Tin tức cùng chuyên mục Tin tức khác Tin tức cùng chuyên mục Tin tức khác Tin tức cùng chuyên mục Tin tức khác Tin tức cùng chuyên mục Tin tức khác Tin tức cùng chuyên mục Tin tức khác Tin tức cùng chuyên mục Tin tức khác Tin tức cùng chuyên mục Tin tức khác Tin tức cùng chuyên mục Tin tức khác Tin tức cùng chuyên mục Tin tức khác Tin tức cùng chuyên mục Tin tức khác Tin tức cùng chuyên mục Tin tức khác Tin tức cùng chuyên mục Tin tức khác Tin tức cùng chuyên mục Tin tức khác Tin tức cùng chuyên mục Tin tức khác Tin tức cùng chuyên mục Tin tức khác Tin tức cùng chuyên mục Tin tức khác Tin tức cùng chuyên mục Tin tức khác Tin tức cùng chuyên mục Tin tức khác Tin tức cùng chuyên mục Tin tức khác Tin tức cùng chuyên mục Tin tức khác Tin tức cùng chuyên mục Tin tức khác Tin tức cùng chuyên mục Tin tức khác Tin tức cùng chuyên mục Tin tức khác Tin tức cùng chuyên mục Tin tức khác Tin tức cùng chuyên mục Tin tức khác Tin tức cùng chuyên mục Tin tức khác Tin tức cùng chuyên mục Tin tức khác Tin tức cùng chuyên mục Tin tức khác Tin tức cùng chuyên mục Tin tức khác Tin tức cùng chuyên mục Tin tức khác Tin tức cùng chuyên mục Tin tức khác Tin tức cùng chuyên mục Tin tức khác Tin tức cùng chuyên mục Tin tức khác Tin tức cùng chuyên mục Tin tức khác Tin tức cùng chuyên mục Tin tức khác Tin tức cùng chuyên mục Tin tức khác Tin tức cùng chuyên mục Tin tức khác Tin tức cùng chuyên mục Tin tức khác Tin tức cùng chuyên mục Tin tức khác Tin tức cùng chuyên mục Tin tức khác Tin tức cùng chuyên mục Tin tức khác Tin tức cùng chuyên mục Tin tức khác Tin tức cùng chuyên mục Tin tức khác Tin tức cùng chuyên mục Tin tức khác Tin tức cùng chuyên mục Tin tức khác Tin tức cùng chuyên mục Tin tức khác Tin tức cùng chuyên mục Tin tức khác Tin tức cùng chuyên mục Tin tức khác Tin tức cùng chuyên mục Tin tức khác Tin tức cùng chuyên mục Tin tức khác Tin tức cùng chuyên mục Tin tức khác Tin tức cùng chuyên mục Tin tức khác Tin tức cùng chuyên mục Tin tức khác Tin tức cùng chuyên mục Tin tức khác Tin tức cùng chuyên mục Tin tức khác Tin tức cùng chuyên mục Tin tức khác Tin tức cùng chuyên mục Tin tức khác Tin tức cùng chuyên mục Tin tức khác Tin tức cùng chuyên mục Tin tức khác Tin tức cùng chuyên mục Tin tức khác Tin tức cùng chuyên mục Tin tức khác Tin tức cùng chuyên mục Tin tức khác Tin tức cùng chuyên mục Tin tức khác Tin tức cùng chuyên mục Tin tức khác Tin tức cùng chuyên mục Tin tức khác Tin tức cùng chuyên mục Tin tức khác Tin tức cùng chuyên mục Tin tức khác Tin tức cùng chuyên mục Tin tức khác Tin tức cùng chuyên mục Tin tức khác Tin tức cùng chuyên mục Tin tức khác Tin tức cùng chuyên mục Tin tức khác Tin tức cùng chuyên mục Tin tức khác Tin tức cùng chuyên mục Tin tức khác Tin tức cùng chuyên mục Tin tức khác Tin tức cùng chuyên mục Tin tức khác Tin tức cùng chuyên mục Tin tức khác Tin tức cùng chuyên mục Tin tức khác Tin tức cùng chuyên mục Tin tức khác Tin tức cùng chuyên mục Tin tức khác Tin tức cùng chuyên mục Tin tức khác Tin tức cùng chuyên mục Tin tức khác Tin tức cùng chuyên mục Tin tức khác Tin tức cùng chuyên mục Tin tức khác Tin tức cùng chuyên mục Tin tức khác Tin tức cùng chuyên mục Tin tức khác Tin tức cùng chuyên mục Tin tức khác Tin tức cùng chuyên mục Tin tức khác Tin tức cùng chuyên mục Tin tức khác Tin tức cùng chuyên mục Tin tức khác Tin tức cùng chuyên mục Tin tức khác Tin tức cùng chuyên mục Tin tức khác Tin tức cùng chuyên mục Tin tức khác Tin tức cùng chuyên mục Tin tức khác Tin tức cùng chuyên mục Tin tức khác Tin tức cùng chuyên mục Tin tức khác Tin tức cùng chuyên mục Tin tức khác Tin tức cùng chuyên mục Tin tức khác Tin tức cùng chuyên mục Tin tức khác Tin tức cùng chuyên mục Tin tức khác Tin tức cùng chuyên mục Tin tức khác Tin tức cùng chuyên mục Tin tức khác Tin tức cùng chuyên mục Tin tức khác Tin tức cùng chuyên mục Tin tức khác Tin tức cùng chuyên mục Tin tức khác Tin tức cùng chuyên mục Tin tức khác Tin tức cùng chuyên mục Tin tức khác Tin tức cùng chuyên mục Tin tức khác Tin tức cùng chuyên mục Tin tức khác Tin tức cùng chuyên mục Tin tức khác Tin tức cùng chuyên mục Tin tức khác Tin tức cùng chuyên mục Tin tức khác Tin tức cùng chuyên mục Tin tức khác Tin tức cùng chuyên mục Tin tức khác Tin tức cùng chuyên mục Tin tức khác Tin tức cùng chuyên mục Tin tức khác Tin tức cùng chuyên mục Tin tức khác Tin tức cùng chuyên mục Tin tức khác Tin tức cùng chuyên mục Tin tức khác Tin tức cùng chuyên mục Tin tức khác Tin tức cùng chuyên mục Tin tức khác Tin tức cùng chuyên mục Tin tức khác Tin tức cùng chuyên mục Tin tức khác Tin tức cùng chuyên mục Tin tức khác Tin tức cùng chuyên mục Tin tức khác Tin tức cùng chuyên mục Tin tức khác Tin tức cùng chuyên mục Tin tức khác Tin tức cùng chuyên mục Tin tức khác Tin tức cùng chuyên mục Tin tức khác Tin tức cùng chuyên mục Tin tức khác Tin tức cùng chuyên mục Tin tức khác Tin tức cùng chuyên mục Tin tức khác Tin tức cùng chuyên mục Tin tức khác Tin tức cùng chuyên mục Tin tức khác Tin tức cùng chuyên mục Tin tức khác Tin tức cùng chuyên mục Tin tức khác Tin tức cùng chuyên mục Tin tức khác Tin tức cùng chuyên mục Tin tức khác Tin tức cùng chuyên mục Tin tức khác Tin tức cùng chuyên mục Tin tức khác Tin tức cùng chuyên mục Tin tức khác Tin tức cùng chuyên mục Tin tức khác Tin tức cùng chuyên mục Tin tức khác Tin tức cùng chuyên mục Tin tức khác Tin tức cùng chuyên mục Tin tức khác Tin tức cùng chuyên mục Tin tức khác Tin tức cùng chuyên mục Tin tức khác Tin tức cùng chuyên mục Tin tức khác Tin tức cùng chuyên mục Tin tức khác Tin tức cùng chuyên mục Tin tức khác Tin tức cùng chuyên mục Tin tức khác Tin tức cùng chuyên mục Tin tức khác Tin tức cùng chuyên mục Tin tức khác Tin tức cùng chuyên mục Tin tức khác Tin tức cùng chuyên mục Tin tức khác Tin tức cùng chuyên mục Tin tức khác Tin tức cùng chuyên mục Tin tức khác Tin tức cùng chuyên mục Tin tức khác Tin tức cùng chuyên mục Tin tức khác Tin tức cùng chuyên mục Tin tức khác Tin tức cùng chuyên mục Tin tức khác Tin tức cùng chuyên mục Tin tức khác Tin tức cùng chuyên mục Tin tức khác Tin tức cùng chuyên mục Tin tức khác Tin tức cùng chuyên mục Tin tức khác Tin tức cùng chuyên mục Tin tức khác Tin tức cùng chuyên mục Tin tức khác Tin tức cùng chuyên mục Tin tức khác Tin tức cùng chuyên mục Tin tức khác Tin tức cùng chuyên mục Tin tức khác Tin tức cùng chuyên mục Tin tức khác Tin tức cùng chuyên mục Tin tức khác Tin tức cùng chuyên mục Tin tức khác Tin tức cùng chuyên mục Tin tức khác Tin tức cùng chuyên mục Tin tức khác Tin tức cùng chuyên mục Tin tức khác Tin tức cùng chuyên mục Tin tức khác Tin tức cùng chuyên mục Tin tức khác Tin tức cùng chuyên mục Tin tức khác Tin tức cùng chuyên mục Tin tức khác Tin tức cùng chuyên mục Tin tức khác Tin tức cùng chuyên mục Tin tức khác Tin tức cùng chuyên mục Tin tức khác Tin tức cùng chuyên mục Tin tức khác Tin tức cùng chuyên mục Tin tức khác Tin tức cùng chuyên mục Tin tức khác Tin tức cùng chuyên mục Tin tức khác Tin tức cùng chuyên mục Tin tức khác Tin tức cùng chuyên mục Tin tức khác Tin tức cùng chuyên mục Tin tức khác Tin tức cùng chuyên mục Tin tức khác Tin tức cùng chuyên mục Tin tức khác Tin tức cùng chuyên mục Tin tức khác Tin tức cùng chuyên mục Tin tức khác Tin tức cùng chuyên mục Tin tức khác Tin tức cùng chuyên mục Tin tức khác Tin tức cùng chuyên mục Tin tức khác Tin tức cùng chuyên mục Tin tức khác Tin tức cùng chuyên mục Tin tức khác Tin tức cùng chuyên mục Tin tức khác Tin tức cùng chuyên mục Tin tức khác Tin tức cùng chuyên mục Tin tức khác Tin tức cùng chuyên mục Tin tức khác Tin tức cùng chuyên mục Tin tức khác Tin tức cùng chuyên mục Tin tức khác Tin tức cùng chuyên mục Tin tức khác Tin tức cùng chuyên mục Tin tức khác Tin tức cùng chuyên mục Tin tức khác Tin tức cùng chuyên mục Tin tức khác Tin tức cùng chuyên mục Tin tức khác Tin tức cùng chuyên mục Tin tức khác Tin tức cùng chuyên mục Tin tức khác Tin tức cùng chuyên mục Tin tức khác Tin tức cùng chuyên mục Tin tức khác Tin tức cùng chuyên mục Tin tức khác Tin tức cùng chuyên mục Tin tức khác Tin tức cùng chuyên mục Tin tức khác Tin tức cùng chuyên mục Tin tức khác Tin tức cùng chuyên mục Tin tức khác Tin tức cùng chuyên mục Tin tức khác Tin tức cùng chuyên mục Tin tức khác Tin tức cùng chuyên mục Tin tức khác Tin tức cùng chuyên mục Tin tức khác Tin tức cùng chuyên mục Tin tức khác Tin tức cùng chuyên mục Tin tức khác Tin tức cùng chuyên mục Tin tức khác Tin tức cùng chuyên mục Tin tức khác Tin tức cùng chuyên mục Tin tức khác Tin tức cùng chuyên mục Tin tức khác Tin tức cùng chuyên mục Tin tức khác Tin tức cùng chuyên mục Tin tức khác Tin tức cùng chuyên mục Tin tức khác Tin tức cùng chuyên mục Tin tức khác Tin tức cùng chuyên mục Tin tức khác Tin tức cùng chuyên mục Tin tức khác Tin tức cùng chuyên mục Tin tức khác Tin tức cùng chuyên mục Tin tức khác Tin tức cùng chuyên mục Tin tức khác Tin tức cùng chuyên mục Tin tức khác Tin tức cùng chuyên mục Tin tức khác Tin tức cùng chuyên mục Tin tức khác Tin tức cùng chuyên mục Tin tức khác Tin tức cùng chuyên mục Tin tức khác Tin tức cùng chuyên mục Tin tức khác Tin tức cùng chuyên mục Tin tức khác Tin tức cùng chuyên mục Tin tức khác Tin tức cùng chuyên mục Tin tức khác Tin tức cùng chuyên mục Tin tức khác Tin tức cùng chuyên mục Tin tức khác Tin tức cùng chuyên mục Tin tức khác Tin tức cùng chuyên mục Tin tức khác Tin tức cùng chuyên mục Tin tức khác Tin tức cùng chuyên mục Tin tức khác Tin tức cùng chuyên mục Tin tức khác Tin tức cùng chuyên mục Tin tức khác Tin tức cùng chuyên mục Tin tức khác Tin tức cùng chuyên mục Tin tức khác Tin tức cùng chuyên mục Tin tức khác Tin tức cùng chuyên mục Tin tức khác Tin tức cùng chuyên mục Tin tức khác Tin tức cùng chuyên mục Tin tức khác Tin tức cùng chuyên mục Tin tức khác Tin tức cùng chuyên mục Tin tức khác Tin tức cùng chuyên mục Tin tức khác Tin tức cùng chuyên mục Tin tức khác Tin tức cùng chuyên mục Tin tức khác Tin tức cùng chuyên mục Tin tức khác Tin tức cùng chuyên mục Tin tức khác Tin tức cùng chuyên mục Tin tức khác Tin tức cùng chuyên mục Tin tức khác Tin tức cùng chuyên mục Tin tức khác Tin tức cùng chuyên mục Tin tức khác Tin tức cùng chuyên mục Tin tức khác Tin tức cùng chuyên mục Tin tức khác Tin tức cùng chuyên mục Tin tức khác Tin tức cùng chuyên mục Tin tức khác Tin tức cùng chuyên mục Tin tức khác Tin tức cùng chuyên mục Tin tức khác Tin tức cùng chuyên mục Tin tức khác Tin tức cùng chuyên mục Tin tức khác Tin tức cùng chuyên mục Tin tức khác Tin tức cùng chuyên mục Tin tức khác Tin tức cùng chuyên mục Tin tức khác Tin tức cùng chuyên mục Tin tức khác Tin tức cùng chuyên mục Tin tức khác Tin tức cùng chuyên mục Tin tức khác Tin tức cùng chuyên mục Tin tức khác Tin tức cùng chuyên mục Tin tức khác Tin tức cùng chuyên mục Tin tức khác Tin tức cùng chuyên mục Tin tức khác Tin tức cùng chuyên mục Tin tức khác Tin tức cùng chuyên mục Tin tức khác Tin tức cùng chuyên mục Tin tức khác Tin tức cùng chuyên mục Tin tức khác Tin tức cùng chuyên mục Tin tức khác Tin tức cùng chuyên mục Tin tức khác Tin tức cùng chuyên mục Tin tức khác Tin tức cùng chuyên mục Tin tức khác Tin tức cùng chuyên mục Tin tức khác Tin tức cùng chuyên mục Tin tức khác Tin tức cùng chuyên mục Tin tức khác Tin tức cùng chuyên mục Tin tức khác Tin tức cùng chuyên mục Tin tức khác Tin tức cùng chuyên mục Tin tức khác Tin tức cùng chuyên mục Tin tức khác Tin tức cùng chuyên mục Tin tức khác Tin tức cùng chuyên mục Tin tức khác Tin tức cùng chuyên mục Tin tức khác Tin tức cùng chuyên mục Tin tức khác Tin tức cùng chuyên mục Tin tức khác Tin tức cùng chuyên mục Tin tức khác Tin tức cùng chuyên mục Tin tức khác Tin tức cùng chuyên mục Tin tức khác Tin tức cùng chuyên mục Tin tức khác Tin tức cùng chuyên mục Tin tức khác Tin tức cùng chuyên mục Tin tức khác Tin tức cùng chuyên mục Tin tức khác Tin tức cùng chuyên mục Tin tức khác Tin tức cùng chuyên mục Tin tức khác Tin tức cùng chuyên mục Tin tức khác Tin tức cùng chuyên mục Tin tức khác Tin tức cùng chuyên mục Tin tức khác Tin tức cùng chuyên mục Tin tức khác Tin tức cùng chuyên mục Tin tức khác Tin tức cùng chuyên mục Tin tức khác Tin tức cùng chuyên mục Tin tức khác Tin tức cùng chuyên mục Tin tức khác Tin tức cùng chuyên mục Tin tức khác Tin tức cùng chuyên mục Tin tức khác Tin tức cùng chuyên mục Tin tức khác Tin tức cùng chuyên mục Tin tức khác Tin tức cùng chuyên mục Tin tức khác Tin tức cùng chuyên mục Tin tức khác Tin tức cùng chuyên mục Tin tức khác Tin tức cùng chuyên mục Tin tức khác Tin tức cùng chuyên mục Tin tức khác Tin tức cùng chuyên mục Tin tức khác Tin tức cùng chuyên mục Tin tức khác Tin tức cùng chuyên mục Tin tức khác Tin tức cùng chuyên mục Tin tức khác Tin tức cùng chuyên mục Tin tức khác Tin tức cùng chuyên mục Tin tức khác Tin tức cùng chuyên mục Tin tức khác Tin tức cùng chuyên mục Tin tức khác Tin tức cùng chuyên mục Tin tức khác Tin tức cùng chuyên mục Tin tức khác Tin tức cùng chuyên mục Tin tức khác Tin tức cùng chuyên mục Tin tức khác Tin tức cùng chuyên mục Tin tức khác Tin tức cùng chuyên mục Tin tức khác Tin tức cùng chuyên mục Tin tức khác Tin tức cùng chuyên mục Tin tức khác Tin tức cùng chuyên mục Tin tức khác Tin tức cùng chuyên mục Tin tức khác Tin tức cùng chuyên mục Tin tức khác Tin tức cùng chuyên mục Tin tức khác Tin tức cùng chuyên mục Tin tức khác Tin tức cùng chuyên mục Tin tức khác Tin tức cùng chuyên mục Tin tức khác Tin tức cùng chuyên mục Tin tức khác Tin tức cùng chuyên mục Tin tức khác Tin tức cùng chuyên mục Tin tức khác Tin tức cùng chuyên mục Tin tức khác Tin tức cùng chuyên mục Tin tức khác Tin tức cùng chuyên mục Tin tức khác Tin tức cùng chuyên mục Tin tức khác Tin tức cùng chuyên mục Tin tức khác Tin tức cùng chuyên mục Tin tức khác Tin tức cùng chuyên mục Tin tức khác Tin tức cùng chuyên mục Tin tức khác Tin tức cùng chuyên mục Tin tức khác Tin tức cùng chuyên mục Tin tức khác Tin tức cùng chuyên mục Tin tức khác Tin tức cùng chuyên mục Tin tức khác Tin tức cùng chuyên mục Tin tức khác Tin tức cùng chuyên mục Tin tức khác Tin tức cùng chuyên mục Tin tức khác Tin tức cùng chuyên mục Tin tức khác Tin tức cùng chuyên mục Tin tức khác Tin tức cùng chuyên mục Tin tức khác Tin tức cùng chuyên mục Tin tức khác Tin tức cùng chuyên mục Tin tức khác Tin tức cùng chuyên mục Tin tức khác Tin tức cùng chuyên mục Tin tức khác Tin tức cùng chuyên mục Tin tức khác Tin tức cùng chuyên mục Tin tức khác Tin tức cùng chuyên mục Tin tức khác Tin tức cùng chuyên mục Tin tức khác Tin tức cùng chuyên mục Tin tức khác Tin tức cùng chuyên mục Tin tức khác Tin tức cùng chuyên mục Tin tức khác Tin tức cùng chuyên mục Tin tức khác Tin tức cùng chuyên mục Tin tức khác Tin tức cùng chuyên mục Tin tức khác Tin tức cùng chuyên mục Tin tức khác Tin tức cùng chuyên mục Tin tức khác Tin tức cùng chuyên mục Tin tức khác Tin tức cùng chuyên mục Tin tức khác Tin tức cùng chuyên mục Tin tức khác Tin tức cùng chuyên mục Tin tức khác Tin tức cùng chuyên mục Tin tức khác Tin tức cùng chuyên mục Tin tức khác Tin tức cùng chuyên mục Tin tức khác Tin tức cùng chuyên mục Tin tức khác Tin tức cùng chuyên mục Tin tức khác Tin tức cùng chuyên mục Tin tức khác Tin tức cùng chuyên mục Tin tức khác Tin tức cùng chuyên mục Tin tức khác Tin tức cùng chuyên mục Tin tức khác Tin tức cùng chuyên mục Tin tức khác Tin tức cùng chuyên mục Tin tức khác Tin tức cùng chuyên mục Tin tức khác Tin tức cùng chuyên mục Tin tức khác Tin tức cùng chuyên mục Tin tức khác Tin tức cùng chuyên mục Tin tức khác Tin tức cùng chuyên mục Tin tức khác Tin tức cùng chuyên mục Tin tức khác Tin tức cùng chuyên mục Tin tức khác Tin tức cùng chuyên mục Tin tức khác Tin tức cùng chuyên mục Tin tức khác Tin tức cùng chuyên mục Tin tức khác Tin tức cùng chuyên mục Tin tức khác Tin tức cùng chuyên mục Tin tức khác Tin tức cùng chuyên mục Tin tức khác Tin tức cùng chuyên mục Tin tức khác Tin tức cùng chuyên mục Tin tức khác Tin tức cùng chuyên mục Tin tức khác Tin tức cùng chuyên mục Tin tức khác Tin tức cùng chuyên mục Tin tức khác Tin tức cùng chuyên mục Tin tức khác Tin tức cùng chuyên mục Tin tức khác Tin tức cùng chuyên mục Tin tức khác Tin tức cùng chuyên mục Tin tức khác Tin tức cùng chuyên mục Tin tức khác Tin tức cùng chuyên mục Tin tức khác Tin tức cùng chuyên mục Tin tức khác Tin tức cùng chuyên mục Tin tức khác Tin tức cùng chuyên mục Tin tức khác Tin tức cùng chuyên mục Tin tức khác Tin tức cùng chuyên mục Tin tức khác Tin tức cùng chuyên mục Tin tức khác Tin tức cùng chuyên mục Tin tức khác Tin tức cùng chuyên mục Tin tức khác Tin tức cùng chuyên mục Tin tức khác Tin tức cùng chuyên mục Tin tức khác Tin tức cùng chuyên mục Tin tức khác Tin tức cùng chuyên mục Tin tức khác Tin tức cùng chuyên mục Tin tức khác Tin tức cùng chuyên mục Tin tức khác Tin tức cùng chuyên mục Tin tức khác Tin tức cùng chuyên mục Tin tức khác Tin tức cùng chuyên mục Tin tức khác Tin tức cùng chuyên mục Tin tức khác Tin tức cùng chuyên mục Tin tức khác Tin tức cùng chuyên mục Tin tức khác Tin tức cùng chuyên mục Tin tức khác Tin tức cùng chuyên mục Tin tức khác Tin tức cùng chuyên mục Tin tức khác Tin tức cùng chuyên mục Tin tức khác Tin tức cùng chuyên mục Tin tức khác Tin tức cùng chuyên mục Tin tức khác Tin tức cùng chuyên mục Tin tức khác Tin tức cùng chuyên mục Tin tức khác Tin tức cùng chuyên mục Tin tức khác Tin tức cùng chuyên mục Tin tức khác Tin tức cùng chuyên mục Tin tức khác Tin tức cùng chuyên mục Tin tức khác Tin tức cùng chuyên mục Tin tức khác Tin tức cùng chuyên mục Tin tức khác Tin tức cùng chuyên mục Tin tức khác Tin tức cùng chuyên mục Tin tức khác Tin tức cùng chuyên mục Tin tức khác Tin tức cùng chuyên mục Tin tức khác Tin tức cùng chuyên mục Tin tức khác Tin tức cùng chuyên mục Tin tức khác Tin tức cùng chuyên mục Tin tức khác Tin tức cùng chuyên mục Tin tức khác Tin tức cùng chuyên mục Tin tức khác Tin tức cùng chuyên mục Tin tức khác Tin tức cùng chuyên mục Tin tức khác Tin tức cùng chuyên mục Tin tức khác Tin tức cùng chuyên mục Tin tức khác Tin tức cùng chuyên mục Tin tức khác Tin tức cùng chuyên mục Tin tức khác Tin tức cùng chuyên mục Tin tức khác Tin tức cùng chuyên mục Tin tức khác Tin tức cùng chuyên mục Tin tức khác Tin tức cùng chuyên mục Tin tức khác Tin tức cùng chuyên mục Tin tức khác Tin tức cùng chuyên mục Tin tức khác Tin tức cùng chuyên mục Tin tức khác Tin tức cùng chuyên mục Tin tức khác Tin tức cùng chuyên mục Tin tức khác Tin tức cùng chuyên mục Tin tức khác Tin tức cùng chuyên mục Tin tức khác Tin tức cùng chuyên mục Tin tức khác Tin tức cùng chuyên mục Tin tức khác Tin tức cùng chuyên mục Tin tức khác Tin tức cùng chuyên mục Tin tức khác Tin tức cùng chuyên mục Tin tức khác Tin tức cùng chuyên mục Tin tức khác Tin tức cùng chuyên mục Tin tức khác Tin tức cùng chuyên mục Tin tức khác Tin tức cùng chuyên mục Tin tức khác Tin tức cùng chuyên mục Tin tức khác Tin tức cùng chuyên mục Tin tức khác Tin tức cùng chuyên mục Tin tức khác Tin tức cùng chuyên mục Tin tức khác Tin tức cùng chuyên mục Tin tức khác Tin tức cùng chuyên mục Tin tức khác Tin tức cùng chuyên mục Tin tức khác Tin tức cùng chuyên mục Tin tức khác Tin tức cùng chuyên mục Tin tức khác Tin tức cùng chuyên mục Tin tức khác Tin tức cùng chuyên mục Tin tức khác Tin tức cùng chuyên mục Tin tức khác Tin tức cùng chuyên mục Tin tức khác Tin tức cùng chuyên mục Tin tức khác Tin tức cùng chuyên mục Tin tức khác Tin tức cùng chuyên mục Tin tức khác Tin tức cùng chuyên mục Tin tức khác Tin tức cùng chuyên mục Tin tức khác Tin tức cùng chuyên mục Tin tức khác Tin tức cùng chuyên mục Tin tức khác Tin tức cùng chuyên mục Tin tức khác Tin tức cùng chuyên mục Tin tức khác Tin tức cùng chuyên mục Tin tức khác Tin tức cùng chuyên mục Tin tức khác Tin tức cùng chuyên mục Tin tức khác Tin tức cùng chuyên mục Tin tức khác Tin tức cùng chuyên mục Tin tức khác Tin tức cùng chuyên mục Tin tức khác Tin tức cùng chuyên mục Tin tức khác Tin tức cùng chuyên mục Tin tức khác Tin tức cùng chuyên mục Tin tức khác Tin tức cùng chuyên mục Tin tức khác Tin tức cùng chuyên mục Tin tức khác Tin tức cùng chuyên mục Tin tức khác Tin tức cùng chuyên mục Tin tức khác Tin tức cùng chuyên mục Tin tức khác Tin tức cùng chuyên mục Tin tức khác Tin tức cùng chuyên mục Tin tức khác Tin tức cùng chuyên mục Tin tức khác Tin tức cùng chuyên mục Tin tức khác Tin tức cùng chuyên mục Tin tức khác Tin tức cùng chuyên mục Tin tức khác Tin tức cùng chuyên mục Tin tức khác Tin tức cùng chuyên mục Tin tức khác Tin tức cùng chuyên mục Tin tức khác Tin tức cùng chuyên mục Tin tức khác Tin tức cùng chuyên mục Tin tức khác Tin tức cùng chuyên mục Tin tức khác Tin tức cùng chuyên mục Tin tức khác Tin tức cùng chuyên mục Tin tức khác Tin tức cùng chuyên mục Tin tức khác Tin tức cùng chuyên mục Tin tức khác Tin tức cùng chuyên mục Tin tức khác Tin tức cùng chuyên mục Tin tức khác Tin tức cùng chuyên mục Tin tức khác Tin tức cùng chuyên mục Tin tức khác Tin tức cùng chuyên mục Tin tức khác Tin tức cùng chuyên mục Tin tức khác Tin tức cùng chuyên mục Tin tức khác Tin tức cùng chuyên mục Tin tức khác Tin tức cùng chuyên mục Tin tức khác Tin tức cùng chuyên mục Tin tức khác Tin tức cùng chuyên mục Tin tức khác Tin tức cùng chuyên mục Tin tức khác Tin tức cùng chuyên mục Tin tức khác Tin tức cùng chuyên mục Tin tức khác Tin tức cùng chuyên mục Tin tức khác Tin tức cùng chuyên mục Tin tức khác Tin tức cùng chuyên mục Tin tức khác Tin tức cùng chuyên mục Tin tức khác Tin tức cùng chuyên mục Tin tức khác Tin tức cùng chuyên mục Tin tức khác Tin tức cùng chuyên mục Tin tức khác Tin tức cùng chuyên mục Tin tức khác Tin tức cùng chuyên mục Tin tức khác Tin tức cùng chuyên mục Tin tức khác Tin tức cùng chuyên mục Tin tức khác Tin tức cùng chuyên mục Tin tức khác Tin tức cùng chuyên mục Tin tức khác Tin tức cùng chuyên mục Tin tức khác Tin tức cùng chuyên mục Tin tức khác Tin tức cùng chuyên mục Tin tức khác Tin tức cùng chuyên mục Tin tức khác Tin tức cùng chuyên mục Tin tức khác Tin tức cùng chuyên mục Tin tức khác Tin tức cùng chuyên mục Tin tức khác Tin tức cùng chuyên mục Tin tức khác Tin tức cùng chuyên mục Tin tức khác Tin tức cùng chuyên mục Tin tức khác Tin tức cùng chuyên mục Tin tức khác Tin tức cùng chuyên mục Tin tức khác Tin tức cùng chuyên mục Tin tức khác Tin tức cùng chuyên mục Tin tức khác Tin tức cùng chuyên mục Tin tức khác Tin tức cùng chuyên mục Tin tức khác Tin tức cùng chuyên mục Tin tức khác Tin tức cùng chuyên mục Tin tức khác Tin tức cùng chuyên mục Tin tức khác Tin tức cùng chuyên mục Tin tức khác Tin tức cùng chuyên mục Tin tức khác Tin tức cùng chuyên mục Tin tức khác Tin tức cùng chuyên mục Tin tức khác Tin tức cùng chuyên mục Tin tức khác Tin tức cùng chuyên mục Tin tức khác Tin tức cùng chuyên mục Tin tức khác Tin tức cùng chuyên mục Tin tức khác Tin tức cùng chuyên mục Tin tức khác Tin tức cùng chuyên mục Tin tức khác Tin tức cùng chuyên mục Tin tức khác Tin tức cùng chuyên mục Tin tức khác Tin tức cùng chuyên mục Tin tức khác Tin tức cùng chuyên mục Tin tức khác Tin tức cùng chuyên mục Tin tức khác Tin tức cùng chuyên mục Tin tức khác Tin tức cùng chuyên mục Tin tức khác Tin tức cùng chuyên mục Tin tức khác Tin tức cùng chuyên mục Tin tức khác Tin tức cùng chuyên mục Tin tức khác Tin tức cùng chuyên mục Tin tức khác Tin tức cùng chuyên mục Tin tức khác Tin tức cùng chuyên mục Tin tức khác Tin tức cùng chuyên mục Tin tức khác Tin tức cùng chuyên mục Tin tức khác Tin tức cùng chuyên mục Tin tức khác Tin tức cùng chuyên mục Tin tức khác Tin tức cùng chuyên mục Tin tức khác Tin tức cùng chuyên mục Tin tức khác Tin tức cùng chuyên mục Tin tức khác Tin tức cùng chuyên mục Tin tức khác Tin tức cùng chuyên mục Tin tức khác Tin tức cùng chuyên mục Tin tức khác Tin tức cùng chuyên mục Tin tức khác Tin tức cùng chuyên mục Tin tức khác Tin tức cùng chuyên mục Tin tức khác Tin tức cùng chuyên mục Tin tức khác Tin tức cùng chuyên mục Tin tức khác Tin tức cùng chuyên mục Tin tức khác Tin tức cùng chuyên mục Tin tức khác Tin tức cùng chuyên mục Tin tức khác Tin tức cùng chuyên mục Tin tức khác Tin tức cùng chuyên mục Tin tức khác Tin tức cùng chuyên mục Tin tức khác Tin tức cùng chuyên mục Tin tức khác Tin tức cùng chuyên mục Tin tức khác Tin tức cùng chuyên mục Tin tức khác Tin tức cùng chuyên mục Tin tức khác Tin tức cùng chuyên mục Tin tức khác Tin tức cùng chuyên mục Tin tức khác Tin tức cùng chuyên mục Tin tức khác Tin tức cùng chuyên mục Tin tức khác Tin tức cùng chuyên mục Tin tức khác Tin tức cùng chuyên mục Tin tức khác Tin tức cùng chuyên mục Tin tức khác Tin tức cùng chuyên mục Tin tức khác Tin tức cùng chuyên mục Tin tức khác Tin tức cùng chuyên mục Tin tức khác Tin tức cùng chuyên mục Tin tức khác Tin tức cùng chuyên mục Tin tức khác Tin tức cùng chuyên mục Tin tức khác Tin tức cùng chuyên mục Tin tức khác Tin tức cùng chuyên mục Tin tức khác Tin tức cùng chuyên mục Tin tức khác Tin tức cùng chuyên mục Tin tức khác Tin tức cùng chuyên mục Tin tức khác Tin tức cùng chuyên mục Tin tức khác Tin tức cùng chuyên mục Tin tức khác Tin tức cùng chuyên mục Tin tức khác Tin tức cùng chuyên mục Tin tức khác Tin tức cùng chuyên mục Tin tức khác Tin tức cùng chuyên mục Tin tức khác Tin tức cùng chuyên mục Tin tức khác Tin tức cùng chuyên mục Tin tức khác Tin tức cùng chuyên mục Tin tức khác Tin tức cùng chuyên mục Tin tức khác Tin tức cùng chuyên mục Tin tức khác Tin tức cùng chuyên mục Tin tức khác Tin tức cùng chuyên mục Tin tức khác Tin tức cùng chuyên mục Tin tức khác Tin tức cùng chuyên mục Tin tức khác Tin tức cùng chuyên mục Tin tức khác Tin tức cùng chuyên mục Tin tức khác Tin tức cùng chuyên mục Tin tức khác Tin tức cùng chuyên mục Tin tức khác Tin tức cùng chuyên mục Tin tức khác Tin tức cùng chuyên mục Tin tức khác Tin tức cùng chuyên mục Tin tức khác Tin tức cùng chuyên mục Tin tức khác Tin tức cùng chuyên mục Tin tức khác Tin tức cùng chuyên mục Tin tức khác Tin tức cùng chuyên mục Tin tức khác Tin tức cùng chuyên mục Tin tức khác Tin tức cùng chuyên mục Tin tức khác Tin tức cùng chuyên mục Tin tức khác Tin tức cùng chuyên mục Tin tức khác Tin tức cùng chuyên mục Tin tức khác Tin tức cùng chuyên mục Tin tức khác Tin tức cùng chuyên mục Tin tức khác Tin tức cùng chuyên mục Tin tức khác Tin tức cùng chuyên mục Tin tức khác Tin tức cùng chuyên mục Tin tức khác Tin tức cùng chuyên mục Tin tức khác Tin tức cùng chuyên mục Tin tức khác Tin tức cùng chuyên mục Tin tức khác Tin tức cùng chuyên mục Tin tức khác Tin tức cùng chuyên mục Tin tức khác Tin tức cùng chuyên mục Tin tức khác Tin tức cùng chuyên mục Tin tức khác Tin tức cùng chuyên mục Tin tức khác Tin tức cùng chuyên mục Tin tức khác Tin tức cùng chuyên mục Tin tức khác Tin tức cùng chuyên mục Tin tức khác Tin tức cùng chuyên mục Tin tức khác Tin tức cùng chuyên mục Tin tức khác Tin tức cùng chuyên mục Tin tức khác Tin tức cùng chuyên mục Tin tức khác Tin tức cùng chuyên mục Tin tức khác Tin tức cùng chuyên mục Tin tức khác Tin tức cùng chuyên mục Tin tức khác Tin tức cùng chuyên mục Tin tức khác Tin tức cùng chuyên mục Tin tức khác Tin tức cùng chuyên mục Tin tức khác Tin tức cùng chuyên mục Tin tức khác Tin tức cùng chuyên mục Tin tức khác Tin tức cùng chuyên mục Tin tức khác Tin tức cùng chuyên mục Tin tức khác Tin tức cùng chuyên mục Tin tức khác Tin tức cùng chuyên mục Tin tức khác Tin tức cùng chuyên mục Tin tức khác Tin tức cùng chuyên mục Tin tức khác Tin tức cùng chuyên mục Tin tức khác Tin tức cùng chuyên mục Tin tức khác Tin tức cùng chuyên mục Tin tức khác Tin tức cùng chuyên mục Tin tức khác Tin tức cùng chuyên mục Tin tức khác Tin tức cùng chuyên mục Tin tức khác Tin tức cùng chuyên mục Tin tức khác Tin tức cùng chuyên mục Tin tức khác Tin tức cùng chuyên mục Tin tức khác Tin tức cùng chuyên mục Tin tức khác Tin tức cùng chuyên mục Tin tức khác Tin tức cùng chuyên mục Tin tức khác Tin tức cùng chuyên mục Tin tức khác Tin tức cùng chuyên mục Tin tức khác Tin tức cùng chuyên mục Tin tức khác Tin tức cùng chuyên mục Tin tức khác Tin tức cùng chuyên mục Tin tức khác Tin tức cùng chuyên mục Tin tức khác Tin tức cùng chuyên mục Tin tức khác Tin tức cùng chuyên mục Tin tức khác Tin tức cùng chuyên mục Tin tức khác Tin tức cùng chuyên mục Tin tức khác Tin tức cùng chuyên mục Tin tức khác Tin tức cùng chuyên mục Tin tức khác Tin tức cùng chuyên mục Tin tức khác Tin tức cùng chuyên mục Tin tức khác Tin tức cùng chuyên mục Tin tức khác Tin tức cùng chuyên mục Tin tức khác Tin tức cùng chuyên mục Tin tức khác Tin tức cùng chuyên mục Tin tức khác Tin tức cùng chuyên mục Tin tức khác Tin tức cùng chuyên mục Tin tức khác Tin tức cùng chuyên mục Tin tức khác Tin tức cùng chuyên mục Tin tức khác Tin tức cùng chuyên mục Tin tức khác Tin tức cùng chuyên mục Tin tức khác Tin tức cùng chuyên mục Tin tức khác Tin tức cùng chuyên mục Tin tức khác Tin tức cùng chuyên mục Tin tức khác Tin tức cùng chuyên mục Tin tức khác Tin tức cùng chuyên mục Tin tức khác Tin tức cùng chuyên mục Tin tức khác Tin tức cùng chuyên mục Tin tức khác Tin tức cùng chuyên mục Tin tức khác Tin tức cùng chuyên mục Tin tức khác Tin tức cùng chuyên mục Tin tức khác Tin tức cùng chuyên mục Tin tức khác Tin tức cùng chuyên mục Tin tức khác Tin tức cùng chuyên mục Tin tức khác Tin tức cùng chuyên mục Tin tức khác Tin tức cùng chuyên mục Tin tức khác Tin tức cùng chuyên mục Tin tức khác Tin tức cùng chuyên mục Tin tức khác Tin tức cùng chuyên mục Tin tức khác Tin tức cùng chuyên mục Tin tức khác Tin tức cùng chuyên mục Tin tức khác Tin tức cùng chuyên mục Tin tức khác Tin tức cùng chuyên mục Tin tức khác Tin tức cùng chuyên mục Tin tức khác Tin tức cùng chuyên mục Tin tức khác Tin tức cùng chuyên mục Tin tức khác Tin tức cùng chuyên mục Tin tức khác Tin tức cùng chuyên mục Tin tức khác Tin tức cùng chuyên mục Tin tức khác Tin tức cùng chuyên mục Tin tức khác Tin tức cùng chuyên mục Tin tức khác Tin tức cùng chuyên mục Tin tức khác Tin tức cùng chuyên mục Tin tức khác Tin tức cùng chuyên mục Tin tức khác Tin tức cùng chuyên mục Tin tức khác Tin tức cùng chuyên mục Tin tức khác Tin tức cùng chuyên mục Tin tức khác Tin tức cùng chuyên mục Tin tức khác Tin tức cùng chuyên mục Tin tức khác Tin tức cùng chuyên mục Tin tức khác Tin tức cùng chuyên mục Tin tức khác Tin tức cùng chuyên mục Tin tức khác Tin tức cùng chuyên mục Tin tức khác Tin tức cùng chuyên mục Tin tức khác Tin tức cùng chuyên mục Tin tức khác Tin tức cùng chuyên mục Tin tức khác Tin tức cùng chuyên mục Tin tức khác Tin tức cùng chuyên mục Tin tức khác Tin tức cùng chuyên mục Tin tức khác Tin tức cùng chuyên mục Tin tức khác Tin tức cùng chuyên mục Tin tức khác Tin tức cùng chuyên mục Tin tức khác Tin tức cùng chuyên mục Tin tức khác Tin tức cùng chuyên mục Tin tức khác Tin tức cùng chuyên mục Tin tức khác Tin tức cùng chuyên mục Tin tức khác Tin tức cùng chuyên mục Tin tức khác Tin tức cùng chuyên mục Tin tức khác Tin tức cùng chuyên mục Tin tức khác Tin tức cùng chuyên mục Tin tức khác Tin tức cùng chuyên mục Tin tức khác Tin tức cùng chuyên mục Tin tức khác Tin tức cùng chuyên mục Tin tức khác Tin tức cùng chuyên mục Tin tức khác Tin tức cùng chuyên mục Tin tức khác Tin tức cùng chuyên mục Tin tức khác Tin tức cùng chuyên mục Tin tức khác Tin tức cùng chuyên mục Tin tức khác Tin tức cùng chuyên mục Tin tức khác Tin tức cùng chuyên mục Tin tức khác Tin tức cùng chuyên mục Tin tức khác Tin tức cùng chuyên mục Tin tức khác Tin tức cùng chuyên mục Tin tức khác Tin tức cùng chuyên mục Tin tức khác Tin tức cùng chuyên mục Tin tức khác Tin tức cùng chuyên mục Tin tức khác Tin tức cùng chuyên mục Tin tức khác Tin tức cùng chuyên mục Tin tức khác Tin tức cùng chuyên mục Tin tức khác Tin tức cùng chuyên mục Tin tức khác Tin tức cùng chuyên mục Tin tức khác Tin tức cùng chuyên mục Tin tức khác Tin tức cùng chuyên mục Tin tức khác Tin tức cùng chuyên mục Tin tức khác Tin tức cùng chuyên mục Tin tức khác Tin tức cùng chuyên mục Tin tức khác Tin tức cùng chuyên mục Tin tức khác Tin tức cùng chuyên mục Tin tức khác Tin tức cùng chuyên mục Tin tức khác Tin tức cùng chuyên mục Tin tức khác Tin tức cùng chuyên mục Tin tức khác Tin tức cùng chuyên mục Tin tức khác Tin tức cùng chuyên mục Tin tức khác Tin tức cùng chuyên mục Tin tức khác Tin tức cùng chuyên mục Tin tức khác Tin tức cùng chuyên mục Tin tức khác Tin tức cùng chuyên mục Tin tức khác Tin tức cùng chuyên mục Tin tức khác Tin tức cùng chuyên mục Tin tức khác Tin tức cùng chuyên mục Tin tức khác Tin tức cùng chuyên mục Tin tức khác Tin tức cùng chuyên mục Tin tức khác Tin tức cùng chuyên mục Tin tức khác Tin tức cùng chuyên mục Tin tức khác Tin tức cùng chuyên mục Tin tức khác Tin tức cùng chuyên mục Tin tức khác Tin tức cùng chuyên mục Tin tức khác Tin tức cùng chuyên mục Tin tức khác Tin tức cùng chuyên mục Tin tức khác Tin tức cùng chuyên mục Tin tức khác Tin tức cùng chuyên mục Tin tức khác Tin tức cùng chuyên mục Tin tức khác Tin tức cùng chuyên mục Tin tức khác Tin tức cùng chuyên mục Tin tức khác Tin tức cùng chuyên mục Tin tức khác Tin tức cùng chuyên mục Tin tức khác Tin tức cùng chuyên mục Tin tức khác Tin tức cùng chuyên mục Tin tức khác Tin tức cùng chuyên mục Tin tức khác Tin tức cùng chuyên mục Tin tức khác Tin tức cùng chuyên mục Tin tức khác Tin tức cùng chuyên mục Tin tức khác Tin tức cùng chuyên mục Tin tức khác Tin tức cùng chuyên mục Tin tức khác Tin tức cùng chuyên mục Tin tức khác Tin tức cùng chuyên mục Tin tức khác Tin tức cùng chuyên mục Tin tức khác Tin tức cùng chuyên mục Tin tức khác Tin tức cùng chuyên mục Tin tức khác Tin tức cùng chuyên mục Tin tức khác Tin tức cùng chuyên mục Tin tức khác Tin tức cùng chuyên mục Tin tức khác Tin tức cùng chuyên mục Tin tức khác Tin tức cùng chuyên mục Tin tức khác Tin tức cùng chuyên mục Tin tức khác Tin tức cùng chuyên mục Tin tức khác Tin tức cùng chuyên mục Tin tức khác Tin tức cùng chuyên mục Tin tức khác Tin tức cùng chuyên mục Tin tức khác Tin tức cùng chuyên mục Tin tức khác Tin tức cùng chuyên mục Tin tức khác Tin tức cùng chuyên mục Tin tức khác Tin tức cùng chuyên mục Tin tức khác Tin tức cùng chuyên mục Tin tức khác Tin tức cùng chuyên mục Tin tức khác Tin tức cùng chuyên mục Tin tức khác Tin tức cùng chuyên mục Tin tức khác Tin tức cùng chuyên mục Tin tức khác Tin tức cùng chuyên mục Tin tức khác Tin tức cùng chuyên mục Tin tức khác Tin tức cùng chuyên mục Tin tức khác Tin tức cùng chuyên mục Tin tức khác Tin tức cùng chuyên mục Tin tức khác Tin tức cùng chuyên mục Tin tức khác Tin tức cùng chuyên mục Tin tức khác Tin tức cùng chuyên mục Tin tức khác Tin tức cùng chuyên mục Tin tức khác Tin tức cùng chuyên mục Tin tức khác Tin tức cùng chuyên mục Tin tức khác Tin tức cùng chuyên mục Tin tức khác Tin tức cùng chuyên mục Tin tức khác Tin tức cùng chuyên mục Tin tức khác Tin tức cùng chuyên mục Tin tức khác Tin tức cùng chuyên mục Tin tức khác Tin tức cùng chuyên mục Tin tức khác Tin tức cùng chuyên mục Tin tức khác Tin tức cùng chuyên mục Tin tức khác Tin tức cùng chuyên mục Tin tức khác Tin tức cùng chuyên mục Tin tức khác Tin tức cùng chuyên mục Tin tức khác Tin tức cùng chuyên mục Tin tức khác Tin tức cùng chuyên mục Tin tức khác Tin tức cùng chuyên mục Tin tức khác Tin tức cùng chuyên mục Tin tức khác Tin tức cùng chuyên mục Tin tức khác Tin tức cùng chuyên mục Tin tức khác Tin tức cùng chuyên mục Tin tức khác Tin tức cùng chuyên mục Tin tức khác Tin tức cùng chuyên mục Tin tức khác Tin tức cùng chuyên mục Tin tức khác Tin tức cùng chuyên mục Tin tức khác Tin tức cùng chuyên mục Tin tức khác Tin tức cùng chuyên mục Tin tức khác Tin tức cùng chuyên mục Tin tức khác Tin tức cùng chuyên mục Tin tức khác Tin tức cùng chuyên mục Tin tức khác Tin tức cùng chuyên mục Tin tức khác Tin tức cùng chuyên mục Tin tức khác Tin tức cùng chuyên mục Tin tức khác Tin tức cùng chuyên mục Tin tức khác Tin tức cùng chuyên mục Tin tức khác Tin tức cùng chuyên mục Tin tức khác Tin tức cùng chuyên mục Tin tức khác Tin tức cùng chuyên mục Tin tức khác Tin tức cùng chuyên mục Tin tức khác Tin tức cùng chuyên mục Tin tức khác Tin tức cùng chuyên mục Tin tức khác Tin tức cùng chuyên mục Tin tức khác Tin tức cùng chuyên mục Tin tức khác Tin tức cùng chuyên mục Tin tức khác Tin tức cùng chuyên mục Tin tức khác Tin tức cùng chuyên mục Tin tức khác Tin tức cùng chuyên mục Tin tức khác Tin tức cùng chuyên mục Tin tức khác Tin tức cùng chuyên mục Tin tức khác Tin tức cùng chuyên mục Tin tức khác Tin tức cùng chuyên mục Tin tức khác Tin tức cùng chuyên mục Tin tức khác Tin tức cùng chuyên mục Tin tức khác Tin tức cùng chuyên mục Tin tức khác Tin tức cùng chuyên mục Tin tức khác Tin tức cùng chuyên mục Tin tức khác Tin tức cùng chuyên mục Tin tức khác Tin tức cùng chuyên mục Tin tức khác Tin tức cùng chuyên mục Tin tức khác Tin tức cùng chuyên mục Tin tức khác Tin tức cùng chuyên mục Tin tức khác Tin tức cùng chuyên mục Tin tức khác Tin tức cùng chuyên mục Tin tức khác Tin tức cùng chuyên mục Tin tức khác Tin tức cùng chuyên mục Tin tức khác Tin tức cùng chuyên mục Tin tức khác Tin tức cùng chuyên mục Tin tức khác Tin tức cùng chuyên mục Tin tức khác Tin tức cùng chuyên mục Tin tức khác Tin tức cùng chuyên mục Tin tức khác Tin tức cùng chuyên mục Tin tức khác Tin tức cùng chuyên mục Tin tức khác Tin tức cùng chuyên mục Tin tức khác Tin tức cùng chuyên mục Tin tức khác Tin tức cùng chuyên mục Tin tức khác Tin tức cùng chuyên mục Tin tức khác Tin tức cùng chuyên mục Tin tức khác Tin tức cùng chuyên mục Tin tức khác Tin tức cùng chuyên mục Tin tức khác Tin tức cùng chuyên mục Tin tức khác Tin tức cùng chuyên mục Tin tức khác Tin tức cùng chuyên mục Tin tức khác Tin tức cùng chuyên mục Tin tức khác Tin tức cùng chuyên mục Tin tức khác Tin tức cùng chuyên mục Tin tức khác Tin tức cùng chuyên mục Tin tức khác Tin tức cùng chuyên mục Tin tức khác Tin tức cùng chuyên mục Tin tức khác Tin tức cùng chuyên mục Tin tức khác Tin tức cùng chuyên mục Tin tức khác Tin tức cùng chuyên mục Tin tức khác Tin tức cùng chuyên mục Tin tức khác Tin tức cùng chuyên mục Tin tức khác Tin tức cùng chuyên mục Tin tức khác Tin tức cùng chuyên mục Tin tức khác Tin tức cùng chuyên mục Tin tức khác Tin tức cùng chuyên mục Tin tức khác Tin tức cùng chuyên mục Tin tức khác Tin tức cùng chuyên mục Tin tức khác Tin tức cùng chuyên mục Tin tức khác Tin tức cùng chuyên mục Tin tức khác Tin tức cùng chuyên mục Tin tức khác Tin tức cùng chuyên mục Tin tức khác Tin tức cùng chuyên mục Tin tức khác Tin tức cùng chuyên mục Tin tức khác Tin tức cùng chuyên mục Tin tức khác Tin tức cùng chuyên mục Tin tức khác Tin tức cùng chuyên mục Tin tức khác Tin tức cùng chuyên mục Tin tức khác Tin tức cùng chuyên mục Tin tức khác Tin tức cùng chuyên mục Tin tức khác Tin tức cùng chuyên mục Tin tức khác Tin tức cùng chuyên mục Tin tức khác Tin tức cùng chuyên mục Tin tức khác Tin tức cùng chuyên mục Tin tức khác Tin tức cùng chuyên mục Tin tức khác Tin tức cùng chuyên mục Tin tức khác Tin tức cùng chuyên mục Tin tức khác Tin tức cùng chuyên mục Tin tức khác Tin tức cùng chuyên mục Tin tức khác Tin tức cùng chuyên mục Tin tức khác Tin tức cùng chuyên mục Tin tức khác Tin tức cùng chuyên mục Tin tức khác Tin tức cùng chuyên mục Tin tức khác Tin tức cùng chuyên mục Tin tức khác Tin tức cùng chuyên mục Tin tức khác Tin tức cùng chuyên mục Tin tức khác Tin tức cùng chuyên mục Tin tức khác Tin tức cùng chuyên mục Tin tức khác Tin tức cùng chuyên mục Tin tức khác Tin tức cùng chuyên mục Tin tức khác Tin tức cùng chuyên mục Tin tức khác Tin tức cùng chuyên mục Tin tức khác Tin tức cùng chuyên mục Tin tức khác Tin tức cùng chuyên mục Tin tức khác Tin tức cùng chuyên mục Tin tức khác Tin tức cùng chuyên mục Tin tức khác Tin tức cùng chuyên mục Tin tức khác Tin tức cùng chuyên mục Tin tức khác Tin tức cùng chuyên mục Tin tức khác Tin tức cùng chuyên mục Tin tức khác Tin tức cùng chuyên mục Tin tức khác Tin tức cùng chuyên mục Tin tức khác Tin tức cùng chuyên mục Tin tức khác Tin tức cùng chuyên mục Tin tức khác Tin tức cùng chuyên mục Tin tức khác Tin tức cùng chuyên mục Tin tức khác Tin tức cùng chuyên mục Tin tức khác Tin tức cùng chuyên mục Tin tức khác Tin tức cùng chuyên mục Tin tức khác Tin tức cùng chuyên mục Tin tức khác Tin tức cùng chuyên mục Tin tức khác Tin tức cùng chuyên mục Tin tức khác Tin tức cùng chuyên mục Tin tức khác Tin tức cùng chuyên mục Tin tức khác Tin tức cùng chuyên mục Tin tức khác Tin tức cùng chuyên mục Tin tức khác Tin tức cùng chuyên mục Tin tức khác Tin tức cùng chuyên mục Tin tức khác Tin tức cùng chuyên mục Tin tức khác Tin tức cùng chuyên mục Tin tức khác Tin tức cùng chuyên mục Tin tức khác Tin tức cùng chuyên mục Tin tức khác Tin tức cùng chuyên mục Tin tức khác Tin tức cùng chuyên mục Tin tức khác Tin tức cùng chuyên mục Tin tức khác Tin tức cùng chuyên mục Tin tức khác Tin tức cùng chuyên mục Tin tức khác Tin tức cùng chuyên mục Tin tức khác Tin tức cùng chuyên mục Tin tức khác Tin tức cùng chuyên mục Tin tức khác Tin tức cùng chuyên mục Tin tức khác Tin tức cùng chuyên mục Tin tức khác Tin tức cùng chuyên mục Tin tức khác Tin tức cùng chuyên mục Tin tức khác Tin tức cùng chuyên mục Tin tức khác Tin tức cùng chuyên mục Tin tức khác Tin tức cùng chuyên mục Tin tức khác Tin tức cùng chuyên mục Tin tức khác Tin tức cùng chuyên mục Tin tức khác Tin tức cùng chuyên mục Tin tức khác Tin tức cùng chuyên mục Tin tức khác Tin tức cùng chuyên mục Tin tức khác Tin tức cùng chuyên mục Tin tức khác Tin tức cùng chuyên mục Tin tức khác Tin tức cùng chuyên mục Tin tức khác Tin tức cùng chuyên mục Tin tức khác Tin tức cùng chuyên mục Tin tức khác Tin tức cùng chuyên mục Tin tức khác Tin tức cùng chuyên mục Tin tức khác Tin tức cùng chuyên mục Tin tức khác Tin tức cùng chuyên mục Tin tức khác Tin tức cùng chuyên mục Tin tức khác Tin tức cùng chuyên mục Tin tức khác Tin tức cùng chuyên mục Tin tức khác Tin tức cùng chuyên mục Tin tức khác Tin tức cùng chuyên mục Tin tức khác Tin tức cùng chuyên mục Tin tức khác Tin tức cùng chuyên mục Tin tức khác Tin tức cùng chuyên mục Tin tức khác Tin tức cùng chuyên mục Tin tức khác Tin tức cùng chuyên mục Tin tức khác Tin tức cùng chuyên mục Tin tức khác Tin tức cùng chuyên mục Tin tức khác Tin tức cùng chuyên mục Tin tức khác Tin tức cùng chuyên mục Tin tức khác Tin tức cùng chuyên mục Tin tức khác Tin tức cùng chuyên mục Tin tức khác Tin tức cùng chuyên mục Tin tức khác Tin tức cùng chuyên mục Tin tức khác Tin tức cùng chuyên mục Tin tức khác Tin tức cùng chuyên mục Tin tức khác Tin tức cùng chuyên mục Tin tức khác Tin tức cùng chuyên mục Tin tức khác Tin tức cùng chuyên mục Tin tức khác Tin tức cùng chuyên mục Tin tức khác Tin tức cùng chuyên mục Tin tức khác Tin tức cùng chuyên mục Tin tức khác Tin tức cùng chuyên mục Tin tức khác Tin tức cùng chuyên mục Tin tức khác Tin tức cùng chuyên mục Tin tức khác Tin tức cùng chuyên mục Tin tức khác Tin tức cùng chuyên mục Tin tức khác Tin tức cùng chuyên mục Tin tức khác Tin tức cùng chuyên mục Tin tức khác Tin tức cùng chuyên mục Tin tức khác Tin tức cùng chuyên mục Tin tức khác Tin tức cùng chuyên mục Tin tức khác Tin tức cùng chuyên mục Tin tức khác Tin tức cùng chuyên mục Tin tức khác Tin tức cùng chuyên mục Tin tức khác Tin tức cùng chuyên mục Tin tức khác Tin tức cùng chuyên mục Tin tức khác Tin tức cùng chuyên mục Tin tức khác Tin tức cùng chuyên mục Tin tức khác Tin tức cùng chuyên mục Tin tức khác Tin tức cùng chuyên mục Tin tức khác Tin tức cùng chuyên mục Tin tức khác Tin tức cùng chuyên mục Tin tức khác Tin tức cùng chuyên mục Tin tức khác Tin tức cùng chuyên mục Tin tức khác Tin tức cùng chuyên mục Tin tức khác Tin tức cùng chuyên mục Tin tức khác Tin tức cùng chuyên mục Tin tức khác Tin tức cùng chuyên mục Tin tức khác Tin tức cùng chuyên mục Tin tức khác Tin tức cùng chuyên mục Tin tức khác Tin tức cùng chuyên mục Tin tức khác Tin tức cùng chuyên mục Tin tức khác Tin tức cùng chuyên mục Tin tức khác Tin tức cùng chuyên mục Tin tức khác Tin tức cùng chuyên mục Tin tức khác Tin tức cùng chuyên mục Tin tức khác Tin tức cùng chuyên mục Tin tức khác Tin tức cùng chuyên mục Tin tức khác Tin tức cùng chuyên mục Tin tức khác Tin tức cùng chuyên mục Tin tức khác Tin tức cùng chuyên mục Tin tức khác Tin tức cùng chuyên mục Tin tức khác Tin tức cùng chuyên mục Tin tức khác Tin tức cùng chuyên mục Tin tức khác Tin tức cùng chuyên mục Tin tức khác Tin tức cùng chuyên mục Tin tức khác Tin tức cùng chuyên mục Tin tức khác Tin tức cùng chuyên mục Tin tức khác Tin tức cùng chuyên mục Tin tức khác Tin tức cùng chuyên mục Tin tức khác Tin tức cùng chuyên mục Tin tức khác Tin tức cùng chuyên mục Tin tức khác Tin tức cùng chuyên mục Tin tức khác Tin tức cùng chuyên mục Tin tức khác Tin tức cùng chuyên mục Tin tức khác Tin tức cùng chuyên mục Tin tức khác Tin tức cùng chuyên mục Tin tức khác Tin tức cùng chuyên mục Tin tức khác Tin tức cùng chuyên mục Tin tức khác Tin tức cùng chuyên mục Tin tức khác Tin tức cùng chuyên mục Tin tức khác Tin tức cùng chuyên mục Tin tức khác Tin tức cùng chuyên mục Tin tức khác Tin tức cùng chuyên mục Tin tức khác Tin tức cùng chuyên mục Tin tức khác Tin tức cùng chuyên mục Tin tức khác Tin tức cùng chuyên mục Tin tức khác Tin tức cùng chuyên mục Tin tức khác Tin tức cùng chuyên mục Tin tức khác Tin tức cùng chuyên mục Tin tức khác Tin tức cùng chuyên mục Tin tức khác Tin tức cùng chuyên mục Tin tức khác Tin tức cùng chuyên mục Tin tức khác Tin tức cùng chuyên mục Tin tức khác Tin tức cùng chuyên mục Tin tức khác Tin tức cùng chuyên mục Tin tức khác Tin tức cùng chuyên mục Tin tức khác Tin tức cùng chuyên mục Tin tức khác Tin tức cùng chuyên mục Tin tức khác Tin tức cùng chuyên mục Tin tức khác Tin tức cùng chuyên mục Tin tức khác Tin tức cùng chuyên mục Tin tức khác Tin tức cùng chuyên mục Tin tức khác Tin tức cùng chuyên mục Tin tức khác Tin tức cùng chuyên mục Tin tức khác Tin tức cùng chuyên mục Tin tức khác Tin tức cùng chuyên mục Tin tức khác Tin tức cùng chuyên mục Tin tức khác Tin tức cùng chuyên mục Tin tức khác Tin tức cùng chuyên mục Tin tức khác Tin tức cùng chuyên mục Tin tức khác Tin tức cùng chuyên mục Tin tức khác Tin tức cùng chuyên mục Tin tức khác Tin tức cùng chuyên mục Tin tức khác Tin tức cùng chuyên mục Tin tức khác Tin tức cùng chuyên mục Tin tức khác Tin tức cùng chuyên mục Tin tức khác Tin tức cùng chuyên mục Tin tức khác Tin tức cùng chuyên mục Tin tức khác Tin tức cùng chuyên mục Tin tức khác Tin tức cùng chuyên mục Tin tức khác Tin tức cùng chuyên mục Tin tức khác Tin tức cùng chuyên mục Tin tức khác Tin tức cùng chuyên mục Tin tức khác Tin tức cùng chuyên mục Tin tức khác Tin tức cùng chuyên mục Tin tức khác Tin tức cùng chuyên mục Tin tức khác Tin tức cùng chuyên mục Tin tức khác Tin tức cùng chuyên mục Tin tức khác Tin tức cùng chuyên mục Tin tức khác Tin tức cùng chuyên mục Tin tức khác Tin tức cùng chuyên mục Tin tức khác Tin tức cùng chuyên mục Tin tức khác Tin tức cùng chuyên mục Tin tức khác Tin tức cùng chuyên mục Tin tức khác Tin tức cùng chuyên mục Tin tức khác Tin tức cùng chuyên mục Tin tức khác Tin tức cùng chuyên mục Tin tức khác Tin tức cùng chuyên mục Tin tức khác Tin tức cùng chuyên mục Tin tức khác Tin tức cùng chuyên mục Tin tức khác Tin tức cùng chuyên mục Tin tức khác Tin tức cùng chuyên mục Tin tức khác Tin tức cùng chuyên mục Tin tức khác Tin tức cùng chuyên mục Tin tức khác Tin tức cùng chuyên mục Tin tức khác Tin tức cùng chuyên mục Tin tức khác Tin tức cùng chuyên mục Tin tức khác Tin tức cùng chuyên mục Tin tức khác Tin tức cùng chuyên mục Tin tức khác Tin tức cùng chuyên mục Tin tức khác Tin tức cùng chuyên mục Tin tức khác Tin tức cùng chuyên mục Tin tức khác Tin tức cùng chuyên mục Tin tức khác Tin tức cùng chuyên mục Tin tức khác Tin tức cùng chuyên mục Tin tức khác Tin tức cùng chuyên mục Tin tức khác Tin tức cùng chuyên mục Tin tức khác Tin tức cùng chuyên mục Tin tức khác Tin tức cùng chuyên mục Tin tức khác Tin tức cùng chuyên mục Tin tức khác Tin tức cùng chuyên mục Tin tức khác Tin tức cùng chuyên mục Tin tức khác Tin tức cùng chuyên mục Tin tức khác Tin tức cùng chuyên mục Tin tức khác Tin tức cùng chuyên mục Tin tức khác Tin tức cùng chuyên mục Tin tức khác Tin tức cùng chuyên mục Tin tức khác Tin tức cùng chuyên mục Tin tức khác Tin tức cùng chuyên mục Tin tức khác Tin tức cùng chuyên mục Tin tức khác Tin tức cùng chuyên mục Tin tức khác Tin tức cùng chuyên mục Tin tức khác Tin tức cùng chuyên mục Tin tức khác Tin tức cùng chuyên mục Tin tức khác Tin tức cùng chuyên mục Tin tức khác Tin tức cùng chuyên mục Tin tức khác Tin tức cùng chuyên mục Tin tức khác Tin tức cùng chuyên mục Tin tức khác Tin tức cùng chuyên mục Tin tức khác Tin tức cùng chuyên mục Tin tức khác Tin tức cùng chuyên mục Tin tức khác Tin tức cùng chuyên mục Tin tức khác Tin tức cùng chuyên mục Tin tức khác Tin tức cùng chuyên mục Tin tức khác Tin tức cùng chuyên mục Tin tức khác Tin tức cùng chuyên mục Tin tức khác Tin tức cùng chuyên mục Tin tức khác Tin tức cùng chuyên mục Tin tức khác Tin tức cùng chuyên mục Tin tức khác Tin tức cùng chuyên mục Tin tức khác Tin tức cùng chuyên mục Tin tức khác Tin tức cùng chuyên mục Tin tức khác Tin tức cùng chuyên mục Tin tức khác Tin tức cùng chuyên mục Tin tức khác Tin tức cùng chuyên mục Tin tức khác Tin tức cùng chuyên mục Tin tức khác Tin tức cùng chuyên mục Tin tức khác Tin tức cùng chuyên mục Tin tức khác Tin tức cùng chuyên mục Tin tức khác Tin tức cùng chuyên mục Tin tức khác Tin tức cùng chuyên mục Tin tức khác Tin tức cùng chuyên mục Tin tức khác Tin tức cùng chuyên mục Tin tức khác Tin tức cùng chuyên mục Tin tức khác Tin tức cùng chuyên mục Tin tức khác Tin tức cùng chuyên mục Tin tức khác Tin tức cùng chuyên mục Tin tức khác Tin tức cùng chuyên mục Tin tức khác Tin tức cùng chuyên mục Tin tức khác Tin tức cùng chuyên mục Tin tức khác Tin tức cùng chuyên mục Tin tức khác Tin tức cùng chuyên mục Tin tức khác Tin tức cùng chuyên mục Tin tức khác Tin tức cùng chuyên mục Tin tức khác Tin tức cùng chuyên mục Tin tức khác Tin tức cùng chuyên mục Tin tức khác Tin tức cùng chuyên mục Tin tức khác Tin tức cùng chuyên mục Tin tức khác Tin tức cùng chuyên mục Tin tức khác Tin tức cùng chuyên mục Tin tức khác Tin tức cùng chuyên mục Tin tức khác Tin tức cùng chuyên mục Tin tức khác Tin tức cùng chuyên mục Tin tức khác Tin tức cùng chuyên mục Tin tức khác Tin tức cùng chuyên mục Tin tức khác Tin tức cùng chuyên mục Tin tức khác Tin tức cùng chuyên mục Tin tức khác Tin tức cùng chuyên mục Tin tức khác Tin tức cùng chuyên mục Tin tức khác Tin tức cùng chuyên mục Tin tức khác Tin tức cùng chuyên mục Tin tức khác Tin tức cùng chuyên mục Tin tức khác Tin tức cùng chuyên mục Tin tức khác Tin tức cùng chuyên mục Tin tức khác Tin tức cùng chuyên mục Tin tức khác Tin tức cùng chuyên mục Tin tức khác Tin tức cùng chuyên mục Tin tức khác Tin tức cùng chuyên mục Tin tức khác Tin tức cùng chuyên mục Tin tức khác Tin tức cùng chuyên mục Tin tức khác Tin tức cùng chuyên mục Tin tức khác Tin tức cùng chuyên mục Tin tức khác Tin tức cùng chuyên mục Tin tức khác Tin tức cùng chuyên mục Tin tức khác Tin tức cùng chuyên mục Tin tức khác Tin tức cùng chuyên mục Tin tức khác Tin tức cùng chuyên mục Tin tức khác Tin tức cùng chuyên mục Tin tức khác Tin tức cùng chuyên mục Tin tức khác Tin tức cùng chuyên mục Tin tức khác Tin tức cùng chuyên mục Tin tức khác Tin tức cùng chuyên mục Tin tức khác Tin tức cùng chuyên mục Tin tức khác Tin tức cùng chuyên mục Tin tức khác Tin tức cùng chuyên mục Tin tức khác Tin tức cùng chuyên mục Tin tức khác Tin tức cùng chuyên mục Tin tức khác Tin tức cùng chuyên mục Tin tức khác Tin tức cùng chuyên mục Tin tức khác Tin tức cùng chuyên mục Tin tức khác Tin tức cùng chuyên mục Tin tức khác Tin tức cùng chuyên mục Tin tức khác Tin tức cùng chuyên mục Tin tức khác Tin tức cùng chuyên mục Tin tức khác Tin tức cùng chuyên mục Tin tức khác Tin tức cùng chuyên mục Tin tức khác Tin tức cùng chuyên mục Tin tức khác Tin tức cùng chuyên mục Tin tức khác Tin tức cùng chuyên mục Tin tức khác Tin tức cùng chuyên mục Tin tức khác Tin tức cùng chuyên mục Tin tức khác Tin tức cùng chuyên mục Tin tức khác Tin tức cùng chuyên mục Tin tức khác Tin tức cùng chuyên mục Tin tức khác Tin tức cùng chuyên mục Tin tức khác Tin tức cùng chuyên mục Tin tức khác Tin tức cùng chuyên mục Tin tức khác Tin tức cùng chuyên mục Tin tức khác Tin tức cùng chuyên mục Tin tức khác Tin tức cùng chuyên mục Tin tức khác Tin tức cùng chuyên mục Tin tức khác Tin tức cùng chuyên mục Tin tức khác Tin tức cùng chuyên mục Tin tức khác Tin tức cùng chuyên mục Tin tức khác Tin tức cùng chuyên mục Tin tức khác Tin tức cùng chuyên mục Tin tức khác Tin tức cùng chuyên mục Tin tức khác Tin tức cùng chuyên mục Tin tức khác Tin tức cùng chuyên mục Tin tức khác Tin tức cùng chuyên mục Tin tức khác Tin tức cùng chuyên mục Tin tức khác Tin tức cùng chuyên mục Tin tức khác Tin tức cùng chuyên mục Tin tức khác Tin tức cùng chuyên mục Tin tức khác Tin tức cùng chuyên mục Tin tức khác Tin tức cùng chuyên mục Tin tức khác Tin tức cùng chuyên mục Tin tức khác Tin tức cùng chuyên mục Tin tức khác Tin tức cùng chuyên mục Tin tức khác Tin tức cùng chuyên mục Tin tức khác Tin tức cùng chuyên mục Tin tức khác Tin tức cùng chuyên mục Tin tức khác Tin tức cùng chuyên mục Tin tức khác Tin tức cùng chuyên mục Tin tức khác Tin tức cùng chuyên mục Tin tức khác Tin tức cùng chuyên mục Tin tức khác Tin tức cùng chuyên mục Tin tức khác Tin tức cùng chuyên mục Tin tức khác Tin tức cùng chuyên mục Tin tức khác Tin tức cùng chuyên mục Tin tức khác Tin tức cùng chuyên mục Tin tức khác Tin tức cùng chuyên mục Tin tức khác Tin tức cùng chuyên mục Tin tức khác Tin tức cùng chuyên mục Tin tức khác Tin tức cùng chuyên mục Tin tức khác Tin tức cùng chuyên mục Tin tức khác Tin tức cùng chuyên mục Tin tức khác Tin tức cùng chuyên mục Tin tức khác Tin tức cùng chuyên mục Tin tức khác Tin tức cùng chuyên mục Tin tức khác Tin tức cùng chuyên mục Tin tức khác Tin tức cùng chuyên mục Tin tức khác Tin tức cùng chuyên mục Tin tức khác Tin tức cùng chuyên mục Tin tức khác Tin tức cùng chuyên mục Tin tức khác Tin tức cùng chuyên mục Tin tức khác Tin tức cùng chuyên mục Tin tức khác Tin tức cùng chuyên mục Tin tức khác Tin tức cùng chuyên mục Tin tức khác Tin tức cùng chuyên mục Tin tức khác Tin tức cùng chuyên mục Tin tức khác Tin tức cùng chuyên mục Tin tức khác Tin tức cùng chuyên mục Tin tức khác Tin tức cùng chuyên mục Tin tức khác Tin tức cùng chuyên mục Tin tức khác Tin tức cùng chuyên mục Tin tức khác Tin tức cùng chuyên mục Tin tức khác Tin tức cùng chuyên mục Tin tức khác Tin tức cùng chuyên mục Tin tức khác Tin tức cùng chuyên mục Tin tức khác Tin tức cùng chuyên mục Tin tức khác Tin tức cùng chuyên mục Tin tức khác Tin tức cùng chuyên mục Tin tức khác Tin tức cùng chuyên mục Tin tức khác Tin tức cùng chuyên mục Tin tức khác Tin tức cùng chuyên mục Tin tức khác Tin tức cùng chuyên mục Tin tức khác Tin tức cùng chuyên mục Tin tức khác Tin tức cùng chuyên mục Tin tức khác Tin tức cùng chuyên mục Tin tức khác Tin tức cùng chuyên mục Tin tức khác Tin tức cùng chuyên mục Tin tức khác Tin tức cùng chuyên mục Tin tức khác Tin tức cùng chuyên mục Tin tức khác Tin tức cùng chuyên mục Tin tức khác Tin tức cùng chuyên mục Tin tức khác Tin tức cùng chuyên mục Tin tức khác Tin tức cùng chuyên mục Tin tức khác Tin tức cùng chuyên mục Tin tức khác Tin tức cùng chuyên mục Tin tức khác Tin tức cùng chuyên mục Tin tức khác Tin tức cùng chuyên mục Tin tức khác Tin tức cùng chuyên mục Tin tức khác Tin tức cùng chuyên mục Tin tức khác Tin tức cùng chuyên mục Tin tức khác Tin tức cùng chuyên mục Tin tức khác Tin tức cùng chuyên mục Tin tức khác Tin tức cùng chuyên mục Tin tức khác Tin tức cùng chuyên mục Tin tức khác Tin tức cùng chuyên mục Tin tức khác Tin tức cùng chuyên mục Tin tức khác Tin tức cùng chuyên mục Tin tức khác Tin tức cùng chuyên mục Tin tức khác Tin tức cùng chuyên mục Tin tức khác Tin tức cùng chuyên mục Tin tức khác Tin tức cùng chuyên mục Tin tức khác Tin tức cùng chuyên mục Tin tức khác Tin tức cùng chuyên mục Tin tức khác Tin tức cùng chuyên mục Tin tức khác Tin tức cùng chuyên mục Tin tức khác Tin tức cùng chuyên mục Tin tức khác Tin tức cùng chuyên mục Tin tức khác Tin tức cùng chuyên mục Tin tức khác Tin tức cùng chuyên mục Tin tức khác Tin tức cùng chuyên mục Tin tức khác Tin tức cùng chuyên mục Tin tức khác Tin tức cùng chuyên mục Tin tức khác Tin tức cùng chuyên mục Tin tức khác Tin tức cùng chuyên mục Tin tức khác Tin tức cùng chuyên mục Tin tức khác Tin tức cùng chuyên mục Tin tức khác Tin tức cùng chuyên mục Tin tức khác Tin tức cùng chuyên mục Tin tức khác Tin tức cùng chuyên mục Tin tức khác Tin tức cùng chuyên mục Tin tức khác Tin tức cùng chuyên mục Tin tức khác Tin tức cùng chuyên mục Tin tức khác Tin tức cùng chuyên mục Tin tức khác Tin tức cùng chuyên mục Tin tức khác Tin tức cùng chuyên mục Tin tức khác Tin tức cùng chuyên mục Tin tức khác Tin tức cùng chuyên mục Tin tức khác Tin tức cùng chuyên mục Tin tức khác Tin tức cùng chuyên mục Tin tức khác Tin tức cùng chuyên mục Tin tức khác Tin tức cùng chuyên mục Tin tức khác Tin tức cùng chuyên mục Tin tức khác Tin tức cùng chuyên mục Tin tức khác Tin tức cùng chuyên mục Tin tức khác Tin tức cùng chuyên mục Tin tức khác Tin tức cùng chuyên mục Tin tức khác Tin tức cùng chuyên mục Tin tức khác Tin tức cùng chuyên mục Tin tức khác Tin tức cùng chuyên mục Tin tức khác Tin tức cùng chuyên mục Tin tức khác Tin tức cùng chuyên mục Tin tức khác Tin tức cùng chuyên mục Tin tức khác Tin tức cùng chuyên mục Tin tức khác Tin tức cùng chuyên mục Tin tức khác Tin tức cùng chuyên mục Tin tức khác Tin tức cùng chuyên mục Tin tức khác Tin tức cùng chuyên mục Tin tức khác Tin tức cùng chuyên mục Tin tức khác Tin tức cùng chuyên mục Tin tức khác Tin tức cùng chuyên mục Tin tức khác Tin tức cùng chuyên mục Tin tức khác Tin tức cùng chuyên mục Tin tức khác Tin tức cùng chuyên mục Tin tức khác Tin tức cùng chuyên mục Tin tức khác Tin tức cùng chuyên mục Tin tức khác Tin tức cùng chuyên mục Tin tức khác Tin tức cùng chuyên mục Tin tức khác Tin tức cùng chuyên mục Tin tức khác Tin tức cùng chuyên mục Tin tức khác Tin tức cùng chuyên mục Tin tức khác Tin tức cùng chuyên mục Tin tức khác Tin tức cùng chuyên mục Tin tức khác Tin tức cùng chuyên mục Tin tức khác Tin tức cùng chuyên mục Tin tức khác Tin tức cùng chuyên mục Tin tức khác Tin tức cùng chuyên mục Tin tức khác Tin tức cùng chuyên mục Tin tức khác Tin tức cùng chuyên mục Tin tức khác Tin tức cùng chuyên mục Tin tức khác Tin tức cùng chuyên mục Tin tức khác Tin tức cùng chuyên mục Tin tức khác Tin tức cùng chuyên mục Tin tức khác Tin tức cùng chuyên mục Tin tức khác Tin tức cùng chuyên mục Tin tức khác Tin tức cùng chuyên mục Tin tức khác Tin tức cùng chuyên mục Tin tức khác Tin tức cùng chuyên mục Tin tức khác Tin tức cùng chuyên mục Tin tức khác Tin tức cùng chuyên mục Tin tức khác Tin tức cùng chuyên mục Tin tức khác Tin tức cùng chuyên mục Tin tức khác Tin tức cùng chuyên mục Tin tức khác Tin tức cùng chuyên mục Tin tức khác Tin tức cùng chuyên mục Tin tức khác Tin tức cùng chuyên mục Tin tức khác Tin tức cùng chuyên mục Tin tức khác Tin tức cùng chuyên mục Tin tức khác Tin tức cùng chuyên mục Tin tức khác Tin tức cùng chuyên mục Tin tức khác Tin tức cùng chuyên mục Tin tức khác Tin tức cùng chuyên mục Tin tức khác Tin tức cùng chuyên mục Tin tức khác Tin tức cùng chuyên mục Tin tức khác Tin tức cùng chuyên mục Tin tức khác Tin tức cùng chuyên mục Tin tức khác Tin tức cùng chuyên mục Tin tức khác Tin tức cùng chuyên mục Tin tức khác Tin tức cùng chuyên mục Tin tức khác Tin tức cùng chuyên mục Tin tức khác Tin tức cùng chuyên mục Tin tức khác Tin tức cùng chuyên mục Tin tức khác Tin tức cùng chuyên mục Tin tức khác Tin tức cùng chuyên mục Tin tức khác Tin tức cùng chuyên mục Tin tức khác Tin tức cùng chuyên mục Tin tức khác Tin tức cùng chuyên mục Tin tức khác Tin tức cùng chuyên mục Tin tức khác Tin tức cùng chuyên mục Tin tức khác Tin tức cùng chuyên mục Tin tức khác Tin tức cùng chuyên mục Tin tức khác Tin tức cùng chuyên mục Tin tức khác Tin tức cùng chuyên mục Tin tức khác Tin tức cùng chuyên mục Tin tức khác Tin tức cùng chuyên mục Tin tức khác Tin tức cùng chuyên mục Tin tức khác Tin tức cùng chuyên mục Tin tức khác Tin tức cùng chuyên mục Tin tức khác Tin tức cùng chuyên mục Tin tức khác Tin tức cùng chuyên mục Tin tức khác Tin tức cùng chuyên mục Tin tức khác Tin tức cùng chuyên mục Tin tức khác Tin tức cùng chuyên mục Tin tức khác Tin tức cùng chuyên mục Tin tức khác Tin tức cùng chuyên mục Tin tức khác Tin tức cùng chuyên mục Tin tức khác Tin tức cùng chuyên mục Tin tức khác Tin tức cùng chuyên mục Tin tức khác Tin tức cùng chuyên mục Tin tức khác Tin tức cùng chuyên mục Tin tức khác Tin tức cùng chuyên mục Tin tức khác Tin tức cùng chuyên mục Tin tức khác Tin tức cùng chuyên mục Tin tức khác Tin tức cùng chuyên mục Tin tức khác Tin tức cùng chuyên mục Tin tức khác Tin tức cùng chuyên mục Tin tức khác Tin tức cùng chuyên mục Tin tức khác Tin tức cùng chuyên mục Tin tức khác Tin tức cùng chuyên mục Tin tức khác Tin tức cùng chuyên mục Tin tức khác Tin tức cùng chuyên mục Tin tức khác Tin tức cùng chuyên mục Tin tức khác Tin tức cùng chuyên mục Tin tức khác Tin tức cùng chuyên mục Tin tức khác Tin tức cùng chuyên mục Tin tức khác Tin tức cùng chuyên mục Tin tức khác Tin tức cùng chuyên mục Tin tức khác Tin tức cùng chuyên mục Tin tức khác Tin tức cùng chuyên mục Tin tức khác Tin tức cùng chuyên mục Tin tức khác Tin tức cùng chuyên mục Tin tức khác Tin tức cùng chuyên mục Tin tức khác Tin tức cùng chuyên mục Tin tức khác Tin tức cùng chuyên mục Tin tức khác Tin tức cùng chuyên mục Tin tức khác Tin tức cùng chuyên mục Tin tức khác Tin tức cùng chuyên mục Tin tức khác Tin tức cùng chuyên mục Tin tức khác Tin tức cùng chuyên mục Tin tức khác Tin tức cùng chuyên mục Tin tức khác Tin tức cùng chuyên mục Tin tức khác Tin tức cùng chuyên mục Tin tức khác Tin tức cùng chuyên mục Tin tức khác Tin tức cùng chuyên mục Tin tức khác Tin tức cùng chuyên mục Tin tức khác Tin tức cùng chuyên mục Tin tức khác Tin tức cùng chuyên mục Tin tức khác Tin tức cùng chuyên mục Tin tức khác Tin tức cùng chuyên mục Tin tức khác Tin tức cùng chuyên mục Tin tức khác Tin tức cùng chuyên mục Tin tức khác Tin tức cùng chuyên mục Tin tức khác Tin tức cùng chuyên mục Tin tức khác Tin tức cùng chuyên mục Tin tức khác Tin tức cùng chuyên mục Tin tức khác Tin tức cùng chuyên mục Tin tức khác Tin tức cùng chuyên mục Tin tức khác Tin tức cùng chuyên mục Tin tức khác Tin tức cùng chuyên mục Tin tức khác Tin tức cùng chuyên mục Tin tức khác Tin tức cùng chuyên mục Tin tức khác Tin tức cùng chuyên mục Tin tức khác Tin tức cùng chuyên mục Tin tức khác Tin tức cùng chuyên mục Tin tức khác Tin tức cùng chuyên mục Tin tức khác Tin tức cùng chuyên mục Tin tức khác Tin tức cùng chuyên mục Tin tức khác Tin tức cùng chuyên mục Tin tức khác Tin tức cùng chuyên mục Tin tức khác Tin tức cùng chuyên mục Tin tức khác Tin tức cùng chuyên mục Tin tức khác Tin tức cùng chuyên mục Tin tức khác Tin tức cùng chuyên mục Tin tức khác Tin tức cùng chuyên mục Tin tức khác Tin tức cùng chuyên mục Tin tức khác Tin tức cùng chuyên mục Tin tức khác Tin tức cùng chuyên mục Tin tức khác Tin tức cùng chuyên mục Tin tức khác Tin tức cùng chuyên mục Tin tức khác Tin tức cùng chuyên mục Tin tức khác Tin tức cùng chuyên mục Tin tức khác Tin tức cùng chuyên mục Tin tức khác Tin tức cùng chuyên mục Tin tức khác Tin tức cùng chuyên mục Tin tức khác Tin tức cùng chuyên mục Tin tức khác Tin tức cùng chuyên mục Tin tức khác Tin tức cùng chuyên mục Tin tức khác Tin tức cùng chuyên mục Tin tức khác Tin tức cùng chuyên mục Tin tức khác Tin tức cùng chuyên mục Tin tức khác Tin tức cùng chuyên mục Tin tức khác Tin tức cùng chuyên mục Tin tức khác Tin tức cùng chuyên mục Tin tức khác Tin tức cùng chuyên mục Tin tức khác Tin tức cùng chuyên mục Tin tức khác Tin tức cùng chuyên mục Tin tức khác Tin tức cùng chuyên mục Tin tức khác Tin tức cùng chuyên mục Tin tức khác Tin tức cùng chuyên mục Tin tức khác Tin tức cùng chuyên mục Tin tức khác Tin tức cùng chuyên mục Tin tức khác Tin tức cùng chuyên mục Tin tức khác Tin tức cùng chuyên mục Tin tức khác Tin tức cùng chuyên mục Tin tức khác Tin tức cùng chuyên mục Tin tức khác Tin tức cùng chuyên mục Tin tức khác Tin tức cùng chuyên mục Tin tức khác Tin tức cùng chuyên mục Tin tức khác Tin tức cùng chuyên mục Tin tức khác Tin tức cùng chuyên mục Tin tức khác Tin tức cùng chuyên mục Tin tức khác Tin tức cùng chuyên mục Tin tức khác Tin tức cùng chuyên mục Tin tức khác Tin tức cùng chuyên mục Tin tức khác Tin tức cùng chuyên mục Tin tức khác Tin tức cùng chuyên mục Tin tức khác Tin tức cùng chuyên mục Tin tức khác Tin tức cùng chuyên mục Tin tức khác Tin tức cùng chuyên mục Tin tức khác Tin tức cùng chuyên mục Tin tức khác Tin tức cùng chuyên mục Tin tức khác Tin tức cùng chuyên mục Tin tức khác Tin tức cùng chuyên mục Tin tức khác Tin tức cùng chuyên mục Tin tức khác Tin tức cùng chuyên mục Tin tức khác Tin tức cùng chuyên mục Tin tức khác Tin tức cùng chuyên mục Tin tức khác Tin tức cùng chuyên mục Tin tức khác Tin tức cùng chuyên mục Tin tức khác Tin tức cùng chuyên mục Tin tức khác Tin tức cùng chuyên mục Tin tức khác Tin tức cùng chuyên mục Tin tức khác Tin tức cùng chuyên mục Tin tức khác Tin tức cùng chuyên mục Tin tức khác Tin tức cùng chuyên mục Tin tức khác Tin tức cùng chuyên mục Tin tức khác Tin tức cùng chuyên mục Tin tức khác Tin tức cùng chuyên mục Tin tức khác Tin tức cùng chuyên mục Tin tức khác Tin tức cùng chuyên mục Tin tức khác Tin tức cùng chuyên mục Tin tức khác Tin tức cùng chuyên mục Tin tức khác Tin tức cùng chuyên mục Tin tức khác Tin tức cùng chuyên mục Tin tức khác Tin tức cùng chuyên mục Tin tức khác Tin tức cùng chuyên mục Tin tức khác Tin tức cùng chuyên mục Tin tức khác Tin tức cùng chuyên mục Tin tức khác Tin tức cùng chuyên mục Tin tức khác Tin tức cùng chuyên mục Tin tức khác Tin tức cùng chuyên mục Tin tức khác Tin tức cùng chuyên mục Tin tức khác Tin tức cùng chuyên mục Tin tức khác Tin tức cùng chuyên mục Tin tức khác Tin tức cùng chuyên mục Tin tức khác Tin tức cùng chuyên mục Tin tức khác Tin tức cùng chuyên mục Tin tức khác Tin tức cùng chuyên mục Tin tức khác Tin tức cùng chuyên mục Tin tức khác Tin tức cùng chuyên mục Tin tức khác Tin tức cùng chuyên mục Tin tức khác Tin tức cùng chuyên mục Tin tức khác Tin tức cùng chuyên mục Tin tức khác Tin tức cùng chuyên mục Tin tức khác Tin tức cùng chuyên mục Tin tức khác Tin tức cùng chuyên mục Tin tức khác Tin tức cùng chuyên mục Tin tức khác Tin tức cùng chuyên mục Tin tức khác Tin tức cùng chuyên mục Tin tức khác Tin tức cùng chuyên mục Tin tức khác Tin tức cùng chuyên mục Tin tức khác Tin tức cùng chuyên mục Tin tức khác Tin tức cùng chuyên mục Tin tức khác Tin tức cùng chuyên mục Tin tức khác Tin tức cùng chuyên mục Tin tức khác Tin tức cùng chuyên mục Tin tức khác Tin tức cùng chuyên mục Tin tức khác Tin tức cùng chuyên mục Tin tức khác Tin tức cùng chuyên mục Tin tức khác Tin tức cùng chuyên mục Tin tức khác Tin tức cùng chuyên mục Tin tức khác Tin tức cùng chuyên mục Tin tức khác Tin tức cùng chuyên mục Tin tức khác Tin tức cùng chuyên mục Tin tức khác Tin tức cùng chuyên mục Tin tức khác Tin tức cùng chuyên mục Tin tức khác Tin tức cùng chuyên mục Tin tức khác Tin tức cùng chuyên mục Tin tức khác Tin tức cùng chuyên mục Tin tức khác Tin tức cùng chuyên mục Tin tức khác Tin tức cùng chuyên mục Tin tức khác Tin tức cùng chuyên mục Tin tức khác Tin tức cùng chuyên mục Tin tức khác Tin tức cùng chuyên mục Tin tức khác Tin tức cùng chuyên mục Tin tức khác Tin tức cùng chuyên mục Tin tức khác Tin tức cùng chuyên mục Tin tức khác Tin tức cùng chuyên mục Tin tức khác Tin tức cùng chuyên mục Tin tức khác Tin tức cùng chuyên mục Tin tức khác Tin tức cùng chuyên mục Tin tức khác Tin tức cùng chuyên mục Tin tức khác Tin tức cùng chuyên mục Tin tức khác Tin tức cùng chuyên mục Tin tức khác Tin tức cùng chuyên mục Tin tức khác Tin tức cùng chuyên mục Tin tức khác Tin tức cùng chuyên mục Tin tức khác Tin tức cùng chuyên mục Tin tức khác Tin tức cùng chuyên mục Tin tức khác Tin tức cùng chuyên mục Tin tức khác Tin tức cùng chuyên mục Tin tức khác Tin tức cùng chuyên mục Tin tức khác Tin tức cùng chuyên mục Tin tức khác Tin tức cùng chuyên mục Tin tức khác Tin tức cùng chuyên mục Tin tức khác Tin tức cùng chuyên mục Tin tức khác Tin tức cùng chuyên mục Tin tức khác Tin tức cùng chuyên mục Tin tức khác Tin tức cùng chuyên mục Tin tức khác Tin tức cùng chuyên mục Tin tức khác Tin tức cùng chuyên mục Tin tức khác Tin tức cùng chuyên mục Tin tức khác Tin tức cùng chuyên mục Tin tức khác Tin tức cùng chuyên mục Tin tức khác Tin tức cùng chuyên mục Tin tức khác Tin tức cùng chuyên mục Tin tức khác Tin tức cùng chuyên mục Tin tức khác Tin tức cùng chuyên mục Tin tức khác Tin tức cùng chuyên mục Tin tức khác Tin tức cùng chuyên mục Tin tức khác Tin tức cùng chuyên mục Tin tức khác Tin tức cùng chuyên mục Tin tức khác Tin tức cùng chuyên mục Tin tức khác Tin tức cùng chuyên mục Tin tức khác Tin tức cùng chuyên mục Tin tức khác Tin tức cùng chuyên mục Tin tức khác Tin tức cùng chuyên mục Tin tức khác Tin tức cùng chuyên mục Tin tức khác Tin tức cùng chuyên mục Tin tức khác Tin tức cùng chuyên mục Tin tức khác Tin tức cùng chuyên mục Tin tức khác Tin tức cùng chuyên mục Tin tức khác Tin tức cùng chuyên mục Tin tức khác Tin tức cùng chuyên mục Tin tức khác Tin tức cùng chuyên mục Tin tức khác Tin tức cùng chuyên mục Tin tức khác Tin tức cùng chuyên mục Tin tức khác Tin tức cùng chuyên mục Tin tức khác Tin tức cùng chuyên mục Tin tức khác Tin tức cùng chuyên mục Tin tức khác Tin tức cùng chuyên mục Tin tức khác Tin tức cùng chuyên mục Tin tức khác Tin tức cùng chuyên mục Tin tức khác Tin tức cùng chuyên mục Tin tức khác Tin tức cùng chuyên mục Tin tức khác Tin tức cùng chuyên mục Tin tức khác Tin tức cùng chuyên mục Tin tức khác Tin tức cùng chuyên mục Tin tức khác Tin tức cùng chuyên mục Tin tức khác Tin tức cùng chuyên mục Tin tức khác Tin tức cùng chuyên mục Tin tức khác Tin tức cùng chuyên mục Tin tức khác Tin tức cùng chuyên mục Tin tức khác Tin tức cùng chuyên mục Tin tức khác Tin tức cùng chuyên mục Tin tức khác Tin tức cùng chuyên mục Tin tức khác Tin tức cùng chuyên mục Tin tức khác Tin tức cùng chuyên mục Tin tức khác Tin tức cùng chuyên mục Tin tức khác Tin tức cùng chuyên mục Tin tức khác Tin tức cùng chuyên mục Tin tức khác Tin tức cùng chuyên mục Tin tức khác Tin tức cùng chuyên mục Tin tức khác Tin tức cùng chuyên mục Tin tức khác Tin tức cùng chuyên mục Tin tức khác Tin tức cùng chuyên mục Tin tức khác Tin tức cùng chuyên mục Tin tức khác Tin tức cùng chuyên mục Tin tức khác Tin tức cùng chuyên mục Tin tức khác Tin tức cùng chuyên mục Tin tức khác Tin tức cùng chuyên mục Tin tức khác Tin tức cùng chuyên mục Tin tức khác Tin tức cùng chuyên mục Tin tức khác Tin tức cùng chuyên mục Tin tức khác Tin tức cùng chuyên mục Tin tức khác Tin tức cùng chuyên mục Tin tức khác Tin tức cùng chuyên mục Tin tức khác Tin tức cùng chuyên mục Tin tức khác Tin tức cùng chuyên mục Tin tức khác Tin tức cùng chuyên mục Tin tức khác Tin tức cùng chuyên mục Tin tức khác Tin tức cùng chuyên mục Tin tức khác Tin tức cùng chuyên mục Tin tức khác Tin tức cùng chuyên mục Tin tức khác Tin tức cùng chuyên mục Tin tức khác Tin tức cùng chuyên mục Tin tức khác Tin tức cùng chuyên mục Tin tức khác Tin tức cùng chuyên mục Tin tức khác Tin tức cùng chuyên mục Tin tức khác Tin tức cùng chuyên mục Tin tức khác Tin tức cùng chuyên mục Tin tức khác Tin tức cùng chuyên mục Tin tức khác Tin tức cùng chuyên mục Tin tức khác Tin tức cùng chuyên mục Tin tức khác Tin tức cùng chuyên mục Tin tức khác Tin tức cùng chuyên mục Tin tức khác Tin tức cùng chuyên mục Tin tức khác Tin tức cùng chuyên mục Tin tức khác Tin tức cùng chuyên mục Tin tức khác Tin tức cùng chuyên mục Tin tức khác Tin tức cùng chuyên mục Tin tức khác Tin tức cùng chuyên mục Tin tức khác Tin tức cùng chuyên mục Tin tức khác Tin tức cùng chuyên mục Tin tức khác Tin tức cùng chuyên mục Tin tức khác Tin tức cùng chuyên mục Tin tức khác Tin tức cùng chuyên mục Tin tức khác Tin tức cùng chuyên mục Tin tức khác Tin tức cùng chuyên mục Tin tức khác Tin tức cùng chuyên mục Tin tức khác Tin tức cùng chuyên mục Tin tức khác Tin tức cùng chuyên mục Tin tức khác Tin tức cùng chuyên mục Tin tức khác Tin tức cùng chuyên mục Tin tức khác Tin tức cùng chuyên mục Tin tức khác Tin tức cùng chuyên mục Tin tức khác Tin tức cùng chuyên mục Tin tức khác Tin tức cùng chuyên mục Tin tức khác Tin tức cùng chuyên mục Tin tức khác Tin tức cùng chuyên mục Tin tức khác Tin tức cùng chuyên mục Tin tức khác Tin tức cùng chuyên mục Tin tức khác Tin tức cùng chuyên mục Tin tức khác Tin tức cùng chuyên mục Tin tức khác Tin tức cùng chuyên mục Tin tức khác Tin tức cùng chuyên mục Tin tức khác Tin tức cùng chuyên mục Tin tức khác Tin tức cùng chuyên mục Tin tức khác Tin tức cùng chuyên mục Tin tức khác Tin tức cùng chuyên mục Tin tức khác Tin tức cùng chuyên mục Tin tức khác Tin tức cùng chuyên mục Tin tức khác Tin tức cùng chuyên mục Tin tức khác Tin tức cùng chuyên mục Tin tức khác Tin tức cùng chuyên mục Tin tức khác Tin tức cùng chuyên mục Tin tức khác Tin tức cùng chuyên mục Tin tức khác Tin tức cùng chuyên mục Tin tức khác Tin tức cùng chuyên mục Tin tức khác Tin tức cùng chuyên mục Tin tức khác Tin tức cùng chuyên mục Tin tức khác Tin tức cùng chuyên mục Tin tức khác Tin tức cùng chuyên mục Tin tức khác Tin tức cùng chuyên mục Tin tức khác Tin tức cùng chuyên mục Tin tức khác Tin tức cùng chuyên mục Tin tức khác Tin tức cùng chuyên mục Tin tức khác Tin tức cùng chuyên mục Tin tức khác Tin tức cùng chuyên mục Tin tức khác Tin tức cùng chuyên mục Tin tức khác Tin tức cùng chuyên mục Tin tức khác Tin tức cùng chuyên mục Tin tức khác Tin tức cùng chuyên mục Tin tức khác Tin tức cùng chuyên mục Tin tức khác Tin tức cùng chuyên mục Tin tức khác Tin tức cùng chuyên mục Tin tức khác Tin tức cùng chuyên mục Tin tức khác Tin tức cùng chuyên mục Tin tức khác Tin tức cùng chuyên mục Tin tức khác Tin tức cùng chuyên mục Tin tức khác Tin tức cùng chuyên mục Tin tức khác Tin tức cùng chuyên mục Tin tức khác Tin tức cùng chuyên mục Tin tức khác Tin tức cùng chuyên mục Tin tức khác Tin tức cùng chuyên mục Tin tức khác Tin tức cùng chuyên mục Tin tức khác Tin tức cùng chuyên mục Tin tức khác Tin tức cùng chuyên mục Tin tức khác Tin tức cùng chuyên mục Tin tức khác Tin tức cùng chuyên mục Tin tức khác Tin tức cùng chuyên mục Tin tức khác Tin tức cùng chuyên mục Tin tức khác Tin tức cùng chuyên mục Tin tức khác Tin tức cùng chuyên mục Tin tức khác Tin tức cùng chuyên mục Tin tức khác Tin tức cùng chuyên mục Tin tức khác Tin tức cùng chuyên mục Tin tức khác Tin tức cùng chuyên mục Tin tức khác Tin tức cùng chuyên mục Tin tức khác Tin tức cùng chuyên mục Tin tức khác Tin tức cùng chuyên mục Tin tức khác Tin tức cùng chuyên mục Tin tức khác Tin tức cùng chuyên mục Tin tức khác Tin tức cùng chuyên mục Tin tức khác Tin tức cùng chuyên mục Tin tức khác Tin tức cùng chuyên mục Tin tức khác Tin tức cùng chuyên mục Tin tức khác Tin tức cùng chuyên mục Tin tức khác Tin tức cùng chuyên mục Tin tức khác Tin tức cùng chuyên mục Tin tức khác Tin tức cùng chuyên mục Tin tức khác Tin tức cùng chuyên mục Tin tức khác Tin tức cùng chuyên mục Tin tức khác Tin tức cùng chuyên mục Tin tức khác Tin tức cùng chuyên mục Tin tức khác Tin tức cùng chuyên mục Tin tức khác Tin tức cùng chuyên mục Tin tức khác Tin tức cùng chuyên mục Tin tức khác Tin tức cùng chuyên mục Tin tức khác Tin tức cùng chuyên mục Tin tức khác Tin tức cùng chuyên mục Tin tức khác Tin tức cùng chuyên mục Tin tức khác Tin tức cùng chuyên mục Tin tức khác Tin tức cùng chuyên mục Tin tức khác Tin tức cùng chuyên mục Tin tức khác Tin tức cùng chuyên mục Tin tức khác Tin tức cùng chuyên mục Tin tức khác Tin tức cùng chuyên mục Tin tức khác Tin tức cùng chuyên mục Tin tức khác Tin tức cùng chuyên mục Tin tức khác Tin tức cùng chuyên mục Tin tức khác Tin tức cùng chuyên mục Tin tức khác Tin tức cùng chuyên mục Tin tức khác Tin tức cùng chuyên mục Tin tức khác Tin tức cùng chuyên mục Tin tức khác Tin tức cùng chuyên mục Tin tức khác Tin tức cùng chuyên mục Tin tức khác Tin tức cùng chuyên mục Tin tức khác Tin tức cùng chuyên mục Tin tức khác Tin tức cùng chuyên mục Tin tức khác Tin tức cùng chuyên mục Tin tức khác Tin tức cùng 